Sentence,Context_PP1,Context_PP2,Context_PP1_simple,Context_PP2_simple,PP1_simple,PP2_simple,Verb,PP1,PP2,PP1_len,PP2_len,Adp1,Adp2,NP1,NP2,PP1_Pronom,PP2_Pronom,PP1_Type,PP2_Type,Position,Language
"ב ה_ קיץ ה אחרון , ב 21 ו ב 31 ב אוגוסט סגר מישהו את ה ברז ה מרכזי ל רחוב שלם ב תל אביב , ב שעה שבע ו חצי ב ה_ בוקר .",ב ה_ קיץ ה אחרון,ב 21 ו ב 31 ב אוגוסט,ב קיץ,ב 21,ב קיץ,ב 21,סגר,ב ה_ קיץ ה אחרון,ב 21 ו ב 31 ב אוגוסט,5,7,ב,ב,קיץ,21,NOUN,NUM,prepositional,prepositional,Preverbal,Hebrew
"ב ה_ קיץ ה אחרון , ב 21 ו ב 31 ב אוגוסט סגר מישהו את ה ברז ה מרכזי ל רחוב שלם ב תל אביב , ב שעה שבע ו חצי ב ה_ בוקר .","ב ה_ קיץ ה אחרון , ב 21 ו ב 31 ב אוגוסט סגר מישהו את ה ברז ה מרכזי ל רחוב שלם ב תל אביב","ב ה_ קיץ ה אחרון , ב 21 ו ב 31 ב אוגוסט סגר מישהו את ה ברז ה מרכזי ב שעה שבע ו חצי ב ה_ בוקר","ב ה_ קיץ ה אחרון , ב 21 ו ב 31 ב אוגוסט סגר מישהו את ה ברז ה מרכזי ל רחוב","ב ה_ קיץ ה אחרון , ב 21 ו ב 31 ב אוגוסט סגר מישהו את ה ברז ה מרכזי ב שעה",ל רחוב,ב שעה,סגר,ל רחוב שלם ב תל אביב,ב שעה שבע ו חצי ב ה_ בוקר,6,8,ל,ב,רחוב,שעה,NOUN,NOUN,prepositional,prepositional,Postverbal,Hebrew
"כש אתה ממתין ל שיחה ה עוברת דרך מרכזייה ב מוסד גדול , ה סיכויים ל כך אף רבים יותר .",כש אתה ממתין ל שיחה ה עוברת דרך מרכזייה,כש אתה ממתין ל שיחה ה עוברת ב מוסד גדול,כש אתה ממתין ל שיחה ה עוברת דרך מרכזייה,כש אתה ממתין ל שיחה ה עוברת ב מוסד,דרך מרכזייה,ב מוסד,עבר,דרך מרכזייה,ב מוסד גדול,2,3,דרך,ב,מרכזייה,מוסד,NOUN,NOUN,prepositional,prepositional,Postverbal,Hebrew
"לפני כ חודשיים פורסמה בורה ב ה_ עלון ה חודשי של ויזה , כי "" מ היום אפשר להזמין גז ו לשלם עבור_ _הוא ב ה_ טלפון "" , דהיינו , ב כרטיס אשראי .","לפני כ חודשיים פורסמה בורה ב ה_ עלון ה חודשי של ויזה , כי "" מ היום אפשר להזמין גז ו לשלם עבור_ _הוא","לפני כ חודשיים פורסמה בורה ב ה_ עלון ה חודשי של ויזה , כי "" מ היום אפשר להזמין גז ו לשלם ב ה_ טלפון","לפני כ חודשיים פורסמה בורה ב ה_ עלון ה חודשי של ויזה , כי "" מ היום אפשר להזמין גז ו לשלם עבור_ _הוא","לפני כ חודשיים פורסמה בורה ב ה_ עלון ה חודשי של ויזה , כי "" מ היום אפשר להזמין גז ו לשלם ב טלפון",עבור הוא,ב טלפון,שילם,עבור_ _הוא,ב ה_ טלפון,2,3,עבור,ב,הוא,טלפון,PRON,NOUN,prepositional,prepositional,Postverbal,Hebrew
"ב בנק לאומי , לעומת זאת , שולחים ל בעל ה חשבון הודעה מוקדמת אך ו רק באשר ל סכום ה גבוה מ 04 ש""ח .",ב בנק לאומי,לעומת זאת,ב בנק,לעומת זאת,ב בנק,לעומת זאת,שלח,ב בנק לאומי,לעומת זאת,3,2,ב,לעומת,בנק,זאת,NOUN,PRON,prepositional,prepositional,Preverbal,Hebrew
"יעל , ה גיבורה ה ישראלית , פוגשת ב אלינה , עולה רוסיה , ב נסיבות לגמרי לא רגילות .","יעל , ה גיבורה ה ישראלית , פוגשת ב אלינה , עולה רוסיה","יעל , ה גיבורה ה ישראלית , פוגשת ב נסיבות לגמרי לא רגילות","יעל , ה גיבורה ה ישראלית , פוגשת ב אלינה","יעל , ה גיבורה ה ישראלית , פוגשת ב נסיבות",ב אלינה,ב נסיבה,פגש,"ב אלינה , עולה רוסיה",ב נסיבות לגמרי לא רגילות,5,5,ב,ב,אלינה,נסיבה,PROPN,NOUN,prepositional,prepositional,Postverbal,Hebrew
"היא לא מוכנה לקרוא ב עברית כי ה שפה נשמעת ל_ _היא כמו "" רעש ב ה_ אוזניים "" .",היא לא מוכנה לקרוא ב עברית כי ה שפה נשמעת ל_ _היא,"היא לא מוכנה לקרוא ב עברית כי ה שפה נשמעת כמו "" רעש ב ה_ אוזניים """,היא לא מוכנה לקרוא ב עברית כי ה שפה נשמעת ל_ _היא,היא לא מוכנה לקרוא ב עברית כי ה שפה נשמעת כמו רעש,ל הוא,כמו רעש,נשמע,ל_ _היא,"כמו "" רעש ב ה_ אוזניים """,2,7,ל,כמו,הוא,רעש,PRON,NOUN,prepositional,prepositional,Postverbal,Hebrew
"היא סבורה ש ב ה_ פעם ה באה ש תתמודד עם ה נושא , תעסוק ב נושא ה זרות ו ה עקרות של אדם מבוגר , לאחר ש מיצתה את חוויה_ _של_ _היא כ ילדה עולה .","היא סבורה ש ב ה_ פעם ה באה ש תתמודד עם ה נושא , תעסוק ב נושא ה זרות ו ה עקרות של אדם מבוגר","היא סבורה ש ב ה_ פעם ה באה ש תתמודד עם ה נושא , תעסוק לאחר ש מיצתה את חוויה_ _של_ _היא כ ילדה עולה","היא סבורה ש ב ה_ פעם ה באה ש תתמודד עם ה נושא , תעסוק ב נושא","היא סבורה ש ב ה_ פעם ה באה ש תתמודד עם ה נושא , תעסוק לאחר מיצתה",ב נושא,לאחר מיצה,עסק,ב נושא ה זרות ו ה עקרות של אדם מבוגר,לאחר ש מיצתה את חוויה_ _של_ _היא כ ילדה עולה,10,10,ב,לאחר,נושא,מיצה,NOUN,VERB,prepositional,prepositional,Postverbal,Hebrew
"שעות ספורות לפני ש המריא יוסף לפיד ל בודפשט ( ב ה_ פעם ה רביעית ב חודש זה ) פלט ה מחשב ב בית_ _של_ _הוא את דפי ה פרק ה חמישי ב ה_ סדרה "" שבט כהן "" , ש אותו_ _היא הוא כותב ב ימים אלה ל ה_ טלוויזיה .",שעות ספורות לפני ש המריא יוסף לפיד ל בודפשט,שעות ספורות לפני ש המריא יוסף לפיד ( ב ה_ פעם ה רביעית ב חודש זה ),שעות ספורות לפני ש המריא יוסף לפיד ל בודפשט,שעות ספורות לפני ש המריא יוסף לפיד ב פעם,ל בודפשט,ב פעם,המריא,ל בודפשט,( ב ה_ פעם ה רביעית ב חודש זה ),2,10,ל,ב,בודפשט,פעם,PROPN,NOUN,prepositional,prepositional,Postverbal,Hebrew
"שעות ספורות לפני ש המריא יוסף לפיד ל בודפשט ( ב ה_ פעם ה רביעית ב חודש זה ) פלט ה מחשב ב בית_ _של_ _הוא את דפי ה פרק ה חמישי ב ה_ סדרה "" שבט כהן "" , ש אותו_ _היא הוא כותב ב ימים אלה ל ה_ טלוויזיה .","שעות ספורות לפני ש המריא יוסף לפיד ל בודפשט ( ב ה_ פעם ה רביעית ב חודש זה ) פלט ה מחשב ב בית_ _של_ _הוא את דפי ה פרק ה חמישי ב ה_ סדרה "" שבט כהן "" , ש אותו_ _היא הוא כותב ב ימים אלה","שעות ספורות לפני ש המריא יוסף לפיד ל בודפשט ( ב ה_ פעם ה רביעית ב חודש זה ) פלט ה מחשב ב בית_ _של_ _הוא את דפי ה פרק ה חמישי ב ה_ סדרה "" שבט כהן "" , ש אותו_ _היא הוא כותב ל ה_ טלוויזיה","שעות ספורות לפני ש המריא יוסף לפיד ל בודפשט ( ב ה_ פעם ה רביעית ב חודש זה ) פלט ה מחשב ב בית_ _של_ _הוא את דפי ה פרק ה חמישי ב ה_ סדרה "" שבט כהן "" , ש אותו_ _היא הוא כותב ב ימים","שעות ספורות לפני ש המריא יוסף לפיד ל בודפשט ( ב ה_ פעם ה רביעית ב חודש זה ) פלט ה מחשב ב בית_ _של_ _הוא את דפי ה פרק ה חמישי ב ה_ סדרה "" שבט כהן "" , ש אותו_ _היא הוא כותב ל טלוויזיה",ב יום,ל טלוויזיה,כתב,ב ימים אלה,ל ה_ טלוויזיה,3,3,ב,ל,יום,טלוויזיה,NOUN,NOUN,prepositional,prepositional,Postverbal,Hebrew
לפיד מודע ל כך ש ה סדרות ש צולמו ל ה_ טלוויזיה ה ישראלית עד כה לא התקבלו ב אהדה רבה על - ידי ה מבקרים .,לפיד מודע ל כך ש ה סדרות ש צולמו ל ה_ טלוויזיה ה ישראלית עד כה לא התקבלו ב אהדה רבה,לפיד מודע ל כך ש ה סדרות ש צולמו ל ה_ טלוויזיה ה ישראלית עד כה לא התקבלו על - ידי ה מבקרים,לפיד מודע ל כך ש ה סדרות ש צולמו ל ה_ טלוויזיה ה ישראלית עד כה לא התקבלו ב אהדה,לפיד מודע ל כך ש ה סדרות ש צולמו ל ה_ טלוויזיה ה ישראלית עד כה לא התקבלו על מבקרים,ב אהדה,על מבקר,התקבל,ב אהדה רבה,על - ידי ה מבקרים,3,5,ב,על,אהדה,מבקר,NOUN,NOUN,prepositional,prepositional,Postverbal,Hebrew
מ כל עבודה הודפסו ב ה_ אלבומים ה ראשונים בין 52 ל 05 עותקים .,מ כל עבודה הודפסו ב ה_ אלבומים ה ראשונים,מ כל עבודה הודפסו בין 52 ל 05 עותקים,מ כל עבודה הודפסו ב אלבומים,מ כל עבודה הודפסו בין עותקים,ב אלבום,בין עותק,הודפס,ב ה_ אלבומים ה ראשונים,בין 52 ל 05 עותקים,5,5,ב,בין,אלבום,עותק,NOUN,NOUN,prepositional,prepositional,Postverbal,Hebrew
"ה אלבומים ניתנים ללא תמורה ל ה_ מוזיאונים ב ה_ ארץ , ל חוגים ל תולדות ה אמנות , ל מרכזים קהילתיים ו עוד , "" ו זאת בעצם מטרת ה עניין , להפיץ אמנות , ו ש אנשים יבואו ב מגע אתה _היא "" .",ה אלבומים ניתנים ללא תמורה,"ה אלבומים ניתנים ל ה_ מוזיאונים ב ה_ ארץ , ל חוגים ל תולדות ה אמנות , ל מרכזים קהילתיים ו עוד",ה אלבומים ניתנים ללא תמורה,ה אלבומים ניתנים ל מוזיאונים,ללא תמורה,ל מוזיאון,ניתן,ללא תמורה,"ל ה_ מוזיאונים ב ה_ ארץ , ל חוגים ל תולדות ה אמנות , ל מרכזים קהילתיים ו עוד",2,19,ללא,ל,תמורה,מוזיאון,NOUN,NOUN,prepositional,prepositional,Postverbal,Hebrew
"ה אלבומים ניתנים ללא תמורה ל ה_ מוזיאונים ב ה_ ארץ , ל חוגים ל תולדות ה אמנות , ל מרכזים קהילתיים ו עוד , "" ו זאת בעצם מטרת ה עניין , להפיץ אמנות , ו ש אנשים יבואו ב מגע אתה _היא "" .","ה אלבומים ניתנים ללא תמורה ל ה_ מוזיאונים ב ה_ ארץ , ל חוגים ל תולדות ה אמנות , ל מרכזים קהילתיים ו עוד , "" ו זאת בעצם מטרת ה עניין , להפיץ אמנות , ו ש אנשים יבואו ב מגע","ה אלבומים ניתנים ללא תמורה ל ה_ מוזיאונים ב ה_ ארץ , ל חוגים ל תולדות ה אמנות , ל מרכזים קהילתיים ו עוד , "" ו זאת בעצם מטרת ה עניין , להפיץ אמנות , ו ש אנשים יבואו אתה _היא","ה אלבומים ניתנים ללא תמורה ל ה_ מוזיאונים ב ה_ ארץ , ל חוגים ל תולדות ה אמנות , ל מרכזים קהילתיים ו עוד , "" ו זאת בעצם מטרת ה עניין , להפיץ אמנות , ו ש אנשים יבואו ב מגע","ה אלבומים ניתנים ללא תמורה ל ה_ מוזיאונים ב ה_ ארץ , ל חוגים ל תולדות ה אמנות , ל מרכזים קהילתיים ו עוד , "" ו זאת בעצם מטרת ה עניין , להפיץ אמנות , ו ש אנשים יבואו אתה _היא",ב מגע,את הוא,בא,ב מגע,אתה _היא,2,2,ב,את,מגע,הוא,NOUN,PRON,prepositional,prepositional,Postverbal,Hebrew
ה תערוכה מוצגת ב בית אריאלה עד ה 25.11 .,ה תערוכה מוצגת ב בית אריאלה,ה תערוכה מוצגת עד ה 25.11,ה תערוכה מוצגת ב בית,ה תערוכה מוצגת עד 25.11,ב בית,עד 25.11,הוצג,ב בית אריאלה,עד ה 25.11,3,3,ב,עד,בית,25.11,NOUN,NUM,prepositional,prepositional,Postverbal,Hebrew
ה שיר נכתב ב ה_ מקור ל סרט זה ו הוא מובא ב_ _הוא ב לחן מופנם ו ב רוח חנוך לוין של רפי קדישזון .,ה שיר נכתב ב ה_ מקור,ה שיר נכתב ל סרט זה,ה שיר נכתב ב מקור,ה שיר נכתב ל סרט,ב מקור,ל סרט,נכתב,ב ה_ מקור,ל סרט זה,3,3,ב,ל,מקור,סרט,NOUN,NOUN,prepositional,prepositional,Postverbal,Hebrew
ה שיר נכתב ב ה_ מקור ל סרט זה ו הוא מובא ב_ _הוא ב לחן מופנם ו ב רוח חנוך לוין של רפי קדישזון .,ה שיר נכתב ב ה_ מקור ל סרט זה ו הוא מובא ב_ _הוא,ה שיר נכתב ב ה_ מקור ל סרט זה ו הוא מובא ב לחן מופנם ו ב רוח חנוך לוין של רפי קדישזון,ה שיר נכתב ב ה_ מקור ל סרט זה ו הוא מובא ב_ _הוא,ה שיר נכתב ב ה_ מקור ל סרט זה ו הוא מובא ב לחן,ב הוא,ב לחן,הובא,ב_ _הוא,ב לחן מופנם ו ב רוח חנוך לוין של רפי קדישזון,2,11,ב,ב,הוא,לחן,PRON,NOUN,prepositional,prepositional,Postverbal,Hebrew
"ה קולנוע הוא ללא ספק ה מקום ה מושלם ל דיון ב פנטסיות ; פס ה קול ה מוסיקלי נושא איכויות הוליוודיות , ו לעתים הופך ה סרט ל מיוזיקל ; כאשר קולף ו ה מלכה רוקדים את ה וולס של_ _הם , בין אורות ו צללים , ב ה_ מועדון של ה שכונה , יושב ל_ _הוא רפאל קלצקין , ב תפקיד קבצן מקומי , ו שר ל נסים עזיקרי את "" ציפור מכנסי ה שבת של_ _אני "" .","ה קולנוע הוא ללא ספק ה מקום ה מושלם ל דיון ב פנטסיות ; פס ה קול ה מוסיקלי נושא איכויות הוליוודיות , ו לעתים הופך ה סרט ל מיוזיקל ; כאשר קולף ו ה מלכה רוקדים את ה וולס של_ _הם , בין אורות ו צללים , ב ה_ מועדון של ה שכונה , יושב ל_ _הוא","ה קולנוע הוא ללא ספק ה מקום ה מושלם ל דיון ב פנטסיות ; פס ה קול ה מוסיקלי נושא איכויות הוליוודיות , ו לעתים הופך ה סרט ל מיוזיקל ; כאשר קולף ו ה מלכה רוקדים את ה וולס של_ _הם , בין אורות ו צללים , ב ה_ מועדון של ה שכונה , יושב ב תפקיד קבצן מקומי","ה קולנוע הוא ללא ספק ה מקום ה מושלם ל דיון ב פנטסיות ; פס ה קול ה מוסיקלי נושא איכויות הוליוודיות , ו לעתים הופך ה סרט ל מיוזיקל ; כאשר קולף ו ה מלכה רוקדים את ה וולס של_ _הם , בין אורות ו צללים , ב ה_ מועדון של ה שכונה , יושב ל_ _הוא","ה קולנוע הוא ללא ספק ה מקום ה מושלם ל דיון ב פנטסיות ; פס ה קול ה מוסיקלי נושא איכויות הוליוודיות , ו לעתים הופך ה סרט ל מיוזיקל ; כאשר קולף ו ה מלכה רוקדים את ה וולס של_ _הם , בין אורות ו צללים , ב ה_ מועדון של ה שכונה , יושב ב תפקיד",ל הוא,ב תפקיד,ישב,ל_ _הוא,ב תפקיד קבצן מקומי,2,4,ל,ב,הוא,תפקיד,PRON,NOUN,prepositional,prepositional,Postverbal,Hebrew
"לפני כן עסק , ב מסגרת חברה ש הקים , ב הפקת סרטי רפואה ו ב בימוי_ _של_ _הם .","לפני כן עסק , ב מסגרת חברה ש הקים","לפני כן עסק , ב הפקת סרטי רפואה ו ב בימוי_ _של_ _הם","לפני כן עסק , ב חברה","לפני כן עסק , ב הפקת",ב חברה,ב הפקה,עסק,ב מסגרת חברה ש הקים,ב הפקת סרטי רפואה ו ב בימוי_ _של_ _הם,5,9,ב,ב,חברה,הפקה,NOUN,NOUN,prepositional,prepositional,Postverbal,Hebrew
""" פנטסיה על נושא רומנטי "" יוקרן ב סינמטק תל - אביב , ב ה_ 15 ו ב ה_ 16 ב נובמבר ב ה_ חצות , ב ה_ 17 ב נובמבר ב שעה 7.30 ו ב ה_ 30 ב נובמבר ב שעה שתיים אחר ה צהרים .",""" פנטסיה על נושא רומנטי "" יוקרן ב סינמטק תל - אביב",""" פנטסיה על נושא רומנטי "" יוקרן ב ה_ 15 ו ב ה_ 16 ב נובמבר ב ה_ חצות , ב ה_ 17 ב נובמבר ב שעה 7.30 ו ב ה_ 30 ב נובמבר ב שעה שתיים אחר ה צהרים",""" פנטסיה על נושא רומנטי "" יוקרן ב סינמטק",""" פנטסיה על נושא רומנטי "" יוקרן ב 15",ב סינמטק,ב 15,הוקרן,ב סינמטק תל - אביב,"ב ה_ 15 ו ב ה_ 16 ב נובמבר ב ה_ חצות , ב ה_ 17 ב נובמבר ב שעה 7.30 ו ב ה_ 30 ב נובמבר ב שעה שתיים אחר ה צהרים",5,33,ב,ב,סינמטק,15,NOUN,NUM,prepositional,prepositional,Postverbal,Hebrew
"תשורת המשך אשר ל_ _היא תנאים ה ניתנים ל חוסכים ותיקים בלבד "" , כותב סניף מ סניפי בנק לאומי ל ה_ לקוחה , ש תוכנית ה חיסכון צמודת - ה מדד של_ _היא עמדה ל פידיון ב ה_ חודש ש עבר ( אוקטובר ) .","תשורת המשך אשר ל_ _היא תנאים ה ניתנים ל חוסכים ותיקים בלבד "" , כותב סניף מ סניפי בנק לאומי ל ה_ לקוחה , ש תוכנית ה חיסכון צמודת - ה מדד של_ _היא עמדה ל פידיון","תשורת המשך אשר ל_ _היא תנאים ה ניתנים ל חוסכים ותיקים בלבד "" , כותב סניף מ סניפי בנק לאומי ל ה_ לקוחה , ש תוכנית ה חיסכון צמודת - ה מדד של_ _היא עמדה ב ה_ חודש ש עבר ( אוקטובר )","תשורת המשך אשר ל_ _היא תנאים ה ניתנים ל חוסכים ותיקים בלבד "" , כותב סניף מ סניפי בנק לאומי ל ה_ לקוחה , ש תוכנית ה חיסכון צמודת - ה מדד של_ _היא עמדה ל פידיון","תשורת המשך אשר ל_ _היא תנאים ה ניתנים ל חוסכים ותיקים בלבד "" , כותב סניף מ סניפי בנק לאומי ל ה_ לקוחה , ש תוכנית ה חיסכון צמודת - ה מדד של_ _היא עמדה ב חודש",ל פדיון,ב חודש,עמד,ל פידיון,ב ה_ חודש ש עבר ( אוקטובר ),2,8,ל,ב,פדיון,חודש,NOUN,NOUN,prepositional,prepositional,Postverbal,Hebrew
"להלן הודיע ה בנק ל ה_ לקוחה כי יעביר את ה כספים ש הצטברו ל זכות_ _של_ _היא , כולל כל ה הטבות , ל תוכנית חדשה ( "" כוח תשורת המשך "" ) , כאשר ה מדד ה יסודי לגבי ה תוכנית ה חדשה יהיה ה מדד ש יפורסם בגין אוקטובר 0991 .",להלן הודיע ה בנק ל ה_ לקוחה כי יעביר את ה כספים ש הצטברו ל זכות_ _של_ _היא,"להלן הודיע ה בנק ל ה_ לקוחה כי יעביר את ה כספים ש הצטברו ל תוכנית חדשה ( "" כוח תשורת המשך "" )",להלן הודיע ה בנק ל ה_ לקוחה כי יעביר את ה כספים ש הצטברו ל זכות_,להלן הודיע ה בנק ל ה_ לקוחה כי יעביר את ה כספים ש הצטברו ל תוכנית,ל זכות,ל תוכנית,הצטבר,ל זכות_ _של_ _היא,"ל תוכנית חדשה ( "" כוח תשורת המשך "" )",4,10,ל,ל,זכות,תוכנית,NOUN,NOUN,prepositional,prepositional,Postverbal,Hebrew
"ב מה מתבטא ה "" המשך "" , כלומר , מה הם ה "" תנאים ה ניתנים ל חוסכים ותיקים בלבד "" ב תוכניות ה המשך ?","ב מה מתבטא ה "" המשך "" , כלומר , מה הם ה "" תנאים ה ניתנים ל חוסכים ותיקים בלבד","ב מה מתבטא ה "" המשך "" , כלומר , מה הם ה "" תנאים ה ניתנים ב תוכניות ה המשך","ב מה מתבטא ה "" המשך "" , כלומר , מה הם ה "" תנאים ה ניתנים ל חוסכים","ב מה מתבטא ה "" המשך "" , כלומר , מה הם ה "" תנאים ה ניתנים ב תוכניות",ל חסך,ב תוכנית,ניתן,ל חוסכים ותיקים בלבד,ב תוכניות ה המשך,4,4,ל,ב,חסך,תוכנית,VERB,NOUN,prepositional,prepositional,Postverbal,Hebrew
"ל דוגמה , אם ב תוכנית רגילה יכול ה חוסך לצאת מן ה תוכנית כעבור שנתיים , כאשר ה בנק משלם ל_ _הוא 59 % מן ה ריבית ו ה הצמדה ש נצברו ב ה_ תכנית "" המשך "" הוא רשאי לצאת עם נזק כ נ""ל כבר אחרי שנה אחת ; אם ב ה_ תוכנית ה רגילה יקבל ה חוסך ריבית שנתית ב שיעור של אחוז שלם ( ו לא חצי אחוז , כפי ש הבינה ה חוסכת ב טעות ) לאחר ש יתמיד ב ה_ חיסכון שלוש שנים חוסך ב תוכנית המשך יתעשר ב אחוז אחד ל שנה כבר אחרי שנתיים .","ל דוגמה , אם ב תוכנית רגילה יכול ה חוסך לצאת מן ה תוכנית","ל דוגמה , אם ב תוכנית רגילה יכול ה חוסך לצאת כעבור שנתיים","ל דוגמה , אם ב תוכנית רגילה יכול ה חוסך לצאת מן תוכנית","ל דוגמה , אם ב תוכנית רגילה יכול ה חוסך לצאת כעבור שנתיים",מן תוכנית,כעבור שנה,יצא,מן ה תוכנית,כעבור שנתיים,3,2,מן,כעבור,תוכנית,שנה,NOUN,NOUN,prepositional,prepositional,Postverbal,Hebrew
"ל דוגמה , אם ב תוכנית רגילה יכול ה חוסך לצאת מן ה תוכנית כעבור שנתיים , כאשר ה בנק משלם ל_ _הוא 59 % מן ה ריבית ו ה הצמדה ש נצברו ב ה_ תכנית "" המשך "" הוא רשאי לצאת עם נזק כ נ""ל כבר אחרי שנה אחת ; אם ב ה_ תוכנית ה רגילה יקבל ה חוסך ריבית שנתית ב שיעור של אחוז שלם ( ו לא חצי אחוז , כפי ש הבינה ה חוסכת ב טעות ) לאחר ש יתמיד ב ה_ חיסכון שלוש שנים חוסך ב תוכנית המשך יתעשר ב אחוז אחד ל שנה כבר אחרי שנתיים .","ל דוגמה , אם ב תוכנית רגילה יכול ה חוסך לצאת מן ה תוכנית כעבור שנתיים , כאשר ה בנק משלם ל_ _הוא 59 % מן ה ריבית ו ה הצמדה ש נצברו ב ה_ תכנית "" המשך "" הוא רשאי לצאת עם נזק כ נ""ל","ל דוגמה , אם ב תוכנית רגילה יכול ה חוסך לצאת מן ה תוכנית כעבור שנתיים , כאשר ה בנק משלם ל_ _הוא 59 % מן ה ריבית ו ה הצמדה ש נצברו ב ה_ תכנית "" המשך "" הוא רשאי לצאת כבר אחרי שנה אחת","ל דוגמה , אם ב תוכנית רגילה יכול ה חוסך לצאת מן ה תוכנית כעבור שנתיים , כאשר ה בנק משלם ל_ _הוא 59 % מן ה ריבית ו ה הצמדה ש נצברו ב ה_ תכנית "" המשך "" הוא רשאי לצאת עם נזק","ל דוגמה , אם ב תוכנית רגילה יכול ה חוסך לצאת מן ה תוכנית כעבור שנתיים , כאשר ה בנק משלם ל_ _הוא 59 % מן ה ריבית ו ה הצמדה ש נצברו ב ה_ תכנית "" המשך "" הוא רשאי לצאת אחרי שנה",עם נזק,אחרי שנה,יצא,"עם נזק כ נ""ל",כבר אחרי שנה אחת,4,4,עם,אחרי,נזק,שנה,NOUN,NOUN,prepositional,prepositional,Postverbal,Hebrew
