Sentence,Context_PP1,Context_PP2,Context_PP1_simple,Context_PP2_simple,PP1_simple,PP2_simple,Verb,PP1,PP2,PP1_len,PP2_len,Adp1,Adp2,NP1,NP2,PP1_Pronom,PP2_Pronom,PP1_Type,PP2_Type,Position,Language
"כדי לבצע את ה בלתי אפשרי הוא חייב לדכא כל רגשי רחמים ו כבר ב פרק ה פתיחה הוא מוצג כ דורסני ו אכזר , כ מי ש נמלט מ חברת בני - אדם ו כ חוקר ש יצאו ל_ _הוא מוניטין בשל דייקנות_ _של_ _הוא .","כדי לבצע את ה בלתי אפשרי הוא חייב לדכא כל רגשי רחמים ו כבר ב פרק ה פתיחה הוא מוצג כ דורסני ו אכזר , כ מי ש נמלט מ חברת בני - אדם ו כ חוקר ש יצאו ל_ _הוא","כדי לבצע את ה בלתי אפשרי הוא חייב לדכא כל רגשי רחמים ו כבר ב פרק ה פתיחה הוא מוצג כ דורסני ו אכזר , כ מי ש נמלט מ חברת בני - אדם ו כ חוקר ש יצאו בשל דייקנות_ _של_ _הוא","כדי לבצע את ה בלתי אפשרי הוא חייב לדכא כל רגשי רחמים ו כבר ב פרק ה פתיחה הוא מוצג כ דורסני ו אכזר , כ מי ש נמלט מ חברת בני - אדם ו כ חוקר ש יצאו ל_ _הוא","כדי לבצע את ה בלתי אפשרי הוא חייב לדכא כל רגשי רחמים ו כבר ב פרק ה פתיחה הוא מוצג כ דורסני ו אכזר , כ מי ש נמלט מ חברת בני - אדם ו כ חוקר ש יצאו בשל דייקנות_",ל הוא,בשל דייקנות,יצא,ל_ _הוא,בשל דייקנות_ _של_ _הוא,2,4,ל,בשל,הוא,דייקנות,PRON,NOUN,prepositional,prepositional,Postverbal,Hebrew
"זו תפישת עולם משוללת כל ענווה , תפישה ה מוציאה כל אפשרות של אמונה דתית ש על פי הגדרה_ _של_ _היא מייחדת את ה אדם מן ה אל ב אפסות_ _של_ _הוא לעומת גדולה_ _של_ _הוא של ה כל - יכול , ו ה כל - יודע .","זו תפישת עולם משוללת כל ענווה , תפישה ה מוציאה כל אפשרות של אמונה דתית ש על פי הגדרה_ _של_ _היא מייחדת את ה אדם מן ה אל","זו תפישת עולם משוללת כל ענווה , תפישה ה מוציאה כל אפשרות של אמונה דתית ש על פי הגדרה_ _של_ _היא מייחדת את ה אדם ב אפסות_ _של_ _הוא לעומת גדולה_ _של_ _הוא של ה כל - יכול , ו ה כל - יודע","זו תפישת עולם משוללת כל ענווה , תפישה ה מוציאה כל אפשרות של אמונה דתית ש על פי הגדרה_ _של_ _היא מייחדת את ה אדם מן אל","זו תפישת עולם משוללת כל ענווה , תפישה ה מוציאה כל אפשרות של אמונה דתית ש על פי הגדרה_ _של_ _היא מייחדת את ה אדם ב אפסות_",מן אל,ב אפסות,ייחד,מן ה אל,"ב אפסות_ _של_ _הוא לעומת גדולה_ _של_ _הוא של ה כל - יכול , ו ה כל - יודע",3,19,מן,ב,אל,אפסות,NOUN,NOUN,prepositional,prepositional,Postverbal,Hebrew
"לורה , מסופר ל_ _אנחנו מיד , הגיעה ב ה_ עת ה אחרונה ל החלטה כי אינה יכולה להאמין עוד ב אלוהים .","לורה , מסופר ל_ _אנחנו מיד , הגיעה ב ה_ עת ה אחרונה","לורה , מסופר ל_ _אנחנו מיד , הגיעה ל החלטה כי אינה יכולה להאמין עוד ב אלוהים","לורה , מסופר ל_ _אנחנו מיד , הגיעה ב עת","לורה , מסופר ל_ _אנחנו מיד , הגיעה ל החלטה",ב עת,ל החלטה,הגיע,ב ה_ עת ה אחרונה,ל החלטה כי אינה יכולה להאמין עוד ב אלוהים,5,9,ב,ל,עת,החלטה,NOUN,NOUN,prepositional,prepositional,Postverbal,Hebrew
קודם ש הוא יוצא ל מסע_ _של_ _הוא הוא מארס ל_ _הוא את לורה ל אשה .,קודם ש הוא יוצא ל מסע_ _של_ _הוא הוא מארס ל_ _הוא,קודם ש הוא יוצא ל מסע_ _של_ _הוא הוא מארס ל אשה,קודם ש הוא יוצא ל מסע_ _של_ _הוא הוא מארס ל_ _הוא,קודם ש הוא יוצא ל מסע_ _של_ _הוא הוא מארס ל אשה,ל הוא,ל איש,אירס,ל_ _הוא,ל אשה,2,2,ל,ל,הוא,איש,PRON,NOUN,prepositional,prepositional,Postverbal,Hebrew
"רוח_ _של_ _היא , או נכון יותר צל , מלווה את_ _הוא כל ה דרך , ו אילו היא , ה ספונה ב בית_ _של_ _היא , עוקבת ב דמיון_ _של_ _היא אחרי ה שלבים ה שונים ב מסע_ _של_ _הוא של אהוב_ _של_ _היא , ו מסע_ _של_ _היא ה רוחני הוא מסע ה ייסורים בעקבות ישו אל ה אמונה .","רוח_ _של_ _היא , או נכון יותר צל , מלווה את_ _הוא כל ה דרך , ו אילו היא , ה ספונה ב בית_ _של_ _היא , עוקבת ב דמיון_ _של_ _היא","רוח_ _של_ _היא , או נכון יותר צל , מלווה את_ _הוא כל ה דרך , ו אילו היא , ה ספונה ב בית_ _של_ _היא , עוקבת אחרי ה שלבים ה שונים ב מסע_ _של_ _הוא של אהוב_ _של_ _היא","רוח_ _של_ _היא , או נכון יותר צל , מלווה את_ _הוא כל ה דרך , ו אילו היא , ה ספונה ב בית_ _של_ _היא , עוקבת ב דמיון_","רוח_ _של_ _היא , או נכון יותר צל , מלווה את_ _הוא כל ה דרך , ו אילו היא , ה ספונה ב בית_ _של_ _היא , עוקבת אחרי שלבים",ב דמיון,אחרי שלב,עקב,ב דמיון_ _של_ _היא,אחרי ה שלבים ה שונים ב מסע_ _של_ _הוא של אהוב_ _של_ _היא,4,13,ב,אחרי,דמיון,שלב,NOUN,NOUN,prepositional,prepositional,Postverbal,Hebrew
"פוס יוצא ל ה_ דרך ב לוויית שמונה אנשים , מדען , משורר , איש תם , איש מיומן ב מלאכות ו רב תושייה , גאד שם_ _של_ _הוא , מי ש ינטש ו יבגוד ב_ _הוא כ יהודה איש קריות ב ישו , איש אחד מפוקפק ו איש חסר אופי ו עוד שני ילידים .",פוס יוצא ל ה_ דרך,"פוס יוצא ב לוויית שמונה אנשים , מדען , משורר , איש תם , איש מיומן ב מלאכות ו רב תושייה , גאד שם_ _של_ _הוא , מי ש ינטש ו יבגוד ב_ _הוא כ יהודה איש קריות ב ישו , איש אחד מפוקפק ו איש חסר אופי ו עוד שני ילידים",פוס יוצא ל דרך,פוס יוצא ב לוויית,ל דרך,ב לוויה,יצא,ל ה_ דרך,"ב לוויית שמונה אנשים , מדען , משורר , איש תם , איש מיומן ב מלאכות ו רב תושייה , גאד שם_ _של_ _הוא , מי ש ינטש ו יבגוד ב_ _הוא כ יהודה איש קריות ב ישו , איש אחד מפוקפק ו איש חסר אופי ו עוד שני ילידים",3,50,ל,ב,דרך,לוויה,NOUN,NOUN,prepositional,prepositional,Postverbal,Hebrew
"פוס יוצא ל ה_ דרך ב לוויית שמונה אנשים , מדען , משורר , איש תם , איש מיומן ב מלאכות ו רב תושייה , גאד שם_ _של_ _הוא , מי ש ינטש ו יבגוד ב_ _הוא כ יהודה איש קריות ב ישו , איש אחד מפוקפק ו איש חסר אופי ו עוד שני ילידים .","פוס יוצא ל ה_ דרך ב לוויית שמונה אנשים , מדען , משורר , איש תם , איש מיומן ב מלאכות ו רב תושייה , גאד שם_ _של_ _הוא , מי ש ינטש ו יבגוד ב_ _הוא","פוס יוצא ל ה_ דרך ב לוויית שמונה אנשים , מדען , משורר , איש תם , איש מיומן ב מלאכות ו רב תושייה , גאד שם_ _של_ _הוא , מי ש ינטש ו יבגוד כ יהודה איש קריות ב ישו","פוס יוצא ל ה_ דרך ב לוויית שמונה אנשים , מדען , משורר , איש תם , איש מיומן ב מלאכות ו רב תושייה , גאד שם_ _של_ _הוא , מי ש ינטש ו יבגוד ב_ _הוא","פוס יוצא ל ה_ דרך ב לוויית שמונה אנשים , מדען , משורר , איש תם , איש מיומן ב מלאכות ו רב תושייה , גאד שם_ _של_ _הוא , מי ש ינטש ו יבגוד כ יהודה",ב הוא,כ יהודה,_,ב_ _הוא,כ יהודה איש קריות ב ישו,2,6,ב,כ,הוא,יהודה,PRON,PROPN,prepositional,prepositional,Postverbal,Hebrew
"ה מדען נרצח על ידי ילידים ב שלב מוקדם של ה מסע ב ה_ ישימון ו ב סוף_ _של_ _הוא של דבר נותרים עם פוס רק ה משורר ו ה איש ה תם , ה נאמן .",ה מדען נרצח על ידי ילידים,ה מדען נרצח ב שלב מוקדם של ה מסע ב ה_ ישימון,ה מדען נרצח על ילידים,ה מדען נרצח ב שלב,על יליד,ב שלב,נרצח,על ידי ילידים,ב שלב מוקדם של ה מסע ב ה_ ישימון,3,9,על,ב,יליד,שלב,NOUN,NOUN,prepositional,prepositional,Postverbal,Hebrew
"היא פורשת מן ה חיים ב מובן מסוים , שכן היא מוותרת על חיי חברה ו נישואין , נעשית מורה ב בית ספר ל בנות ו לובשת שחורים כ אחת ה נזירות .",היא פורשת מן ה חיים,היא פורשת ב מובן מסוים,היא פורשת מן חיים,היא פורשת ב מובן,מן חיים,ב מובן,פרש,מן ה חיים,ב מובן מסוים,3,3,מן,ב,חיים,מובן,NOUN,NOUN,prepositional,prepositional,Postverbal,Hebrew
"ב פרק זה עוסק וייט ב ה_ שאלה מי בעצם היה פוס , ו מביא גרסות שונות : פוס היה ה שטן , פוס היה אדם מעוות , פוס הוא ה מיתוס ש אינו כלה לעולם , כפי ש אומרת לורה : "" פוס לא מת , הוא נמצא שם עדיין , כך אומרים , ב מרחבי ה ארץ , ו תמיד יהיה , ו אגדת חיים_ _של_ _הוא תיכתב ב סוף_ _של_ _הוא של דבר , בידי אלה ש הוטרדו בגין_ _היא "" .","ב פרק זה עוסק וייט ב ה_ שאלה מי בעצם היה פוס , ו מביא גרסות שונות : פוס היה ה שטן , פוס היה אדם מעוות , פוס הוא ה מיתוס ש אינו כלה לעולם , כפי ש אומרת לורה : "" פוס לא מת , הוא נמצא שם עדיין , כך אומרים , ב מרחבי ה ארץ , ו תמיד יהיה , ו אגדת חיים_ _של_ _הוא תיכתב ב סוף_ _של_ _הוא של דבר","ב פרק זה עוסק וייט ב ה_ שאלה מי בעצם היה פוס , ו מביא גרסות שונות : פוס היה ה שטן , פוס היה אדם מעוות , פוס הוא ה מיתוס ש אינו כלה לעולם , כפי ש אומרת לורה : "" פוס לא מת , הוא נמצא שם עדיין , כך אומרים , ב מרחבי ה ארץ , ו תמיד יהיה , ו אגדת חיים_ _של_ _הוא תיכתב בידי אלה ש הוטרדו בגין_ _היא","ב פרק זה עוסק וייט ב ה_ שאלה מי בעצם היה פוס , ו מביא גרסות שונות : פוס היה ה שטן , פוס היה אדם מעוות , פוס הוא ה מיתוס ש אינו כלה לעולם , כפי ש אומרת לורה : "" פוס לא מת , הוא נמצא שם עדיין , כך אומרים , ב מרחבי ה ארץ , ו תמיד יהיה , ו אגדת חיים_ _של_ _הוא תיכתב ב סוף_","ב פרק זה עוסק וייט ב ה_ שאלה מי בעצם היה פוס , ו מביא גרסות שונות : פוס היה ה שטן , פוס היה אדם מעוות , פוס הוא ה מיתוס ש אינו כלה לעולם , כפי ש אומרת לורה : "" פוס לא מת , הוא נמצא שם עדיין , כך אומרים , ב מרחבי ה ארץ , ו תמיד יהיה , ו אגדת חיים_ _של_ _הוא תיכתב בידי אלה",ב סוף,בידי אלה,נכתב,ב סוף_ _של_ _הוא של דבר,בידי אלה ש הוטרדו בגין_ _היא,6,6,ב,בידי,סוף,אלה,NOUN,PRON,prepositional,prepositional,Postverbal,Hebrew
ו אולם שני דברים מתבהרים ב סוף ה ספר ללא שיור של ספק .,ו אולם שני דברים מתבהרים ב סוף ה ספר,ו אולם שני דברים מתבהרים ללא שיור של ספק,ו אולם שני דברים מתבהרים ב סוף,ו אולם שני דברים מתבהרים ללא שיור,ב סוף,ללא שיור,התבהר,ב סוף ה ספר,ללא שיור של ספק,4,4,ב,ללא,סוף,שיור,NOUN,NOUN,prepositional,prepositional,Postverbal,Hebrew
"ה תשובה ניתנת על ידי וייט ב ה_ סיפור ש מספר גאד על מוות_ _של_ _הוא של פוס , סיפור ש איש אינו מאמין ב_ _הוא , מפני ש גאד לא היה נוכח ב ה_ מקום ו לא יכול היה לדעת .",ה תשובה ניתנת על ידי וייט,"ה תשובה ניתנת ב ה_ סיפור ש מספר גאד על מוות_ _של_ _הוא של פוס , סיפור ש איש אינו מאמין ב_ _הוא , מפני ש גאד לא היה נוכח ב ה_ מקום ו לא יכול היה לדעת",ה תשובה ניתנת על וייט,ה תשובה ניתנת ב סיפור,על וייט,ב סיפור,ניתן,על ידי וייט,"ב ה_ סיפור ש מספר גאד על מוות_ _של_ _הוא של פוס , סיפור ש איש אינו מאמין ב_ _הוא , מפני ש גאד לא היה נוכח ב ה_ מקום ו לא יכול היה לדעת",3,35,על,ב,וייט,סיפור,PROPN,NOUN,prepositional,prepositional,Postverbal,Hebrew
"אבל גאד ש בגד , למד את ה דברים ב דרך של הארה ו הוא ה איש ש בא להעיד ב_ _הוא , ב פוס : "" הוא היה רוחץ את פצע_ _של_ _הם של ה גברים .","אבל גאד ש בגד , למד את ה דברים ב דרך של הארה ו הוא ה איש ש בא להעיד ב_ _הוא","אבל גאד ש בגד , למד את ה דברים ב דרך של הארה ו הוא ה איש ש בא להעיד ב פוס","אבל גאד ש בגד , למד את ה דברים ב דרך של הארה ו הוא ה איש ש בא להעיד ב_ _הוא","אבל גאד ש בגד , למד את ה דברים ב דרך של הארה ו הוא ה איש ש בא להעיד ב פוס",ב הוא,ב פוס,העיד,ב_ _הוא,ב פוס,2,2,ב,ב,הוא,פוס,PRON,PROPN,prepositional,prepositional,Postverbal,Hebrew
ו משום ש היה גרמניסט ו תרבות_ _של_ _היא של גרמניה היתה קרובה מאוד ל לב_ _של_ _הוא מצא עצמו כפוי לעסוק ב ה_ מהות של ה גרמניות ו לתת תשובה על ה שאלות ש ה היסטוריה ה קרובה הציגה ב פנים_ _של_ _הוא ב יחס אליה _היא .,ו משום ש היה גרמניסט ו תרבות_ _של_ _היא של גרמניה היתה קרובה מאוד ל לב_ _של_ _הוא מצא עצמו כפוי לעסוק ב ה_ מהות של ה גרמניות ו לתת תשובה על ה שאלות ש ה היסטוריה ה קרובה הציגה ב פנים_ _של_ _הוא,ו משום ש היה גרמניסט ו תרבות_ _של_ _היא של גרמניה היתה קרובה מאוד ל לב_ _של_ _הוא מצא עצמו כפוי לעסוק ב ה_ מהות של ה גרמניות ו לתת תשובה על ה שאלות ש ה היסטוריה ה קרובה הציגה ב יחס אליה _היא,ו משום ש היה גרמניסט ו תרבות_ _של_ _היא של גרמניה היתה קרובה מאוד ל לב_ _של_ _הוא מצא עצמו כפוי לעסוק ב ה_ מהות של ה גרמניות ו לתת תשובה על ה שאלות ש ה היסטוריה ה קרובה הציגה ב פנים_,ו משום ש היה גרמניסט ו תרבות_ _של_ _היא של גרמניה היתה קרובה מאוד ל לב_ _של_ _הוא מצא עצמו כפוי לעסוק ב ה_ מהות של ה גרמניות ו לתת תשובה על ה שאלות ש ה היסטוריה ה קרובה הציגה ב _היא,ב פנים,ב הוא,הציג,ב פנים_ _של_ _הוא,ב יחס אליה _היא,4,4,ב,ב,פנים,הוא,NOUN,PRON,prepositional,prepositional,Postverbal,Hebrew
"על כן אפשר לקרוא את "" פוס "" גם אחרת ו להבין את דמות_ _של_ _הוא כ התגלמות_ _של_ _היא של ה נפש ה גרמנית : ה פגאניות , ש כנגד_ _היא הוא מציג כאן את ה נצרות , אינה מאפיינת רק את ה ילידים ה קאניבלים , אלא גם את פוס , ה גרמני ה מגאלומאן , ה איש משולל ה רחמים , איש אכזר ו דורסני ה מאמין כי אין גבולות ל כוח_ _של_ _הוא , ו כי יש ב יכולת ה אדם לדעת הכל , ה איש ה יוצא לכבוש טריטוריה ו מקריב על מזבח שאפתנות_ _של_ _הוא חסרת ה מעצורים חיי אדם בלא ש יחוש צער או חרטה .","על כן אפשר לקרוא את "" פוס "" גם אחרת ו להבין את דמות_ _של_ _הוא כ התגלמות_ _של_ _היא של ה נפש ה גרמנית : ה פגאניות , ש כנגד_ _היא הוא מציג כאן את ה נצרות , אינה מאפיינת רק את ה ילידים ה קאניבלים , אלא גם את פוס , ה גרמני ה מגאלומאן , ה איש משולל ה רחמים , איש אכזר ו דורסני ה מאמין כי אין גבולות ל כוח_ _של_ _הוא , ו כי יש ב יכולת ה אדם לדעת הכל , ה איש ה יוצא לכבוש טריטוריה ו מקריב על מזבח שאפתנות_ _של_ _הוא חסרת ה מעצורים","על כן אפשר לקרוא את "" פוס "" גם אחרת ו להבין את דמות_ _של_ _הוא כ התגלמות_ _של_ _היא של ה נפש ה גרמנית : ה פגאניות , ש כנגד_ _היא הוא מציג כאן את ה נצרות , אינה מאפיינת רק את ה ילידים ה קאניבלים , אלא גם את פוס , ה גרמני ה מגאלומאן , ה איש משולל ה רחמים , איש אכזר ו דורסני ה מאמין כי אין גבולות ל כוח_ _של_ _הוא , ו כי יש ב יכולת ה אדם לדעת הכל , ה איש ה יוצא לכבוש טריטוריה ו מקריב בלא ש יחוש צער או חרטה","על כן אפשר לקרוא את "" פוס "" גם אחרת ו להבין את דמות_ _של_ _הוא כ התגלמות_ _של_ _היא של ה נפש ה גרמנית : ה פגאניות , ש כנגד_ _היא הוא מציג כאן את ה נצרות , אינה מאפיינת רק את ה ילידים ה קאניבלים , אלא גם את פוס , ה גרמני ה מגאלומאן , ה איש משולל ה רחמים , איש אכזר ו דורסני ה מאמין כי אין גבולות ל כוח_ _של_ _הוא , ו כי יש ב יכולת ה אדם לדעת הכל , ה איש ה יוצא לכבוש טריטוריה ו מקריב על מזבח","על כן אפשר לקרוא את "" פוס "" גם אחרת ו להבין את דמות_ _של_ _הוא כ התגלמות_ _של_ _היא של ה נפש ה גרמנית : ה פגאניות , ש כנגד_ _היא הוא מציג כאן את ה נצרות , אינה מאפיינת רק את ה ילידים ה קאניבלים , אלא גם את פוס , ה גרמני ה מגאלומאן , ה איש משולל ה רחמים , איש אכזר ו דורסני ה מאמין כי אין גבולות ל כוח_ _של_ _הוא , ו כי יש ב יכולת ה אדם לדעת הכל , ה איש ה יוצא לכבוש טריטוריה ו מקריב בלא יחוש",על מזבח,בלא חש,הקריב,על מזבח שאפתנות_ _של_ _הוא חסרת ה מעצורים,בלא ש יחוש צער או חרטה,8,6,על,בלא,מזבח,חש,NOUN,VERB,prepositional,prepositional,Postverbal,Hebrew
"אין פלא ב כך , ש ה רעיון ל כתיבת "" פוס "" עלה על דעה_ _של_ _הוא של וייט דווקא ב תקופת מלחמת ה עולם ה שנייה ו ב ה_ מדבר ה מערבי , ב זמן ה קרבות נגד רומל .","אין פלא ב כך , ש ה רעיון ל כתיבת "" פוס "" עלה על דעה_ _של_ _הוא של וייט","אין פלא ב כך , ש ה רעיון ל כתיבת "" פוס "" עלה ב תקופת מלחמת ה עולם ה שנייה ו ב ה_ מדבר ה מערבי , ב זמן ה קרבות נגד רומל","אין פלא ב כך , ש ה רעיון ל כתיבת "" פוס "" עלה על דעה_","אין פלא ב כך , ש ה רעיון ל כתיבת "" פוס "" עלה ב תקופת",על דעה,ב תקופה,עלה,על דעה_ _של_ _הוא של וייט,"ב תקופת מלחמת ה עולם ה שנייה ו ב ה_ מדבר ה מערבי , ב זמן ה קרבות נגד רומל",6,20,על,ב,דעה,תקופה,NOUN,NOUN,prepositional,prepositional,Postverbal,Hebrew
"אם הבליע כאן וייט את אשר הטרידו את _הוא ב אותו זמן מתחת ל קליפה_ _של_ _הוא של רומאן היסטורי , כביכול , אודיסיאה מודרנית , או אלתורים על מחזה פאסיון , לא ייפלא ש מצא ל נכון לשוב ו לעסוק ב כך במפורש ב רומאן גדול אחר של_ _הוא , אולי אחד ה רומאנים ה גדולים ש נכתבו ב זמן מן ה זמנים , ב "" יורדי ה מרכבה "" , ספר ש מתחת ל ה_ מעטה ה מיסטי של_ _הוא , הוא היגד עמוק ו רב - עוצמה על ה אנטישמיות ו ה שואה .","אם הבליע כאן וייט את אשר הטרידו את _הוא ב אותו זמן מתחת ל קליפה_ _של_ _הוא של רומאן היסטורי , כביכול , אודיסיאה מודרנית , או אלתורים על מחזה פאסיון , לא ייפלא ש מצא ל נכון לשוב ו לעסוק ב כך במפורש ב רומאן גדול אחר של_ _הוא , אולי אחד ה רומאנים ה גדולים ש נכתבו ב זמן מן ה זמנים","אם הבליע כאן וייט את אשר הטרידו את _הוא ב אותו זמן מתחת ל קליפה_ _של_ _הוא של רומאן היסטורי , כביכול , אודיסיאה מודרנית , או אלתורים על מחזה פאסיון , לא ייפלא ש מצא ל נכון לשוב ו לעסוק ב כך במפורש ב "" יורדי ה מרכבה "" , ספר ש מתחת ל ה_ מעטה ה מיסטי של_ _הוא , הוא היגד עמוק ו רב - עוצמה על ה אנטישמיות ו ה שואה","אם הבליע כאן וייט את אשר הטרידו את _הוא ב אותו זמן מתחת ל קליפה_ _של_ _הוא של רומאן היסטורי , כביכול , אודיסיאה מודרנית , או אלתורים על מחזה פאסיון , לא ייפלא ש מצא ל נכון לשוב ו לעסוק ב כך במפורש ב רומאן","אם הבליע כאן וייט את אשר הטרידו את _הוא ב אותו זמן מתחת ל קליפה_ _של_ _הוא של רומאן היסטורי , כביכול , אודיסיאה מודרנית , או אלתורים על מחזה פאסיון , לא ייפלא ש מצא ל נכון לשוב ו לעסוק ב כך במפורש ב יורדי",ב רומן,ב _,מצא,"ב רומאן גדול אחר של_ _הוא , אולי אחד ה רומאנים ה גדולים ש נכתבו ב זמן מן ה זמנים","ב "" יורדי ה מרכבה "" , ספר ש מתחת ל ה_ מעטה ה מיסטי של_ _הוא , הוא היגד עמוק ו רב - עוצמה על ה אנטישמיות ו ה שואה",20,31,ב,ב,רומן,_,NOUN,NOUN,prepositional,prepositional,Postverbal,Hebrew
"ב הכנה_ _של_ _הוא ל שמירת ה סדר ב עת מסע הלוויית מאיר כהנא , העמיד בפני עצמו פיקוד ה משטרה , בין ה יעדים ה אחרים אך ב דרגה של עדיפות , את ה הגנה על ה עיתונאים ש היו אמורים לסקר את ה הלוויה .","ב הכנה_ _של_ _הוא ל שמירת ה סדר ב עת מסע הלוויית מאיר כהנא , העמיד בפני עצמו","ב הכנה_ _של_ _הוא ל שמירת ה סדר ב עת מסע הלוויית מאיר כהנא , העמיד בין ה יעדים ה אחרים אך ב דרגה של עדיפות","ב הכנה_ _של_ _הוא ל שמירת ה סדר ב עת מסע הלוויית מאיר כהנא , העמיד בפני עצמו","ב הכנה_ _של_ _הוא ל שמירת ה סדר ב עת מסע הלוויית מאיר כהנא , העמיד בין יעדים",בפני עצמו,בין יעד,העמיד,בפני עצמו,בין ה יעדים ה אחרים אך ב דרגה של עדיפות,2,10,בפני,בין,עצמו,יעד,PRON,NOUN,prepositional,prepositional,Postverbal,Hebrew
