Sentence,Context_PP1,Context_PP2,Context_PP1_simple,Context_PP2_simple,PP1_simple,PP2_simple,Verb,PP1,PP2,PP1_len,PP2_len,Adp1,Adp2,NP1,NP2,PP1_Pronom,PP2_Pronom,PP1_Type,PP2_Type,Position,Language
ה קהל איתר סוף סוף ערבי ו יהודים חבטו ב_ _הוא עד זוב דם .,ה קהל איתר סוף סוף ערבי ו יהודים חבטו ב_ _הוא,ה קהל איתר סוף סוף ערבי ו יהודים חבטו עד זוב דם,ה קהל איתר סוף סוף ערבי ו יהודים חבטו ב_ _הוא,ה קהל איתר סוף סוף ערבי ו יהודים חבטו עד זוב,ב הוא,עד זב,חבט,ב_ _הוא,עד זוב דם,2,3,ב,עד,הוא,זב,PRON,NOUN,prepositional,prepositional,Postverbal,Hebrew
ה אמבולנס התקרב אך בקושי ו גם כאשר נסגרו ה דלתות היכו עשרות ב ה_ ידיים ו ב ה_ רגליים על פח ה רכב .,ה אמבולנס התקרב אך בקושי ו גם כאשר נסגרו ה דלתות היכו עשרות ב ה_ ידיים ו ב ה_ רגליים,ה אמבולנס התקרב אך בקושי ו גם כאשר נסגרו ה דלתות היכו עשרות על פח ה רכב,ה אמבולנס התקרב אך בקושי ו גם כאשר נסגרו ה דלתות היכו עשרות ב ידיים,ה אמבולנס התקרב אך בקושי ו גם כאשר נסגרו ה דלתות היכו עשרות על פח,ב יד,על פח,הכה,ב ה_ ידיים ו ב ה_ רגליים,על פח ה רכב,7,4,ב,על,יד,פח,NOUN,NOUN,prepositional,prepositional,Postverbal,Hebrew
"סופר "" ה ארץ "" ב ה_ צפון , מוסיף : יריות נשמעו אתמול ב שעה 2000 ב ה_ ערב ב שפרעם , סמוך ל בית_ _של_ _הוא של ראש ה עירייה , איברהים נימר חוסיין .","סופר "" ה ארץ "" ב ה_ צפון , מוסיף : יריות נשמעו אתמול ב שעה 2000 ב ה_ ערב","סופר "" ה ארץ "" ב ה_ צפון , מוסיף : יריות נשמעו אתמול ב שפרעם","סופר "" ה ארץ "" ב ה_ צפון , מוסיף : יריות נשמעו אתמול ב שעה","סופר "" ה ארץ "" ב ה_ צפון , מוסיף : יריות נשמעו אתמול ב שפרעם",ב שעה,ב שפרעם,נשמע,ב שעה 2000 ב ה_ ערב,ב שפרעם,6,2,ב,ב,שעה,שפרעם,NOUN,PROPN,prepositional,prepositional,Postverbal,Hebrew
הם התבקשו לדווח ל ה_ משטרה על תנועה_ _של_ _הם .,הם התבקשו לדווח ל ה_ משטרה,הם התבקשו לדווח על תנועה_ _של_ _הם,הם התבקשו לדווח ל משטרה,הם התבקשו לדווח על תנועה_,ל משטרה,על תנועה,דיווח,ל ה_ משטרה,על תנועה_ _של_ _הם,3,4,ל,על,משטרה,תנועה,NOUN,NOUN,prepositional,prepositional,Postverbal,Hebrew
"חמישה חיילי צה""ל נפצעו ב אורח קל ב תקריות קשות ש היו ב סוף ה שבוע ב רצועת עזה .","חמישה חיילי צה""ל נפצעו ב אורח קל","חמישה חיילי צה""ל נפצעו ב תקריות קשות ש היו ב סוף ה שבוע ב רצועת עזה","חמישה חיילי צה""ל נפצעו ב אורח","חמישה חיילי צה""ל נפצעו ב תקריות",ב אורח,ב תקרית,נפצע,ב אורח קל,ב תקריות קשות ש היו ב סוף ה שבוע ב רצועת עזה,3,12,ב,ב,אורח,תקרית,NOUN,NOUN,prepositional,prepositional,Postverbal,Hebrew
מקורות פלשתיניים דיווחו ש ה תקריות החלו ב כמה מחנות פליטים כבר ב יום שישי .,מקורות פלשתיניים דיווחו ש ה תקריות החלו ב כמה מחנות פליטים,מקורות פלשתיניים דיווחו ש ה תקריות החלו כבר ב יום שישי,מקורות פלשתיניים דיווחו ש ה תקריות החלו ב מחנות,מקורות פלשתיניים דיווחו ש ה תקריות החלו ב יום,ב מחנה,ב יום,החל,ב כמה מחנות פליטים,כבר ב יום שישי,4,4,ב,ב,מחנה,יום,NOUN,NOUN,prepositional,prepositional,Postverbal,Hebrew
"אמש דוווח מ פי מקורות פלשתיניים על תושב דיר אל באלח , בן 51 , ש נפצע ב אורח בינוני ו הועבר ל ביה""ח תל - ה שומר .",אמש דוווח מ פי מקורות פלשתיניים,"אמש דוווח על תושב דיר אל באלח , בן 51 , ש נפצע ב אורח בינוני ו הועבר ל ביה""ח תל - ה שומר",אמש דוווח מ מקורות,אמש דוווח על תושב,מ מקור,על תושב,דוווח,מ פי מקורות פלשתיניים,"על תושב דיר אל באלח , בן 51 , ש נפצע ב אורח בינוני ו הועבר ל ביה""ח תל - ה שומר",4,22,מ,על,מקור,תושב,NOUN,NOUN,prepositional,prepositional,Postverbal,Hebrew
ב ה_ שטחים התקיימה ב יום שישי שביתה כללית ב יום ה שנה ל הצהרת בלפור .,ב ה_ שטחים התקיימה ב יום שישי,ב ה_ שטחים התקיימה ב יום ה שנה ל הצהרת בלפור,ב ה_ שטחים התקיימה ב יום,ב ה_ שטחים התקיימה ב יום,ב יום,ב יום,התקיים,ב יום שישי,ב יום ה שנה ל הצהרת בלפור,3,7,ב,ב,יום,יום,NOUN,NOUN,prepositional,prepositional,Postverbal,Hebrew
"אתמול הסיר צה""ל את ה עוצר מ רוב שטחי ה גדה ה מערבית , ש הושמו ב עוצר מונע לרגל יום הצהרת בלפור ו בעקבות אירועים אלימים .","אתמול הסיר צה""ל את ה עוצר מ רוב שטחי ה גדה ה מערבית , ש הושמו ב עוצר מונע","אתמול הסיר צה""ל את ה עוצר מ רוב שטחי ה גדה ה מערבית , ש הושמו לרגל יום הצהרת בלפור ו בעקבות אירועים אלימים","אתמול הסיר צה""ל את ה עוצר מ רוב שטחי ה גדה ה מערבית , ש הושמו ב עוצר","אתמול הסיר צה""ל את ה עוצר מ רוב שטחי ה גדה ה מערבית , ש הושמו לרגל יום",ב עוצר,לרגל יום,הושם,ב עוצר מונע,לרגל יום הצהרת בלפור ו בעקבות אירועים אלימים,3,8,ב,לרגל,עוצר,יום,NOUN,NOUN,prepositional,prepositional,Postverbal,Hebrew
"מקורות פלשתיניים טענו כי ב סוף ה שבוע הוכו ב מרכז שכם 01 תושבים מקומיים בידי חיילי צה""ל , סמוך ל שוק ה ירקות .",מקורות פלשתיניים טענו כי ב סוף ה שבוע הוכו ב מרכז שכם,"מקורות פלשתיניים טענו כי ב סוף ה שבוע הוכו בידי חיילי צה""ל",מקורות פלשתיניים טענו כי ב סוף ה שבוע הוכו ב מרכז,מקורות פלשתיניים טענו כי ב סוף ה שבוע הוכו בידי חיילי,ב מרכז,בידי חייל,הוכה,ב מרכז שכם,"בידי חיילי צה""ל",3,3,ב,בידי,מרכז,חייל,NOUN,NOUN,prepositional,prepositional,Postverbal,Hebrew
"ב כפר בלעא ב נפת טול כרם תקפו שלושה רעולי פנים ב סכינים רופא מקומי ד""ר עפיף ברברח , בן 03 , ש אושפז ב מצב קשה ב בית ה חולים אל איתיחאד ב שכם .","ב כפר בלעא ב נפת טול כרם תקפו שלושה רעולי פנים ב סכינים רופא מקומי ד""ר עפיף ברברח , בן 03 , ש אושפז ב מצב קשה","ב כפר בלעא ב נפת טול כרם תקפו שלושה רעולי פנים ב סכינים רופא מקומי ד""ר עפיף ברברח , בן 03 , ש אושפז ב בית ה חולים אל איתיחאד ב שכם","ב כפר בלעא ב נפת טול כרם תקפו שלושה רעולי פנים ב סכינים רופא מקומי ד""ר עפיף ברברח , בן 03 , ש אושפז ב מצב","ב כפר בלעא ב נפת טול כרם תקפו שלושה רעולי פנים ב סכינים רופא מקומי ד""ר עפיף ברברח , בן 03 , ש אושפז ב בית",ב מצב,ב בית,אושפז,ב מצב קשה,ב בית ה חולים אל איתיחאד ב שכם,3,8,ב,ב,מצב,בית,NOUN,NOUN,prepositional,prepositional,Postverbal,Hebrew
"מקורות צבאיים מסרו כי ב יום שישי הושלך בקבוק תבערה לעבר כוח משמר ה גבול ב רחבת כנסיית ה מולד ב בית לחם , אך הוא התנפץ מבלי להתלקח ו מבלי לגרום ל נזק או ל נפגעים .",מקורות צבאיים מסרו כי ב יום שישי הושלך בקבוק תבערה לעבר כוח משמר ה גבול,מקורות צבאיים מסרו כי ב יום שישי הושלך בקבוק תבערה ב רחבת כנסיית ה מולד ב בית לחם,מקורות צבאיים מסרו כי ב יום שישי הושלך בקבוק תבערה לעבר כוח,מקורות צבאיים מסרו כי ב יום שישי הושלך בקבוק תבערה ב רחבת,לעבר כוח,ב רחבה,הושלך,לעבר כוח משמר ה גבול,ב רחבת כנסיית ה מולד ב בית לחם,5,8,לעבר,ב,כוח,רחבה,NOUN,NOUN,prepositional,prepositional,Postverbal,Hebrew
"כ תוצאה מ זריקת אבנים לעבר אוטובוס ישראלי ב חלחול , נפצעה ב יום שישי קל תיירת ב ראש_ _של_ _היא , ו היא טופלה ב ה_ מקום .","כ תוצאה מ זריקת אבנים לעבר אוטובוס ישראלי ב חלחול , נפצעה ב יום שישי","כ תוצאה מ זריקת אבנים לעבר אוטובוס ישראלי ב חלחול , נפצעה ב ראש_ _של_ _היא","כ תוצאה מ זריקת אבנים לעבר אוטובוס ישראלי ב חלחול , נפצעה ב יום","כ תוצאה מ זריקת אבנים לעבר אוטובוס ישראלי ב חלחול , נפצעה ב ראש_",ב יום,ב ראש,נפצע,ב יום שישי,ב ראש_ _של_ _היא,3,4,ב,ב,יום,ראש,NOUN,NOUN,prepositional,prepositional,Postverbal,Hebrew
"ארנס הודיע ל מפקדי צה""ל ב ה_ אזור על בוא_ _של_ _הוא רק כ שעה - שעתיים לפני הגיעו .","ארנס הודיע ל מפקדי צה""ל ב ה_ אזור",ארנס הודיע על בוא_ _של_ _הוא,ארנס הודיע ל מפקדי,ארנס הודיע על בוא_,ל מפקד,על בוא,הודיע,"ל מפקדי צה""ל ב ה_ אזור",על בוא_ _של_ _הוא,6,4,ל,על,מפקד,בוא,NOUN,NOUN,prepositional,prepositional,Postverbal,Hebrew
"מקורות פלשתיניים דיווחו על 511 פצועים , בעיקר ב רפיח .",מקורות פלשתיניים דיווחו על 511 פצועים,מקורות פלשתיניים דיווחו בעיקר ב רפיח,מקורות פלשתיניים דיווחו על פצועים,מקורות פלשתיניים דיווחו ב רפיח,על פצוע,ב רפיח,דיווח,על 511 פצועים,בעיקר ב רפיח,3,3,על,ב,פצוע,רפיח,NOUN,PROPN,prepositional,prepositional,Postverbal,Hebrew
קצין בכיר הגדיר את ה מתרחש ב ה_ רצועה ב ה_ יומיים ה אחרונים כ מלחמה .,קצין בכיר הגדיר את ה מתרחש ב ה_ רצועה,קצין בכיר הגדיר את ה מתרחש ב ה_ יומיים ה אחרונים,קצין בכיר הגדיר את ה מתרחש ב רצועה,קצין בכיר הגדיר את ה מתרחש ב יומיים,ב רצועה,ב יום,התרחש,ב ה_ רצועה,ב ה_ יומיים ה אחרונים,3,5,ב,ב,רצועה,יום,NOUN,NOUN,prepositional,prepositional,Postverbal,Hebrew
"אתמול הושלכו ארבעה בקבוקי תבערה על כוחות של צה""ל ב רפיח .","אתמול הושלכו ארבעה בקבוקי תבערה על כוחות של צה""ל",אתמול הושלכו ארבעה בקבוקי תבערה ב רפיח,אתמול הושלכו ארבעה בקבוקי תבערה על כוחות,אתמול הושלכו ארבעה בקבוקי תבערה ב רפיח,על כוח,ב רפיח,הושלך,"על כוחות של צה""ל",ב רפיח,4,2,על,ב,כוח,רפיח,NOUN,PROPN,prepositional,prepositional,Postverbal,Hebrew
"מקורות פלשתיניים מסרו כי חיילים , ש ירדו מ מיניבוס לבן ב שכונת ראפידיה ב שכם , ניפצו ב עזרת אבנים זגוגיות של מכוניות חונות של תושבים מקומיים , בין_ _הן גם את חלונות מכונית_ _של_ _הוא של דר מוסטפא מקבול .","מקורות פלשתיניים מסרו כי חיילים , ש ירדו מ מיניבוס לבן","מקורות פלשתיניים מסרו כי חיילים , ש ירדו ב שכונת ראפידיה ב שכם","מקורות פלשתיניים מסרו כי חיילים , ש ירדו מ מיניבוס","מקורות פלשתיניים מסרו כי חיילים , ש ירדו ב שכונת",מ מיניבוס,ב שכונה,ירד,מ מיניבוס לבן,ב שכונת ראפידיה ב שכם,3,5,מ,ב,מיניבוס,שכונה,NOUN,NOUN,prepositional,prepositional,Postverbal,Hebrew
"זו ה פעם שלישית ב ה_ חודש ה אחרון , ש סיורים של צה""ל מותקפים ב אש חיה ב ה_ רצועה .","זו ה פעם שלישית ב ה_ חודש ה אחרון , ש סיורים של צה""ל מותקפים ב אש חיה","זו ה פעם שלישית ב ה_ חודש ה אחרון , ש סיורים של צה""ל מותקפים ב ה_ רצועה","זו ה פעם שלישית ב ה_ חודש ה אחרון , ש סיורים של צה""ל מותקפים ב אש","זו ה פעם שלישית ב ה_ חודש ה אחרון , ש סיורים של צה""ל מותקפים ב רצועה",ב אש,ב רצועה,הותקף,ב אש חיה,ב ה_ רצועה,3,3,ב,ב,אש,רצועה,NOUN,NOUN,prepositional,prepositional,Postverbal,Hebrew
שניים מן_ _הם אושפזו ל קבלת טיפול ב בית ה חולים ה ממשלתי ב רמאללה .,שניים מן_ _הם אושפזו ל קבלת טיפול,שניים מן_ _הם אושפזו ב בית ה חולים ה ממשלתי ב רמאללה,שניים מן_ _הם אושפזו ל קבלת,שניים מן_ _הם אושפזו ב בית,ל קבלה,ב בית,אושפז,ל קבלת טיפול,ב בית ה חולים ה ממשלתי ב רמאללה,3,8,ל,ב,קבלה,בית,NOUN,NOUN,prepositional,prepositional,Postverbal,Hebrew
"תושבים טענו כי ה אבן נזרקה בידי חיילים מ תצפית צבאית , ה נמצאת על גג בניין אגודת ה צדקה ב ה_ שכונה .",תושבים טענו כי ה אבן נזרקה בידי חיילים,"תושבים טענו כי ה אבן נזרקה מ תצפית צבאית , ה נמצאת על גג בניין אגודת ה צדקה ב ה_ שכונה",תושבים טענו כי ה אבן נזרקה בידי חיילים,תושבים טענו כי ה אבן נזרקה מ תצפית,בידי חייל,מ תצפית,נזרק,בידי חיילים,"מ תצפית צבאית , ה נמצאת על גג בניין אגודת ה צדקה ב ה_ שכונה",2,15,בידי,מ,חייל,תצפית,NOUN,NOUN,prepositional,prepositional,Postverbal,Hebrew
"ב בית ה משפט ב עזה נידונו אתמול שלושה צעירים ל מאסר עולם , לאחר ש הורשעו ב חטיפת תושב מקומי ו רציחה_ _של_ _הוא על ידי הטבעה_ _של_ _הוא ב בור ביוב .",ב בית ה משפט ב עזה נידונו אתמול שלושה צעירים ל מאסר עולם,ב בית ה משפט ב עזה נידונו אתמול שלושה צעירים לאחר ש הורשעו ב חטיפת תושב מקומי ו רציחה_ _של_ _הוא על ידי הטבעה_ _של_ _הוא ב בור ביוב,ב בית ה משפט ב עזה נידונו אתמול שלושה צעירים ל מאסר,ב בית ה משפט ב עזה נידונו אתמול שלושה צעירים לאחר הורשעו,ל מאסר,לאחר הורשע,נידון,ל מאסר עולם,לאחר ש הורשעו ב חטיפת תושב מקומי ו רציחה_ _של_ _הוא על ידי הטבעה_ _של_ _הוא ב בור ביוב,3,19,ל,לאחר,מאסר,הורשע,NOUN,VERB,prepositional,prepositional,Postverbal,Hebrew
""" קיטש ו מוות "" , מכנה שגב את מה ש ראה , תוך ש הוא מצטרף ב כך ל רשימה ארוכה ו צפופה של כותבים .",""" קיטש ו מוות "" , מכנה שגב את מה ש ראה , תוך ש הוא מצטרף ב כך",""" קיטש ו מוות "" , מכנה שגב את מה ש ראה , תוך ש הוא מצטרף ל רשימה ארוכה ו צפופה של כותבים",""" קיטש ו מוות "" , מכנה שגב את מה ש ראה , תוך ש הוא מצטרף ב כך",""" קיטש ו מוות "" , מכנה שגב את מה ש ראה , תוך ש הוא מצטרף ל רשימה",ב כך,ל רשימה,הצטרף,ב כך,ל רשימה ארוכה ו צפופה של כותבים,2,7,ב,ל,כך,רשימה,PRON,NOUN,prepositional,prepositional,Postverbal,Hebrew
"נראה ש כל טקס , כל מחווה סמלית כלפי ה רצח ה קולקטיווי ה זה , נתפסת ב עין_ _של_ _הוא כ קיטש .","נראה ש כל טקס , כל מחווה סמלית כלפי ה רצח ה קולקטיווי ה זה , נתפסת ב עין_ _של_ _הוא","נראה ש כל טקס , כל מחווה סמלית כלפי ה רצח ה קולקטיווי ה זה , נתפסת כ קיטש","נראה ש כל טקס , כל מחווה סמלית כלפי ה רצח ה קולקטיווי ה זה , נתפסת ב עין_","נראה ש כל טקס , כל מחווה סמלית כלפי ה רצח ה קולקטיווי ה זה , נתפסת כ קיטש",ב עין,כ קיטש,נתפס,ב עין_ _של_ _הוא,כ קיטש,4,2,ב,כ,עין,קיטש,NOUN,NOUN,prepositional,prepositional,Postverbal,Hebrew
"אלא ש ב עניין ה שואה , כמו ב כל ה נוגע ל ה_ מוות על רקע לאומי ב הקשרים אחרים , יש ל ה_ סמלים משמעות לאומית , ו לא רק אישית .",אלא ש ב עניין ה שואה,אלא ש כמו ב כל ה נוגע ל ה_ מוות על רקע לאומי ב הקשרים אחרים,אלא ש ב עניין,אלא ש כמו ב נוגע,ב עניין,כמו ב נגע,יש,ב עניין ה שואה,כמו ב כל ה נוגע ל ה_ מוות על רקע לאומי ב הקשרים אחרים,4,14,ב,כמו ב,עניין,נגע,NOUN,VERB,prepositional,prepositional,Preverbal,Hebrew
"מ צד שני , שגב , מ בחינה_ _של_ _הוא , צודק .",מ צד שני,מ בחינה_ _של_ _הוא,מ צד,מ בחינה_,מ צד,מ בחינה,צדק,מ צד שני,מ בחינה_ _של_ _הוא,3,4,מ,מ,צד,בחינה,NOUN,NOUN,prepositional,prepositional,Preverbal,Hebrew
"אולי , אם כן , הם רצים ל פולין דווקא משום ש יש ב לב_ _של_ _הם רגש לאומי טבעי , ו הם מחפשים ל_ _הוא חיזוקים ו סמלים , ו מפני ש בעלי השקפה כמו שגב השתדלו מאוד לעקור את ה רגש ה זה ב יחס ל כל מה ש היה "" סמל תשתית "" כ ה_ זה כאן ב ה_ ארץ .","אולי , אם כן , הם רצים ל פולין דווקא משום ש יש ב לב_ _של_ _הם רגש לאומי טבעי , ו הם מחפשים ל_ _הוא חיזוקים ו סמלים , ו מפני ש בעלי השקפה כמו שגב השתדלו מאוד לעקור את ה רגש ה זה ב יחס ל כל מה ש היה "" סמל תשתית "" כ ה_ זה","אולי , אם כן , הם רצים ל פולין דווקא משום ש יש ב לב_ _של_ _הם רגש לאומי טבעי , ו הם מחפשים ל_ _הוא חיזוקים ו סמלים , ו מפני ש בעלי השקפה כמו שגב השתדלו מאוד לעקור את ה רגש ה זה כאן ב ה_ ארץ","אולי , אם כן , הם רצים ל פולין דווקא משום ש יש ב לב_ _של_ _הם רגש לאומי טבעי , ו הם מחפשים ל_ _הוא חיזוקים ו סמלים , ו מפני ש בעלי השקפה כמו שגב השתדלו מאוד לעקור את ה רגש ה זה ב מה","אולי , אם כן , הם רצים ל פולין דווקא משום ש יש ב לב_ _של_ _הם רגש לאומי טבעי , ו הם מחפשים ל_ _הוא חיזוקים ו סמלים , ו מפני ש בעלי השקפה כמו שגב השתדלו מאוד לעקור את ה רגש ה זה ב ארץ",ב מה,ב ארץ,עקר,"ב יחס ל כל מה ש היה "" סמל תשתית "" כ ה_ זה",כאן ב ה_ ארץ,14,4,ב,ב,מה,ארץ,ADV,NOUN,prepositional,prepositional,Postverbal,Hebrew
"עכשיו מסתבר ש זרוע_ _של_ _הם ה ארוכה של ה מתנכרים ב ה_ עם , באמצעות שליחים כמו שגב , מחפשת אחרי_ _הם גם ל שם .","עכשיו מסתבר ש זרוע_ _של_ _הם ה ארוכה של ה מתנכרים ב ה_ עם , באמצעות שליחים כמו שגב , מחפשת אחרי_ _הם","עכשיו מסתבר ש זרוע_ _של_ _הם ה ארוכה של ה מתנכרים ב ה_ עם , באמצעות שליחים כמו שגב , מחפשת גם ל שם","עכשיו מסתבר ש זרוע_ _של_ _הם ה ארוכה של ה מתנכרים ב ה_ עם , באמצעות שליחים כמו שגב , מחפשת אחרי_ _הם","עכשיו מסתבר ש זרוע_ _של_ _הם ה ארוכה של ה מתנכרים ב ה_ עם , באמצעות שליחים כמו שגב , מחפשת ל שם",אחרי הוא,ל שם,חיפש,אחרי_ _הם,גם ל שם,2,3,אחרי,ל,הוא,שם,PRON,ADV,prepositional,prepositional,Postverbal,Hebrew
"אלא ש בעלי השקפה כמו שגב טועים טעות מרה כש הם מסיטים את תשומת - ה לב מ אותו חלק של תוצאות ה רגש ה לאומי ש הוא שלילי , לעבר ניסיון לעקר את ה רגש ה לאומי עצמו , את טקס_ _של_ _הוא ו את סמל_ _של_ _הוא , ו לפגוע ב_ _הם .",אלא ש בעלי השקפה כמו שגב טועים טעות מרה כש הם מסיטים את תשומת - ה לב מ אותו חלק של תוצאות ה רגש ה לאומי ש הוא שלילי,"אלא ש בעלי השקפה כמו שגב טועים טעות מרה כש הם מסיטים את תשומת - ה לב לעבר ניסיון לעקר את ה רגש ה לאומי עצמו , את טקס_ _של_ _הוא ו את סמל_ _של_ _הוא , ו לפגוע ב_ _הם",אלא ש בעלי השקפה כמו שגב טועים טעות מרה כש הם מסיטים את תשומת - ה לב מ חלק,אלא ש בעלי השקפה כמו שגב טועים טעות מרה כש הם מסיטים את תשומת - ה לב לעבר ניסיון,מ חלק,לעבר ניסיון,הסיט,מ אותו חלק של תוצאות ה רגש ה לאומי ש הוא שלילי,"לעבר ניסיון לעקר את ה רגש ה לאומי עצמו , את טקס_ _של_ _הוא ו את סמל_ _של_ _הוא , ו לפגוע ב_ _הם",12,24,מ,לעבר,חלק,ניסיון,NOUN,NOUN,prepositional,prepositional,Postverbal,Hebrew
"לא שיננו ב __ _של_ _הם ש היא מחייבת את_ _הם לבצר את ה דמוקרטיה ( עוד דוגמה ל תגובה סטריאוטיפית : מה עניין ה משטר ה דמוקרטי ל כאן , כאשר היטלר עצמו עלה ל ה_ שלטון ב מסגרת משטר כ ה_ זה י""ש ) , להילחם ב גזענות , להגן על מיעוטים ו על זכויות ה אדם , להימנע מ ביצוע פקודות בלתי חוקיות "" .","לא שיננו ב __ _של_ _הם ש היא מחייבת את_ _הם לבצר את ה דמוקרטיה ( עוד דוגמה ל תגובה סטריאוטיפית : מה עניין ה משטר ה דמוקרטי ל כאן , כאשר היטלר עצמו עלה ל ה_ שלטון","לא שיננו ב __ _של_ _הם ש היא מחייבת את_ _הם לבצר את ה דמוקרטיה ( עוד דוגמה ל תגובה סטריאוטיפית : מה עניין ה משטר ה דמוקרטי ל כאן , כאשר היטלר עצמו עלה ב מסגרת משטר כ ה_ זה","לא שיננו ב __ _של_ _הם ש היא מחייבת את_ _הם לבצר את ה דמוקרטיה ( עוד דוגמה ל תגובה סטריאוטיפית : מה עניין ה משטר ה דמוקרטי ל כאן , כאשר היטלר עצמו עלה ל שלטון","לא שיננו ב __ _של_ _הם ש היא מחייבת את_ _הם לבצר את ה דמוקרטיה ( עוד דוגמה ל תגובה סטריאוטיפית : מה עניין ה משטר ה דמוקרטי ל כאן , כאשר היטלר עצמו עלה ב משטר",ל שלטון,ב משטר,עלה,ל ה_ שלטון,ב מסגרת משטר כ ה_ זה,3,6,ל,ב,שלטון,משטר,NOUN,NOUN,prepositional,prepositional,Postverbal,Hebrew
