Sentence,Context_PP1,Context_PP2,Context_PP1_simple,Context_PP2_simple,PP1_simple,PP2_simple,Verb,PP1,PP2,PP1_len,PP2_len,Adp1,Adp2,NP1,NP2,PP1_Pronom,PP2_Pronom,PP1_Type,PP2_Type,Position,Language
"לולא תקרית ה דמים ב הר ה בית , אין ספק כי הקמת מחוז ירושלים , ו כינון ה מטה ה מבצעי של שר ה משטרה , לא היו נכנסים ב מהירות ש כ ה_ זאת ל שלב ה ביצוע .","לולא תקרית ה דמים ב הר ה בית , אין ספק כי הקמת מחוז ירושלים , ו כינון ה מטה ה מבצעי של שר ה משטרה , לא היו נכנסים ב מהירות ש כ ה_ זאת","לולא תקרית ה דמים ב הר ה בית , אין ספק כי הקמת מחוז ירושלים , ו כינון ה מטה ה מבצעי של שר ה משטרה , לא היו נכנסים ל שלב ה ביצוע","לולא תקרית ה דמים ב הר ה בית , אין ספק כי הקמת מחוז ירושלים , ו כינון ה מטה ה מבצעי של שר ה משטרה , לא היו נכנסים ב מהירות","לולא תקרית ה דמים ב הר ה בית , אין ספק כי הקמת מחוז ירושלים , ו כינון ה מטה ה מבצעי של שר ה משטרה , לא היו נכנסים ל שלב",ב מהירות,ל שלב,נכנס,ב מהירות ש כ ה_ זאת,ל שלב ה ביצוע,6,4,ב,ל,מהירות,שלב,NOUN,NOUN,prepositional,prepositional,Postverbal,Hebrew
"ה צורך ב מינוי קצינים בכירים כ ה_ יועצים ל שר ה משטרה , הקמת מחוז ירושלים ו מינוי ניצב ב ראש_ _של_ _הוא , פרישה_ _של_ _הוא ה קרובה של מפקד ה מחוז ה דרומי , ניצב רחמים קומפורט , ו כן פרישה_ _של_ _הוא ה צפויה ל גמלאות של ראש אגף כוח אדם , ניצב שלמה חרון , כל אלה יביאו ב ה_ חודשים ה קרובים ל סבב מינויים רחב היקף ב ה_ משטרה .","ה צורך ב מינוי קצינים בכירים כ ה_ יועצים ל שר ה משטרה , הקמת מחוז ירושלים ו מינוי ניצב ב ראש_ _של_ _הוא , פרישה_ _של_ _הוא ה קרובה של מפקד ה מחוז ה דרומי , ניצב רחמים קומפורט , ו כן פרישה_ _של_ _הוא ה צפויה ל גמלאות של ראש אגף כוח אדם , ניצב שלמה חרון , כל אלה יביאו ב ה_ חודשים ה קרובים","ה צורך ב מינוי קצינים בכירים כ ה_ יועצים ל שר ה משטרה , הקמת מחוז ירושלים ו מינוי ניצב ב ראש_ _של_ _הוא , פרישה_ _של_ _הוא ה קרובה של מפקד ה מחוז ה דרומי , ניצב רחמים קומפורט , ו כן פרישה_ _של_ _הוא ה צפויה ל גמלאות של ראש אגף כוח אדם , ניצב שלמה חרון , כל אלה יביאו ל סבב מינויים רחב היקף ב ה_ משטרה","ה צורך ב מינוי קצינים בכירים כ ה_ יועצים ל שר ה משטרה , הקמת מחוז ירושלים ו מינוי ניצב ב ראש_ _של_ _הוא , פרישה_ _של_ _הוא ה קרובה של מפקד ה מחוז ה דרומי , ניצב רחמים קומפורט , ו כן פרישה_ _של_ _הוא ה צפויה ל גמלאות של ראש אגף כוח אדם , ניצב שלמה חרון , כל אלה יביאו ב חודשים","ה צורך ב מינוי קצינים בכירים כ ה_ יועצים ל שר ה משטרה , הקמת מחוז ירושלים ו מינוי ניצב ב ראש_ _של_ _הוא , פרישה_ _של_ _הוא ה קרובה של מפקד ה מחוז ה דרומי , ניצב רחמים קומפורט , ו כן פרישה_ _של_ _הוא ה צפויה ל גמלאות של ראש אגף כוח אדם , ניצב שלמה חרון , כל אלה יביאו ל סבב",ב חודש,ל סבב,הביא,ב ה_ חודשים ה קרובים,ל סבב מינויים רחב היקף ב ה_ משטרה,5,8,ב,ל,חודש,סבב,NOUN,NOUN,prepositional,prepositional,Postverbal,Hebrew
שר ה משטרה מראיין ב ה_ שבועיים ה אחרונים ב פעולה מואצת קציני משטרה רבים .,שר ה משטרה מראיין ב ה_ שבועיים ה אחרונים,שר ה משטרה מראיין ב פעולה מואצת,שר ה משטרה מראיין ב שבועיים,שר ה משטרה מראיין ב פעולה,ב שבוע,ב פעולה,ראיין,ב ה_ שבועיים ה אחרונים,ב פעולה מואצת,5,3,ב,ב,שבוע,פעולה,NOUN,NOUN,prepositional,prepositional,Postverbal,Hebrew
מילוא מעורב אישית ב קביעת ה מינויים ו משתתף ב אופן פעיל ב החלטות לגבי ה שיבוצים .,מילוא מעורב אישית ב קביעת ה מינויים ו משתתף ב אופן פעיל,מילוא מעורב אישית ב קביעת ה מינויים ו משתתף ב החלטות לגבי ה שיבוצים,מילוא מעורב אישית ב קביעת ה מינויים ו משתתף ב אופן,מילוא מעורב אישית ב קביעת ה מינויים ו משתתף ב החלטות,ב אופן,ב החלטה,השתתף,ב אופן פעיל,ב החלטות לגבי ה שיבוצים,3,5,ב,ב,אופן,החלטה,NOUN,NOUN,prepositional,prepositional,Postverbal,Hebrew
"ב ימים אלה שוקדים ב אגף ה תכנון ב ה_ מטה ה ארצי של ה משטרה על קביעת דמות_ _של_ _הוא של מחוז ירושלים ה חדש , הן מ בחינת ה פריסה ה טריטוריאלית ו הן מ בחינת תקנון כוח ה אדם ו ה אמצעים .",ב ימים אלה שוקדים ב אגף ה תכנון ב ה_ מטה ה ארצי של ה משטרה,"ב ימים אלה שוקדים על קביעת דמות_ _של_ _הוא של מחוז ירושלים ה חדש , הן מ בחינת ה פריסה ה טריטוריאלית ו הן מ בחינת תקנון כוח ה אדם ו ה אמצעים",ב ימים אלה שוקדים ב אגף,ב ימים אלה שוקדים על קביעת,ב אגף,על קביעה,שקד,ב אגף ה תכנון ב ה_ מטה ה ארצי של ה משטרה,"על קביעת דמות_ _של_ _הוא של מחוז ירושלים ה חדש , הן מ בחינת ה פריסה ה טריטוריאלית ו הן מ בחינת תקנון כוח ה אדם ו ה אמצעים",12,29,ב,על,אגף,קביעה,NOUN,NOUN,prepositional,prepositional,Postverbal,Hebrew
"עתה , עם ה הודעה על הקמת ה מחוז ה חדש , הבטיח שר ה משטרה כי יתוספו ל ירושלים 053 שוטרים חדשים ב אורח קבע .","עתה , עם ה הודעה על הקמת ה מחוז ה חדש , הבטיח שר ה משטרה כי יתוספו ל ירושלים","עתה , עם ה הודעה על הקמת ה מחוז ה חדש , הבטיח שר ה משטרה כי יתוספו ב אורח קבע","עתה , עם ה הודעה על הקמת ה מחוז ה חדש , הבטיח שר ה משטרה כי יתוספו ל ירושלים","עתה , עם ה הודעה על הקמת ה מחוז ה חדש , הבטיח שר ה משטרה כי יתוספו ב אורח",ל ירושלים,ב אורח,יתוספו,ל ירושלים,ב אורח קבע,2,3,ל,ב,ירושלים,אורח,PROPN,NOUN,prepositional,prepositional,Postverbal,Hebrew
"על פי החלטת ה מפכ""ל ה קודם , דוד קראוס , מתוגבר מרחב ירושלים , מ אז פרוץ ה אינתיפאדה , ב אופן קבוע ב מאות שוטרים , ה מגיעים על פי תורנות מ כל ה יחידות ב ה_ ארץ .","על פי החלטת ה מפכ""ל ה קודם , דוד קראוס , מתוגבר מרחב ירושלים , מ אז פרוץ ה אינתיפאדה , ב אופן קבוע ב מאות שוטרים , ה מגיעים על פי תורנות","על פי החלטת ה מפכ""ל ה קודם , דוד קראוס , מתוגבר מרחב ירושלים , מ אז פרוץ ה אינתיפאדה , ב אופן קבוע ב מאות שוטרים , ה מגיעים מ כל ה יחידות ב ה_ ארץ","על פי החלטת ה מפכ""ל ה קודם , דוד קראוס , מתוגבר מרחב ירושלים , מ אז פרוץ ה אינתיפאדה , ב אופן קבוע ב מאות שוטרים , ה מגיעים על תורנות","על פי החלטת ה מפכ""ל ה קודם , דוד קראוס , מתוגבר מרחב ירושלים , מ אז פרוץ ה אינתיפאדה , ב אופן קבוע ב מאות שוטרים , ה מגיעים מ יחידות",על תורנות,מ יחידה,הגיע,על פי תורנות,מ כל ה יחידות ב ה_ ארץ,3,7,על,מ,תורנות,יחידה,NOUN,NOUN,prepositional,prepositional,Postverbal,Hebrew
"ה שר מילוא איים , כי אם לא יאושרו תקנים נוספים , יעביר יחידות של משמר ה גבול , ה פועלות ב ה_ שטחים תחת פיקוד צה""ל , ל תגבור ירושלים .","ה שר מילוא איים , כי אם לא יאושרו תקנים נוספים , יעביר יחידות של משמר ה גבול , ה פועלות ב ה_ שטחים","ה שר מילוא איים , כי אם לא יאושרו תקנים נוספים , יעביר יחידות של משמר ה גבול , ה פועלות תחת פיקוד צה""ל","ה שר מילוא איים , כי אם לא יאושרו תקנים נוספים , יעביר יחידות של משמר ה גבול , ה פועלות ב שטחים","ה שר מילוא איים , כי אם לא יאושרו תקנים נוספים , יעביר יחידות של משמר ה גבול , ה פועלות תחת פיקוד",ב שטח,תחת פיקוד,פעל,ב ה_ שטחים,"תחת פיקוד צה""ל",3,3,ב,תחת,שטח,פיקוד,NOUN,NOUN,prepositional,prepositional,Postverbal,Hebrew
"ועדת זמיר גם המליצה , כאמור , להקים ב משרד ה משטרה צוות מקצועי של קציני משטרה , ש יסייע ל ה_ שר לממש את אחריות_ _של_ _הוא ה מיניסטריאלית על ה משטרה , ב דומה ל ה_ מטה ה מוקם ב ימים אלה ב משרד ה ביטחון לצד שר ה ביטחון .","ועדת זמיר גם המליצה , כאמור , להקים ב משרד ה משטרה צוות מקצועי של קציני משטרה , ש יסייע ל ה_ שר לממש את אחריות_ _של_ _הוא ה מיניסטריאלית על ה משטרה , ב דומה ל ה_ מטה ה מוקם ב ימים אלה","ועדת זמיר גם המליצה , כאמור , להקים ב משרד ה משטרה צוות מקצועי של קציני משטרה , ש יסייע ל ה_ שר לממש את אחריות_ _של_ _הוא ה מיניסטריאלית על ה משטרה , ב דומה ל ה_ מטה ה מוקם ב משרד ה ביטחון לצד שר ה ביטחון","ועדת זמיר גם המליצה , כאמור , להקים ב משרד ה משטרה צוות מקצועי של קציני משטרה , ש יסייע ל ה_ שר לממש את אחריות_ _של_ _הוא ה מיניסטריאלית על ה משטרה , ב דומה ל ה_ מטה ה מוקם ב ימים","ועדת זמיר גם המליצה , כאמור , להקים ב משרד ה משטרה צוות מקצועי של קציני משטרה , ש יסייע ל ה_ שר לממש את אחריות_ _של_ _הוא ה מיניסטריאלית על ה משטרה , ב דומה ל ה_ מטה ה מוקם ב משרד",ב יום,ב משרד,הוקם,ב ימים אלה,ב משרד ה ביטחון לצד שר ה ביטחון,3,8,ב,ב,יום,משרד,NOUN,NOUN,prepositional,prepositional,Postverbal,Hebrew
"כבר ב נובמבר 9891 חיבר מנכל משרד ה משטרה , גד אבינר , מסמך , ש הופץ כ חוברת בין אנשי משרד ה משטרה ו משרדי ממשלה ו גופים אחרים , ו ב_ _הוא דן ב עקרונות ל תפקוד_ _של_ _הוא של משרד ה משטרה כ "" גוף מטה מיניסטריאלי ה פועל מול מטות ה משטרה ו שירות בתי ה סוהר "" .","כבר ב נובמבר 9891 חיבר מנכל משרד ה משטרה , גד אבינר , מסמך , ש הופץ כ חוברת","כבר ב נובמבר 9891 חיבר מנכל משרד ה משטרה , גד אבינר , מסמך , ש הופץ בין אנשי משרד ה משטרה ו משרדי ממשלה ו גופים אחרים","כבר ב נובמבר 9891 חיבר מנכל משרד ה משטרה , גד אבינר , מסמך , ש הופץ כ חוברת","כבר ב נובמבר 9891 חיבר מנכל משרד ה משטרה , גד אבינר , מסמך , ש הופץ בין אנשי",כ חוברת,בין איש,הופץ,כ חוברת,בין אנשי משרד ה משטרה ו משרדי ממשלה ו גופים אחרים,2,11,כ,בין,חוברת,איש,NOUN,NOUN,prepositional,prepositional,Postverbal,Hebrew
""" סביר להעריך כי ה דגם של גוף מטה מיניסטריאלי ש התגבש אצל_ _אנחנו , עשוי לשמש ב עתיד מודל ל יישום גם ב מערכות ממשלתיות אחרות "" , נאמר ב ה_ חוברת .",""" סביר להעריך כי ה דגם של גוף מטה מיניסטריאלי ש התגבש אצל_ _אנחנו , עשוי לשמש ב עתיד",""" סביר להעריך כי ה דגם של גוף מטה מיניסטריאלי ש התגבש אצל_ _אנחנו , עשוי לשמש גם ב מערכות ממשלתיות אחרות",""" סביר להעריך כי ה דגם של גוף מטה מיניסטריאלי ש התגבש אצל_ _אנחנו , עשוי לשמש ב עתיד",""" סביר להעריך כי ה דגם של גוף מטה מיניסטריאלי ש התגבש אצל_ _אנחנו , עשוי לשמש ב מערכות",ב עתיד,ב מערכת,שימש,ב עתיד,גם ב מערכות ממשלתיות אחרות,2,5,ב,ב,עתיד,מערכת,NOUN,NOUN,prepositional,prepositional,Postverbal,Hebrew
"הוא רומז ל קשיים ש יש ל משרד ה משטרה ו ל שר ה משטרה ב מימוש אחריות_ _של_ _הוא ה מיניסטריאלית : "" משרד ה משטרה , כ גוף מטה מקצועי ו מתאם של שר ה משטרה , אמור לבצע תפקיד_ _של_ _הוא מול ה מטות של שתי זרועות מבצעיות ( משטרה ו שב""ס ) בעלות עוצמה , אופי שמרני ו מסורת אוטונומית ארוכה .",הוא רומז ל קשיים ש יש ל משרד ה משטרה ו ל שר ה משטרה,הוא רומז ל קשיים ש יש ב מימוש אחריות_ _של_ _הוא ה מיניסטריאלית,הוא רומז ל קשיים ש יש ל משרד,הוא רומז ל קשיים ש יש ב מימוש,ל משרד,ב מימוש,יש,ל משרד ה משטרה ו ל שר ה משטרה,ב מימוש אחריות_ _של_ _הוא ה מיניסטריאלית,9,7,ל,ב,משרד,מימוש,NOUN,NOUN,prepositional,prepositional,Postverbal,Hebrew
"ב ימים אלה עוסק שר ה משטרה ב קצב מוגבר , יחד עם אנשי משרד_ _של_ _הוא , ב הכנות ל הקמת ה מטה ה זה .",ב ימים אלה עוסק שר ה משטרה ב קצב מוגבר,ב ימים אלה עוסק שר ה משטרה ב הכנות ל הקמת ה מטה ה זה,ב ימים אלה עוסק שר ה משטרה ב קצב,ב ימים אלה עוסק שר ה משטרה ב הכנות,ב קצב,ב הכנה,עסק,ב קצב מוגבר,ב הכנות ל הקמת ה מטה ה זה,3,8,ב,ב,קצב,הכנה,NOUN,NOUN,prepositional,prepositional,Postverbal,Hebrew
ב שלב זה אין שר ה משטרה מתכוון להתמקד עם ה צוות של_ _הוא ב תחום ה חקירות .,ב שלב זה אין שר ה משטרה מתכוון להתמקד עם ה צוות של_ _הוא,ב שלב זה אין שר ה משטרה מתכוון להתמקד ב תחום ה חקירות,ב שלב זה אין שר ה משטרה מתכוון להתמקד עם צוות,ב שלב זה אין שר ה משטרה מתכוון להתמקד ב תחום,עם צוות,ב תחום,התמקד,עם ה צוות של_ _הוא,ב תחום ה חקירות,5,4,עם,ב,צוות,תחום,NOUN,NOUN,prepositional,prepositional,Postverbal,Hebrew
"מותר לפקפק ב נכונות ה חישובים ה אלה , ש הרי מטרה_ _של_ _הם ה עיקרית היא להטיל מורא על ה מבוטחים ו ללחוץ באמצעות_ _הם על ה פוליטיקאים , ו במיוחד על ה מחוקקים ה אמורים לדון ב ה_ שבועות ה קרובים ב אישור ה תקנות ל שעת חירום , ש מ כוח_ _של_ _הן הוטל ה מס ב אמצע ספטמבר .","מותר לפקפק ב נכונות ה חישובים ה אלה , ש הרי מטרה_ _של_ _הם ה עיקרית היא להטיל מורא על ה מבוטחים ו ללחוץ באמצעות_ _הם","מותר לפקפק ב נכונות ה חישובים ה אלה , ש הרי מטרה_ _של_ _הם ה עיקרית היא להטיל מורא על ה מבוטחים ו ללחוץ על ה פוליטיקאים , ו במיוחד על ה מחוקקים ה אמורים לדון ב ה_ שבועות ה קרובים ב אישור ה תקנות ל שעת חירום , ש מ כוח_ _של_ _הן הוטל ה מס ב אמצע ספטמבר","מותר לפקפק ב נכונות ה חישובים ה אלה , ש הרי מטרה_ _של_ _הם ה עיקרית היא להטיל מורא על ה מבוטחים ו ללחוץ באמצעות_ _הם","מותר לפקפק ב נכונות ה חישובים ה אלה , ש הרי מטרה_ _של_ _הם ה עיקרית היא להטיל מורא על ה מבוטחים ו ללחוץ על פוליטיקאים",באמצעות הוא,על פוליטיקאי,לחץ,באמצעות_ _הם,"על ה פוליטיקאים , ו במיוחד על ה מחוקקים ה אמורים לדון ב ה_ שבועות ה קרובים ב אישור ה תקנות ל שעת חירום , ש מ כוח_ _של_ _הן הוטל ה מס ב אמצע ספטמבר",2,36,באמצעות,על,הוא,פוליטיקאי,PRON,NOUN,prepositional,prepositional,Postverbal,Hebrew
"מותר לפקפק ב נכונות ה חישובים ה אלה , ש הרי מטרה_ _של_ _הם ה עיקרית היא להטיל מורא על ה מבוטחים ו ללחוץ באמצעות_ _הם על ה פוליטיקאים , ו במיוחד על ה מחוקקים ה אמורים לדון ב ה_ שבועות ה קרובים ב אישור ה תקנות ל שעת חירום , ש מ כוח_ _של_ _הן הוטל ה מס ב אמצע ספטמבר .","מותר לפקפק ב נכונות ה חישובים ה אלה , ש הרי מטרה_ _של_ _הם ה עיקרית היא להטיל מורא על ה מבוטחים ו ללחוץ באמצעות_ _הם על ה פוליטיקאים , ו במיוחד על ה מחוקקים ה אמורים לדון ב ה_ שבועות ה קרובים","מותר לפקפק ב נכונות ה חישובים ה אלה , ש הרי מטרה_ _של_ _הם ה עיקרית היא להטיל מורא על ה מבוטחים ו ללחוץ באמצעות_ _הם על ה פוליטיקאים , ו במיוחד על ה מחוקקים ה אמורים לדון ב אישור ה תקנות ל שעת חירום , ש מ כוח_ _של_ _הן הוטל ה מס ב אמצע ספטמבר","מותר לפקפק ב נכונות ה חישובים ה אלה , ש הרי מטרה_ _של_ _הם ה עיקרית היא להטיל מורא על ה מבוטחים ו ללחוץ באמצעות_ _הם על ה פוליטיקאים , ו במיוחד על ה מחוקקים ה אמורים לדון ב שבועות","מותר לפקפק ב נכונות ה חישובים ה אלה , ש הרי מטרה_ _של_ _הם ה עיקרית היא להטיל מורא על ה מבוטחים ו ללחוץ באמצעות_ _הם על ה פוליטיקאים , ו במיוחד על ה מחוקקים ה אמורים לדון ב אישור",ב שבוע,ב אישור,דן,ב ה_ שבועות ה קרובים,"ב אישור ה תקנות ל שעת חירום , ש מ כוח_ _של_ _הן הוטל ה מס ב אמצע ספטמבר",5,19,ב,ב,שבוע,אישור,NOUN,NOUN,prepositional,prepositional,Postverbal,Hebrew
"ה הסדרים הללו נקבעו ב תקופה קדומה , ש ב_ _היא הכתיבו ראשי מפא""י ל מקבלי ה החלטות ב ה_ ממשלה את ה הסדרים ה ממלכתיים ב התאם ל ה_ אינטרסים של ה הסתדרות .","ה הסדרים הללו נקבעו ב תקופה קדומה , ש ב_ _היא הכתיבו ראשי מפא""י ל מקבלי ה החלטות ב ה_ ממשלה","ה הסדרים הללו נקבעו ב תקופה קדומה , ש ב_ _היא הכתיבו ראשי מפא""י ב התאם ל ה_ אינטרסים של ה הסתדרות","ה הסדרים הללו נקבעו ב תקופה קדומה , ש ב_ _היא הכתיבו ראשי מפא""י ל מקבלי","ה הסדרים הללו נקבעו ב תקופה קדומה , ש ב_ _היא הכתיבו ראשי מפא""י ב אינטרסים",ל מקבל,ב אינטרס,הכתיב,ל מקבלי ה החלטות ב ה_ ממשלה,ב התאם ל ה_ אינטרסים של ה הסתדרות,7,8,ל,ב,מקבל,אינטרס,NOUN,NOUN,prepositional,prepositional,Postverbal,Hebrew
"ב תנאי דה - לוקס אלה , כמעט כל אחד יכול לנהל קרן פנסיה : כל מה ש דרוש הוא חשב ש ייחשב את זכויות ה חברים , שלם ש יכין ו ישלח ל_ _הם את ה צקים ב ה_ זמן , ו מעט ריסון עצמי ( תכונה ש לא כל מנהלי קרנות ה פנסיה הצטיינו ב_ _היא ב ה_ עבר ) .","ב תנאי דה - לוקס אלה , כמעט כל אחד יכול לנהל קרן פנסיה : כל מה ש דרוש הוא חשב ש ייחשב את זכויות ה חברים , שלם ש יכין ו ישלח ל_ _הם","ב תנאי דה - לוקס אלה , כמעט כל אחד יכול לנהל קרן פנסיה : כל מה ש דרוש הוא חשב ש ייחשב את זכויות ה חברים , שלם ש יכין ו ישלח ב ה_ זמן","ב תנאי דה - לוקס אלה , כמעט כל אחד יכול לנהל קרן פנסיה : כל מה ש דרוש הוא חשב ש ייחשב את זכויות ה חברים , שלם ש יכין ו ישלח ל_ _הם","ב תנאי דה - לוקס אלה , כמעט כל אחד יכול לנהל קרן פנסיה : כל מה ש דרוש הוא חשב ש ייחשב את זכויות ה חברים , שלם ש יכין ו ישלח ב זמן",ל הוא,ב זמן,הכין,ל_ _הם,ב ה_ זמן,2,3,ל,ב,הוא,זמן,PRON,NOUN,prepositional,prepositional,Postverbal,Hebrew
"ב תנאי דה - לוקס אלה , כמעט כל אחד יכול לנהל קרן פנסיה : כל מה ש דרוש הוא חשב ש ייחשב את זכויות ה חברים , שלם ש יכין ו ישלח ל_ _הם את ה צקים ב ה_ זמן , ו מעט ריסון עצמי ( תכונה ש לא כל מנהלי קרנות ה פנסיה הצטיינו ב_ _היא ב ה_ עבר ) .","ב תנאי דה - לוקס אלה , כמעט כל אחד יכול לנהל קרן פנסיה : כל מה ש דרוש הוא חשב ש ייחשב את זכויות ה חברים , שלם ש יכין ו ישלח ל_ _הם את ה צקים ב ה_ זמן , ו מעט ריסון עצמי ( תכונה ש לא כל מנהלי קרנות ה פנסיה הצטיינו ב_ _היא","ב תנאי דה - לוקס אלה , כמעט כל אחד יכול לנהל קרן פנסיה : כל מה ש דרוש הוא חשב ש ייחשב את זכויות ה חברים , שלם ש יכין ו ישלח ל_ _הם את ה צקים ב ה_ זמן , ו מעט ריסון עצמי ( תכונה ש לא כל מנהלי קרנות ה פנסיה הצטיינו ב ה_ עבר","ב תנאי דה - לוקס אלה , כמעט כל אחד יכול לנהל קרן פנסיה : כל מה ש דרוש הוא חשב ש ייחשב את זכויות ה חברים , שלם ש יכין ו ישלח ל_ _הם את ה צקים ב ה_ זמן , ו מעט ריסון עצמי ( תכונה ש לא כל מנהלי קרנות ה פנסיה הצטיינו ב_ _היא","ב תנאי דה - לוקס אלה , כמעט כל אחד יכול לנהל קרן פנסיה : כל מה ש דרוש הוא חשב ש ייחשב את זכויות ה חברים , שלם ש יכין ו ישלח ל_ _הם את ה צקים ב ה_ זמן , ו מעט ריסון עצמי ( תכונה ש לא כל מנהלי קרנות ה פנסיה הצטיינו ב עבר",ב הוא,ב עבר,הצטיין,ב_ _היא,ב ה_ עבר,2,3,ב,ב,הוא,עבר,PRON,NOUN,prepositional,prepositional,Postverbal,Hebrew
