Sentence,Context_PP1,Context_PP2,Context_PP1_simple,Context_PP2_simple,PP1_simple,PP2_simple,Verb,PP1,PP2,PP1_len,PP2_len,Adp1,Adp2,NP1,NP2,PP1_Pronom,PP2_Pronom,PP1_Type,PP2_Type,Position,Language
A hadiipari kutatások eredményeit a korábbi 3-4 év helyett ma már hat hónap múlva felhasználják a polgári termelésben .,A hadiipari kutatások eredményeit a korábbi 3-4 év helyett,A hadiipari kutatások eredményeit hat hónap múlva,A hadiipari kutatások eredményeit év helyett,A hadiipari kutatások eredményeit hónap múlva,év helyett,hónap múlva,fel+használ,a korábbi 3-4 év helyett,hat hónap múlva,5,3,helyett,múlva,év,hónap,NOUN,NOUN,postpositional,postpositional,Preverbal,Hungarian
"Az alelnök meséli el azt is , hogy az egyik elakadt autót rövid két óra alatt sikerült , az ítéletidő ellenére , valakinek kifosztania .","Az alelnök meséli el azt is , hogy az egyik elakadt autót rövid két óra alatt","Az alelnök meséli el azt is , hogy az egyik elakadt autót az ítéletidő ellenére","Az alelnök meséli el azt is , hogy az egyik elakadt autót óra alatt","Az alelnök meséli el azt is , hogy az egyik elakadt autót ítéletidő ellenére",óra alatt,ítéletidő ellenére,ki+foszt,rövid két óra alatt,az ítéletidő ellenére,4,3,alatt,ellenére,óra,ítéletidő,NOUN,NOUN,postpositional,postpositional,Preverbal,Hungarian
Veszprém megyében a 8-as úton órákon állt a forgalom Várpalota és a péti elágazás között két elakadt kamion miatt .,Veszprém megyében a 8-as úton órákon állt a forgalom Várpalota és a péti elágazás között,Veszprém megyében a 8-as úton órákon állt a forgalom két elakadt kamion miatt,Veszprém megyében a 8-as úton órákon állt a forgalom Várpalota között,Veszprém megyében a 8-as úton órákon állt a forgalom kamion miatt,Várpalota között,kamion miatt,áll,Várpalota és a péti elágazás között,két elakadt kamion miatt,6,4,között,miatt,Várpalota,kamion,PROPN,NOUN,postpositional,postpositional,Postverbal,Hungarian
A vezetékre rakódott vizes hó miatt a Dnyeper melléki vasútvonalakon villanymozdony helyett gőzmozdonyok vontatták a személyszállító szerelvényeket .,A vezetékre rakódott vizes hó miatt,villanymozdony helyett,hó miatt,villanymozdony helyett,hó miatt,villanymozdony helyett,von,A vezetékre rakódott vizes hó miatt,villanymozdony helyett,6,2,miatt,helyett,hó,villanymozdony,NOUN,NOUN,postpositional,postpositional,Preverbal,Hungarian
"A kiállítás anyaga a négy világhírű , európai művész , Joan Miró , Antoni Tapies , Eduardo Chillida és Pierre Alechinsky rajzai és sokszorosított grafikái köré épül , de az ő munkáik mellett az érdeklődők az elmúlt évtizedek képzőművészei közül megtekinthetik még Nicola da Maria , Günther Uecker , Emil Schumacher , Gerhard Hoeme , Bernard Dorny , Etienne Hajdu és Bér János műveit is .","A kiállítás anyaga a négy világhírű , európai művész , Joan Miró , Antoni Tapies , Eduardo Chillida és Pierre Alechinsky rajzai és sokszorosított grafikái köré épül , de az ő munkáik mellett","A kiállítás anyaga a négy világhírű , európai művész , Joan Miró , Antoni Tapies , Eduardo Chillida és Pierre Alechinsky rajzai és sokszorosított grafikái köré épül , de az elmúlt évtizedek képzőművészei közül","A kiállítás anyaga a négy világhírű , európai művész , Joan Miró , Antoni Tapies , Eduardo Chillida és Pierre Alechinsky rajzai és sokszorosított grafikái köré épül , de munkáik mellett","A kiállítás anyaga a négy világhírű , európai művész , Joan Miró , Antoni Tapies , Eduardo Chillida és Pierre Alechinsky rajzai és sokszorosított grafikái köré épül , de képzőművészei közül",munka mellett,képzőművész közül,meg+tekint,az ő munkáik mellett,az elmúlt évtizedek képzőművészei közül,4,5,mellett,közül,munka,képzőművész,NOUN,NOUN,postpositional,postpositional,Preverbal,Hungarian
Az RTS rendőrségi közleményre hivatkozó beszámolója szerint a támadás a kizárólag albánok lakta Lucane és Konculj között történt .,Az RTS rendőrségi közleményre hivatkozó beszámolója szerint,a kizárólag albánok lakta Lucane és Konculj között,beszámolója szerint,Lucane között,beszámoló szerint,Lucane között,történik,Az RTS rendőrségi közleményre hivatkozó beszámolója szerint,a kizárólag albánok lakta Lucane és Konculj között,7,8,szerint,között,beszámoló,Lucane,NOUN,PROPN,postpositional,postpositional,Preverbal,Hungarian
"Az eddigi rendszer szerint a nők akár már 20 , a férfiak pedig 25 évi munka után nyugdíjba vonulhattak ( az átlagos korhatár jelenleg 47 és 50 év ) , miközben a várható élettartam Törökországban 60 év .",Az eddigi rendszer szerint,25 évi munka után,rendszer szerint,munka után,rendszer szerint,munka után,vonulhat,Az eddigi rendszer szerint,25 évi munka után,4,4,szerint,után,rendszer,munka,NOUN,NOUN,postpositional,postpositional,Preverbal,Hungarian
"Szakértők szerint a nemzetközi döntőbíráskodást megtiltó 1995-ös törvény más egyéb okokkal együtt 2-6 milliárd dollárnyi külföldi beruházástól fosztotta meg a gazdaságot , főként az infrastruktúra területén .",Szakértők szerint,más egyéb okokkal együtt,Szakértők szerint,okokkal együtt,szakértő szerint,ok együtt,foszt,Szakértők szerint,más egyéb okokkal együtt,2,4,szerint,együtt,szakértő,ok,NOUN,NOUN,postpositional,postpositional,Preverbal,Hungarian
