Sentence,Context_PP1,Context_PP2,Context_PP1_simple,Context_PP2_simple,PP1_simple,PP2_simple,Verb,PP1,PP2,PP1_len,PP2_len,Adp1,Adp2,NP1,NP2,PP1_Pronom,PP2_Pronom,PP1_Type,PP2_Type,Position,Language
目 から レーザー 、 パイプ から は 放物 線 状 に 超 小型 「 イオン リング 」 ばら撒く 。,目 から レーザー 、 パイプ から は,目 から レーザー 、 放物 線 状 に,目 から レーザー 、 パイプ から は,目 から レーザー 、 状 に,パイプ から は,状 に,ばら撒く,パイプ から は,放物 線 状 に,3,4,から は,に,パイプ,状,NOUN,NOUN,postpositional,postpositional,Preverbal,Japanese
また 、 本作 に は 風見 志郎 / 仮面 ライダー V 3 が 敵 と し て 登場 する 。,また 、 本作 に は,また 、 敵 と し て,また 、 本作 に は,また 、 敵 と,本作 に は,敵 と,登場,本作 に は,敵 と し て,3,4,に は,と,本作,敵,NOUN,NOUN,postpositional,postpositional,Preverbal,Japanese
また 、 大型 の 二 枚 窓 で 構成 さ れ た 前面 構造 は 、 視界 の 広 さ から 運転 士 から 好評 を 博し た 。,また 、 大型 の 二 枚 窓 で 構成 さ れ た 前面 構造 は 、 視界 の 広 さ から,また 、 大型 の 二 枚 窓 で 構成 さ れ た 前面 構造 は 、 運転 士 から,また 、 大型 の 二 枚 窓 で 構成 さ れ た 前面 構造 は 、 広 から,また 、 大型 の 二 枚 窓 で 構成 さ れ た 前面 構造 は 、 士 から,広い から,士 から,博する,視界 の 広 さ から,運転 士 から,5,3,から,から,広い,士,ADJ,NOUN,postpositional,postpositional,Preverbal,Japanese
この こと から 「 ドジャース 永遠 の ホーム 」 と 呼ば れ 親しま れ て いる 。,この こと から,「 ドジャース 永遠 の ホーム 」 と,こと から,ホーム と,こと から,ホーム と,呼ぶ,この こと から,「 ドジャース 永遠 の ホーム 」 と,3,7,から,と,こと,ホーム,NOUN,NOUN,postpositional,postpositional,Preverbal,Japanese
20 世紀 に 入っ て から は 映画 館 に 改装 さ れ た が 、 その 後 も しばしば 小 規模 オペラ の 公演 に 利用 さ れ 、 後述 の 1997 年 から の フェニーチェ 劇場 焼失 再建 期間 中 は 仮 劇場 の 一 つ と し て 活用 さ れ た 。,20 世紀 に 入っ て から は 映画 館 に 改装 さ れ た が 、 その 後 も,20 世紀 に 入っ て から は 映画 館 に 改装 さ れ た が 、 小 規模 オペラ の 公演 に,20 世紀 に 入っ て から は 映画 館 に 改装 さ れ た が 、 後 も,20 世紀 に 入っ て から は 映画 館 に 改装 さ れ た が 、 公演 に,後 も,公演 に,利用,その 後 も,小 規模 オペラ の 公演 に,3,6,も,に,後,公演,NOUN,NOUN,postpositional,postpositional,Preverbal,Japanese
"そして , あまり に カネ を 持っ て いる 宗教 団体 に つい て 見聞き する とき , それ は 信者 たち が 払っ た 多額 な お 布施 で あり , 時 に は 霊感 商法 悪質 な カネ集め も 行わ れ て いる の か も しれ ない , と 思わ れ がち です 。","そして , あまり に カネ を 持っ て いる 宗教 団体 に つい て 見聞き する とき , それ は 信者 たち が 払っ た 多額 な お 布施 で あり , 時 に は","そして , あまり に カネ を 持っ て いる 宗教 団体 に つい て 見聞き する とき , それ は 信者 たち が 払っ た 多額 な お 布施 で あり , 霊感 商法 悪質 な カネ集め も","そして , あまり に カネ を 持っ て いる 宗教 団体 に つい て 見聞き する とき , それ は 信者 たち が 払っ た 多額 な お 布施 で あり , 時 に は","そして , あまり に カネ を 持っ て いる 宗教 団体 に つい て 見聞き する とき , それ は 信者 たち が 払っ た 多額 な お 布施 で あり , カネ集め も",時 に は,カネ集め も,行う,時 に は,霊感 商法 悪質 な カネ集め も,3,6,に は,も,時,カネ集め,NOUN,NOUN,postpositional,postpositional,Preverbal,Japanese
世界 に 愛 と 光 を 広げる ため ご 協力 下さい 。,世界 に,愛 と,世界 に,愛 と,世界 に,愛 と,広げる,世界 に,愛 と,2,2,に,と,世界,愛,NOUN,NOUN,postpositional,postpositional,Preverbal,Japanese
そして 幼い ころ から クリエイティブ な もの に 興味 が あっ た 仲 さん は “ 日本 の クリエイター を もっと 世界 に 知っ て 欲しい ” と いう 思い から 退社 後 に マンガ や イラスト を 共有 できる サービス “ Magajin ” を 立ち上げ ます 。,そして 幼い ころ から,そして クリエイティブ な もの に,そして ころ から,そして もの に,ころ から,もの に,ある,幼い ころ から,クリエイティブ な もの に,3,4,から,に,ころ,もの,NOUN,NOUN,postpositional,postpositional,Preverbal,Japanese
そして 幼い ころ から クリエイティブ な もの に 興味 が あっ た 仲 さん は “ 日本 の クリエイター を もっと 世界 に 知っ て 欲しい ” と いう 思い から 退社 後 に マンガ や イラスト を 共有 できる サービス “ Magajin ” を 立ち上げ ます 。,そして 幼い ころ から クリエイティブ な もの に 興味 が あっ た 仲 さん は “ 日本 の クリエイター を もっと 世界 に 知っ て 欲しい ” と いう 思い から,そして 幼い ころ から クリエイティブ な もの に 興味 が あっ た 仲 さん は 退社 後 に,そして 幼い ころ から クリエイティブ な もの に 興味 が あっ た 仲 さん は 思い から,そして 幼い ころ から クリエイティブ な もの に 興味 が あっ た 仲 さん は 後 に,思い から,後 に,立ち上げる,“ 日本 の クリエイター を もっと 世界 に 知っ て 欲しい ” と いう 思い から,退社 後 に,16,3,から,に,思い,後,NOUN,NOUN,postpositional,postpositional,Preverbal,Japanese
近畿 日本 鉄道 が 発足 し た 直後 は 「 近鉄 」 と 呼ば ず 「 日本 鉄道 」 、 「 近畿 日本 」 や 「 近日 」 と 称し 、 社名 を 冠し た 駅名 も 1944 年 6 月 の 発足 後 19 70 年 2 月 まで は 「 近鉄 ○ ○ 」 で なく 「 近畿 日本 ○ ○ 」 と なっ て い た 。,近畿 日本 鉄道 が 発足 し た 直後 は 「 近鉄 」 と 呼ば ず 「 日本 鉄道 」 、 「 近畿 日本 」 や 「 近日 」 と 称し 、 社名 を 冠し た 駅名 も,近畿 日本 鉄道 が 発足 し た 直後 は 「 近鉄 」 と 呼ば ず 「 日本 鉄道 」 、 「 近畿 日本 」 や 「 近日 」 と 称し 、 「 近畿 日本 ○ ○ 」 と,近畿 日本 鉄道 が 発足 し た 直後 は 「 近鉄 」 と 呼ば ず 「 日本 鉄道 」 、 「 近畿 日本 」 や 「 近日 」 と 称し 、 駅名 も,近畿 日本 鉄道 が 発足 し た 直後 は 「 近鉄 」 と 呼ば ず 「 日本 鉄道 」 、 「 近畿 日本 」 や 「 近日 」 と 称し 、 日本 と,駅名 も,日本 と,なる,社名 を 冠し た 駅名 も,「 近畿 日本 ○ ○ 」 と,6,7,も,と,駅名,日本,NOUN,PROPN,postpositional,postpositional,Preverbal,Japanese
快活 な 性格 で 、 こと ある ごと に ユウ に つい て 回る 。,快活 な 性格 で 、 こと ある ごと に,快活 な 性格 で 、 ユウ に,快活 な 性格 で 、 こと に,快活 な 性格 で 、 ユウ に,こと に,ユウ に,つく,こと ある ごと に,ユウ に,4,2,に,に,こと,ユウ,NOUN,PROPN,postpositional,postpositional,Preverbal,Japanese
雪 の 祖父 で 桂木 流 柔術 の 道場 を 構え て おり 、 古流 の 大家 と し て 知ら れ て いる 。,雪 の 祖父 で,古流 の 大家 と し て,祖父 で,大家 と,祖父 で,大家 と,知る,雪 の 祖父 で,古流 の 大家 と し て,4,6,で,と,祖父,大家,NOUN,NOUN,postpositional,postpositional,Preverbal,Japanese
日本 で は 、 密教 が 平安 時代 前期 に 隆盛 し た こと から 、 五壇 法 の 本尊 と し て 五 大 明王 が 祀ら れ た 。,日本 で は 、 密教 が 平安 時代 前期 に 隆盛 し た こと から 、,五壇 法 の 本尊 と し て,こと から,本尊 と,こと から,本尊 と,祀る,日本 で は 、 密教 が 平安 時代 前期 に 隆盛 し た こと から 、,五壇 法 の 本尊 と し て,16,7,から,と,こと,本尊,NOUN,NOUN,postpositional,postpositional,Preverbal,Japanese
胸冬 は 豹牙 と 、 唯常 は 隼 と 調査 に 出 て 、 霧隠 が 放っ た 霞衣 と いう 忍法 で 味方 に 同士 討ち が 起き た こと を 確認 する 。,胸冬 は 豹牙 と 、 唯常 は 隼 と 調査 に 出 て 、 霧隠 が 放っ た 霞衣 と いう 忍法 で,胸冬 は 豹牙 と 、 唯常 は 隼 と 調査 に 出 て 、 味方 に,胸冬 は 豹牙 と 、 唯常 は 隼 と 調査 に 出 て 、 忍法 で,胸冬 は 豹牙 と 、 唯常 は 隼 と 調査 に 出 て 、 味方 に,忍法 で,味方 に,起きる,霧隠 が 放っ た 霞衣 と いう 忍法 で,味方 に,9,2,で,に,忍法,味方,NOUN,NOUN,postpositional,postpositional,Preverbal,Japanese
「 ロディニア 」 と いう 名前 は マーク ・ マクメナミン に よっ て 1987 年 に 考案 さ れ 、 19 90 年 に 発表 さ れ た 。,「 ロディニア 」 と いう 名前 は マーク ・ マクメナミン に よっ て,「 ロディニア 」 と いう 名前 は 1987 年 に,「 ロディニア 」 と いう 名前 は マクメナミン に,「 ロディニア 」 と いう 名前 は 年 に,マクメナミン に,年 に,考案,マーク ・ マクメナミン に よっ て,1987 年 に,6,3,に,に,マクメナミン,年,PROPN,NOUN,postpositional,postpositional,Preverbal,Japanese
最終 的 に マジカル コンパクト の 件 を 貢 が 解決 し た こと で 、 貢 の こと を ルリス の 婚約 者 と し て 、 自分 の 義兄 と し て 認める よう に なる 。,最終 的 に マジカル コンパクト の 件 を 貢 が 解決 し た こと で 、 貢 の こと を ルリス の 婚約 者 と し て 、,最終 的 に マジカル コンパクト の 件 を 貢 が 解決 し た こと で 、 貢 の こと を 自分 の 義兄 と し て,最終 的 に マジカル コンパクト の 件 を 貢 が 解決 し た こと で 、 貢 の こと を 者 と,最終 的 に マジカル コンパクト の 件 を 貢 が 解決 し た こと で 、 貢 の こと を 義兄 と,者 と,義兄 と,認める,ルリス の 婚約 者 と し て 、,自分 の 義兄 と し て,8,6,と,と,者,義兄,NOUN,NOUN,postpositional,postpositional,Preverbal,Japanese
一方 、 iOS 版 の VLC Media Player を 制作 し た 企業 の 共同 創業 者 で ある Romain Goyet 氏 は 意見 を 異 に Ars Technica に 対し て 次 の よう に 語っ て いる 。,一方 、 iOS 版 の VLC Media Player を 制作 し た 企業 の 共同 創業 者 で ある Romain Goyet 氏 は 意見 を 異 に,一方 、 iOS 版 の VLC Media Player を 制作 し た 企業 の 共同 創業 者 で ある Romain Goyet 氏 は 意見 を Ars Technica に 対し て,一方 、 iOS 版 の VLC Media Player を 制作 し た 企業 の 共同 創業 者 で ある Romain Goyet 氏 は 意見 を 異 に,一方 、 iOS 版 の VLC Media Player を 制作 し た 企業 の 共同 創業 者 で ある Romain Goyet 氏 は 意見 を Technica に,異 に,Technica に,語る,異 に,Ars Technica に 対し て,2,5,に,に,異,Technica,NOUN,NOUN,postpositional,postpositional,Preverbal,Japanese
鍋 は 百 式 鍋 と いっ て 、 スープ が 二 種類 、 具材 も いろいろ 選べる もの で 、 トマト スープ と 豆乳 スープ に し て み まし た 。,鍋 は 百 式 鍋 と いっ て 、 スープ が 二 種類 、 具材 も いろいろ 選べる もの で 、 トマト スープ と,鍋 は 百 式 鍋 と いっ て 、 スープ が 二 種類 、 具材 も いろいろ 選べる もの で 、 豆乳 スープ に,鍋 は 百 式 鍋 と いっ て 、 スープ が 二 種類 、 具材 も いろいろ 選べる もの で 、 スープ と,鍋 は 百 式 鍋 と いっ て 、 スープ が 二 種類 、 具材 も いろいろ 選べる もの で 、 スープ に,スープ と,スープ に,する,トマト スープ と,豆乳 スープ に,3,3,と,に,スープ,スープ,NOUN,NOUN,postpositional,postpositional,Preverbal,Japanese
その 結果 、 同盟 の 政治 家 トリューニヒト に 疎ま れる の は もとより 、 しまい に は レベロ から も 疎ま れ 、 帝国 の レンネンカンプ に も 疑惑 を 抱か れ て いる 。,その 結果 、 同盟 の 政治 家 トリューニヒト に 疎ま れる の は もとより 、 しまい に は,その 結果 、 同盟 の 政治 家 トリューニヒト に 疎ま れる の は もとより 、 レベロ から も,その 結果 、 同盟 の 政治 家 トリューニヒト に 疎ま れる の は もとより 、 しまい に は,その 結果 、 同盟 の 政治 家 トリューニヒト に 疎ま れる の は もとより 、 レベロ から も,しまい に は,レベロ から も,疎む,しまい に は,レベロ から も,3,3,に は,から も,しまい,レベロ,NOUN,PROPN,postpositional,postpositional,Preverbal,Japanese
木 に 登っ た 1 頭 は やや 小型 で ある こと から メス 、 やや 大きな 根元 の 1 頭 は オス と 判断 でき た 。,木 に 登っ た 1 頭 は やや 小型 で ある こと から,木 に 登っ た 1 頭 は メス 、 やや 大きな 根元 の 1 頭 は オス と,木 に 登っ た 1 頭 は こと から,木 に 登っ た 1 頭 は オス と,こと から,オス と,判断,やや 小型 で ある こと から,メス 、 やや 大きな 根元 の 1 頭 は オス と,6,11,から,と,こと,オス,NOUN,NOUN,postpositional,postpositional,Preverbal,Japanese
60 年 前 に 先代 が 屋台 で 教わっ た らーめん を ずっと 続け て いる 。,60 年 前 に,屋台 で,前 に,屋台 で,前 に,屋台 で,教わる,60 年 前 に,屋台 で,4,2,に,で,前,屋台,NOUN,NOUN,postpositional,postpositional,Preverbal,Japanese
マンハッタン 、 グリニッジ ・ ヴィレッジ の ニューヨーク 大学 が 所有 する 4th ストリート に 位置 し た が 、 2001 年 の 9 . 11 アメリカ 同時 多発 テロ 事件 で 強制 的 に 立入 禁止 区域 と なっ た 。,マンハッタン 、 グリニッジ ・ ヴィレッジ の ニューヨーク 大学 が 所有 する 4th ストリート に 位置 し た が 、 2001 年 の 9 . 11 アメリカ 同時 多発 テロ 事件 で,マンハッタン 、 グリニッジ ・ ヴィレッジ の ニューヨーク 大学 が 所有 する 4th ストリート に 位置 し た が 、 立入 禁止 区域 と,マンハッタン 、 グリニッジ ・ ヴィレッジ の ニューヨーク 大学 が 所有 する 4th ストリート に 位置 し た が 、 事件 で,マンハッタン 、 グリニッジ ・ ヴィレッジ の ニューヨーク 大学 が 所有 する 4th ストリート に 位置 し た が 、 区域 と,事件 で,区域 と,なる,2001 年 の 9 . 11 アメリカ 同時 多発 テロ 事件 で,立入 禁止 区域 と,12,4,で,と,事件,区域,NOUN,NOUN,postpositional,postpositional,Preverbal,Japanese
これ も おそらく 難聴 の ため と 思わ れる 。,これ も,難聴 の ため と,これ も,ため と,これ も,ため と,思う,これ も,難聴 の ため と,2,4,も,と,これ,ため,PRON,NOUN,postpositional,postpositional,Preverbal,Japanese
その 後 は まず ニュルンベルク に 、 次いで ウルム に 移転 する 。,その 後 は まず ニュルンベルク に 、,その 後 は まず ウルム に,その 後 は まず ニュルンベルク に,その 後 は まず ウルム に,ニュルンベルク に,ウルム に,移転,ニュルンベルク に 、,ウルム に,3,2,に,に,ニュルンベルク,ウルム,PROPN,PROPN,postpositional,postpositional,Preverbal,Japanese
オリジナル の 書体 デザイン に より 同じ 物 は この世 に 存在 し ない 。,オリジナル の 書体 デザイン に より,この世 に,デザイン に,この世 に,デザイン に,この世 に,存在,オリジナル の 書体 デザイン に より,この世 に,6,2,に,に,デザイン,この世,NOUN,NOUN,postpositional,postpositional,Preverbal,Japanese
埼京 線 沿線 で 新宿 か 池袋 で 探し て い て いく つ か 見 て 回り まし た が 、 新宿 周辺 で は 間違え なく 安く 結婚 式 が 出来る と 思い まし た 。,埼京 線 沿線 で,新宿 か 池袋 で,沿線 で,池袋 で,沿線 で,池袋 で,探す,埼京 線 沿線 で,新宿 か 池袋 で,4,4,で,で,沿線,池袋,NOUN,PROPN,postpositional,postpositional,Preverbal,Japanese
その 後 、 1996 年 、 2002 年 、 2005 年 に 韓国 で アルバム を リリース し て 一時 的 で は ある が 韓国 歌謡 界 に 復帰 する 。,その 後 、 1996 年 、 2002 年 、 2005 年 に,その 後 、 韓国 で,その 後 、 年 に,その 後 、 韓国 で,年 に,韓国 で,リリース,1996 年 、 2002 年 、 2005 年 に,韓国 で,9,2,に,で,年,韓国,NOUN,PROPN,postpositional,postpositional,Preverbal,Japanese
2010 年 に は ユーロ ビジョン ・ ソング ・ コンテスト 2010 の トルコ 代表 に 選ば れ た 。,2010 年 に は,ユーロ ビジョン ・ ソング ・ コンテスト 2010 の トルコ 代表 に,年 に は,代表 に,年 に は,代表 に,選ぶ,2010 年 に は,ユーロ ビジョン ・ ソング ・ コンテスト 2010 の トルコ 代表 に,4,11,に は,に,年,代表,NOUN,NOUN,postpositional,postpositional,Preverbal,Japanese
プロトコル は TCP で 、 ポート を 同時 に 複数 使う の が 特徴 的 で ある 。,プロトコル は TCP で 、,プロトコル は 同時 に,プロトコル は TCP で,プロトコル は 同時 に,TCP で,同時 に,使う,TCP で 、,同時 に,3,2,で,に,TCP,同時,NOUN,NOUN,postpositional,postpositional,Preverbal,Japanese
そんな ある 日 、 マネージャー の 自宅 付近 の 焼肉 屋 で マネージャー 夫婦 と 食事 を し て い た 時 、 ふと し た こと から 大きな 言い争い に 店内 は 荒れ 、 メンバー は マネージャー に 殴ら れ て しまう 。,そんな ある 日 、 マネージャー の 自宅 付近 の 焼肉 屋 で,そんな ある 日 、 マネージャー 夫婦 と,そんな ある 日 、 屋 で,そんな ある 日 、 夫婦 と,屋 で,夫婦 と,する,マネージャー の 自宅 付近 の 焼肉 屋 で,マネージャー 夫婦 と,8,3,で,と,屋,夫婦,NOUN,NOUN,postpositional,postpositional,Preverbal,Japanese
そんな ある 日 、 マネージャー の 自宅 付近 の 焼肉 屋 で マネージャー 夫婦 と 食事 を し て い た 時 、 ふと し た こと から 大きな 言い争い に 店内 は 荒れ 、 メンバー は マネージャー に 殴ら れ て しまう 。,そんな ある 日 、 マネージャー の 自宅 付近 の 焼肉 屋 で マネージャー 夫婦 と 食事 を し て い た 時 、 ふと し た こと から,そんな ある 日 、 マネージャー の 自宅 付近 の 焼肉 屋 で マネージャー 夫婦 と 食事 を し て い た 時 、 大きな 言い争い に,そんな ある 日 、 マネージャー の 自宅 付近 の 焼肉 屋 で マネージャー 夫婦 と 食事 を し て い た 時 、 こと から,そんな ある 日 、 マネージャー の 自宅 付近 の 焼肉 屋 で マネージャー 夫婦 と 食事 を し て い た 時 、 言い争い に,こと から,言い争い に,荒れる,ふと し た こと から,大きな 言い争い に,5,3,から,に,こと,言い争い,NOUN,NOUN,postpositional,postpositional,Preverbal,Japanese
前期 新人 会 の メンバー を 中心 と する 同人 に より 1922 年 に 結成 さ れ 、 機関 誌 『 社會 思想 』 を 刊行 し た 。,前期 新人 会 の メンバー を 中心 と する 同人 に より,1922 年 に,同人 に,年 に,同人 に,年 に,結成,前期 新人 会 の メンバー を 中心 と する 同人 に より,1922 年 に,12,3,に,に,同人,年,NOUN,NOUN,postpositional,postpositional,Preverbal,Japanese
この 川 は 古代 ローマ 時代 に は ティビシス また は ティビスクス と し て 知ら れ て い た 。,この 川 は 古代 ローマ 時代 に は,この 川 は ティビシス また は ティビスクス と し て,この 川 は 時代 に は,この 川 は ティビスクス と,時代 に は,ティビスクス と,知る,古代 ローマ 時代 に は,ティビシス また は ティビスクス と し て,5,7,に は,と,時代,ティビスクス,NOUN,PROPN,postpositional,postpositional,Preverbal,Japanese
人口 は パナマ に 約 二千 人 、 コスタリカ に 数百 人 いる と 見 られる 。,人口 は パナマ に,人口 は コスタリカ に,人口 は パナマ に,人口 は コスタリカ に,パナマ に,コスタリカ に,いる,パナマ に,コスタリカ に,2,2,に,に,パナマ,コスタリカ,PROPN,PROPN,postpositional,postpositional,Preverbal,Japanese
2011 年 から 大宮 に 完全 移籍 する こと に なっ た 。,2011 年 から,大宮 に,年 から,大宮 に,年 から,大宮 に,移籍,2011 年 から,大宮 に,3,2,から,に,年,大宮,NOUN,PROPN,postpositional,postpositional,Preverbal,Japanese
1773 年 に 第 16 竜騎 兵隊 の 少尉 を 購入 し 、 1776 年 に は 北 アメリカ に 派遣 さ れ 、 9 月 末 に ニューヨーク 市 に 到着 し て い た 。,1773 年 に 第 16 竜騎 兵隊 の 少尉 を 購入 し 、 1776 年 に は,1773 年 に 第 16 竜騎 兵隊 の 少尉 を 購入 し 、 北 アメリカ に,1773 年 に 第 16 竜騎 兵隊 の 少尉 を 購入 し 、 年 に は,1773 年 に 第 16 竜騎 兵隊 の 少尉 を 購入 し 、 アメリカ に,年 に は,アメリカ に,派遣,1776 年 に は,北 アメリカ に,4,3,に は,に,年,アメリカ,NOUN,PROPN,postpositional,postpositional,Preverbal,Japanese
1773 年 に 第 16 竜騎 兵隊 の 少尉 を 購入 し 、 1776 年 に は 北 アメリカ に 派遣 さ れ 、 9 月 末 に ニューヨーク 市 に 到着 し て い た 。,1773 年 に 第 16 竜騎 兵隊 の 少尉 を 購入 し 、 1776 年 に は 北 アメリカ に 派遣 さ れ 、 9 月 末 に,1773 年 に 第 16 竜騎 兵隊 の 少尉 を 購入 し 、 1776 年 に は 北 アメリカ に 派遣 さ れ 、 ニューヨーク 市 に,1773 年 に 第 16 竜騎 兵隊 の 少尉 を 購入 し 、 1776 年 に は 北 アメリカ に 派遣 さ れ 、 末 に,1773 年 に 第 16 竜騎 兵隊 の 少尉 を 購入 し 、 1776 年 に は 北 アメリカ に 派遣 さ れ 、 市 に,末 に,市 に,到着,9 月 末 に,ニューヨーク 市 に,4,3,に,に,末,市,NOUN,NOUN,postpositional,postpositional,Preverbal,Japanese
ディズニー ・ チャンネル より 日本 語 版 全話 放送 も ある 。,ディズニー ・ チャンネル より,日本 語 版 全話 放送 も,チャンネル より,放送 も,チャンネル より,放送 も,ある,ディズニー ・ チャンネル より,日本 語 版 全話 放送 も,4,6,より,も,チャンネル,放送,NOUN,NOUN,postpositional,postpositional,Preverbal,Japanese
その 後 、 財政 福祉 委員 会 で 審議 さ れ 、 22 日 に 同 委員 会 で 意思 決定 し 、 同 午後 3 時 から の 本 会議 で 採決 さ れる 。,その 後 、 財政 福祉 委員 会 で 審議 さ れ 、 22 日 に,その 後 、 財政 福祉 委員 会 で 審議 さ れ 、 同 委員 会 で,その 後 、 財政 福祉 委員 会 で 審議 さ れ 、 日 に,その 後 、 財政 福祉 委員 会 で 審議 さ れ 、 会 で,日 に,会 で,決定,22 日 に,同 委員 会 で,3,4,に,で,日,会,NOUN,NOUN,postpositional,postpositional,Preverbal,Japanese
事故 の 前 に 異常 は 何 も 感じ なかっ た よ 。,事故 の 前 に,何 も,前 に,何 も,前 に,何 も,感ずる,事故 の 前 に,何 も,4,2,に,も,前,何,NOUN,PRON,postpositional,postpositional,Preverbal,Japanese
昨年 の 中国 で の 販売 台数 は 9 万 0500 台 で 、 今年 の 目標 は それ を 33 % 上回る 水準 と なる 。,昨年 の 中国 で の 販売 台数 は 9 万 0500 台 で 、,それ を 33 % 上回る 水準 と,台 で,水準 と,台 で,水準 と,なる,昨年 の 中国 で の 販売 台数 は 9 万 0500 台 で 、,それ を 33 % 上回る 水準 と,14,7,で,と,台,水準,NOUN,NOUN,postpositional,postpositional,Preverbal,Japanese
