Sentence,Context_PP1,Context_PP2,Context_PP1_simple,Context_PP2_simple,PP1_simple,PP2_simple,Verb,PP1,PP2,PP1_len,PP2_len,Adp1,Adp2,NP1,NP2,PP1_Pronom,PP2_Pronom,PP1_Type,PP2_Type,Position,Language
なお 、 彼女 の 音楽 で 有名 な ため か 、 家 が ある 辺り は メロディ ストリート と いう 名前 に なっ て いる 。,なお 、 彼女 の 音楽 で 有名 な ため か 、,なお 、 メロディ ストリート と いう 名前 に,なお 、 ため か,なお 、 名前 に,ため か,名前 に,なる,彼女 の 音楽 で 有名 な ため か 、,メロディ ストリート と いう 名前 に,9,6,か,に,ため,名前,NOUN,NOUN,postpositional,postpositional,Preverbal,Japanese
ジェームズ ・ ウォン と 共 に 『 X ファイル 』 や 『 ファイナル ・ デスティネーション 』 など の 脚本 を 書い て いる こと で 知ら れる 。,ジェームズ ・ ウォン と,共 に,ウォン と,共 に,ウォン と,共 に,書く,ジェームズ ・ ウォン と,共 に,4,2,と,に,ウォン,共,PROPN,NOUN,postpositional,postpositional,Preverbal,Japanese
フロア の 人 に 指摘 し 、 作り直し は お 断り し た もの の 、 肝心 の シェフ から の お 詫び が しばらく なく 、 何事 も なかっ た か の よう に ほか の テーブル に 食事 を 出し に いっ て い まし た 。,フロア の 人 に 指摘 し 、 作り直し は お 断り し た もの の 、 肝心 の シェフ から の お 詫び が しばらく なく 、 何事 も なかっ た か の よう に ほか の テーブル に,フロア の 人 に 指摘 し 、 作り直し は お 断り し た もの の 、 肝心 の シェフ から の お 詫び が しばらく なく 、 何事 も なかっ た か の よう に 食事 を 出し に,フロア の 人 に 指摘 し 、 作り直し は お 断り し た もの の 、 肝心 の シェフ から の お 詫び が しばらく なく 、 何事 も なかっ た か の よう に テーブル に,フロア の 人 に 指摘 し 、 作り直し は お 断り し た もの の 、 肝心 の シェフ から の お 詫び が しばらく なく 、 何事 も なかっ た か の よう に 出し に,テーブル に,出し に,いく,ほか の テーブル に,食事 を 出し に,4,4,に,に,テーブル,出し,NOUN,NOUN,postpositional,postpositional,Preverbal,Japanese
また 、 女子 の 競走 も 1962 年 まで 行わ れ た 。,また 、 女子 の 競走 も,また 、 1962 年 まで,また 、 競走 も,また 、 年 まで,競走 も,年 まで,行う,女子 の 競走 も,1962 年 まで,4,3,も,まで,競走,年,NOUN,NOUN,postpositional,postpositional,Preverbal,Japanese
ロビー は 低層 部 1 階 に ある が 、 宿泊 客 向け の フロント は 高層 棟 26 階 に あり 、 エグゼクティブ ラウンジ も 同階 に ある 。,ロビー は 低層 部 1 階 に ある が 、 宿泊 客 向け の フロント は 高層 棟 26 階 に あり 、 エグゼクティブ ラウンジ も,ロビー は 低層 部 1 階 に ある が 、 宿泊 客 向け の フロント は 高層 棟 26 階 に あり 、 同階 に,ロビー は 低層 部 1 階 に ある が 、 宿泊 客 向け の フロント は 高層 棟 26 階 に あり 、 ラウンジ も,ロビー は 低層 部 1 階 に ある が 、 宿泊 客 向け の フロント は 高層 棟 26 階 に あり 、 同階 に,ラウンジ も,同階 に,ある,エグゼクティブ ラウンジ も,同階 に,3,2,も,に,ラウンジ,同階,NOUN,NOUN,postpositional,postpositional,Preverbal,Japanese
“ DVP シリーズ ” は 、 硬度 の 高い ハード タイプ の フィルム で 、 液晶 画面 を キズ や ホコリ から しっかり 保護 し ます 。,“ DVP シリーズ ” は 、 硬度 の 高い ハード タイプ の フィルム で 、,“ DVP シリーズ ” は 、 キズ や ホコリ から,“ DVP シリーズ ” は 、 フィルム で,“ DVP シリーズ ” は 、 ホコリ から,フィルム で,ホコリ から,保護,硬度 の 高い ハード タイプ の フィルム で 、,キズ や ホコリ から,9,4,で,から,フィルム,ホコリ,NOUN,NOUN,postpositional,postpositional,Preverbal,Japanese
“ 救世 主 ” と なっ た 韓流 スター が 、 今季 も ゴール で 磐田 を 押し上げる 。,“ 救世 主 ” と なっ た 韓流 スター が 、 今季 も,“ 救世 主 ” と なっ た 韓流 スター が 、 ゴール で,“ 救世 主 ” と なっ た 韓流 スター が 、 今季 も,“ 救世 主 ” と なっ た 韓流 スター が 、 ゴール で,今季 も,ゴール で,押し上げる,今季 も,ゴール で,2,2,も,で,今季,ゴール,NOUN,NOUN,postpositional,postpositional,Preverbal,Japanese
旅 の 途中 で 倒れ た 地球 降下 部隊 の 女性 兵士 を 看取っ た 際 、 体格 の 似通っ て い た 彼女 から バートレー を 形見 と し て 受け取っ た 。,旅 の 途中 で 倒れ た 地球 降下 部隊 の 女性 兵士 を 看取っ た 際 、 体格 の 似通っ て い た 彼女 から,旅 の 途中 で 倒れ た 地球 降下 部隊 の 女性 兵士 を 看取っ た 際 、 形見 と し て,旅 の 途中 で 倒れ た 地球 降下 部隊 の 女性 兵士 を 看取っ た 際 、 彼女 から,旅 の 途中 で 倒れ た 地球 降下 部隊 の 女性 兵士 を 看取っ た 際 、 形見 と,彼女 から,形見 と,受け取る,体格 の 似通っ て い た 彼女 から,形見 と し て,8,4,から,と,彼女,形見,PRON,NOUN,postpositional,postpositional,Preverbal,Japanese
この 画期 的 な テキスタイル を 梶原 さん と 共 に 生み出し て いる 産地 の ひと つ が 、 兵庫 県 西脇 市 。,この 画期 的 な テキスタイル を 梶原 さん と,この 画期 的 な テキスタイル を 共 に,この 画期 的 な テキスタイル を さん と,この 画期 的 な テキスタイル を 共 に,さん と,共 に,生み出す,梶原 さん と,共 に,3,2,と,に,さん,共,NOUN,NOUN,postpositional,postpositional,Preverbal,Japanese
夏 真っ盛り に 、 挙式 だっ た の で 、 日焼け や 、 背中 の ニキビ 、 シミ が 心配 だっ た の です が 、 私 に 合っ た プラン で 、 コース 中 も 、 細かく 肌 の ケア に つい て 、 日焼け 対策 や 、 シミ 対策 、 二の腕 ・ ワキ 肉 の 引き締め 方 など の アドバイス を たくさん 頂き 、 安心 し て 、 当日 を 迎える 事 が 出来 まし た 。,夏 真っ盛り に 、 挙式 だっ た の で 、 日焼け や 、 背中 の ニキビ 、 シミ が 心配 だっ た の です が 、 私 に 合っ た プラン で 、 コース 中 も 、,夏 真っ盛り に 、 挙式 だっ た の で 、 日焼け や 、 背中 の ニキビ 、 シミ が 心配 だっ た の です が 、 私 に 合っ た プラン で 、 肌 の ケア に つい て 、,夏 真っ盛り に 、 挙式 だっ た の で 、 日焼け や 、 背中 の ニキビ 、 シミ が 心配 だっ た の です が 、 私 に 合っ た プラン で 、 中 も,夏 真っ盛り に 、 挙式 だっ た の で 、 日焼け や 、 背中 の ニキビ 、 シミ が 心配 だっ た の です が 、 私 に 合っ た プラン で 、 ケア に,中 も,ケア に,いただく,コース 中 も 、,肌 の ケア に つい て 、,4,7,も,に,中,ケア,NOUN,NOUN,postpositional,postpositional,Preverbal,Japanese
これ まで 松尾 会長 は 「 今 すぐ 辞める こと に は マイナス も ある 」 など と し て 、 真部 氏 の 続投 を 求め て い た 。,これ まで 松尾 会長 は 「 今 すぐ 辞める こと に は,これ まで 松尾 会長 は マイナス も,これ まで 松尾 会長 は こと に は,これ まで 松尾 会長 は マイナス も,こと に は,マイナス も,ある,「 今 すぐ 辞める こと に は,マイナス も,7,2,に は,も,こと,マイナス,NOUN,NOUN,postpositional,postpositional,Preverbal,Japanese
ハーフ エルフ と 言う 事 で 住ん で い た 村 で は 冷遇 さ れ て い た 。,ハーフ エルフ と 言う 事 で,住ん で い た 村 で は,事 で,村 で は,事 で,村 で は,冷遇,ハーフ エルフ と 言う 事 で,住ん で い た 村 で は,6,7,で,で は,事,村,NOUN,NOUN,postpositional,postpositional,Preverbal,Japanese
屈突 通 や 殷 開山 が 敬徳 を 殺す よう 進言 し た が 、 李 世民 は 「 敬徳 が 叛く とき は 、 尋相 の 後 に など つく もの か 」 と 相手 に せ ず 、 敬徳 を 寝室 の 中 に 招い て 「 わたし は 讒言 を もっ て 良士 を 害し たり は し ない 」 と いい 、 「 去り たい とき に は 資金 と せよ 」 と 金 まで 渡し た 。,屈突 通 や 殷 開山 が 敬徳 を 殺す よう 進言 し た が 、 李 世民 は 「 敬徳 が 叛く とき は 、 尋相 の 後 に など つく もの か 」 と,屈突 通 や 殷 開山 が 敬徳 を 殺す よう 進言 し た が 、 李 世民 は 相手 に,屈突 通 や 殷 開山 が 敬徳 を 殺す よう 進言 し た が 、 李 世民 は もの と,屈突 通 や 殷 開山 が 敬徳 を 殺す よう 進言 し た が 、 李 世民 は 相手 に,もの と,相手 に,する,「 敬徳 が 叛く とき は 、 尋相 の 後 に など つく もの か 」 と,相手 に,17,2,と,に,もの,相手,NOUN,NOUN,postpositional,postpositional,Preverbal,Japanese
屈突 通 や 殷 開山 が 敬徳 を 殺す よう 進言 し た が 、 李 世民 は 「 敬徳 が 叛く とき は 、 尋相 の 後 に など つく もの か 」 と 相手 に せ ず 、 敬徳 を 寝室 の 中 に 招い て 「 わたし は 讒言 を もっ て 良士 を 害し たり は し ない 」 と いい 、 「 去り たい とき に は 資金 と せよ 」 と 金 まで 渡し た 。,屈突 通 や 殷 開山 が 敬徳 を 殺す よう 進言 し た が 、 李 世民 は 「 敬徳 が 叛く とき は 、 尋相 の 後 に など つく もの か 」 と 相手 に せ ず 、 敬徳 を 寝室 の 中 に 招い て 「 わたし は 讒言 を もっ て 良士 を 害し たり は し ない 」 と いい 、 「 去り たい とき に は 資金 と せよ 」 と,屈突 通 や 殷 開山 が 敬徳 を 殺す よう 進言 し た が 、 李 世民 は 「 敬徳 が 叛く とき は 、 尋相 の 後 に など つく もの か 」 と 相手 に せ ず 、 敬徳 を 寝室 の 中 に 招い て 「 わたし は 讒言 を もっ て 良士 を 害し たり は し ない 」 と いい 、 金 まで,屈突 通 や 殷 開山 が 敬徳 を 殺す よう 進言 し た が 、 李 世民 は 「 敬徳 が 叛く とき は 、 尋相 の 後 に など つく もの か 」 と 相手 に せ ず 、 敬徳 を 寝室 の 中 に 招い て 「 わたし は 讒言 を もっ て 良士 を 害し たり は し ない 」 と いい 、 資金 と と,屈突 通 や 殷 開山 が 敬徳 を 殺す よう 進言 し た が 、 李 世民 は 「 敬徳 が 叛く とき は 、 尋相 の 後 に など つく もの か 」 と 相手 に せ ず 、 敬徳 を 寝室 の 中 に 招い て 「 わたし は 讒言 を もっ て 良士 を 害し たり は し ない 」 と いい 、 金 まで,資金 と と,金 まで,渡す,「 去り たい とき に は 資金 と せよ 」 と,金 まで,11,2,と と,まで,資金,金,NOUN,NOUN,postpositional,postpositional,Preverbal,Japanese
理研 の 石川 智久 上級 研究 員 に よる と 、 航空 機 や 新 幹線 など の 交通 機関 で 人 が 活発 に 移動 し て いる こと が 変異 ウイルス 流行 の 背景 に ある と み られる 。,理研 の 石川 智久 上級 研究 員 に よる と 、,変異 ウイルス 流行 の 背景 に,員 に,背景 に,員 に,背景 に,ある,理研 の 石川 智久 上級 研究 員 に よる と 、,変異 ウイルス 流行 の 背景 に,11,6,に,に,員,背景,NOUN,NOUN,postpositional,postpositional,Preverbal,Japanese
"ナポレオン の 軍 は マッセナ 師団 と オージュロー 師団 を 加え て 22 , 500 に 膨らん で い た が 、 さらに 日中 に は デスピノワ の 部隊 も 加わる はず だっ た 。","ナポレオン の 軍 は マッセナ 師団 と オージュロー 師団 を 加え て 22 , 500 に 膨らん で い た が 、 さらに 日中 に は","ナポレオン の 軍 は マッセナ 師団 と オージュロー 師団 を 加え て 22 , 500 に 膨らん で い た が 、 さらに デスピノワ の 部隊 も","ナポレオン の 軍 は マッセナ 師団 と オージュロー 師団 を 加え て 22 , 500 に 膨らん で い た が 、 さらに 日中 に は","ナポレオン の 軍 は マッセナ 師団 と オージュロー 師団 を 加え て 22 , 500 に 膨らん で い た が 、 さらに 部隊 も",日中 に は,部隊 も,加わる,日中 に は,デスピノワ の 部隊 も,3,4,に は,も,日中,部隊,NOUN,NOUN,postpositional,postpositional,Preverbal,Japanese
ただし 誘導 信号 機 に よる 場合 や 無 閉塞 運転 、 別途 指示 に より 次 区間 に 進入 する こと が 可能 な 箇所 も ある 。,ただし 誘導 信号 機 に よる 場合 や 無 閉塞 運転 、 別途 指示 に より,ただし 次 区間 に,ただし 指示 に,ただし 区間 に,指示 に,区間 に,進入,誘導 信号 機 に よる 場合 や 無 閉塞 運転 、 別途 指示 に より,次 区間 に,15,3,に,に,指示,区間,NOUN,NOUN,postpositional,postpositional,Preverbal,Japanese
2002 年 に ガーディアン 賞 、 2008 年 に アストリッド ・ リンドグレーン 記念 文学 賞 を 受賞 し た 。,2002 年 に,2008 年 に,年 に,年 に,年 に,年 に,受賞,2002 年 に,2008 年 に,3,3,に,に,年,年,NOUN,NOUN,postpositional,postpositional,Preverbal,Japanese
仕事帰り に 同僚 と 冷たい ビール が 飲み たく て ここ に ハイネケン コールド ビール ある の を 知っ て い た の で 同僚 を 無理やり 誘っ て いっ て き まし た 。,仕事帰り に,同僚 と,仕事帰り に,同僚 と,仕事帰り に,同僚 と,飲む,仕事帰り に,同僚 と,2,2,に,と,仕事帰り,同僚,NOUN,NOUN,postpositional,postpositional,Preverbal,Japanese
また 、 この 短 期間 で の 都市 復興 は 、 1995 年 に 発生 し た 阪神 ・ 淡路 大 震災 に おい て 参考 と さ れ た 。,また 、 この 短 期間 で の 都市 復興 は 、 1995 年 に 発生 し た 阪神 ・ 淡路 大 震災 に おい て,また 、 この 短 期間 で の 都市 復興 は 、 参考 と,また 、 この 短 期間 で の 都市 復興 は 、 震災 に,また 、 この 短 期間 で の 都市 復興 は 、 参考 と,震災 に,参考 と,する,1995 年 に 発生 し た 阪神 ・ 淡路 大 震災 に おい て,参考 と,14,2,に,と,震災,参考,NOUN,NOUN,postpositional,postpositional,Preverbal,Japanese
実 は HDCD エンコード 盤 は 、 0 dB を 超える 波形 尖塔 部 を 鈍ら せ て 記録 し 、 再生 時 に 非 直線 量子 化 に よっ て 鈍ら せ た 波形 尖塔 部 を 復活 さ せる ピーク エクステンション と いう しくみ の ため に 、 通常 の CD 盤 と 比較 する と 音量 が 小さく 聴こえ て しまう の で HDCD 盤 と 通常 CD 盤 再生 時 に 音量 差 が ある と 、 いちいち リスナー が 再生 時 の ボリューム を 調整 する 煩わし さ が 生じる の で 、 音量 差 が 生じ ない よう に しくみ に なっ て いる 。,実 は HDCD エンコード 盤 は 、 0 dB を 超える 波形 尖塔 部 を 鈍ら せ て 記録 し 、 再生 時 に,実 は HDCD エンコード 盤 は 、 0 dB を 超える 波形 尖塔 部 を 鈍ら せ て 記録 し 、 非 直線 量子 化 に よっ て,実 は HDCD エンコード 盤 は 、 0 dB を 超える 波形 尖塔 部 を 鈍ら せ て 記録 し 、 時 に,実 は HDCD エンコード 盤 は 、 0 dB を 超える 波形 尖塔 部 を 鈍ら せ て 記録 し 、 化 に,時 に,化 に,復活,再生 時 に,非 直線 量子 化 に よっ て,3,7,に,に,時,化,NOUN,NOUN,postpositional,postpositional,Preverbal,Japanese
1889 年 に 器具 と し て の ティー が イギリス で 発明 さ れ た が 、 当初 は 台状 の もの だっ た 。,1889 年 に,イギリス で,年 に,イギリス で,年 に,イギリス で,発明,1889 年 に,イギリス で,3,2,に,で,年,イギリス,NOUN,PROPN,postpositional,postpositional,Preverbal,Japanese
1921 年 に 入っ て 、 将官 会議 から 嚮導 艦 に 関する 5 つ の 案 が 提出 さ れ た が 、 海軍 歴史 家 の ノーマン ・ フリードマン に よれ ば 、 その 建造 費用 は 大半 の ウィックス 級 駆逐 艦 および クレムソン 級 駆逐 艦 を 購入 する の に 等しい 額 で ある と 議会 から 指摘 さ れ た と いう 。,1921 年 に 入っ て 、 将官 会議 から 嚮導 艦 に 関する 5 つ の 案 が 提出 さ れ た が 、 海軍 歴史 家 の ノーマン ・ フリードマン に よれ ば 、,1921 年 に 入っ て 、 将官 会議 から 嚮導 艦 に 関する 5 つ の 案 が 提出 さ れ た が 、 議会 から,1921 年 に 入っ て 、 将官 会議 から 嚮導 艦 に 関する 5 つ の 案 が 提出 さ れ た が 、 フリードマン に,1921 年 に 入っ て 、 将官 会議 から 嚮導 艦 に 関する 5 つ の 案 が 提出 さ れ た が 、 議会 から,フリードマン に,議会 から,指摘,海軍 歴史 家 の ノーマン ・ フリードマン に よれ ば 、,議会 から,11,2,に,から,フリードマン,議会,PROPN,NOUN,postpositional,postpositional,Preverbal,Japanese
ネット と は 、 かさぶた の よう な もの で あり 、 果実 の 成長 期 に 果肉 と 表皮 の 伸長 率 の ずれ に よっ て 生じる ひび割れ を 塞ぐ 役割 を 担っ て いる 。,ネット と は 、 かさぶた の よう な もの で あり 、 果実 の 成長 期 に,ネット と は 、 かさぶた の よう な もの で あり 、 果肉 と 表皮 の 伸長 率 の ずれ に よっ て,ネット と は 、 かさぶた の よう な もの で あり 、 期 に,ネット と は 、 かさぶた の よう な もの で あり 、 ずれ に,期 に,ずれ に,生じる,果実 の 成長 期 に,果肉 と 表皮 の 伸長 率 の ずれ に よっ て,5,11,に,に,期,ずれ,NOUN,NOUN,postpositional,postpositional,Preverbal,Japanese
帝辛 に 寵愛 さ れ 、 末喜 など と 共 に 悪女 の 代 名詞 的 存在 と し て 扱わ れる 。,帝辛 に 寵愛 さ れ 、 末喜 など と 共 に,帝辛 に 寵愛 さ れ 、 悪女 の 代 名詞 的 存在 と し て,帝辛 に 寵愛 さ れ 、 共 に,帝辛 に 寵愛 さ れ 、 存在 と,共 に,存在 と,扱う,末喜 など と 共 に,悪女 の 代 名詞 的 存在 と し て,5,9,に,と,共,存在,NOUN,NOUN,postpositional,postpositional,Preverbal,Japanese
運輸 安全 委員 会 の 報告 で は 、 離陸 中 に 第 1 エンジン の ドラム が 脱落 し 、 これ が 回転 部分 で ある タービン の ベーン に 挟まっ た ため 、 エンジン の 故障 を 招い た と 2010 年 2 月 に 発表 さ れ た 。,運輸 安全 委員 会 の 報告 で は 、,2010 年 2 月 に,報告 で は,月 に,報告 で は,月 に,発表,運輸 安全 委員 会 の 報告 で は 、,2010 年 2 月 に,9,5,で は,に,報告,月,NOUN,NOUN,postpositional,postpositional,Preverbal,Japanese
"統一 グループ の 巨大 コンツェルン は , エンドレス 信者 献金 や 霊感 商法 など で 日本 から 不当 に 吸い上げ た 巨額 の お 金 が その 資金 源 に なっ て いる 。","統一 グループ の 巨大 コンツェルン は , エンドレス 信者 献金 や 霊感 商法 など で","統一 グループ の 巨大 コンツェルン は , 日本 から","統一 グループ の 巨大 コンツェルン は , 商法 など で","統一 グループ の 巨大 コンツェルン は , 日本 から",商法 など で,日本 から,吸い上げる,エンドレス 信者 献金 や 霊感 商法 など で,日本 から,8,2,など で,から,商法,日本,NOUN,PROPN,postpositional,postpositional,Preverbal,Japanese
新しい スタイル で 補習 塾 だけ で なく 予備 校 の 要素 も 取り入れ た 個別 指導 。,新しい スタイル で,補習 塾 だけ で なく 予備 校 の 要素 も,スタイル で,要素 も,スタイル で,要素 も,取り入れる,新しい スタイル で,補習 塾 だけ で なく 予備 校 の 要素 も,3,10,で,も,スタイル,要素,NOUN,NOUN,postpositional,postpositional,Preverbal,Japanese
市民 の 夜間 外出 も 午後 7 時 から 午前 5 時 まで の 間 は 禁止 と なっ た 。,市民 の 夜間 外出 も,禁止 と,外出 も,禁止 と,外出 も,禁止 と,なる,市民 の 夜間 外出 も,禁止 と,5,2,も,と,外出,禁止,NOUN,NOUN,postpositional,postpositional,Preverbal,Japanese
会見 後 に 外務 省 担当 者 が 記者 団 に 説明 し た ところ に よる と 、 菅 首相 は 9 月 に 予定 さ れ て い た 訪米 に つい て 「 日本 国内 の 政治 情勢 に より 総理 と し て 行け なく なり 残念 」 と し た 上 で 、 「 約束 を 果たせ ず 申し訳 ない 」 と 陳謝 し た と いう 。,会見 後 に,記者 団 に,後 に,団 に,後 に,団 に,説明,会見 後 に,記者 団 に,3,3,に,に,後,団,NOUN,NOUN,postpositional,postpositional,Preverbal,Japanese
また 、 集め られ た 資金 の 運用 に つい て は 、 ドイツ 連邦 銀行 へ の 預金 や 、 大蔵 省 の 証券 、 電気 通信 事業 に 対する 貸し付け など に 制限 さ れ て い た 。,また 、 集め られ た 資金 の 運用 に つい て は 、,また 、 ドイツ 連邦 銀行 へ の 預金 や 、 大蔵 省 の 証券 、 電気 通信 事業 に 対する 貸し付け など に,また 、 運用 に は,また 、 貸し付け など に,運用 に は,貸し付け など に,制限,集め られ た 資金 の 運用 に つい て は 、,ドイツ 連邦 銀行 へ の 預金 や 、 大蔵 省 の 証券 、 電気 通信 事業 に 対する 貸し付け など に,11,21,に は,など に,運用,貸し付け,NOUN,NOUN,postpositional,postpositional,Preverbal,Japanese
5 日 発売 の スポーツ 紙 「 東京 スポーツ 」 に よる と 、 赤西 は 今月 中旬 に 米国 ・ ロサンゼルス で 行う ソロ ライブ の 為 、 先月 9 日 に 渡米 。,5 日 発売 の スポーツ 紙 「 東京 スポーツ 」 に よる と 、 赤西 は 今月 中旬 に,5 日 発売 の スポーツ 紙 「 東京 スポーツ 」 に よる と 、 赤西 は 米国 ・ ロサンゼルス で,5 日 発売 の スポーツ 紙 「 東京 スポーツ 」 に よる と 、 赤西 は 中旬 に,5 日 発売 の スポーツ 紙 「 東京 スポーツ 」 に よる と 、 赤西 は ロサンゼルス で,中旬 に,ロサンゼルス で,行う,今月 中旬 に,米国 ・ ロサンゼルス で,3,4,に,で,中旬,ロサンゼルス,NOUN,PROPN,postpositional,postpositional,Preverbal,Japanese
いわゆる 少年 事件 で は 加害 者 の 住所 氏名 すら 被害 者 に 伝え られ ず 、 審判 は 非 公開 で どんな 事実 認定 が なさ れ た か すら 知る よし も ない 。,いわゆる 少年 事件 で は 加害 者 の 住所 氏名 すら,いわゆる 少年 事件 で は 被害 者 に,いわゆる 少年 事件 で は 氏名 すら,いわゆる 少年 事件 で は 者 に,氏名 すら,者 に,伝える,加害 者 の 住所 氏名 すら,被害 者 に,6,3,すら,に,氏名,者,NOUN,NOUN,postpositional,postpositional,Preverbal,Japanese
中世 の 宮座 の 祭祀 組織 や 神事 を 伝え て いる こと から 、 国 の 重要 無形 民俗 文化 財 に 指定 さ れ て いる 。,中世 の 宮座 の 祭祀 組織 や 神事 を 伝え て いる こと から 、,国 の 重要 無形 民俗 文化 財 に,こと から,財 に,こと から,財 に,指定,中世 の 宮座 の 祭祀 組織 や 神事 を 伝え て いる こと から 、,国 の 重要 無形 民俗 文化 財 に,15,8,から,に,こと,財,NOUN,NOUN,postpositional,postpositional,Preverbal,Japanese
中山道 の 第 一 宿 と し て は 「 板橋 宿 」 と 呼ば れ て おり 、 江戸 四 宿 の ひと つ で あっ た 。,中山道 の 第 一 宿 と し て は,「 板橋 宿 」 と,宿 と は,宿 と,宿 と は,宿 と,呼ぶ,中山道 の 第 一 宿 と し て は,「 板橋 宿 」 と,9,5,と は,と,宿,宿,NOUN,NOUN,postpositional,postpositional,Preverbal,Japanese
