Sentence,Context_PP1,Context_PP2,Context_PP1_simple,Context_PP2_simple,PP1_simple,PP2_simple,Verb,PP1,PP2,PP1_len,PP2_len,Adp1,Adp2,NP1,NP2,PP1_Pronom,PP2_Pronom,PP1_Type,PP2_Type,Position,Language
"3 年次 に は トータル オフェンス で 2 , 892 ヤード を 獲得 し 、 これ は 大学 記録 と なっ た 。",3 年次 に は,トータル オフェンス で,年次 に は,オフェンス で,年次 に は,オフェンス で,獲得,3 年次 に は,トータル オフェンス で,4,3,に は,で,年次,オフェンス,NOUN,NOUN,postpositional,postpositional,Preverbal,Japanese
そして 、 第 40 話 で その カオル と 百子 を も 失い 、 完全 に 孤児 に なっ て ゲン と とも に 美山 家 に 身 を 寄せ 、 また ゲン に 連れ添っ て 円盤 生物 を 調査 する パートナー と なる 。,そして 、 第 40 話 で その カオル と 百子 を も 失い 、 完全 に 孤児 に なっ て ゲン と とも に,そして 、 第 40 話 で その カオル と 百子 を も 失い 、 完全 に 孤児 に なっ て 美山 家 に,そして 、 第 40 話 で その カオル と 百子 を も 失い 、 完全 に 孤児 に なっ て とも に,そして 、 第 40 話 で その カオル と 百子 を も 失い 、 完全 に 孤児 に なっ て 家 に,とも に,家 に,寄せる,ゲン と とも に,美山 家 に,4,3,に,に,とも,家,NOUN,NOUN,postpositional,postpositional,Preverbal,Japanese
そして 、 第 40 話 で その カオル と 百子 を も 失い 、 完全 に 孤児 に なっ て ゲン と とも に 美山 家 に 身 を 寄せ 、 また ゲン に 連れ添っ て 円盤 生物 を 調査 する パートナー と なる 。,そして 、 第 40 話 で,そして 、 ゲン に 連れ添っ て 円盤 生物 を 調査 する パートナー と,そして 、 話 で,そして 、 パートナー と,話 で,パートナー と,なる,第 40 話 で,ゲン に 連れ添っ て 円盤 生物 を 調査 する パートナー と,4,11,で,と,話,パートナー,NOUN,NOUN,postpositional,postpositional,Preverbal,Japanese
配属 さ れ て 最初 の 1 カ月 こそ 「 親切 な 先輩 に 恵まれ て ラッキー だ な 」 と 思っ た もの の 、 その 後 すぐ に 「 ちょっと お せっかい か な 」 と 感じる よう に なり 、 半年 後 に は 「 少し 邪魔 か も 」 と 思い 、 1 年 後 に は 「 生産 性 の 阻害 要因 だ 」 と 確信 する に 至り まし た 。,配属 さ れ て 最初 の 1 カ月 こそ 「 親切 な 先輩 に 恵まれ て ラッキー だ な 」 と 思っ た もの の 、 その 後 すぐ に,配属 さ れ て 最初 の 1 カ月 こそ 「 親切 な 先輩 に 恵まれ て ラッキー だ な 」 と 思っ た もの の 、 その 後 「 ちょっと お せっかい か な 」 と,配属 さ れ て 最初 の 1 カ月 こそ 「 親切 な 先輩 に 恵まれ て ラッキー だ な 」 と 思っ た もの の 、 その 後 すぐ に,配属 さ れ て 最初 の 1 カ月 こそ 「 親切 な 先輩 に 恵まれ て ラッキー だ な 」 と 思っ た もの の 、 その 後 せっかい と,すぐ に,せっかい と,感じる,すぐ に,「 ちょっと お せっかい か な 」 と,2,8,に,と,すぐ,せっかい,ADV,NOUN,postpositional,postpositional,Preverbal,Japanese
高松 に 3 店舗 を 展開 する 四国 スイーツ の 専門 店 、 ラ ・ ファミーユ で は 、 バレンタイン を 前 に 、 焼か ない チョコレート ケーキ 「 半熟 ザッハトルテ 」 の 発売 を 開始 し まし た 。,高松 に 3 店舗 を 展開 する 四国 スイーツ の 専門 店 、 ラ ・ ファミーユ で は 、,バレンタイン を 前 に 、,ファミーユ で は,前 に,ファミーユ で は,前 に,開始,高松 に 3 店舗 を 展開 する 四国 スイーツ の 専門 店 、 ラ ・ ファミーユ で は 、,バレンタイン を 前 に 、,19,5,で は,に,ファミーユ,前,NOUN,NOUN,postpositional,postpositional,Preverbal,Japanese
チーム 名 は アマチュア 時代 の 「 ロッテ ・ ジャイアンツ 」 の 名 を その まま 維持 し て 、 重光 オーナー の 故郷 で ある 釜山 ・ 慶尚 南道 地域 を フランチャイズ 保護 地域 と し て 、 釜山 を 本拠 地 と する プロ 球団 と し て 転向 し た 。,チーム 名 は アマチュア 時代 の 「 ロッテ ・ ジャイアンツ 」 の 名 を その まま 維持 し て 、 重光 オーナー の 故郷 で ある 釜山 ・ 慶尚 南道 地域 を フランチャイズ 保護 地域 と し て 、,チーム 名 は アマチュア 時代 の 「 ロッテ ・ ジャイアンツ 」 の 名 を その まま 維持 し て 、 本拠 地 と,チーム 名 は アマチュア 時代 の 「 ロッテ ・ ジャイアンツ 」 の 名 を その まま 維持 し て 、 地域 と,チーム 名 は アマチュア 時代 の 「 ロッテ ・ ジャイアンツ 」 の 名 を その まま 維持 し て 、 地 と,地域 と,地 と,する,重光 オーナー の 故郷 で ある 釜山 ・ 慶尚 南道 地域 を フランチャイズ 保護 地域 と し て 、,本拠 地 と,19,3,と,と,地域,地,NOUN,NOUN,postpositional,postpositional,Preverbal,Japanese
山陽 新 幹線 厚狭 駅 - 新 下関 駅 - 小倉 駅 山陽 本線 長府 駅 - 新 下関 駅 - 幡生 駅 * 当駅 を 始発 と する 「 みすゞ 潮彩 」 は 、 当駅 - 下関 駅 間 で は 幡生 駅 に 停車 し ない 。,山陽 新 幹線 厚狭 駅 - 新 下関 駅 - 小倉 駅 山陽 本線 長府 駅 - 新 下関 駅 - 幡生 駅 * 当駅 を 始発 と する 「 みすゞ 潮彩 」 は 、 当駅 - 下関 駅 間 で は,山陽 新 幹線 厚狭 駅 - 新 下関 駅 - 小倉 駅 山陽 本線 長府 駅 - 新 下関 駅 - 幡生 駅 * 当駅 を 始発 と する 「 みすゞ 潮彩 」 は 、 幡生 駅 に,山陽 新 幹線 厚狭 駅 - 新 下関 駅 - 小倉 駅 山陽 本線 長府 駅 - 新 下関 駅 - 幡生 駅 * 当駅 を 始発 と する 「 みすゞ 潮彩 」 は 、 間 で は,山陽 新 幹線 厚狭 駅 - 新 下関 駅 - 小倉 駅 山陽 本線 長府 駅 - 新 下関 駅 - 幡生 駅 * 当駅 を 始発 と する 「 みすゞ 潮彩 」 は 、 駅 に,間 で は,駅 に,停車,当駅 - 下関 駅 間 で は,幡生 駅 に,7,3,で は,に,間,駅,NOUN,NOUN,postpositional,postpositional,Preverbal,Japanese
徒歩 15 分 で 港 まで いける の で アクセス に 便利 でし た 。,徒歩 15 分 で,港 まで,分 で,港 まで,分 で,港 まで,いける,徒歩 15 分 で,港 まで,4,2,で,まで,分,港,NOUN,NOUN,postpositional,postpositional,Preverbal,Japanese
これ に 対し て 、 民間 の 金融 機関 から は 、 金融 サービス の 拡充 は 本来 の 郵便 貯金 業務 の 枠 を 超え た もの で ある こと 、 ドイツ テレコム から の 赤字 補てん は 、 民間 と の 公正 な 競争 を 阻害 し て いる こと など が 批判 さ れ た 。,これ に 対し て 、,民間 の 金融 機関 から は 、,これ に,機関 から は,これ に,機関 から は,批判,これ に 対し て 、,民間 の 金融 機関 から は 、,5,7,に,から は,これ,機関,PRON,NOUN,postpositional,postpositional,Preverbal,Japanese
6 月 19 日 に 保釈 金 を 支払い 釈放 、 7 月 15 日 から イングランド 艦隊 の 義勇 兵 と なり 、 8 月 1日 に ノルウェー の ベルゲン 港 で オランダ 共和 国 と の 交戦 を 経験 し た 。,6 月 19 日 に 保釈 金 を 支払い 釈放 、 7 月 15 日 から,6 月 19 日 に 保釈 金 を 支払い 釈放 、 イングランド 艦隊 の 義勇 兵 と,6 月 19 日 に 保釈 金 を 支払い 釈放 、 日 から,6 月 19 日 に 保釈 金 を 支払い 釈放 、 兵 と,日 から,兵 と,なる,7 月 15 日 から,イングランド 艦隊 の 義勇 兵 と,5,6,から,と,日,兵,NOUN,NOUN,postpositional,postpositional,Preverbal,Japanese
6 月 19 日 に 保釈 金 を 支払い 釈放 、 7 月 15 日 から イングランド 艦隊 の 義勇 兵 と なり 、 8 月 1日 に ノルウェー の ベルゲン 港 で オランダ 共和 国 と の 交戦 を 経験 し た 。,6 月 19 日 に 保釈 金 を 支払い 釈放 、 7 月 15 日 から イングランド 艦隊 の 義勇 兵 と なり 、 8 月 1日 に,6 月 19 日 に 保釈 金 を 支払い 釈放 、 7 月 15 日 から イングランド 艦隊 の 義勇 兵 と なり 、 ノルウェー の ベルゲン 港 で,6 月 19 日 に 保釈 金 を 支払い 釈放 、 7 月 15 日 から イングランド 艦隊 の 義勇 兵 と なり 、 1日 に,6 月 19 日 に 保釈 金 を 支払い 釈放 、 7 月 15 日 から イングランド 艦隊 の 義勇 兵 と なり 、 港 で,1日 に,港 で,経験,8 月 1日 に,ノルウェー の ベルゲン 港 で,4,5,に,で,1日,港,NOUN,NOUN,postpositional,postpositional,Preverbal,Japanese
今月 22 日 に は 、 今回 の 現場 から わずか 260 メートル ほど の 事務 所 から 出火 し て おり 、 警察 に よる と 、 放火 の 可能 性 が ある と いう 。,今月 22 日 に は 、,今回 の 現場 から わずか 260 メートル ほど の 事務 所 から,日 に は,所 から,日 に は,所 から,出火,今月 22 日 に は 、,今回 の 現場 から わずか 260 メートル ほど の 事務 所 から,6,12,に は,から,日,所,NOUN,NOUN,postpositional,postpositional,Preverbal,Japanese
球界 の 話題 を 独占 し て いる 次代 の エース に 対し 、 ダルビッシュ は 自身 の ルーキー 時代 を 振り返り ながら 苦笑 交じり に 比較 し た 。,球界 の 話題 を 独占 し て いる 次代 の エース に 対し 、,苦笑 交じり に,エース に,交じり に,エース に,交じり に,比較,球界 の 話題 を 独占 し て いる 次代 の エース に 対し 、,苦笑 交じり に,14,3,に,に,エース,交じり,NOUN,NOUN,postpositional,postpositional,Preverbal,Japanese
更に その 後 、 繊維 ・ 水着 のみ なら ず 、 グループ 事業 全体 の PR も 担わ せる ため 、 第 33 代 から 「 旭 化成 グループ キャンペーン モデル 」 に 名称 変更 し 、 今 に 至っ て いる 。,更に その 後 、 繊維 ・ 水着 のみ なら ず 、 グループ 事業 全体 の PR も 担わ せる ため 、 第 33 代 から,更に その 後 、 繊維 ・ 水着 のみ なら ず 、 グループ 事業 全体 の PR も 担わ せる ため 、 「 旭 化成 グループ キャンペーン モデル 」 に,更に その 後 、 繊維 ・ 水着 のみ なら ず 、 グループ 事業 全体 の PR も 担わ せる ため 、 代 から,更に その 後 、 繊維 ・ 水着 のみ なら ず 、 グループ 事業 全体 の PR も 担わ せる ため 、 モデル に,代 から,モデル に,変更,第 33 代 から,「 旭 化成 グループ キャンペーン モデル 」 に,4,8,から,に,代,モデル,NOUN,NOUN,postpositional,postpositional,Preverbal,Japanese
近年 で は 『 うたばん 』 の よう に 、 それ を 逆手 に 取り 笑い の ネタ と し て 積極 的 に 活用 する 番組 も 現れ て いる 。,近年 で は,『 うたばん 』 の よう に 、 それ を 逆手 に 取り 笑い の ネタ と し て 積極 的 に 活用 する 番組 も,近年 で は,番組 も,近年 で は,番組 も,現れる,近年 で は,『 うたばん 』 の よう に 、 それ を 逆手 に 取り 笑い の ネタ と し て 積極 的 に 活用 する 番組 も,3,25,で は,も,近年,番組,NOUN,NOUN,postpositional,postpositional,Preverbal,Japanese
シリンダー に よっ て は 噴射 から 吸入 まで やや タイム ラグ が 発生 する 為 、 当然 ながら 燃焼 制御 も 大雑把 な もの と なる 。,シリンダー に よっ て は,噴射 から 吸入 まで,シリンダー に は,吸入 まで,シリンダー に は,吸入 まで,発生,シリンダー に よっ て は,噴射 から 吸入 まで,5,4,に は,まで,シリンダー,吸入,NOUN,NOUN,postpositional,postpositional,Preverbal,Japanese
シリンダー に よっ て は 噴射 から 吸入 まで やや タイム ラグ が 発生 する 為 、 当然 ながら 燃焼 制御 も 大雑把 な もの と なる 。,シリンダー に よっ て は 噴射 から 吸入 まで やや タイム ラグ が 発生 する 為 、 当然 ながら 燃焼 制御 も,シリンダー に よっ て は 噴射 から 吸入 まで やや タイム ラグ が 発生 する 為 、 当然 ながら 大雑把 な もの と,シリンダー に よっ て は 噴射 から 吸入 まで やや タイム ラグ が 発生 する 為 、 当然 ながら 制御 も,シリンダー に よっ て は 噴射 から 吸入 まで やや タイム ラグ が 発生 する 為 、 当然 ながら もの と,制御 も,もの と,なる,燃焼 制御 も,大雑把 な もの と,3,4,も,と,制御,もの,NOUN,NOUN,postpositional,postpositional,Preverbal,Japanese
R - 12 は 1932 年 9 月 27 日 に ニューロンドン を 出航 し ペンシルベニア 州 フィラデルフィア に 向かい 、 1932 年 12 月 7 日 に 退役 、 他 の R 級 潜水 艦 と 共 に 予備 役 艦隊 で 保管 さ れ た 。,R - 12 は 1932 年 9 月 27 日 に ニューロンドン を 出航 し ペンシルベニア 州 フィラデルフィア に 向かい 、 1932 年 12 月 7 日 に 退役 、 他 の R 級 潜水 艦 と 共 に,R - 12 は 1932 年 9 月 27 日 に ニューロンドン を 出航 し ペンシルベニア 州 フィラデルフィア に 向かい 、 1932 年 12 月 7 日 に 退役 、 予備 役 艦隊 で,R - 12 は 1932 年 9 月 27 日 に ニューロンドン を 出航 し ペンシルベニア 州 フィラデルフィア に 向かい 、 1932 年 12 月 7 日 に 退役 、 共 に,R - 12 は 1932 年 9 月 27 日 に ニューロンドン を 出航 し ペンシルベニア 州 フィラデルフィア に 向かい 、 1932 年 12 月 7 日 に 退役 、 艦隊 で,共 に,艦隊 で,保管,他 の R 級 潜水 艦 と 共 に,予備 役 艦隊 で,9,4,に,で,共,艦隊,NOUN,NOUN,postpositional,postpositional,Preverbal,Japanese
なお 、 太陽 の 50 % 以下 の 質量 の 星 で は その 一生 は 1000 億 年 以上 に 及ぶ 。,なお 、 太陽 の 50 % 以下 の 質量 の 星 で は,なお 、 1000 億 年 以上 に,なお 、 星 で は,なお 、 以上 に,星 で は,以上 に,及ぶ,太陽 の 50 % 以下 の 質量 の 星 で は,1000 億 年 以上 に,11,5,で は,に,星,以上,NOUN,NOUN,postpositional,postpositional,Preverbal,Japanese
9 日 夜 から 風邪 の 症状 を 訴え 、 10 日 から グラウンド に は 姿 を 見せ て おら ず 。,9 日 夜 から 風邪 の 症状 を 訴え 、 10 日 から,9 日 夜 から 風邪 の 症状 を 訴え 、 グラウンド に は,9 日 夜 から 風邪 の 症状 を 訴え 、 日 から,9 日 夜 から 風邪 の 症状 を 訴え 、 グラウンド に は,日 から,グラウンド に は,見せる,10 日 から,グラウンド に は,3,3,から,に は,日,グラウンド,NOUN,NOUN,postpositional,postpositional,Preverbal,Japanese
店 の 雰囲気 も 高級 感 に 溢れ て おり 、 先方 も 料理 に は 大 満足 だっ た らしく 接待 も いい 感じ で 進ん だ と 思い ます ね 。,店 の 雰囲気 も,高級 感 に,雰囲気 も,感 に,雰囲気 も,感 に,溢れる,店 の 雰囲気 も,高級 感 に,4,3,も,に,雰囲気,感,NOUN,NOUN,postpositional,postpositional,Preverbal,Japanese
店 の 雰囲気 も 高級 感 に 溢れ て おり 、 先方 も 料理 に は 大 満足 だっ た らしく 接待 も いい 感じ で 進ん だ と 思い ます ね 。,店 の 雰囲気 も 高級 感 に 溢れ て おり 、 先方 も 料理 に は 大 満足 だっ た らしく 接待 も,店 の 雰囲気 も 高級 感 に 溢れ て おり 、 先方 も 料理 に は 大 満足 だっ た らしく いい 感じ で,店 の 雰囲気 も 高級 感 に 溢れ て おり 、 先方 も 料理 に は 大 満足 だっ た らしく 接待 も,店 の 雰囲気 も 高級 感 に 溢れ て おり 、 先方 も 料理 に は 大 満足 だっ た らしく 感じ で,接待 も,感じ で,進む,接待 も,いい 感じ で,2,3,も,で,接待,感じ,NOUN,NOUN,postpositional,postpositional,Preverbal,Japanese
毎回 70 人 前後 を 集める コンサート も 本部 の 新しい 魅力 の 一 つ に 育ち つつ ある 。,毎回 70 人 前後 を 集める コンサート も,本部 の 新しい 魅力 の 一 つ に,コンサート も,つ に,コンサート も,つ に,育つ,毎回 70 人 前後 を 集める コンサート も,本部 の 新しい 魅力 の 一 つ に,8,8,も,に,コンサート,つ,NOUN,NOUN,postpositional,postpositional,Preverbal,Japanese
敗者 復活 トーナメント で 韓国 に 大勝 し 、 最後 の 1 枠 を 賭け た カナダ 戦 に 挑ん だ が 、 第 1 Q で 10 点 差 付け られ 、 第 2 Q 以降 巻き返す も 及ば ず 、 2 大会 連続 で オリンピック 出場 を 逃し た 。,敗者 復活 トーナメント で,韓国 に,トーナメント で,韓国 に,トーナメント で,韓国 に,大勝,敗者 復活 トーナメント で,韓国 に,4,2,で,に,トーナメント,韓国,NOUN,PROPN,postpositional,postpositional,Preverbal,Japanese
福岡 ローカル で 1970 年 代 から 放送 さ れ て いる CM も 大変 有名 で ある 。,福岡 ローカル で,1970 年 代 から,ローカル で,代 から,ローカル で,代 から,放送,福岡 ローカル で,1970 年 代 から,3,4,で,から,ローカル,代,NOUN,NOUN,postpositional,postpositional,Preverbal,Japanese
疲労 回復 で は 他 に 譲る か ?,疲労 回復 で は,他 に,回復 で は,他 に,回復 で は,他 に,譲る,疲労 回復 で は,他 に,4,2,で は,に,回復,他,NOUN,NOUN,postpositional,postpositional,Preverbal,Japanese
その 一方 で 、 財政 赤字 問題 に 関し て は 欧州 諸国 が 協力 し て 支援 する と の 報道 が 相 次い で いる 状況 と なっ て いる こと から 、 これ ら が 幾分 から 下支え 要因 に なる か に も 注目 。,その 一方 で 、 財政 赤字 問題 に 関し て は,その 一方 で 、 欧州 諸国 が 協力 し て 支援 する と の 報道 が 相 次い で いる 状況 と,その 一方 で 、 問題 に は,その 一方 で 、 状況 と,問題 に は,状況 と,なる,財政 赤字 問題 に 関し て は,欧州 諸国 が 協力 し て 支援 する と の 報道 が 相 次い で いる 状況 と,7,18,に は,と,問題,状況,NOUN,NOUN,postpositional,postpositional,Preverbal,Japanese
"今回 の リーフレット で は カルト 対策 と し て , しっかり “ 偽装 サークル ” の 勧誘 へ の 啓発 が 含ま れ て い ます 。",今回 の リーフレット で は,"カルト 対策 と し て ,",リーフレット で は,対策 と,リーフレット で は,対策 と,含む,今回 の リーフレット で は,"カルト 対策 と し て ,",5,6,で は,と,リーフレット,対策,NOUN,NOUN,postpositional,postpositional,Preverbal,Japanese
この 時点 で は 商品 化 に つい て 触れ られ て い なかっ た が 、 2006 年 1 月 に 発売 計画 が 発表 さ れ た 。,この 時点 で は,商品 化 に つい て,時点 で は,化 に,時点 で は,化 に,触れる,この 時点 で は,商品 化 に つい て,4,5,で は,に,時点,化,NOUN,NOUN,postpositional,postpositional,Preverbal,Japanese
何事 も 占い で 決める 極度 の 占い好き 。,何事 も,占い で,何事 も,占い で,何事 も,占い で,決める,何事 も,占い で,2,2,も,で,何事,占い,NOUN,NOUN,postpositional,postpositional,Preverbal,Japanese
MH から は ハートフル コミューン に よっ て 変身 する よう に なる 。,MH から は,ハートフル コミューン に よっ て,MH から は,コミューン に,MH から は,コミューン に,変身,MH から は,ハートフル コミューン に よっ て,3,5,から は,に,MH,コミューン,NOUN,NOUN,postpositional,postpositional,Preverbal,Japanese
生 合成 に も 使わ れ て いる グルタミン 酸 デヒドロゲナーゼ や 、 アミノ トランスフェラーゼ 、 グルタミン 酸 合成 酵素 など の 酵素 と 補 酵素 の 作用 に よっ て 、 それぞれ 異なる 原料 から 製造 する 方法 も ある 。,生 合成 に も 使わ れ て いる グルタミン 酸 デヒドロゲナーゼ や 、 アミノ トランスフェラーゼ 、 グルタミン 酸 合成 酵素 など の 酵素 と 補 酵素 の 作用 に よっ て 、,それぞれ 異なる 原料 から,作用 に,原料 から,作用 に,原料 から,製造,生 合成 に も 使わ れ て いる グルタミン 酸 デヒドロゲナーゼ や 、 アミノ トランスフェラーゼ 、 グルタミン 酸 合成 酵素 など の 酵素 と 補 酵素 の 作用 に よっ て 、,それぞれ 異なる 原料 から,32,4,に,から,作用,原料,NOUN,NOUN,postpositional,postpositional,Preverbal,Japanese
船 が 静止 し て いる 状態 で は 、 船体 に は 重力 と 浮力 の 二 つ の 力 が 加わる 。,船 が 静止 し て いる 状態 で は 、,船体 に は,状態 で は,船体 に は,状態 で は,船体 に は,加わる,船 が 静止 し て いる 状態 で は 、,船体 に は,10,3,で は,に は,状態,船体,NOUN,NOUN,postpositional,postpositional,Preverbal,Japanese
「 カラス の パラドックス 」 と も 呼ば れる が 、 パラドックス と し て 扱う べき か どう か に は 異論 も ある 。,「 カラス の パラドックス 」 と も 呼ば れる が 、 パラドックス と し て 扱う べき か どう か に は,「 カラス の パラドックス 」 と も 呼ば れる が 、 異論 も,「 カラス の パラドックス 」 と も 呼ば れる が 、 どう か に は,「 カラス の パラドックス 」 と も 呼ば れる が 、 異論 も,どう か に は,異論 も,ある,パラドックス と し て 扱う べき か どう か に は,異論 も,11,2,か に は,も,どう,異論,ADV,NOUN,postpositional,postpositional,Preverbal,Japanese
1948 - 49 シーズン に は レアル ・ マドリード に 移籍 し 、 1950 年 11 月 5 日 に は クラブ の 通算 1000 点 目 を 決め た 。,1948 - 49 シーズン に は,レアル ・ マドリード に,シーズン に は,マドリード に,シーズン に は,マドリード に,移籍,1948 - 49 シーズン に は,レアル ・ マドリード に,6,4,に は,に,シーズン,マドリード,NOUN,PROPN,postpositional,postpositional,Preverbal,Japanese
起 終点 は いずれ も 三重 県 に ある が 、 3 . 5 km だけ 奈良 県 を 通過 する ため 三重 県内 完結 路線 で は ない 。,起 終点 は いずれ も,起 終点 は 三重 県 に,起 終点 は いずれ も,起 終点 は 県 に,いずれ も,県 に,ある,いずれ も,三重 県 に,2,3,も,に,いずれ,県,PRON,NOUN,postpositional,postpositional,Preverbal,Japanese
"しかし , 昨年 10 月 に 幸福 の 科学 学園 が 土地 を 購入 し た 際 に 地元 へ の 情報 伝達 が 不 十分 だっ た こと から , 住民 から は いまだ に 土地 購入 の 経緯 を 問いただす 質問 が 出 た ほか , 学園 建設 計画 の 図面 が たびたび 変更 に なっ て いる こと を 不審 がる 質問 , “ 住民 の 意見 は 計画 は 変え ない と いう 態度 で 話 に なら ない ” と する 意見 など が 噴出 。","しかし , 昨年 10 月 に 幸福 の 科学 学園 が 土地 を 購入 し た 際 に 地元 へ の 情報 伝達 が 不 十分 だっ た こと から ,","しかし , 住民 から は","しかし , こと から","しかし , 住民 から は",こと から,住民 から は,出る,"昨年 10 月 に 幸福 の 科学 学園 が 土地 を 購入 し た 際 に 地元 へ の 情報 伝達 が 不 十分 だっ た こと から ,",住民 から は,29,3,から,から は,こと,住民,NOUN,NOUN,postpositional,postpositional,Preverbal,Japanese
