Sentence,Context_PP1,Context_PP2,Context_PP1_simple,Context_PP2_simple,PP1_simple,PP2_simple,Verb,PP1,PP2,PP1_len,PP2_len,Adp1,Adp2,NP1,NP2,PP1_Pronom,PP2_Pronom,PP1_Type,PP2_Type,Position,Language
2010 - 11 シーズン は 、 UEFA スーパー カップ で チャンピオンズ リーグ 王者 の インテル を 2 - 0 で 下し た が 、 UEFA ヨーロッパ リーグ で は グループ リーグ で 敗退 し 、 1 月 から 2 月 前半 に かけ て は 8 敗 を 喫する など 、 お 得意 の 乱調 は 変わら ず 。,2010 - 11 シーズン は 、 UEFA スーパー カップ で チャンピオンズ リーグ 王者 の インテル を 2 - 0 で 下し た が 、 UEFA ヨーロッパ リーグ で は,2010 - 11 シーズン は 、 UEFA スーパー カップ で チャンピオンズ リーグ 王者 の インテル を 2 - 0 で 下し た が 、 グループ リーグ で,2010 - 11 シーズン は 、 UEFA スーパー カップ で チャンピオンズ リーグ 王者 の インテル を 2 - 0 で 下し た が 、 リーグ で は,2010 - 11 シーズン は 、 UEFA スーパー カップ で チャンピオンズ リーグ 王者 の インテル を 2 - 0 で 下し た が 、 リーグ で,リーグ で は,リーグ で,敗退,UEFA ヨーロッパ リーグ で は,グループ リーグ で,5,3,で は,で,リーグ,リーグ,NOUN,NOUN,postpositional,postpositional,Preverbal,Japanese
1 回 2 死 一、二塁 で 中前 へ はじき返し た 。,1 回 2 死 一、二塁 で,中前 へ,一、二塁 で,中前 へ,一、二塁 で,中前 へ,はじき返す,1 回 2 死 一、二塁 で,中前 へ,6,2,で,へ,一、二塁,中前,NOUN,NOUN,postpositional,postpositional,Preverbal,Japanese
フィラメント から 発し た 電子 は 、 グリッド に 到達 する 前 に 、 グリッド の 周り を 何 周 か 回る 。,フィラメント から 発し た 電子 は 、 グリッド に 到達 する 前 に 、,フィラメント から 発し た 電子 は 、 何 周 か,フィラメント から 発し た 電子 は 、 前 に,フィラメント から 発し た 電子 は 、 周 か,前 に,周 か,回る,グリッド に 到達 する 前 に 、,何 周 か,7,3,に,か,前,周,NOUN,NOUN,postpositional,postpositional,Preverbal,Japanese
武珍 州 城 で の 攻防 戦 で は 、 城 の 裏手 より 秘密 裏 に 軍 を 率い て 、 城内 に 進入 し キョン フォン 軍 の 勝利 に 貢献 し た 。,武珍 州 城 で の 攻防 戦 で は 、 城 の 裏手 より,武珍 州 城 で の 攻防 戦 で は 、 秘密 裏 に,武珍 州 城 で の 攻防 戦 で は 、 裏手 より,武珍 州 城 で の 攻防 戦 で は 、 裏 に,裏手 より,裏 に,率いる,城 の 裏手 より,秘密 裏 に,4,3,より,に,裏手,裏,NOUN,NOUN,postpositional,postpositional,Preverbal,Japanese
武珍 州 城 で の 攻防 戦 で は 、 城 の 裏手 より 秘密 裏 に 軍 を 率い て 、 城内 に 進入 し キョン フォン 軍 の 勝利 に 貢献 し た 。,武珍 州 城 で の 攻防 戦 で は 、,キョン フォン 軍 の 勝利 に,戦 で は,勝利 に,戦 で は,勝利 に,貢献,武珍 州 城 で の 攻防 戦 で は 、,キョン フォン 軍 の 勝利 に,10,6,で は,に,戦,勝利,NOUN,NOUN,postpositional,postpositional,Preverbal,Japanese
これ に 伴い 、 2007 年 時点 で 背 番号 0 の 投手 は 佐藤 宏志 、 金剛 弘樹 に 次い で 3 人 目 と なっ た 。,これ に 伴い 、 2007 年 時点 で,これ に 伴い 、 3 人 目 と,これ に 伴い 、 時点 で,これ に 伴い 、 目 と,時点 で,目 と,なる,2007 年 時点 で,3 人 目 と,4,4,で,と,時点,目,NOUN,NOUN,postpositional,postpositional,Preverbal,Japanese
とにかく 店員 の 態度 が 悪く 敬語 どころ か 丁寧 語 すら 使え ず 最低 限 の 挨拶 すら 行え ませ ん 。,とにかく 店員 の 態度 が 悪く 敬語 どころ か,とにかく 店員 の 態度 が 悪く 丁寧 語 すら,とにかく 店員 の 態度 が 悪く 敬語 どころ か,とにかく 店員 の 態度 が 悪く 語 すら,敬語 どころ か,語 すら,使える,敬語 どころ か,丁寧 語 すら,3,3,どころ か,すら,敬語,語,NOUN,NOUN,postpositional,postpositional,Preverbal,Japanese
この 種 の 借り入れ を 使っ た 手口 に つい て は 1987 年 から 2010 年 まで の 間 の 集計 で 約 300 億 円 の 被害 報告 が 挙がっ て いる 。,この 種 の 借り入れ を 使っ た 手口 に つい て は,1987 年 から 2010 年 まで の 間 の 集計 で,手口 に は,集計 で,手口 に は,集計 で,挙がる,この 種 の 借り入れ を 使っ た 手口 に つい て は,1987 年 から 2010 年 まで の 間 の 集計 で,12,11,に は,で,手口,集計,NOUN,NOUN,postpositional,postpositional,Preverbal,Japanese
恵比寿 の 地下 鉄 から 近い し 、 アロマ マッサージ も 気 に なる の で また 行く 予定 です !,恵比寿 の 地下 鉄 から 近い し 、 アロマ マッサージ も,恵比寿 の 地下 鉄 から 近い し 、 気 に,恵比寿 の 地下 鉄 から 近い し 、 マッサージ も,恵比寿 の 地下 鉄 から 近い し 、 気 に,マッサージ も,気 に,なる,アロマ マッサージ も,気 に,3,2,も,に,マッサージ,気,NOUN,NOUN,postpositional,postpositional,Preverbal,Japanese
パーテーション で 隣 の 診察 場所 と 区切ら れ て い ます が 、 隣 で 診察 中 の 患者 さん の 声 が ちょっと 聞こえ ます 。,パーテーション で,隣 の 診察 場所 と,パーテーション で,場所 と,パーテーション で,場所 と,区切る,パーテーション で,隣 の 診察 場所 と,2,5,で,と,パーテーション,場所,NOUN,NOUN,postpositional,postpositional,Preverbal,Japanese
戦後 直後 の 1946 年 に 毎日 新聞 が 実施 し た 世論 調査 で は 、 象徴 天皇 制 へ の 支持 が 85 % 、 反対 が 13 % 、 不明 2 % と なっ て おり 戦後 直後 で も 国民 の 多く が 皇室 の 存続 を 支持 し て いる 。,戦後 直後 の 1946 年 に 毎日 新聞 が 実施 し た 世論 調査 で は 、,不明 2 % と,調査 で は,% と,調査 で は,% と,なる,戦後 直後 の 1946 年 に 毎日 新聞 が 実施 し た 世論 調査 で は 、,不明 2 % と,17,4,で は,と,調査,%,NOUN,NOUN,postpositional,postpositional,Preverbal,Japanese
総務 省 は 17 日 、 NTT ドコモ と KDDI の 2 陣営 が 免許 を 申請 し て いる 次 世代 サービス 「 携帯 端末 向け マルチメディア 放送 」 に つい て 、 事業 者 1 社 を 選定 し て 答申 する よう 電波 監理 審議 会 に 諮問 し た 。,総務 省 は 17 日 、 NTT ドコモ と KDDI の 2 陣営 が 免許 を 申請 し て いる 次 世代 サービス 「 携帯 端末 向け マルチメディア 放送 」 に つい て 、,総務 省 は 17 日 、 電波 監理 審議 会 に,総務 省 は 17 日 、 放送 に,総務 省 は 17 日 、 会 に,放送 に,会 に,諮問,NTT ドコモ と KDDI の 2 陣営 が 免許 を 申請 し て いる 次 世代 サービス 「 携帯 端末 向け マルチメディア 放送 」 に つい て 、,電波 監理 審議 会 に,28,5,に,に,放送,会,NOUN,NOUN,postpositional,postpositional,Preverbal,Japanese
なお 、 欠落 者 が 捕らえ られ 自ら の 意思 で 帰還 し た 場合 に は 、 原則 的 に は 「 帰住 届 」 を 提出 の 後 に 欠落 中 に 罪 を 犯し て い ない か を 確認 が 行わ れ 、 人別 帳 に 氏名 が 復帰 さ れ た 後 に 家族 に 引き渡さ れ た 。,なお 、 欠落 者 が 捕らえ られ 自ら の 意思 で 帰還 し た 場合 に は 、,「 帰住 届 」 を 提出 の 後 に,場合 に は,後 に,場合 に は,後 に,行う,なお 、 欠落 者 が 捕らえ られ 自ら の 意思 で 帰還 し た 場合 に は 、,「 帰住 届 」 を 提出 の 後 に,18,9,に は,に,場合,後,NOUN,NOUN,postpositional,postpositional,Preverbal,Japanese
なお 、 欠落 者 が 捕らえ られ 自ら の 意思 で 帰還 し た 場合 に は 、 原則 的 に は 「 帰住 届 」 を 提出 の 後 に 欠落 中 に 罪 を 犯し て い ない か を 確認 が 行わ れ 、 人別 帳 に 氏名 が 復帰 さ れ た 後 に 家族 に 引き渡さ れ た 。,なお 、 欠落 者 が 捕らえ られ 自ら の 意思 で 帰還 し た 場合 に は 、 原則 的 に は 「 帰住 届 」 を 提出 の 後 に 欠落 中 に 罪 を 犯し て い ない か を 確認 が 行わ れ 、 人別 帳 に 氏名 が 復帰 さ れ た 後 に,家族 に,後 に,家族 に,後 に,家族 に,引き渡す,なお 、 欠落 者 が 捕らえ られ 自ら の 意思 で 帰還 し た 場合 に は 、 原則 的 に は 「 帰住 届 」 を 提出 の 後 に 欠落 中 に 罪 を 犯し て い ない か を 確認 が 行わ れ 、 人別 帳 に 氏名 が 復帰 さ れ た 後 に,家族 に,58,2,に,に,後,家族,ADV,NOUN,postpositional,postpositional,Preverbal,Japanese
これ から 診療 に なる よう です 。,これ から,診療 に,これ から,診療 に,これ から,診療 に,なる,これ から,診療 に,2,2,から,に,これ,診療,PRON,NOUN,postpositional,postpositional,Preverbal,Japanese
店舗 展開 と し て は 長らく 関東 圏 に 限っ て き た が 、 近年 で は 関東 圏 を 脱し 全国 展開 を 視野 に 入れ て いる 。,店舗 展開 と し て は,関東 圏 に,展開 と は,圏 に,展開 と は,圏 に,限る,店舗 展開 と し て は,関東 圏 に,6,3,と は,に,展開,圏,NOUN,NOUN,postpositional,postpositional,Preverbal,Japanese
店舗 展開 と し て は 長らく 関東 圏 に 限っ て き た が 、 近年 で は 関東 圏 を 脱し 全国 展開 を 視野 に 入れ て いる 。,店舗 展開 と し て は 長らく 関東 圏 に 限っ て き た が 、 近年 で は,店舗 展開 と し て は 長らく 関東 圏 に 限っ て き た が 、 視野 に,店舗 展開 と し て は 長らく 関東 圏 に 限っ て き た が 、 近年 で は,店舗 展開 と し て は 長らく 関東 圏 に 限っ て き た が 、 視野 に,近年 で は,視野 に,入れる,近年 で は,視野 に,3,2,で は,に,近年,視野,NOUN,NOUN,postpositional,postpositional,Preverbal,Japanese
漢字 で は 骸炭 と 書く 。,漢字 で は,骸炭 と,漢字 で は,骸炭 と,漢字 で は,骸炭 と,書く,漢字 で は,骸炭 と,3,2,で は,と,漢字,骸炭,NOUN,NOUN,postpositional,postpositional,Preverbal,Japanese
駅舎 は なく 、 ホーム 桑名 寄り の 入口 から ホーム に 入る 。,駅舎 は なく 、 ホーム 桑名 寄り の 入口 から,駅舎 は なく 、 ホーム に,駅舎 は なく 、 入口 から,駅舎 は なく 、 ホーム に,入口 から,ホーム に,入る,ホーム 桑名 寄り の 入口 から,ホーム に,6,2,から,に,入口,ホーム,NOUN,NOUN,postpositional,postpositional,Preverbal,Japanese
はしご で 棚 に 積ま れ た カートン を 取っ て くれる みたい 葉巻 も 大きな ケース に 入れ られ て い て 種類 が いっぱい !,はしご で 棚 に 積ま れ た カートン を 取っ て くれる みたい 葉巻 も,はしご で 棚 に 積ま れ た カートン を 取っ て くれる みたい 大きな ケース に,はしご で 棚 に 積ま れ た カートン を 取っ て くれる みたい 葉巻 も,はしご で 棚 に 積ま れ た カートン を 取っ て くれる みたい ケース に,葉巻 も,ケース に,入れる,葉巻 も,大きな ケース に,2,3,も,に,葉巻,ケース,NOUN,NOUN,postpositional,postpositional,Preverbal,Japanese
こちら で は “ 家系 譜 アドバイザー ” と なっ て いる 。,こちら で は,“ 家系 譜 アドバイザー ” と,こちら で は,アドバイザー と,こちら で は,アドバイザー と,なる,こちら で は,“ 家系 譜 アドバイザー ” と,3,6,で は,と,こちら,アドバイザー,PRON,NOUN,postpositional,postpositional,Preverbal,Japanese
4 月 15 日 、 気象 庁 は 、 宮崎 市 で 最高 気温 が 9 . 5 度 まで しか 上がら ず 、 100 年 ぶり に 4 月 の 観測 史 上 1 位 タイ の 低い 記録 と なっ た こと を 発表 し た 。,4 月 15 日 、 気象 庁 は 、 宮崎 市 で,4 月 15 日 、 気象 庁 は 、 9 . 5 度 まで しか,4 月 15 日 、 気象 庁 は 、 市 で,4 月 15 日 、 気象 庁 は 、 度 まで しか,市 で,度 まで しか,上がる,宮崎 市 で,9 . 5 度 まで しか,3,6,で,まで しか,市,度,NOUN,NOUN,postpositional,postpositional,Preverbal,Japanese
4 月 15 日 、 気象 庁 は 、 宮崎 市 で 最高 気温 が 9 . 5 度 まで しか 上がら ず 、 100 年 ぶり に 4 月 の 観測 史 上 1 位 タイ の 低い 記録 と なっ た こと を 発表 し た 。,4 月 15 日 、 気象 庁 は 、 宮崎 市 で 最高 気温 が 9 . 5 度 まで しか 上がら ず 、 100 年 ぶり に,4 月 15 日 、 気象 庁 は 、 宮崎 市 で 最高 気温 が 9 . 5 度 まで しか 上がら ず 、 1 位 タイ の 低い 記録 と,4 月 15 日 、 気象 庁 は 、 宮崎 市 で 最高 気温 が 9 . 5 度 まで しか 上がら ず 、 ぶり に,4 月 15 日 、 気象 庁 は 、 宮崎 市 で 最高 気温 が 9 . 5 度 まで しか 上がら ず 、 記録 と,ぶり に,記録 と,なる,100 年 ぶり に,1 位 タイ の 低い 記録 と,4,7,に,と,ぶり,記録,NOUN,NOUN,postpositional,postpositional,Preverbal,Japanese
コース 別 順位 廃止 の 影響 か 、 デモ で 流れる 曲 は 太鼓 チーム 側 が 設定 し た もの のみ と なり 、 コース も 「 おに 」 以外 から 「 ふつう 」 のみ と なっ た 。,コース 別 順位 廃止 の 影響 か 、,太鼓 チーム 側 が 設定 し た もの のみ と,影響 か,もの のみ と,影響 か,もの のみ と,なる,コース 別 順位 廃止 の 影響 か 、,太鼓 チーム 側 が 設定 し た もの のみ と,8,10,か,のみ と,影響,もの,NOUN,NOUN,postpositional,postpositional,Preverbal,Japanese
コース 別 順位 廃止 の 影響 か 、 デモ で 流れる 曲 は 太鼓 チーム 側 が 設定 し た もの のみ と なり 、 コース も 「 おに 」 以外 から 「 ふつう 」 のみ と なっ た 。,コース 別 順位 廃止 の 影響 か 、 デモ で 流れる 曲 は 太鼓 チーム 側 が 設定 し た もの のみ と なり 、 コース も,コース 別 順位 廃止 の 影響 か 、 デモ で 流れる 曲 は 太鼓 チーム 側 が 設定 し た もの のみ と なり 、 「 おに 」 以外 から,コース 別 順位 廃止 の 影響 か 、 デモ で 流れる 曲 は 太鼓 チーム 側 が 設定 し た もの のみ と なり 、 コース も,コース 別 順位 廃止 の 影響 か 、 デモ で 流れる 曲 は 太鼓 チーム 側 が 設定 し た もの のみ と なり 、 以外 から,コース も,以外 から,なる,コース も,「 おに 」 以外 から,2,5,も,から,コース,以外,NOUN,NOUN,postpositional,postpositional,Preverbal,Japanese
ダム 湖 は 「 L 」 字 型 に 山間 に 位置 し て おり 、 付近 は 周回 する 市道 に 多く の 公園 が 整備 さ れ て おり 、 家族 連れ など が 憩える 湖畔 で ある 。,ダム 湖 は 「 L 」 字 型 に,ダム 湖 は 山間 に,ダム 湖 は 型 に,ダム 湖 は 山間 に,型 に,山間 に,位置,「 L 」 字 型 に,山間 に,6,2,に,に,型,山間,NOUN,NOUN,postpositional,postpositional,Preverbal,Japanese
"母親 が 助産 師 に 対し て 損害 賠償 を 求める 訴訟 を 起こし , これ が 報じ られ た こと が きっかけ で , 日本 助産 師 会 が ホメオパシー に つい て 調査 を 行っ て い まし た 。","母親 が 助産 師 に 対し て 損害 賠償 を 求める 訴訟 を 起こし , これ が 報じ られ た こと が きっかけ で ,","母親 が 助産 師 に 対し て 損害 賠償 を 求める 訴訟 を 起こし , ホメオパシー に つい て","母親 が 助産 師 に 対し て 損害 賠償 を 求める 訴訟 を 起こし , きっかけ で","母親 が 助産 師 に 対し て 損害 賠償 を 求める 訴訟 を 起こし , ホメオパシー に",きっかけ で,ホメオパシー に,行う,"これ が 報じ られ た こと が きっかけ で ,",ホメオパシー に つい て,10,4,で,に,きっかけ,ホメオパシー,NOUN,NOUN,postpositional,postpositional,Preverbal,Japanese
"大江 議員 は 本紙 に 対し て , 今後 に つい て こう 語り まし た 。","大江 議員 は 本紙 に 対し て ,",大江 議員 は 今後 に つい て,大江 議員 は 本紙 に,大江 議員 は 今後 に,本紙 に,今後 に,語る,"本紙 に 対し て ,",今後 に つい て,5,4,に,に,本紙,今後,NOUN,NOUN,postpositional,postpositional,Preverbal,Japanese
XAMPP と は 別 に 、 Mac OS X 専用 で ほぼ 同 趣旨 の 「 MAMP 」 が mamp . info から 提供 さ れ て いる 。,XAMPP と は 別 に 、 Mac OS X 専用 で,XAMPP と は 別 に 、 mamp . info から,XAMPP と は 別 に 、 専用 で,XAMPP と は 別 に 、 info から,専用 で,info から,提供,Mac OS X 専用 で,mamp . info から,5,4,で,から,専用,info,NOUN,NOUN,postpositional,postpositional,Preverbal,Japanese
音楽 を 中心 に 色々 と 楽しい イベント スペース と し て ご 利用 出来る の で 、 50 人 規模 の イベント 開催 を 考え て いる 人 に は オ ススメ の 場所 です 。,音楽 を 中心 に,楽しい イベント スペース と し て,中心 に,スペース と,中心 に,スペース と,利用,音楽 を 中心 に,楽しい イベント スペース と し て,4,6,に,と,中心,スペース,NOUN,NOUN,postpositional,postpositional,Preverbal,Japanese
"フォロワー に 誰 か いる の か な , と 思っ て み たら , いる わ いる わ 。",フォロワー に,誰 か,フォロワー に,誰 か,フォロワー に,誰 か,いる,フォロワー に,誰 か,2,2,に,か,フォロワー,誰,NOUN,PRON,postpositional,postpositional,Preverbal,Japanese
そして 、 党 規約 の 改正 が 行わ れ 、 総 書記 の 選出 が 党 中央 委員 会 総会 で の 選挙 から 党 大会 に おけ る 「 推戴 」 に 変更 さ れる と とも に 、 党 代表 者 会 で の 党 最高 指導 機関 選挙 で も 実施 さ れる こと が 定め られ た 。,そして 、 党 規約 の 改正 が 行わ れ 、 総 書記 の 選出 が 党 中央 委員 会 総会 で の 選挙 から,そして 、 党 規約 の 改正 が 行わ れ 、 総 書記 の 選出 が 党 大会 に おけ る 「 推戴 」 に,そして 、 党 規約 の 改正 が 行わ れ 、 総 書記 の 選出 が 選挙 から,そして 、 党 規約 の 改正 が 行わ れ 、 総 書記 の 選出 が 推戴 に,選挙 から,推戴 に,変更,党 中央 委員 会 総会 で の 選挙 から,党 大会 に おけ る 「 推戴 」 に,9,9,から,に,選挙,推戴,NOUN,NOUN,postpositional,postpositional,Preverbal,Japanese
パソコン 1 台 で 作品 を 作り 、 自宅 から ネット へ と 発信 する 。,パソコン 1 台 で 作品 を 作り 、 自宅 から,パソコン 1 台 で 作品 を 作り 、 ネット へ と,パソコン 1 台 で 作品 を 作り 、 自宅 から,パソコン 1 台 で 作品 を 作り 、 ネット へ と,自宅 から,ネット へ と,発信,自宅 から,ネット へ と,2,3,から,へ と,自宅,ネット,NOUN,NOUN,postpositional,postpositional,Preverbal,Japanese
中国 で は 『 九 章 算術 』 と 呼ば れる 数学 書 が 漢代 に は 登場 し 、 その なか で 面積 の 計算 法 や 比例 ・ 反 比例 ・ ピタゴラス の 定理 など を 紹介 し て いる 。,中国 で は,漢代 に は,中国 で は,漢代 に は,中国 で は,漢代 に は,登場,中国 で は,漢代 に は,3,3,で は,に は,中国,漢代,PROPN,NOUN,postpositional,postpositional,Preverbal,Japanese
八女 市 の 8 小 中 学校 で は 昨年 1 月 から 順次 、 この 食器 を 使っ て いる 。,八女 市 の 8 小 中 学校 で は,昨年 1 月 から,学校 で は,月 から,学校 で は,月 から,使う,八女 市 の 8 小 中 学校 で は,昨年 1 月 から,9,4,で は,から,学校,月,NOUN,NOUN,postpositional,postpositional,Preverbal,Japanese
店 に は スロープ も あっ て 車 いす の 方 も 来店 できる の で 、 障害 者 に とっ て 有り難い もの です 。,店 に は,スロープ も,店 に は,スロープ も,店 に は,スロープ も,ある,店 に は,スロープ も,3,2,に は,も,店,スロープ,NOUN,NOUN,postpositional,postpositional,Preverbal,Japanese
完璧 主義 で 絶対 に 指示 通り で なけれ ば 許さ ない キューブリック も 、 本作 で は ジャズ の リフ 奏法 ・ アドリブ 奏法 を 映画 の 演技 と し て セラーズ に 許し 、 それ が 成功 の 一因 だっ た と 映画 評論 家 アレクサンダー ・ ウォーカー は 後 に 語っ て いる 。,完璧 主義 で,絶対 に,主義 で,絶対 に,主義 で,絶対 に,許す,完璧 主義 で,絶対 に,3,2,で,に,主義,絶対,NOUN,NOUN,postpositional,postpositional,Preverbal,Japanese
中央 部 の 4 対 の 動輪 に 対し て 、 各 1 軸 の 先 台車 、 従 台車 に より 重量 バランス が 取り やすく 、 乗り心地 が 良い こと から 、 乗務 員 に 好評 で あっ た と いう 。,中央 部 の 4 対 の 動輪 に 対し て 、,各 1 軸 の 先 台車 、 従 台車 に より,動輪 に,台車 に,動輪 に,台車 に,取る,中央 部 の 4 対 の 動輪 に 対し て 、,各 1 軸 の 先 台車 、 従 台車 に より,11,11,に,に,動輪,台車,NOUN,NOUN,postpositional,postpositional,Preverbal,Japanese
上層 部 の OK が 出れ ば その 中 で 何 組 か が ライブ へ 出 られる 。,上層 部 の OK が 出れ ば その 中 で,上層 部 の OK が 出れ ば ライブ へ,上層 部 の OK が 出れ ば 中 で,上層 部 の OK が 出れ ば ライブ へ,中 で,ライブ へ,出る,その 中 で,ライブ へ,3,2,で,へ,中,ライブ,NOUN,NOUN,postpositional,postpositional,Preverbal,Japanese
当初 は 現代 音楽 専門 の インディーズ 系 レコード 会社 と し て 立ち上げ られ 、 すぐ に クラシック 全般 および ジャズ に まで 領域 が 広げ られ た 。,当初 は 現代 音楽 専門 の インディーズ 系 レコード 会社 と し て 立ち上げ られ 、 すぐ に,当初 は 現代 音楽 専門 の インディーズ 系 レコード 会社 と し て 立ち上げ られ 、 クラシック 全般 および ジャズ に まで,当初 は 現代 音楽 専門 の インディーズ 系 レコード 会社 と し て 立ち上げ られ 、 すぐ に,当初 は 現代 音楽 専門 の インディーズ 系 レコード 会社 と し て 立ち上げ られ 、 ジャズ に まで,すぐ に,ジャズ に まで,広げる,すぐ に,クラシック 全般 および ジャズ に まで,2,6,に,に まで,すぐ,ジャズ,ADV,NOUN,postpositional,postpositional,Preverbal,Japanese
新しい 建物 で 部屋 から 利尻 岳 が 見え て 窓 も 広く 接客 も 気持ち が よかっ た です 。,新しい 建物 で,部屋 から,建物 で,部屋 から,建物 で,部屋 から,見える,新しい 建物 で,部屋 から,3,2,で,から,建物,部屋,NOUN,NOUN,postpositional,postpositional,Preverbal,Japanese
戦闘 中 で も 、 経験 値 が 100 ポイント に 達し た 瞬間 に 発生 する 。,戦闘 中 で も 、,経験 値 が 100 ポイント に 達し た 瞬間 に,中 で も,瞬間 に,中 で も,瞬間 に,発生,戦闘 中 で も 、,経験 値 が 100 ポイント に 達し た 瞬間 に,5,10,で も,に,中,瞬間,NOUN,NOUN,postpositional,postpositional,Preverbal,Japanese
だ が 、 減損 損失 の 急増 など で 、 純 損失 は 前年 同期 の 386 億 円 から 拡大 し た 。,だ が 、 減損 損失 の 急増 など で 、,だ が 、 前年 同期 の 386 億 円 から,だ が 、 急増 など で,だ が 、 円 から,急増 など で,円 から,拡大,減損 損失 の 急増 など で 、,前年 同期 の 386 億 円 から,7,7,など で,から,急増,円,NOUN,NOUN,postpositional,postpositional,Preverbal,Japanese
