Sentence,Context_PP1,Context_PP2,Context_PP1_simple,Context_PP2_simple,PP1_simple,PP2_simple,Verb,PP1,PP2,PP1_len,PP2_len,Adp1,Adp2,NP1,NP2,PP1_Pronom,PP2_Pronom,PP1_Type,PP2_Type,Position,Language
"Kultūros paveldas plačiąja prasme suprantamas kaip materialusis – jį sudaro kilnojamosios ir nekilnojamosios vertybės , ir nematerialusis – jo esmė yra iš kartos į kartą perduodamos tradicijos , žinios ir gebėjimai , kultūrinis istorinis kraštovaizdis , atspindintis žmogaus sambūvį su aplinka .","Kultūros paveldas plačiąja prasme suprantamas kaip materialusis – jį sudaro kilnojamosios ir nekilnojamosios vertybės , ir nematerialusis – jo esmė yra iš kartos","Kultūros paveldas plačiąja prasme suprantamas kaip materialusis – jį sudaro kilnojamosios ir nekilnojamosios vertybės , ir nematerialusis – jo esmė yra į kartą","Kultūros paveldas plačiąja prasme suprantamas kaip materialusis – jį sudaro kilnojamosios ir nekilnojamosios vertybės , ir nematerialusis – jo esmė yra iš kartos","Kultūros paveldas plačiąja prasme suprantamas kaip materialusis – jį sudaro kilnojamosios ir nekilnojamosios vertybės , ir nematerialusis – jo esmė yra į kartą",iš karta,į karta,perduoti,iš kartos,į kartą,2,2,iš,į,karta,karta,NOUN,NOUN,prepositional,prepositional,Preverbal,Lithuanian
"Vyras , išgirdęs mano sarkastišką prunkštimą , kartu su erekcija praranda kretinizmo šarvus , tampa pažeidžiamas ir jaukus , kartais netgi apgailėtinas , valandėlę mudu netgi sutariame , sutampame vienas su kitu , bet štai jis ir vėl ima urgzti , judėti , raitytis , gašliai pažeminęs balsą kažką šnabžda partnerei , mane bjauriu nuogu užpakaliu stumdamas iš lovos , kol pagaliau iškrentu iš jos ir netenku sąmonės iki ryto , su viltimi , kad vieną sykį visa tai baigsis , nes daiktas , vadinamas vyru , labai glaudžiai susijęs su daiktu , kuris vadinamas kūnu , o juk nieko pasaulyje nėra paprastesnio už tiesą , kad visi daiktai dėvisi .","Vyras , išgirdęs mano sarkastišką prunkštimą , kartu su erekcija praranda kretinizmo šarvus , tampa pažeidžiamas ir jaukus , kartais netgi apgailėtinas , valandėlę mudu netgi sutariame , sutampame vienas su kitu , bet štai jis ir vėl ima urgzti , judėti , raitytis , gašliai pažeminęs balsą kažką šnabžda partnerei , mane bjauriu nuogu užpakaliu stumdamas iš lovos , kol pagaliau iškrentu iš jos ir netenku sąmonės iki ryto","Vyras , išgirdęs mano sarkastišką prunkštimą , kartu su erekcija praranda kretinizmo šarvus , tampa pažeidžiamas ir jaukus , kartais netgi apgailėtinas , valandėlę mudu netgi sutariame , sutampame vienas su kitu , bet štai jis ir vėl ima urgzti , judėti , raitytis , gašliai pažeminęs balsą kažką šnabžda partnerei , mane bjauriu nuogu užpakaliu stumdamas iš lovos , kol pagaliau iškrentu iš jos ir netenku sąmonės , su viltimi , kad vieną sykį visa tai baigsis , nes daiktas , vadinamas vyru , labai glaudžiai susijęs su daiktu , kuris vadinamas kūnu","Vyras , išgirdęs mano sarkastišką prunkštimą , kartu su erekcija praranda kretinizmo šarvus , tampa pažeidžiamas ir jaukus , kartais netgi apgailėtinas , valandėlę mudu netgi sutariame , sutampame vienas su kitu , bet štai jis ir vėl ima urgzti , judėti , raitytis , gašliai pažeminęs balsą kažką šnabžda partnerei , mane bjauriu nuogu užpakaliu stumdamas iš lovos , kol pagaliau iškrentu iš jos ir netenku sąmonės iki ryto","Vyras , išgirdęs mano sarkastišką prunkštimą , kartu su erekcija praranda kretinizmo šarvus , tampa pažeidžiamas ir jaukus , kartais netgi apgailėtinas , valandėlę mudu netgi sutariame , sutampame vienas su kitu , bet štai jis ir vėl ima urgzti , judėti , raitytis , gašliai pažeminęs balsą kažką šnabžda partnerei , mane bjauriu nuogu užpakaliu stumdamas iš lovos , kol pagaliau iškrentu iš jos ir netenku sąmonės su viltimi",iki rytas,su viltis,netekti,iki ryto,", su viltimi , kad vieną sykį visa tai baigsis , nes daiktas , vadinamas vyru , labai glaudžiai susijęs su daiktu , kuris vadinamas kūnu",2,26,iki,su,rytas,viltis,NOUN,NOUN,prepositional,prepositional,Postverbal,Lithuanian
"Mėsos galima dėti į košes – nuo 80 g iki 100 g porcijai “ , – vardija dietologė .",Mėsos galima dėti į košes – nuo 80 g,Mėsos galima dėti į košes iki 100 g,Mėsos galima dėti į košes nuo 80,Mėsos galima dėti į košes iki 100,nuo 80,iki 100,dėti,– nuo 80 g,iki 100 g,4,3,nuo,iki,80,100,NUM,NUM,prepositional,prepositional,Postverbal,Lithuanian
"„ Matote , pas jus iš viso nėra kairiųjų , “ sako toji europietė .","„ Matote , pas jus",„ Matote iš viso,„ Matote pas jus,„ Matote iš viso,pas jūs,iš visas,būti,", pas jus",iš viso,3,2,pas,iš,jūs,visas,PRON,PRON,prepositional,prepositional,Preverbal,Lithuanian
"Kad ir keista , iš dalies su juo sutinku .","Kad ir keista , iš dalies","Kad ir keista , su juo","Kad ir keista , iš dalies","Kad ir keista , su juo",iš dalis,su jis,sutikti,iš dalies,su juo,2,2,iš,su,dalis,jis,NOUN,PRON,prepositional,prepositional,Preverbal,Lithuanian
