Sentence,Context_PP1,Context_PP2,Context_PP1_simple,Context_PP2_simple,PP1_simple,PP2_simple,Verb,PP1,PP2,PP1_len,PP2_len,Adp1,Adp2,NP1,NP2,PP1_Pronom,PP2_Pronom,PP1_Type,PP2_Type,Position,Language
"Difor har offentlege styresmakter aust ut midlar til einskildtiltak utan klår plan , og difor må ein halde fram med ein kombinasjon av brannsløkking og autoritære straffeekspedisjonar .",Difor har offentlege styresmakter aust ut midlar til einskildtiltak,Difor har offentlege styresmakter aust ut midlar utan klår plan,Difor har offentlege styresmakter aust ut midlar til einskildtiltak,Difor har offentlege styresmakter aust ut midlar utan plan,til einskildtiltak,utan plan,ause,til einskildtiltak,utan klår plan,2,3,til,utan,einskildtiltak,plan,NOUN,NOUN,prepositional,prepositional,Postverbal,NorwegianNynorsk
"Hausten 2005 har orkananherjingane gjort stykket meir aktuelt enn nokon kunne venta , for Tennessee Williams slengjer oss like inn i eit familiedrama på liv og død - nettopp i det den store flaumen akkompagnerer moral og umoral , val på liv og død , som ei slags syndflod .","Hausten 2005 har orkananherjingane gjort stykket meir aktuelt enn nokon kunne venta , for Tennessee Williams slengjer oss like inn i eit familiedrama på liv og død","Hausten 2005 har orkananherjingane gjort stykket meir aktuelt enn nokon kunne venta , for Tennessee Williams slengjer oss - nettopp i det den store flaumen akkompagnerer moral og umoral , val på liv og død , som ei slags syndflod","Hausten 2005 har orkananherjingane gjort stykket meir aktuelt enn nokon kunne venta , for Tennessee Williams slengjer oss inn i familiedrama","Hausten 2005 har orkananherjingane gjort stykket meir aktuelt enn nokon kunne venta , for Tennessee Williams slengjer oss i det",inn i familiedrama,i det,slengje,like inn i eit familiedrama på liv og død,"- nettopp i det den store flaumen akkompagnerer moral og umoral , val på liv og død , som ei slags syndflod",9,22,inn i,i,familiedrama,det,NOUN,PRON,prepositional,prepositional,Postverbal,NorwegianNynorsk
"I den tsjekkiske filmen har den gamle detektivhelten Jan Zeman møtt ein CIA-agent i Berlin i 1960 , og vart eigentleg dobbeltagent for Vesten .",I den tsjekkiske filmen har den gamle detektivhelten Jan Zeman møtt ein CIA-agent i Berlin,I den tsjekkiske filmen har den gamle detektivhelten Jan Zeman møtt ein CIA-agent i 1960,I den tsjekkiske filmen har den gamle detektivhelten Jan Zeman møtt ein CIA-agent i Berlin,I den tsjekkiske filmen har den gamle detektivhelten Jan Zeman møtt ein CIA-agent i 1960,i Berlin,i 1960,møte,i Berlin,i 1960,2,2,i,i,Berlin,1960,PROPN,NUM,prepositional,prepositional,Postverbal,NorwegianNynorsk
Den gamle fjernsynsserien som starta i tsjekkisk fjernsyn i 1975 heitte Dei 30 sakene til major Zeman .,Den gamle fjernsynsserien som starta i tsjekkisk fjernsyn,Den gamle fjernsynsserien som starta i 1975,Den gamle fjernsynsserien som starta i fjernsyn,Den gamle fjernsynsserien som starta i 1975,i fjernsyn,i 1975,starte,i tsjekkisk fjernsyn,i 1975,3,2,i,i,fjernsyn,1975,NOUN,NUM,prepositional,prepositional,Postverbal,NorwegianNynorsk
"Figuren får no nytt liv , med politisk motsett forteikn , i filmen Major Zeman vender tilbake .","Figuren får no nytt liv , med politisk motsett forteikn ,",Figuren får no nytt liv i filmen Major Zeman vender tilbake,Figuren får no nytt liv med forteikn,Figuren får no nytt liv i Major,med forteikn,i Major,få,", med politisk motsett forteikn ,",i filmen Major Zeman vender tilbake,6,6,med,i,forteikn,Major,NOUN,PROPN,prepositional,prepositional,Postverbal,NorwegianNynorsk
« No er det folk som prøver å tene pengar på verket mitt med ein vri som ikkje eingong gjev meining .,« No er det folk som prøver å tene pengar på verket mitt,« No er det folk som prøver å tene pengar med ein vri som ikkje eingong gjev meining,« No er det folk som prøver å tene pengar på verket,« No er det folk som prøver å tene pengar med vri,på verk,med vri,tene,på verket mitt,med ein vri som ikkje eingong gjev meining,3,8,på,med,verk,vri,NOUN,NOUN,prepositional,prepositional,Postverbal,NorwegianNynorsk
"Det må vera rett å seia at omsetjingane til Mallet skapte furore i Europa etter kvart som dei vart omsette til dansk , engelsk og tysk .",Det må vera rett å seia at omsetjingane til Mallet skapte furore i Europa,"Det må vera rett å seia at omsetjingane til Mallet skapte furore etter kvart som dei vart omsette til dansk , engelsk og tysk",Det må vera rett å seia at omsetjingane til Mallet skapte furore i Europa,Det må vera rett å seia at omsetjingane til Mallet skapte furore etter kvart,i Europa,etter kvar,skape,i Europa,"etter kvart som dei vart omsette til dansk , engelsk og tysk",2,12,i,etter,Europa,kvar,PROPN,DET,prepositional,prepositional,Postverbal,NorwegianNynorsk
Menneskedyret i meg skrik ut i smerte ved åsynet av dei unge drepne frå Utøya .,Menneskedyret i meg skrik ut i smerte,Menneskedyret i meg skrik ut ved åsynet av dei unge drepne frå Utøya,Menneskedyret i meg skrik ut i smerte,Menneskedyret i meg skrik ut ved åsynet,i smerte,ved åsyn,skrike,i smerte,ved åsynet av dei unge drepne frå Utøya,2,8,i,ved,smerte,åsyn,NOUN,NOUN,prepositional,prepositional,Postverbal,NorwegianNynorsk
"Stirer du lenge nok ned i avgrunnen , stirer til slutt avgrunnen attende på deg .","Stirer du lenge nok ned i avgrunnen , stirer til slutt","Stirer du lenge nok ned i avgrunnen , stirer attende på deg","Stirer du lenge nok ned i avgrunnen , stirer til slutt","Stirer du lenge nok ned i avgrunnen , stirer attende på deg",til slutt,attende på du,stire,til slutt,attende på deg,2,3,til,attende på,slutt,du,NOUN,PRON,prepositional,prepositional,Postverbal,NorwegianNynorsk
Noko slikt har ikkje hendt på norsk jord sidan mellomalderen .,Noko slikt har ikkje hendt på norsk jord,Noko slikt har ikkje hendt sidan mellomalderen,Noko slikt har ikkje hendt på jord,Noko slikt har ikkje hendt sidan mellomalderen,på jord,sidan mellomalder,hende,på norsk jord,sidan mellomalderen,3,2,på,sidan,jord,mellomalder,NOUN,NOUN,prepositional,prepositional,Postverbal,NorwegianNynorsk
Og lever godt over evne etter det .,Og lever godt over evne,Og lever godt etter det,Og lever godt over evne,Og lever godt etter det,over evne,etter det,leve,over evne,etter det,2,2,over,etter,evne,det,NOUN,PRON,prepositional,prepositional,Postverbal,NorwegianNynorsk
Noregs idrettsforbund ivrar på nytt om å få vinter-OL til Noreg og vedtok sist veke å gå inn for å arbeida vidare med prosessen som kan føra til at Noreg søkjer OL til Oslo i 2022 .,Noregs idrettsforbund ivrar på nytt om å få vinter-OL til Noreg og vedtok sist veke å gå inn for å arbeida vidare med prosessen som kan føra til at Noreg søkjer OL til Oslo,Noregs idrettsforbund ivrar på nytt om å få vinter-OL til Noreg og vedtok sist veke å gå inn for å arbeida vidare med prosessen som kan føra til at Noreg søkjer OL i 2022,Noregs idrettsforbund ivrar på nytt om å få vinter-OL til Noreg og vedtok sist veke å gå inn for å arbeida vidare med prosessen som kan føra til at Noreg søkjer OL til Oslo,Noregs idrettsforbund ivrar på nytt om å få vinter-OL til Noreg og vedtok sist veke å gå inn for å arbeida vidare med prosessen som kan føra til at Noreg søkjer OL i 2022,til Oslo,i 2022,søkje,til Oslo,i 2022,2,2,til,i,Oslo,2022,PROPN,NUM,prepositional,prepositional,Postverbal,NorwegianNynorsk
"Og dei pengane som skal investerast i idretten i framtida , må fordelast over heile landet .",Og dei pengane som skal investerast i idretten,Og dei pengane som skal investerast i framtida,Og dei pengane som skal investerast i idretten,Og dei pengane som skal investerast i framtida,i idrett,i framtid,investere,i idretten,i framtida,2,2,i,i,idrett,framtid,NOUN,NOUN,prepositional,prepositional,Postverbal,NorwegianNynorsk
Eg kom til Noreg som flyktning nokre dagar før jol i 1986 .,Eg kom til Noreg,Eg kom nokre dagar før jol i 1986,Eg kom til Noreg,Eg kom før jol,til Noreg,før jol,kome,til Noreg,nokre dagar før jol i 1986,2,6,til,før,Noreg,jol,PROPN,NOUN,prepositional,prepositional,Postverbal,NorwegianNynorsk
Tvert imot likna han i utsegnene sine på profeten Muhammed og hadde tildriv til krig og sverd .,Tvert imot likna han i utsegnene sine,Tvert imot likna han på profeten Muhammed,Tvert imot likna han i utsegnene,Tvert imot likna han på Muhammed,i utsegn,på Muhammed,likne,i utsegnene sine,på profeten Muhammed,3,3,i,på,utsegn,Muhammed,NOUN,NOUN,prepositional,prepositional,Postverbal,NorwegianNynorsk
"Eg var full av undring over at ei oppegåande , reflektert dame nekta for det som stod med klar tekst i evangeliet , og trudde på eventyret om barnet i Betlehem og stjerna som leidde kongar med gåver til det .","Eg var full av undring over at ei oppegåande , reflektert dame nekta for det som stod med klar tekst","Eg var full av undring over at ei oppegåande , reflektert dame nekta for det som stod i evangeliet","Eg var full av undring over at ei oppegåande , reflektert dame nekta for det som stod med tekst","Eg var full av undring over at ei oppegåande , reflektert dame nekta for det som stod i evangeliet",med tekst,i evangelium,stå,med klar tekst,i evangeliet,3,2,med,i,tekst,evangelium,NOUN,NOUN,prepositional,prepositional,Postverbal,NorwegianNynorsk
Nora Eggen prøver å jakta på den verkelege profeten ut frå ein teologisk ståstad .,Nora Eggen prøver å jakta på den verkelege profeten,Nora Eggen prøver å jakta ut frå ein teologisk ståstad,Nora Eggen prøver å jakta på profeten,Nora Eggen prøver å jakta ut frå ståstad,på profet,ut frå ståstad,jakte,på den verkelege profeten,ut frå ein teologisk ståstad,4,5,på,ut frå,profet,ståstad,NOUN,NOUN,prepositional,prepositional,Postverbal,NorwegianNynorsk
Den fyrste forståinga er å flytta tradisjon og praksis automatisk frå profetens tid til våre dagar .,Den fyrste forståinga er å flytta tradisjon og praksis automatisk frå profetens tid,Den fyrste forståinga er å flytta tradisjon og praksis automatisk til våre dagar,Den fyrste forståinga er å flytta tradisjon og praksis automatisk frå tid,Den fyrste forståinga er å flytta tradisjon og praksis automatisk til dagar,frå tid,til dag,flytte,frå profetens tid,til våre dagar,3,3,frå,til,tid,dag,NOUN,NOUN,prepositional,prepositional,Postverbal,NorwegianNynorsk
"Her treng religionen vårt bidrag med å setja profeten i ramma av dagens fablar og eventyr , å innhenta profeten til vår tid , i staden for å flytta oss sjølve til hans tid .","Her treng religionen vårt bidrag med å setja profeten i ramma av dagens fablar og eventyr , å innhenta profeten til vår tid","Her treng religionen vårt bidrag med å setja profeten i ramma av dagens fablar og eventyr , å innhenta profeten , i staden for å flytta oss sjølve til hans tid","Her treng religionen vårt bidrag med å setja profeten i ramma av dagens fablar og eventyr , å innhenta profeten til tid","Her treng religionen vårt bidrag med å setja profeten i ramma av dagens fablar og eventyr , å innhenta profeten i staden",til tid,i stad,innhente,til vår tid,", i staden for å flytta oss sjølve til hans tid",3,11,til,i,tid,stad,NOUN,NOUN,prepositional,prepositional,Postverbal,NorwegianNynorsk
Oddbjørn Leirvik argumenterer i sin artikkel for likskapen mellom Jesus og Muhammed .,Oddbjørn Leirvik argumenterer i sin artikkel,Oddbjørn Leirvik argumenterer for likskapen mellom Jesus og Muhammed,Oddbjørn Leirvik argumenterer i artikkel,Oddbjørn Leirvik argumenterer for likskapen,i artikkel,for likskap,argumentere,i sin artikkel,for likskapen mellom Jesus og Muhammed,3,6,i,for,artikkel,likskap,NOUN,NOUN,prepositional,prepositional,Postverbal,NorwegianNynorsk
"Forfattaren , Alexander Wisting , er endåtil ein direkte ætling etter Oscar Wisting , Amundsens næraste reisefelle og den einaste som følgde med han til båe polane .","Forfattaren , Alexander Wisting , er endåtil ein direkte ætling etter Oscar Wisting , Amundsens næraste reisefelle og den einaste som følgde med han","Forfattaren , Alexander Wisting , er endåtil ein direkte ætling etter Oscar Wisting , Amundsens næraste reisefelle og den einaste som følgde til båe polane","Forfattaren , Alexander Wisting , er endåtil ein direkte ætling etter Oscar Wisting , Amundsens næraste reisefelle og den einaste som følgde med han","Forfattaren , Alexander Wisting , er endåtil ein direkte ætling etter Oscar Wisting , Amundsens næraste reisefelle og den einaste som følgde til polane",med han,til pol,følgje,med han,til båe polane,2,3,med,til,han,pol,PRON,NOUN,prepositional,prepositional,Postverbal,NorwegianNynorsk
"Når vi talar om bilete , så er det berre å venta på Aftenposten i spaning :","Når vi talar om bilete , så er det berre å venta på Aftenposten","Når vi talar om bilete , så er det berre å venta i spaning","Når vi talar om bilete , så er det berre å venta på Aftenposten","Når vi talar om bilete , så er det berre å venta i spaning",på Aftenposten,i spaning,vente,på Aftenposten,i spaning,2,2,på,i,Aftenposten,spaning,NOUN,NOUN,prepositional,prepositional,Postverbal,NorwegianNynorsk
"1001 spørsmål og svar om språk , som kom ut på Det Norske Samlaget i fjor haust .","1001 spørsmål og svar om språk , som kom ut på Det Norske Samlaget","1001 spørsmål og svar om språk , som kom ut i fjor haust","1001 spørsmål og svar om språk , som kom ut på Det","1001 spørsmål og svar om språk , som kom ut i fjor",på Det,i fjor,kome,på Det Norske Samlaget,i fjor haust,4,3,på,i,Det,fjor,PROPN,NOUN,prepositional,prepositional,Postverbal,NorwegianNynorsk
"Ålvorlegare er det at austlandsk ( i motsetnad til austnorsk ) i språkleg samanheng ikkje femner um midlandsmåli , som òg hev kløyvd infinitiv .",Ålvorlegare er det at austlandsk ( i motsetnad til austnorsk ),Ålvorlegare er det at austlandsk i språkleg samanheng,Ålvorlegare er det at austlandsk i motsetnad,Ålvorlegare er det at austlandsk i samanheng,i motsetnad,i samanheng,femne,( i motsetnad til austnorsk ),i språkleg samanheng,6,3,i,i,motsetnad,samanheng,NOUN,NOUN,prepositional,prepositional,Preverbal,NorwegianNynorsk
"Dersom ein med mørekysten ( sic ) meiner ' den luten av Møre og Romsdal fylke som vender mot havet ' , lyt svaret verta « ja » , for det geografiske umrådet Romsdalen gjeng heilt ut til kysten , med kommunar som Aukra og Fræna .","Dersom ein med mørekysten ( sic ) meiner ' den luten av Møre og Romsdal fylke som vender mot havet ' , lyt svaret verta « ja » , for det geografiske umrådet Romsdalen gjeng heilt ut til kysten","Dersom ein med mørekysten ( sic ) meiner ' den luten av Møre og Romsdal fylke som vender mot havet ' , lyt svaret verta « ja » , for det geografiske umrådet Romsdalen gjeng , med kommunar som Aukra og Fræna","Dersom ein med mørekysten ( sic ) meiner ' den luten av Møre og Romsdal fylke som vender mot havet ' , lyt svaret verta « ja » , for det geografiske umrådet Romsdalen gjeng ut til kysten","Dersom ein med mørekysten ( sic ) meiner ' den luten av Møre og Romsdal fylke som vender mot havet ' , lyt svaret verta « ja » , for det geografiske umrådet Romsdalen gjeng med kommunar",ut til kyst,med kommune,gå,heilt ut til kysten,", med kommunar som Aukra og Fræna",4,7,ut til,med,kyst,kommune,NOUN,NOUN,prepositional,prepositional,Postverbal,NorwegianNynorsk
"Det er rett at formi me kom til i millomalderen ( i formi mér ) , men ho trengde etter kvart heilt til sides den eldre formi vér .",Det er rett at formi me kom til i millomalderen,Det er rett at formi me kom til ( i formi mér ),Det er rett at formi me kom til i millomalderen,Det er rett at formi me kom til i formi,i millomalder,i form,kome,i millomalderen,( i formi mér ),2,5,i,i,millomalder,form,NOUN,NOUN,prepositional,prepositional,Postverbal,NorwegianNynorsk
"Det er rett at formi me kom til i millomalderen ( i formi mér ) , men ho trengde etter kvart heilt til sides den eldre formi vér .","Det er rett at formi me kom til i millomalderen ( i formi mér ) , men ho trengde etter kvart","Det er rett at formi me kom til i millomalderen ( i formi mér ) , men ho trengde heilt til sides","Det er rett at formi me kom til i millomalderen ( i formi mér ) , men ho trengde etter kvart","Det er rett at formi me kom til i millomalderen ( i formi mér ) , men ho trengde til sides",etter kvar,til side,trengje,etter kvart,heilt til sides,2,3,etter,til,kvar,side,DET,NOUN,prepositional,prepositional,Postverbal,NorwegianNynorsk
No sel mange av dei krafta på marknaden med stor profitt .,No sel mange av dei krafta på marknaden,No sel mange av dei krafta med stor profitt,No sel mange av dei krafta på marknaden,No sel mange av dei krafta med profitt,på marknad,med profitt,selje,på marknaden,med stor profitt,2,3,på,med,marknad,profitt,NOUN,NOUN,prepositional,prepositional,Postverbal,NorwegianNynorsk
"Ein av dei er at den kraftkrevjande industrien rundt i Noreg trappar ned delar av verksemda si , og sel straum for hundrevis av millionar på kraftbørsen i staden .","Ein av dei er at den kraftkrevjande industrien rundt i Noreg trappar ned delar av verksemda si , og sel straum for hundrevis av millionar på kraftbørsen","Ein av dei er at den kraftkrevjande industrien rundt i Noreg trappar ned delar av verksemda si , og sel straum for hundrevis av millionar i staden","Ein av dei er at den kraftkrevjande industrien rundt i Noreg trappar ned delar av verksemda si , og sel straum for hundrevis av millionar på kraftbørsen","Ein av dei er at den kraftkrevjande industrien rundt i Noreg trappar ned delar av verksemda si , og sel straum for hundrevis av millionar i staden",på kraftbørs,i stad,selje,på kraftbørsen,i staden,2,2,på,i,kraftbørs,stad,NOUN,NOUN,prepositional,prepositional,Postverbal,NorwegianNynorsk
"Snittprisen ligg i år på 11,6 øre per kilowattime , skreiv Dagens Næringsliv nyleg .",Snittprisen ligg i år,"Snittprisen ligg på 11,6 øre per kilowattime",Snittprisen ligg i år,Snittprisen ligg på øre,i år,på øre,liggje,i år,"på 11,6 øre per kilowattime",2,5,i,på,år,øre,NOUN,NOUN,prepositional,prepositional,Postverbal,NorwegianNynorsk
"Når straumprisen på kraftbørsen Nord Pool i dag ligg over 60 øre per kWh , seier det seg sjølv at selskapa blir freista til å trappe ned aktiviteten ved måteleg lønsame smelteverk , og selje straumen i staden , med permitteringar i industrien som resultat .","Når straumprisen på kraftbørsen Nord Pool i dag ligg over 60 øre per kWh , seier det seg sjølv at selskapa blir freista til å trappe ned aktiviteten ved måteleg lønsame smelteverk , og selje straumen i staden","Når straumprisen på kraftbørsen Nord Pool i dag ligg over 60 øre per kWh , seier det seg sjølv at selskapa blir freista til å trappe ned aktiviteten ved måteleg lønsame smelteverk , og selje straumen , med permitteringar i industrien som resultat","Når straumprisen på kraftbørsen Nord Pool i dag ligg over 60 øre per kWh , seier det seg sjølv at selskapa blir freista til å trappe ned aktiviteten ved måteleg lønsame smelteverk , og selje straumen i staden","Når straumprisen på kraftbørsen Nord Pool i dag ligg over 60 øre per kWh , seier det seg sjølv at selskapa blir freista til å trappe ned aktiviteten ved måteleg lønsame smelteverk , og selje straumen med permitteringar",i stad,med permittering,selje,i staden,", med permitteringar i industrien som resultat",2,7,i,med,stad,permittering,NOUN,NOUN,prepositional,prepositional,Postverbal,NorwegianNynorsk
"Dag og Tid har spurt Statkraft , Statnett , kraftbørsen Nord Pool og Olje- og energidepartementet , men ingen av dei fører noko oversyn over vidaresalet av krafta som industribedriftene har fått til godpris frå staten .","Dag og Tid har spurt Statkraft , Statnett , kraftbørsen Nord Pool og Olje- og energidepartementet , men ingen av dei fører noko oversyn over vidaresalet av krafta som industribedriftene har fått til godpris","Dag og Tid har spurt Statkraft , Statnett , kraftbørsen Nord Pool og Olje- og energidepartementet , men ingen av dei fører noko oversyn over vidaresalet av krafta som industribedriftene har fått frå staten","Dag og Tid har spurt Statkraft , Statnett , kraftbørsen Nord Pool og Olje- og energidepartementet , men ingen av dei fører noko oversyn over vidaresalet av krafta som industribedriftene har fått til godpris","Dag og Tid har spurt Statkraft , Statnett , kraftbørsen Nord Pool og Olje- og energidepartementet , men ingen av dei fører noko oversyn over vidaresalet av krafta som industribedriftene har fått frå staten",til godpris,frå stat,få,til godpris,frå staten,2,2,til,frå,godpris,stat,NOUN,NOUN,prepositional,prepositional,Postverbal,NorwegianNynorsk
"Han er leiar for LO i Trondheim og RV-politikar , og arbeidde i mange år ved Lilleby Metall i Trondheim , som no er nedlagt .","Han er leiar for LO i Trondheim og RV-politikar , og arbeidde i mange år","Han er leiar for LO i Trondheim og RV-politikar , og arbeidde ved Lilleby Metall i Trondheim , som no er nedlagt","Han er leiar for LO i Trondheim og RV-politikar , og arbeidde i år","Han er leiar for LO i Trondheim og RV-politikar , og arbeidde ved Lilleby",i år,ved Lilleby,arbeide,i mange år,"ved Lilleby Metall i Trondheim , som no er nedlagt",3,10,i,ved,år,Lilleby,NOUN,PROPN,prepositional,prepositional,Postverbal,NorwegianNynorsk
Det finst ikkje så reint lite kritikk av islam eller muslimar i offentleg debatt i Noreg i dag ?,Det finst ikkje så reint lite kritikk av islam eller muslimar i offentleg debatt i Noreg,Det finst ikkje så reint lite kritikk av islam eller muslimar i dag,Det finst ikkje så reint lite kritikk av islam eller muslimar i debatt,Det finst ikkje så reint lite kritikk av islam eller muslimar i dag,i debatt,i dag,finnast,i offentleg debatt i Noreg,i dag,5,2,i,i,debatt,dag,NOUN,NOUN,prepositional,prepositional,Postverbal,NorwegianNynorsk
"Dei eminente tankesmiene våre , som ECON og andre , låg , såleis , heilt i verdstoppen med omsyn til oljestrategi og altruisme .","Dei eminente tankesmiene våre , som ECON og andre , låg , såleis , heilt i verdstoppen","Dei eminente tankesmiene våre , som ECON og andre , låg , såleis med omsyn til oljestrategi og altruisme","Dei eminente tankesmiene våre , som ECON og andre , låg , såleis i verdstoppen","Dei eminente tankesmiene våre , som ECON og andre , låg , såleis med omsyn",i verdstopp,med omsyn,liggje,", heilt i verdstoppen",med omsyn til oljestrategi og altruisme,4,6,i,med,verdstopp,omsyn,NOUN,NOUN,prepositional,prepositional,Postverbal,NorwegianNynorsk
"- Forlaga , forfattarane og grafisk bransje sa for lenge sidan klart frå om at det var uansvarleg å innføra nye lærebøker på same tid for så mange skuletrinn .","- Forlaga , forfattarane og grafisk bransje sa for lenge sidan klart frå om at det var uansvarleg å innføra nye lærebøker på same tid","- Forlaga , forfattarane og grafisk bransje sa for lenge sidan klart frå om at det var uansvarleg å innføra nye lærebøker for så mange skuletrinn","- Forlaga , forfattarane og grafisk bransje sa for lenge sidan klart frå om at det var uansvarleg å innføra nye lærebøker på tid","- Forlaga , forfattarane og grafisk bransje sa for lenge sidan klart frå om at det var uansvarleg å innføra nye lærebøker for skuletrinn",på tid,for skuletrinn,innføre,på same tid,for så mange skuletrinn,3,4,på,for,tid,skuletrinn,NOUN,NOUN,prepositional,prepositional,Postverbal,NorwegianNynorsk
"Det er lett for mange å ta til takke med bokmålsutgåvene når dei ikkje finn nynorskbøker i bokhandelen , seier Myklebust .",Det er lett for mange å ta til takke,Det er lett for mange å ta med bokmålsutgåvene,Det er lett for mange å ta til takke,Det er lett for mange å ta med bokmålsutgåvene,til takke,med bokmålsutgåve,ta,til takke,med bokmålsutgåvene,2,2,til,med,takke,bokmålsutgåve,NOUN,NOUN,prepositional,prepositional,Postverbal,NorwegianNynorsk
- Så du legg i dette tilfelle skulda på Gyldendal ?,- Så du legg i dette tilfelle,- Så du legg på Gyldendal,- Så du legg i tilfelle,- Så du legg på Gyldendal,i tilfelle,på Gyldendal,leggje,i dette tilfelle,på Gyldendal,3,2,i,på,tilfelle,Gyldendal,NOUN,PROPN,prepositional,prepositional,Postverbal,NorwegianNynorsk
For ti år sidan kom Willoch med boka En ny miljøpolitikk i serien Gyldendals Pamfletter .,For ti år sidan kom Willoch med boka En ny miljøpolitikk,For ti år sidan kom Willoch i serien Gyldendals Pamfletter,For ti år sidan kom Willoch med En,For ti år sidan kom Willoch i Gyldendals,med En,i Gyldendals,kome,med boka En ny miljøpolitikk,i serien Gyldendals Pamfletter,5,4,med,i,En,Gyldendals,PROPN,PROPN,prepositional,prepositional,Postverbal,NorwegianNynorsk
"I Noreg seier alle partia noko pent om vilje til å ta vare på miljøet , utanom Frp .",I Noreg seier alle partia noko pent om vilje til å ta vare på miljøet,"I Noreg seier alle partia noko pent , utanom Frp",I Noreg seier alle partia noko pent om vilje,I Noreg seier alle partia noko pent utanom Frp,om vilje,utanom Frp,seie,om vilje til å ta vare på miljøet,", utanom Frp",8,3,om,utanom,vilje,Frp,NOUN,NOUN,prepositional,prepositional,Postverbal,NorwegianNynorsk
- Men om du kom i posisjon i dag og ikkje kunne gjera noko med fortida ?,- Men om du kom i posisjon,- Men om du kom i dag,- Men om du kom i posisjon,- Men om du kom i dag,i posisjon,i dag,kome,i posisjon,i dag,2,2,i,i,posisjon,dag,NOUN,NOUN,prepositional,prepositional,Postverbal,NorwegianNynorsk
