Sentence,Context_PP1,Context_PP2,Context_PP1_simple,Context_PP2_simple,PP1_simple,PP2_simple,Verb,PP1,PP2,PP1_len,PP2_len,Adp1,Adp2,NP1,NP2,PP1_Pronom,PP2_Pronom,PP1_Type,PP2_Type,Position,Language
"Kamskjell , piggvar og lammefilet sto på menyen under den kongelige gallamiddagen .","Kamskjell , piggvar og lammefilet sto på menyen","Kamskjell , piggvar og lammefilet sto under den kongelige gallamiddagen","Kamskjell , piggvar og lammefilet sto på menyen","Kamskjell , piggvar og lammefilet sto under gallamiddagen",på meny,under gallamiddag,stå,på menyen,under den kongelige gallamiddagen,2,4,på,under,meny,gallamiddag,NOUN,NOUN,prepositional,prepositional,Postverbal,NorwegianBokmaal
Både Bondevik og Hagen fastslo nok en gang at en trepartiregjering fra tid til annen vil finne det naturlig å søke støtte for sine forslag i Ap. eller endog SV .,Både Bondevik og Hagen fastslo nok en gang at en trepartiregjering fra tid til annen vil finne det naturlig å søke støtte for sine forslag,Både Bondevik og Hagen fastslo nok en gang at en trepartiregjering fra tid til annen vil finne det naturlig å søke støtte i Ap. eller endog SV,Både Bondevik og Hagen fastslo nok en gang at en trepartiregjering fra tid til annen vil finne det naturlig å søke støtte for forslag,Både Bondevik og Hagen fastslo nok en gang at en trepartiregjering fra tid til annen vil finne det naturlig å søke støtte i Ap.,for forslag,i Ap.,søke,for sine forslag,i Ap. eller endog SV,3,5,for,i,forslag,Ap.,NOUN,PROPN,prepositional,prepositional,Postverbal,NorwegianBokmaal
"De tre partiene kan nok satse på Arbeiderpartiet eller SV i noen enkeltsaker som kan være viktige for profileringen av regjeringen , men de må være forberedt på å samarbeide med Fr.p. om statsbudsjettet ikke bare for neste år , men også i resten av fireårsperioden .",De tre partiene kan nok satse på Arbeiderpartiet eller SV,De tre partiene kan nok satse i noen enkeltsaker som kan være viktige for profileringen av regjeringen,De tre partiene kan nok satse på Arbeiderpartiet,De tre partiene kan nok satse i enkeltsaker,på Arbeiderpartiet,i enkeltsak,satse,på Arbeiderpartiet eller SV,i noen enkeltsaker som kan være viktige for profileringen av regjeringen,4,11,på,i,Arbeiderpartiet,enkeltsak,PROPN,NOUN,prepositional,prepositional,Postverbal,NorwegianBokmaal
"De tre partiene kan nok satse på Arbeiderpartiet eller SV i noen enkeltsaker som kan være viktige for profileringen av regjeringen , men de må være forberedt på å samarbeide med Fr.p. om statsbudsjettet ikke bare for neste år , men også i resten av fireårsperioden .","De tre partiene kan nok satse på Arbeiderpartiet eller SV i noen enkeltsaker som kan være viktige for profileringen av regjeringen , men de må være forberedt på å samarbeide med Fr.p.","De tre partiene kan nok satse på Arbeiderpartiet eller SV i noen enkeltsaker som kan være viktige for profileringen av regjeringen , men de må være forberedt på å samarbeide om statsbudsjettet ikke bare for neste år , men også i resten av fireårsperioden","De tre partiene kan nok satse på Arbeiderpartiet eller SV i noen enkeltsaker som kan være viktige for profileringen av regjeringen , men de må være forberedt på å samarbeide med Fr.p.","De tre partiene kan nok satse på Arbeiderpartiet eller SV i noen enkeltsaker som kan være viktige for profileringen av regjeringen , men de må være forberedt på å samarbeide om statsbudsjettet",med Frp.,om statsbudsjett,samarbeide,med Fr.p.,"om statsbudsjettet ikke bare for neste år , men også i resten av fireårsperioden",2,14,med,om,Frp.,statsbudsjett,PROPN,NOUN,prepositional,prepositional,Postverbal,NorwegianBokmaal
"Omar befinner seg ifølge det afghanske nyhetsbyrået AIP fremdeles i Kandahar , sør i Afghanistan , der Taliban-ledelsen har sitt hovedkvarter .",Omar befinner seg ifølge det afghanske nyhetsbyrået AIP,"Omar befinner seg i Kandahar , sør i Afghanistan , der Taliban-ledelsen har sitt hovedkvarter",Omar befinner seg ifølge AIP,Omar befinner seg i Kandahar,ifølge AIP,i Kandahar,befinne,ifølge det afghanske nyhetsbyrået AIP,"i Kandahar , sør i Afghanistan , der Taliban-ledelsen har sitt hovedkvarter",5,12,ifølge,i,AIP,Kandahar,PROPN,PROPN,prepositional,prepositional,Postverbal,NorwegianBokmaal
"I Kofi Annan , som ble valgt til generalsekretær for snart fem år siden , har FN fått en uvanlig engasjert leder som har satt sterkt preg på verdensorganisasjonen og dens fokus .","I Kofi Annan , som ble valgt til generalsekretær","I Kofi Annan , som ble valgt for snart fem år siden","I Kofi Annan , som ble valgt til generalsekretær","I Kofi Annan , som ble valgt for år",til generalsekretær,for år,velge,til generalsekretær,for snart fem år siden,2,5,til,for,generalsekretær,år,NOUN,NOUN,prepositional,prepositional,Postverbal,NorwegianBokmaal
"UNICEF arbeider i 162 land , og prioriterte oppgaver er små barns helse og utvikling , skolegang - særlig for jenter , HIV / AIDS og tiltak for å beskytte barn mot utnyttelse seksuelt , i arbeid og som soldater .","UNICEF arbeider i 162 land , og prioriterte oppgaver er små barns helse og utvikling , skolegang - særlig for jenter , HIV / AIDS og tiltak for å beskytte barn mot utnyttelse seksuelt","UNICEF arbeider i 162 land , og prioriterte oppgaver er små barns helse og utvikling , skolegang - særlig for jenter , HIV / AIDS og tiltak for å beskytte barn , i arbeid og som soldater","UNICEF arbeider i 162 land , og prioriterte oppgaver er små barns helse og utvikling , skolegang - særlig for jenter , HIV / AIDS og tiltak for å beskytte barn mot utnyttelse","UNICEF arbeider i 162 land , og prioriterte oppgaver er små barns helse og utvikling , skolegang - særlig for jenter , HIV / AIDS og tiltak for å beskytte barn i arbeid",mot utnyttelse,i arbeid,beskytte,mot utnyttelse seksuelt,", i arbeid og som soldater",3,6,mot,i,utnyttelse,arbeid,NOUN,NOUN,prepositional,prepositional,Postverbal,NorwegianBokmaal
"Den største flyktningestrømmen kommer i dag fra Afghanistan , men også fra Sudan , Angola , Kongo og Eritrea i Afrika kommer flere millioner flyktninger .",Den største flyktningestrømmen kommer i dag,Den største flyktningestrømmen kommer fra Afghanistan,Den største flyktningestrømmen kommer i dag,Den største flyktningestrømmen kommer fra Afghanistan,i dag,fra Afghanistan,komme,i dag,fra Afghanistan,2,2,i,fra,dag,Afghanistan,NOUN,PROPN,prepositional,prepositional,Postverbal,NorwegianBokmaal
"Verdens matvareprogram , WFP , sørger for matleveranser i akutte situasjoner , som etter jordskjelv , men også mer "" ventede "" kriser som matmangel på grunn av tørke .","Verdens matvareprogram , WFP , sørger for matleveranser","Verdens matvareprogram , WFP , sørger i akutte situasjoner , som etter jordskjelv , men også mer "" ventede "" kriser som matmangel på grunn av tørke","Verdens matvareprogram , WFP , sørger for matleveranser","Verdens matvareprogram , WFP , sørger i situasjoner",for matleveranse,i situasjon,sørge,for matleveranser,"i akutte situasjoner , som etter jordskjelv , men også mer "" ventede "" kriser som matmangel på grunn av tørke",2,21,for,i,matleveranse,situasjon,NOUN,NOUN,prepositional,prepositional,Postverbal,NorwegianBokmaal
"José Ramos-Horta fra Øst-Timor , fredsprisvinner i 1996 , understreket også hvilket viktig redskap FN er for freden , - men freden bygges også dag for dag av menneskene , over hele verden .","José Ramos-Horta fra Øst-Timor , fredsprisvinner i 1996 , understreket også hvilket viktig redskap FN er for freden , - men freden bygges også dag for dag av menneskene","José Ramos-Horta fra Øst-Timor , fredsprisvinner i 1996 , understreket også hvilket viktig redskap FN er for freden , - men freden bygges også dag for dag , over hele verden","José Ramos-Horta fra Øst-Timor , fredsprisvinner i 1996 , understreket også hvilket viktig redskap FN er for freden , - men freden bygges også dag for dag av menneskene","José Ramos-Horta fra Øst-Timor , fredsprisvinner i 1996 , understreket også hvilket viktig redskap FN er for freden , - men freden bygges også dag for dag over verden",av menneske,over verden,bygge,av menneskene,", over hele verden",2,4,av,over,menneske,verden,NOUN,NOUN,prepositional,prepositional,Postverbal,NorwegianBokmaal
"Annan , som sammen med FN ble æret med Nobels fredspris i hundreårsjubiléet for Nobel-prisene , har alltid hatt verdens minste og elendigste i sitt skarpeste fokus .","Annan , som sammen med FN ble æret med Nobels fredspris","Annan , som sammen med FN ble æret i hundreårsjubiléet for Nobel-prisene","Annan , som sammen med FN ble æret med fredspris","Annan , som sammen med FN ble æret i hundreårsjubiléet",med fredspris,i hundreårsjubilé,ære,med Nobels fredspris,i hundreårsjubiléet for Nobel-prisene,3,4,med,i,fredspris,hundreårsjubilé,NOUN,NOUN,prepositional,prepositional,Postverbal,NorwegianBokmaal
""" Kun én av FNs seks tidligere generalsekretærer kan sammenlignes med Annan i personlig kraft og historisk betydning , nemlig Dag Hammarskjöld , organisasjonens andre generalsekretær "" , sa Berge videre .",""" Kun én av FNs seks tidligere generalsekretærer kan sammenlignes med Annan",""" Kun én av FNs seks tidligere generalsekretærer kan sammenlignes i personlig kraft og historisk betydning",""" Kun én av FNs seks tidligere generalsekretærer kan sammenlignes med Annan",""" Kun én av FNs seks tidligere generalsekretærer kan sammenlignes i kraft",med Annan,i kraft,sammenligne,med Annan,i personlig kraft og historisk betydning,2,6,med,i,Annan,kraft,PROPN,NOUN,prepositional,prepositional,Postverbal,NorwegianBokmaal
"- My hope is in you , sang Yossou NDour fra Senegal og pekte bort på Kofi Annan , som var kommet opp på scenen til øredøvende jubel fra 6000 tilskuere .","- My hope is in you , sang Yossou NDour fra Senegal og pekte bort på Kofi Annan , som var kommet opp på scenen","- My hope is in you , sang Yossou NDour fra Senegal og pekte bort på Kofi Annan , som var kommet til øredøvende jubel fra 6000 tilskuere","- My hope is in you , sang Yossou NDour fra Senegal og pekte bort på Kofi Annan , som var kommet opp på scenen","- My hope is in you , sang Yossou NDour fra Senegal og pekte bort på Kofi Annan , som var kommet til jubel",opp på scene,til jubel,komme,opp på scenen,til øredøvende jubel fra 6000 tilskuere,3,6,opp på,til,scene,jubel,NOUN,NOUN,prepositional,prepositional,Postverbal,NorwegianBokmaal
"Tirsdag ble FN , dets leder Kofi Annan og freden behørig feiret i Oslo Spektrum av vanlige folk og av et imponerende antall nobeliteter .","Tirsdag ble FN , dets leder Kofi Annan og freden behørig feiret i Oslo Spektrum","Tirsdag ble FN , dets leder Kofi Annan og freden behørig feiret av vanlige folk og av et imponerende antall nobeliteter","Tirsdag ble FN , dets leder Kofi Annan og freden behørig feiret i Oslo","Tirsdag ble FN , dets leder Kofi Annan og freden behørig feiret av folk",i Oslo,av folk,feire,i Oslo Spektrum,av vanlige folk og av et imponerende antall nobeliteter,3,9,i,av,Oslo,folk,PROPN,NOUN,prepositional,prepositional,Postverbal,NorwegianBokmaal
"FN har blitt kritisert , og den har gjort feil , men FN er ingen perfekt organisasjon fordi den utgjøres av mennesker , og vi er ikke perfekte , sa hun under en pressekonferanse før gårsdagens Fredspriskonsert .","FN har blitt kritisert , og den har gjort feil , men FN er ingen perfekt organisasjon fordi den utgjøres av mennesker , og vi er ikke perfekte , sa hun under en pressekonferanse","FN har blitt kritisert , og den har gjort feil , men FN er ingen perfekt organisasjon fordi den utgjøres av mennesker , og vi er ikke perfekte , sa hun før gårsdagens Fredspriskonsert","FN har blitt kritisert , og den har gjort feil , men FN er ingen perfekt organisasjon fordi den utgjøres av mennesker , og vi er ikke perfekte , sa hun under pressekonferanse","FN har blitt kritisert , og den har gjort feil , men FN er ingen perfekt organisasjon fordi den utgjøres av mennesker , og vi er ikke perfekte , sa hun før Fredspriskonsert",under pressekonferanse,før Fredspriskonsert,si,under en pressekonferanse,før gårsdagens Fredspriskonsert,3,3,under,før,pressekonferanse,Fredspriskonsert,NOUN,PROPN,prepositional,prepositional,Postverbal,NorwegianBokmaal
- Siden vi har 100-årsjubileum i år har vi gjort en ekstra innsats for å finne frem til spesielle talenter i år .,- Siden vi har 100-årsjubileum i år har vi gjort en ekstra innsats for å finne frem til spesielle talenter,- Siden vi har 100-årsjubileum i år har vi gjort en ekstra innsats for å finne i år,- Siden vi har 100-årsjubileum i år har vi gjort en ekstra innsats for å finne frem til talenter,- Siden vi har 100-årsjubileum i år har vi gjort en ekstra innsats for å finne i år,frem til talent,i år,finne,frem til spesielle talenter,i år,4,2,frem til,i,talent,år,NOUN,NOUN,prepositional,prepositional,Postverbal,NorwegianBokmaal
Etter trøbbel i Oslos havnebasseng på fredag gikk det lynraskt for « Fram XVI » i Færderseilasen .,Etter trøbbel i Oslos havnebasseng på fredag gikk det lynraskt for « Fram XVI »,Etter trøbbel i Oslos havnebasseng på fredag gikk det lynraskt i Færderseilasen,Etter trøbbel i Oslos havnebasseng på fredag gikk det lynraskt for Fram,Etter trøbbel i Oslos havnebasseng på fredag gikk det lynraskt i Færderseilasen,for Fram,i Færderseilasen,gå,for « Fram XVI »,i Færderseilasen,5,2,for,i,Fram,Færderseilasen,PROPN,PROPN,prepositional,prepositional,Postverbal,NorwegianBokmaal
Den norske sølvmedaljevinneren fra OL i Beijing har nylig begynt å konkurrere på toppnivå igjen etter lekene i fjor høst .,Den norske sølvmedaljevinneren fra OL i Beijing har nylig begynt å konkurrere på toppnivå,Den norske sølvmedaljevinneren fra OL i Beijing har nylig begynt å konkurrere etter lekene i fjor høst,Den norske sølvmedaljevinneren fra OL i Beijing har nylig begynt å konkurrere på toppnivå,Den norske sølvmedaljevinneren fra OL i Beijing har nylig begynt å konkurrere etter lekene,på toppnivå,etter lek,konkurrere,på toppnivå,etter lekene i fjor høst,2,5,på,etter,toppnivå,lek,NOUN,NOUN,prepositional,prepositional,Postverbal,NorwegianBokmaal
"Etter å ha stått for en sensasjonell reparasjon av bilen midtveis i annen dag av rallyet , og kommet i mål mot alle odds , bestemte Solberg seg for å bryte rallyet .","Etter å ha stått for en sensasjonell reparasjon av bilen midtveis i annen dag av rallyet , og kommet i mål","Etter å ha stått for en sensasjonell reparasjon av bilen midtveis i annen dag av rallyet , og kommet mot alle odds","Etter å ha stått for en sensasjonell reparasjon av bilen midtveis i annen dag av rallyet , og kommet i mål","Etter å ha stått for en sensasjonell reparasjon av bilen midtveis i annen dag av rallyet , og kommet mot odds",i mål,mot odds,komme,i mål,mot alle odds,2,3,i,mot,mål,odds,NOUN,NOUN,prepositional,prepositional,Postverbal,NorwegianBokmaal
For det så umulig ut da venstre støtdemper slo gjennom panseret på nordmannens bil på ellevte fartsprøve .,For det så umulig ut da venstre støtdemper slo gjennom panseret på nordmannens bil,For det så umulig ut da venstre støtdemper slo på ellevte fartsprøve,For det så umulig ut da venstre støtdemper slo gjennom panseret,For det så umulig ut da venstre støtdemper slo på fartsprøve,gjennom panser,på fartsprøve,slå,gjennom panseret på nordmannens bil,på ellevte fartsprøve,5,3,gjennom,på,panser,fartsprøve,NOUN,NOUN,prepositional,prepositional,Postverbal,NorwegianBokmaal
Verdensmesteren fra 2003 slet med en dårlig bil i de siste årene som Subaru-kjører .,Verdensmesteren fra 2003 slet med en dårlig bil,Verdensmesteren fra 2003 slet i de siste årene som Subaru-kjører,Verdensmesteren fra 2003 slet med bil,Verdensmesteren fra 2003 slet i årene,med bil,i år,slite,med en dårlig bil,i de siste årene som Subaru-kjører,4,6,med,i,bil,år,NOUN,NOUN,prepositional,prepositional,Postverbal,NorwegianBokmaal
Stol i alle fall ikke på mytene !,Stol i alle fall,Stol på mytene,Stol i fall,Stol på mytene,i fall,på myte,stole,i alle fall,på mytene,3,2,i,på,fall,myte,NOUN,NOUN,prepositional,prepositional,Postverbal,NorwegianBokmaal
F.eks. sier de at homoseksuelle forbindelser ikke finnes i naturen hos andre arter .,F.eks. sier de at homoseksuelle forbindelser ikke finnes i naturen,F.eks. sier de at homoseksuelle forbindelser ikke finnes hos andre arter,F.eks. sier de at homoseksuelle forbindelser ikke finnes i naturen,F.eks. sier de at homoseksuelle forbindelser ikke finnes hos arter,i natur,hos art,finnes,i naturen,hos andre arter,2,3,i,hos,natur,art,NOUN,NOUN,prepositional,prepositional,Postverbal,NorwegianBokmaal
Men handler ikke heterofili i stor grad om sex også ?,Men handler ikke heterofili i stor grad,Men handler ikke heterofili om sex,Men handler ikke heterofili i grad,Men handler ikke heterofili om sex,i grad,om sex,handle,i stor grad,om sex,3,2,i,om,grad,sex,NOUN,NOUN,prepositional,prepositional,Postverbal,NorwegianBokmaal
Demonstranter protesterer mot militærkuppet foran presidentboligen i Honduras' hovedstad Tegucigalpa søndag .,Demonstranter protesterer mot militærkuppet,Demonstranter protesterer foran presidentboligen i Honduras' hovedstad Tegucigalpa,Demonstranter protesterer mot militærkuppet,Demonstranter protesterer foran presidentboligen,mot militærkupp,foran presidentbolig,protestere,mot militærkuppet,foran presidentboligen i Honduras' hovedstad Tegucigalpa,2,6,mot,foran,militærkupp,presidentbolig,NOUN,NOUN,prepositional,prepositional,Postverbal,NorwegianBokmaal
"Kongeparet får skryt , men utenriksminister Jonas Gahr Støre refser mildt Stortingets utenrikskomité som ikke har vært i Genève på 30 år .","Kongeparet får skryt , men utenriksminister Jonas Gahr Støre refser mildt Stortingets utenrikskomité som ikke har vært i Genève","Kongeparet får skryt , men utenriksminister Jonas Gahr Støre refser mildt Stortingets utenrikskomité som ikke har vært på 30 år","Kongeparet får skryt , men utenriksminister Jonas Gahr Støre refser mildt Stortingets utenrikskomité som ikke har vært i Genève","Kongeparet får skryt , men utenriksminister Jonas Gahr Støre refser mildt Stortingets utenrikskomité som ikke har vært på år",i Genève,på år,være,i Genève,på 30 år,2,3,i,på,Genève,år,PROPN,NOUN,prepositional,prepositional,Postverbal,NorwegianBokmaal
Det ble innledet i Genève i går .,Det ble innledet i Genève,Det ble innledet i går,Det ble innledet i Genève,Det ble innledet i går,i Genève,i går,innlede,i Genève,i går,2,2,i,i,Genève,går,PROPN,NOUN,prepositional,prepositional,Postverbal,NorwegianBokmaal
"Der var de blant annet på besøk i Verdens Helseorganisasjon ( WHO ) og møtte Gro Harlem Brundtlands etterfølger , generaldirektør Lee Jong-Wook .",Der var de blant annet,Der var de på besøk i Verdens Helseorganisasjon ( WHO ),Der var de blant annet,Der var de på besøk,blant annen,på besøk,være,blant annet,på besøk i Verdens Helseorganisasjon ( WHO ),2,8,blant,på,annen,besøk,DET,NOUN,prepositional,prepositional,Postverbal,NorwegianBokmaal
"Harald og Sonja var blant annet i SHOC-rommet , som er WHOs nye operasjonssentral .",Harald og Sonja var blant annet,"Harald og Sonja var i SHOC-rommet , som er WHOs nye operasjonssentral",Harald og Sonja var blant annet,Harald og Sonja var i SHOC-rommet,blant annen,i SHOC-rom,være,blant annet,"i SHOC-rommet , som er WHOs nye operasjonssentral",2,8,blant,i,annen,SHOC-rom,DET,NOUN,prepositional,prepositional,Postverbal,NorwegianBokmaal
Norge er det land som bidrar mest i verden i forhold til innbyggertall .,Norge er det land som bidrar mest i verden,Norge er det land som bidrar mest i forhold til innbyggertall,Norge er det land som bidrar mest i verden,Norge er det land som bidrar mest i forhold,i verden,i forhold,bidra,i verden,i forhold til innbyggertall,2,4,i,i,verden,forhold,NOUN,NOUN,prepositional,prepositional,Postverbal,NorwegianBokmaal
Nasjonalbiblioteket høstet i fjor for første gang inn systematisk alle de over 300 millioner norske nettsidene .,Nasjonalbiblioteket høstet i fjor,Nasjonalbiblioteket høstet for første gang,Nasjonalbiblioteket høstet i fjor,Nasjonalbiblioteket høstet for gang,i fjor,for gang,høste,i fjor,for første gang,2,3,i,for,fjor,gang,NOUN,NOUN,prepositional,prepositional,Postverbal,NorwegianBokmaal
Det står ingenting om sletting i pliktavleveringsloven .,Det står ingenting om sletting,Det står ingenting i pliktavleveringsloven,Det står ingenting om sletting,Det står ingenting i pliktavleveringsloven,om sletting,i pliktavleveringslov,stå,om sletting,i pliktavleveringsloven,2,2,om,i,sletting,pliktavleveringslov,NOUN,NOUN,prepositional,prepositional,Postverbal,NorwegianBokmaal
"Dersom mye stoff blir klausulert eller fjernet , vil vi ikke gi et riktig bilde av hva som foregikk i Norge på det aktuelle tidspunktet , sier hun .","Dersom mye stoff blir klausulert eller fjernet , vil vi ikke gi et riktig bilde av hva som foregikk i Norge","Dersom mye stoff blir klausulert eller fjernet , vil vi ikke gi et riktig bilde av hva som foregikk på det aktuelle tidspunktet","Dersom mye stoff blir klausulert eller fjernet , vil vi ikke gi et riktig bilde av hva som foregikk i Norge","Dersom mye stoff blir klausulert eller fjernet , vil vi ikke gi et riktig bilde av hva som foregikk på tidspunktet",i Norge,på tidspunkt,foregå,i Norge,på det aktuelle tidspunktet,2,4,i,på,Norge,tidspunkt,PROPN,NOUN,prepositional,prepositional,Postverbal,NorwegianBokmaal
For noen måneder siden oppfordret en Mikke Mus-liknende dukke palestinske barn til å ta til våpen mot Israel og USA .,For noen måneder siden oppfordret en Mikke Mus-liknende dukke palestinske barn til å ta til våpen,For noen måneder siden oppfordret en Mikke Mus-liknende dukke palestinske barn til å ta mot Israel og USA,For noen måneder siden oppfordret en Mikke Mus-liknende dukke palestinske barn til å ta til våpen,For noen måneder siden oppfordret en Mikke Mus-liknende dukke palestinske barn til å ta mot Israel,til våpen,mot Israel,ta,til våpen,mot Israel og USA,2,4,til,mot,våpen,Israel,NOUN,PROPN,prepositional,prepositional,Postverbal,NorwegianBokmaal
I februar sendte kanalen drapstrusler mot dansker og karikaturtegnerne i barneprogrammet .,I februar sendte kanalen drapstrusler mot dansker og karikaturtegnerne,I februar sendte kanalen drapstrusler i barneprogrammet,I februar sendte kanalen drapstrusler mot dansker,I februar sendte kanalen drapstrusler i barneprogrammet,mot danske,i barneprogram,sende,mot dansker og karikaturtegnerne,i barneprogrammet,4,2,mot,i,danske,barneprogram,NOUN,NOUN,prepositional,prepositional,Postverbal,NorwegianBokmaal
"Og med på laget har HMK Harald , som har stilt sin Fram XV til disposisjon i ett år .","Og med på laget har HMK Harald , som har stilt sin Fram XV til disposisjon","Og med på laget har HMK Harald , som har stilt sin Fram XV i ett år","Og med på laget har HMK Harald , som har stilt sin Fram XV til disposisjon","Og med på laget har HMK Harald , som har stilt sin Fram XV i år",til disposisjon,i år,stille,til disposisjon,i ett år,2,3,til,i,disposisjon,år,NOUN,NOUN,prepositional,prepositional,Postverbal,NorwegianBokmaal
"Skipper Thomas Nilsson , Geir Dahl Andersen ( taktiker ) , Kristoffer Spone ( rormann ) , Børre Hekk Paulen ( trimmer ) og Anders Myhre ( lukemann ) har seilt med Kongen i en årrekke .","Skipper Thomas Nilsson , Geir Dahl Andersen ( taktiker ) , Kristoffer Spone ( rormann ) , Børre Hekk Paulen ( trimmer ) og Anders Myhre ( lukemann ) har seilt med Kongen","Skipper Thomas Nilsson , Geir Dahl Andersen ( taktiker ) , Kristoffer Spone ( rormann ) , Børre Hekk Paulen ( trimmer ) og Anders Myhre ( lukemann ) har seilt i en årrekke","Skipper Thomas Nilsson , Geir Dahl Andersen ( taktiker ) , Kristoffer Spone ( rormann ) , Børre Hekk Paulen ( trimmer ) og Anders Myhre ( lukemann ) har seilt med Kongen","Skipper Thomas Nilsson , Geir Dahl Andersen ( taktiker ) , Kristoffer Spone ( rormann ) , Børre Hekk Paulen ( trimmer ) og Anders Myhre ( lukemann ) har seilt i årrekke",med Kongen,i årrekke,seile,med Kongen,i en årrekke,2,3,med,i,Kongen,årrekke,PROPN,NOUN,prepositional,prepositional,Postverbal,NorwegianBokmaal
"For dem som vil følge Kongens båt , starter der utenfor Aker Brygge klokken 12.40 i dag - sammen med 14 andre i samme klasse , men tilsammen 80 båter i samme felt .","For dem som vil følge Kongens båt , starter der utenfor Aker Brygge","For dem som vil følge Kongens båt , starter der - sammen med 14 andre i samme klasse , men tilsammen 80 båter i samme felt","For dem som vil følge Kongens båt , starter der utenfor Aker","For dem som vil følge Kongens båt , starter der med andre",utenfor Aker,med annen,starte,utenfor Aker Brygge,"- sammen med 14 andre i samme klasse , men tilsammen 80 båter i samme felt",3,16,utenfor,med,Aker,annen,PROPN,DET,prepositional,prepositional,Postverbal,NorwegianBokmaal
"Navneforskeren mener foreldrene kunne ha valgt for eksempel Märthasdatter eller Arisdatter som etternavn , i stedet for bare Behn .",Navneforskeren mener foreldrene kunne ha valgt for eksempel,"Navneforskeren mener foreldrene kunne ha valgt , i stedet for bare Behn",Navneforskeren mener foreldrene kunne ha valgt for eksempel,Navneforskeren mener foreldrene kunne ha valgt i stedet,for eksempel,i sted,velge,for eksempel,", i stedet for bare Behn",2,6,for,i,eksempel,sted,NOUN,NOUN,prepositional,prepositional,Postverbal,NorwegianBokmaal
