Sentence,Context_PP1,Context_PP2,Context_PP1_simple,Context_PP2_simple,PP1_simple,PP2_simple,Verb,PP1,PP2,PP1_len,PP2_len,Adp1,Adp2,NP1,NP2,PP1_Pronom,PP2_Pronom,PP1_Type,PP2_Type,Position,Language
"En forrykende festforestilling med 10000 tilskuere på campus første kvelden , dagen etter var nye 10000 samlet til selve markeringen i en av idrettsarenaene på campus .","En forrykende festforestilling med 10000 tilskuere på campus første kvelden , dagen etter var nye 10000 samlet til selve markeringen","En forrykende festforestilling med 10000 tilskuere på campus første kvelden , dagen etter var nye 10000 samlet i en av idrettsarenaene på campus","En forrykende festforestilling med 10000 tilskuere på campus første kvelden , dagen etter var nye 10000 samlet til markeringen","En forrykende festforestilling med 10000 tilskuere på campus første kvelden , dagen etter var nye 10000 samlet i en",til markering,i en,samle,til selve markeringen,i en av idrettsarenaene på campus,3,6,til,i,markering,en,NOUN,DET,prepositional,prepositional,Postverbal,NorwegianBokmaal
"Det er et prosjekt med direkte finansiering fra Beijing , og har som mål å utvikle 100 forskningsuniversiteter i verdensklasse i Kina innen 2020 .","Det er et prosjekt med direkte finansiering fra Beijing , og har som mål å utvikle 100 forskningsuniversiteter i verdensklasse i Kina","Det er et prosjekt med direkte finansiering fra Beijing , og har som mål å utvikle 100 forskningsuniversiteter i verdensklasse innen 2020","Det er et prosjekt med direkte finansiering fra Beijing , og har som mål å utvikle 100 forskningsuniversiteter i verdensklasse i Kina","Det er et prosjekt med direkte finansiering fra Beijing , og har som mål å utvikle 100 forskningsuniversiteter i verdensklasse innen 2020",i Kina,innen 2020,utvikle,i Kina,innen 2020,2,2,i,innen,Kina,2020,PROPN,NUM,prepositional,prepositional,Postverbal,NorwegianBokmaal
Kina ligger i « Chongqing-fart » i venstrefeltet på kunnskapsmotorveien .,Kina ligger i « Chongqing-fart »,Kina ligger i venstrefeltet på kunnskapsmotorveien,Kina ligger i Chongqing-fart,Kina ligger i venstrefeltet,i Chongqing-fart,i venstrefelt,ligge,i « Chongqing-fart »,i venstrefeltet på kunnskapsmotorveien,4,4,i,i,Chongqing-fart,venstrefelt,NOUN,NOUN,prepositional,prepositional,Postverbal,NorwegianBokmaal
Vil vi bare holde godt ut til høyre på denne motorveien slik at vi ikke blir påkjørt når de kommer opp bakfra - eller vil vi gi gass og søke å beholde noe av det forspranget vi tross alt ennå har i kunnskapsøkonomien ?,Vil vi bare holde godt ut til høyre,Vil vi bare holde på denne motorveien,Vil vi bare holde ut til høyre,Vil vi bare holde på motorveien,ut til høyre,på motorvei,holde,godt ut til høyre,på denne motorveien,4,3,ut til,på,høyre,motorvei,NOUN,NOUN,prepositional,prepositional,Postverbal,NorwegianBokmaal
"De krever at norske myndigheters skal gjøre en reell innsats for å få Abdulhak stilt for retten i London , og at ingen skal kunne være hevet over loven som her .",De krever at norske myndigheters skal gjøre en reell innsats for å få Abdulhak stilt for retten,De krever at norske myndigheters skal gjøre en reell innsats for å få Abdulhak stilt i London,De krever at norske myndigheters skal gjøre en reell innsats for å få Abdulhak stilt for retten,De krever at norske myndigheters skal gjøre en reell innsats for å få Abdulhak stilt i London,for rett,i London,stille,for retten,i London,2,2,for,i,rett,London,NOUN,PROPN,prepositional,prepositional,Postverbal,NorwegianBokmaal
"gjennom kombinasjon av politisk vilje , diplomatisk håndverk , økonomiske virkemidler , utradisjonelle allianser med ikke-statlige organisasjoner i sør , bidro Norge på en avgjørende måte i forhandlingsprosessen som ledet til at nærmere 100 land undertegnet konvensjonen i Oslo i fjor . »","gjennom kombinasjon av politisk vilje , diplomatisk håndverk , økonomiske virkemidler , utradisjonelle allianser med ikke-statlige organisasjoner i sør , bidro Norge på en avgjørende måte","gjennom kombinasjon av politisk vilje , diplomatisk håndverk , økonomiske virkemidler , utradisjonelle allianser med ikke-statlige organisasjoner i sør , bidro Norge i forhandlingsprosessen som ledet til at nærmere 100 land undertegnet konvensjonen i Oslo i fjor","gjennom kombinasjon av politisk vilje , diplomatisk håndverk , økonomiske virkemidler , utradisjonelle allianser med ikke-statlige organisasjoner i sør , bidro Norge på måte","gjennom kombinasjon av politisk vilje , diplomatisk håndverk , økonomiske virkemidler , utradisjonelle allianser med ikke-statlige organisasjoner i sør , bidro Norge i forhandlingsprosessen",på måte,i forhandlingsprosess,bidra,på en avgjørende måte,i forhandlingsprosessen som ledet til at nærmere 100 land undertegnet konvensjonen i Oslo i fjor,4,15,på,i,måte,forhandlingsprosess,NOUN,NOUN,prepositional,prepositional,Postverbal,NorwegianBokmaal
"gjennom kombinasjon av politisk vilje , diplomatisk håndverk , økonomiske virkemidler , utradisjonelle allianser med ikke-statlige organisasjoner i sør , bidro Norge på en avgjørende måte i forhandlingsprosessen som ledet til at nærmere 100 land undertegnet konvensjonen i Oslo i fjor . »","gjennom kombinasjon av politisk vilje , diplomatisk håndverk , økonomiske virkemidler , utradisjonelle allianser med ikke-statlige organisasjoner i sør , bidro Norge på en avgjørende måte i forhandlingsprosessen som ledet til at nærmere 100 land undertegnet konvensjonen i Oslo","gjennom kombinasjon av politisk vilje , diplomatisk håndverk , økonomiske virkemidler , utradisjonelle allianser med ikke-statlige organisasjoner i sør , bidro Norge på en avgjørende måte i forhandlingsprosessen som ledet til at nærmere 100 land undertegnet konvensjonen i fjor","gjennom kombinasjon av politisk vilje , diplomatisk håndverk , økonomiske virkemidler , utradisjonelle allianser med ikke-statlige organisasjoner i sør , bidro Norge på en avgjørende måte i forhandlingsprosessen som ledet til at nærmere 100 land undertegnet konvensjonen i Oslo","gjennom kombinasjon av politisk vilje , diplomatisk håndverk , økonomiske virkemidler , utradisjonelle allianser med ikke-statlige organisasjoner i sør , bidro Norge på en avgjørende måte i forhandlingsprosessen som ledet til at nærmere 100 land undertegnet konvensjonen i fjor",i Oslo,i fjor,undertegne,i Oslo,i fjor,2,2,i,i,Oslo,fjor,PROPN,NOUN,prepositional,prepositional,Postverbal,NorwegianBokmaal
Blant annet har en norsk muslimsk mor i Norge foreslått å presentere saken for den arabiske verden i Al-Jazzera i Doha .,Blant annet har en norsk muslimsk mor i Norge foreslått å presentere saken for den arabiske verden,Blant annet har en norsk muslimsk mor i Norge foreslått å presentere saken i Al-Jazzera i Doha,Blant annet har en norsk muslimsk mor i Norge foreslått å presentere saken for verden,Blant annet har en norsk muslimsk mor i Norge foreslått å presentere saken i Al-Jazzera,for verden,i Al-Jazzera,presentere,for den arabiske verden,i Al-Jazzera i Doha,4,4,for,i,verden,Al-Jazzera,NOUN,PROPN,prepositional,prepositional,Postverbal,NorwegianBokmaal
Dette er et initiativ som både speiler enkeltpersoners engasjement og at vi kan samles om fundamentale verdier som universelle - på tvers av religion og kulturer .,Dette er et initiativ som både speiler enkeltpersoners engasjement og at vi kan samles om fundamentale verdier,Dette er et initiativ som både speiler enkeltpersoners engasjement og at vi kan samles - på tvers av religion og kulturer,Dette er et initiativ som både speiler enkeltpersoners engasjement og at vi kan samles om verdier,Dette er et initiativ som både speiler enkeltpersoners engasjement og at vi kan samles på tvers,om verdi,på tvers,samle,om fundamentale verdier,- på tvers av religion og kulturer,3,7,om,på,verdi,tvers,NOUN,NOUN,prepositional,prepositional,Postverbal,NorwegianBokmaal
Det ble bekreftet av ambassadøren fra mistenktes hjemland som ( i likhet med meg ) i mars konstaterte at norske myndigheter bare forholder seg til hva engelske myndigheter gjør i saken .,Det ble bekreftet av ambassadøren fra mistenktes hjemland som ( i likhet med meg ),Det ble bekreftet av ambassadøren fra mistenktes hjemland som i mars,Det ble bekreftet av ambassadøren fra mistenktes hjemland som i likhet,Det ble bekreftet av ambassadøren fra mistenktes hjemland som i mars,i likhet,i mars,konstatere,( i likhet med meg ),i mars,6,2,i,i,likhet,mars,NOUN,NOUN,prepositional,prepositional,Preverbal,NorwegianBokmaal
"Men UDs interne motsetningsforhold , spenninger og meningsforskjeller som bl.a. kom til uttrykk i NRKs dokumentar om klasebombeprosessen tidligere i år , er tankevekkende .","Men UDs interne motsetningsforhold , spenninger og meningsforskjeller som bl.a. kom til uttrykk","Men UDs interne motsetningsforhold , spenninger og meningsforskjeller som bl.a. kom i NRKs dokumentar om klasebombeprosessen tidligere i år","Men UDs interne motsetningsforhold , spenninger og meningsforskjeller som bl.a. kom til uttrykk","Men UDs interne motsetningsforhold , spenninger og meningsforskjeller som bl.a. kom i dokumentar",til uttrykk,i dokumentar,komme,til uttrykk,i NRKs dokumentar om klasebombeprosessen tidligere i år,2,8,til,i,uttrykk,dokumentar,NOUN,NOUN,prepositional,prepositional,Postverbal,NorwegianBokmaal
"Denne mannen er i dag president i USA , og kommer om kort tid til Oslo for å motta Nobels fredspris .","Denne mannen er i dag president i USA , og kommer om kort tid","Denne mannen er i dag president i USA , og kommer til Oslo","Denne mannen er i dag president i USA , og kommer om tid","Denne mannen er i dag president i USA , og kommer til Oslo",om tid,til Oslo,komme,om kort tid,til Oslo,3,2,om,til,tid,Oslo,NOUN,PROPN,prepositional,prepositional,Postverbal,NorwegianBokmaal
"Det er riktignok slik at både det nasjonale og internasjonale kultursponsormarkedet har økt voldsomt de senere årene , og en omfattende undersøkelse viste at hele 30 prosent av norske bedrifter ga sponsorpenger til kulturlivet i 2006 .","Det er riktignok slik at både det nasjonale og internasjonale kultursponsormarkedet har økt voldsomt de senere årene , og en omfattende undersøkelse viste at hele 30 prosent av norske bedrifter ga sponsorpenger til kulturlivet","Det er riktignok slik at både det nasjonale og internasjonale kultursponsormarkedet har økt voldsomt de senere årene , og en omfattende undersøkelse viste at hele 30 prosent av norske bedrifter ga sponsorpenger i 2006","Det er riktignok slik at både det nasjonale og internasjonale kultursponsormarkedet har økt voldsomt de senere årene , og en omfattende undersøkelse viste at hele 30 prosent av norske bedrifter ga sponsorpenger til kulturlivet","Det er riktignok slik at både det nasjonale og internasjonale kultursponsormarkedet har økt voldsomt de senere årene , og en omfattende undersøkelse viste at hele 30 prosent av norske bedrifter ga sponsorpenger i 2006",til kulturliv,i 2006,gi,til kulturlivet,i 2006,2,2,til,i,kulturliv,2006,NOUN,NUM,prepositional,prepositional,Postverbal,NorwegianBokmaal
Norsk teater- og orkesterforening ( NTO ) gjorde i fjor sponsorundersøkelser blant 42 av sine medlemmer - dvs. de fleste profesjonelle musikk- og scenekunstinstitusjonene i Norge .,Norsk teater- og orkesterforening ( NTO ) gjorde i fjor,Norsk teater- og orkesterforening ( NTO ) gjorde blant 42 av sine medlemmer - dvs. de fleste profesjonelle musikk- og scenekunstinstitusjonene i Norge,Norsk teater- og orkesterforening ( NTO ) gjorde i fjor,Norsk teater- og orkesterforening ( NTO ) gjorde blant 42,i fjor,blant 42,gjøre,i fjor,blant 42 av sine medlemmer - dvs. de fleste profesjonelle musikk- og scenekunstinstitusjonene i Norge,2,15,i,blant,fjor,42,NOUN,NUM,prepositional,prepositional,Postverbal,NorwegianBokmaal
Derimot henger mye av de mangeårige sponsormidlene fra Hydro i en tynn tråd fra neste år .,Derimot henger mye av de mangeårige sponsormidlene fra Hydro i en tynn tråd,Derimot henger mye av de mangeårige sponsormidlene fra Hydro fra neste år,Derimot henger mye av de mangeårige sponsormidlene fra Hydro i tråd,Derimot henger mye av de mangeårige sponsormidlene fra Hydro fra år,i tråd,fra år,henge,i en tynn tråd,fra neste år,4,3,i,fra,tråd,år,NOUN,NOUN,prepositional,prepositional,Postverbal,NorwegianBokmaal
"Dette incentivet er riktignok heller ikke uproblematisk , men kan i motsetning til mange andre kreative forslag , i alle fall tjene som utgangspunkt for realistiske og konstruktive diskusjoner .","Dette incentivet er riktignok heller ikke uproblematisk , men kan i motsetning til mange andre kreative forslag ,","Dette incentivet er riktignok heller ikke uproblematisk , men kan i alle fall","Dette incentivet er riktignok heller ikke uproblematisk , men kan i motsetning","Dette incentivet er riktignok heller ikke uproblematisk , men kan i fall",i motsetning,i fall,tjene,"i motsetning til mange andre kreative forslag ,",i alle fall,8,3,i,i,motsetning,fall,NOUN,NOUN,prepositional,prepositional,Preverbal,NorwegianBokmaal
"50 år senere , da slekten Mendelsohn samles til jødisk høytid i Miami og seksårige Daniel kommer inn i rommet , gråter kvinnene og sukker på jiddisk :","50 år senere , da slekten Mendelsohn samles til jødisk høytid","50 år senere , da slekten Mendelsohn samles i Miami","50 år senere , da slekten Mendelsohn samles til høytid","50 år senere , da slekten Mendelsohn samles i Miami",til høytid,i Miami,samle,til jødisk høytid,i Miami,3,2,til,i,høytid,Miami,NOUN,PROPN,prepositional,prepositional,Postverbal,NorwegianBokmaal
"Shmiel var eldst av syv søsken og midtpunktet i familien , som utvandret til New York i 1912 .","Shmiel var eldst av syv søsken og midtpunktet i familien , som utvandret til New York","Shmiel var eldst av syv søsken og midtpunktet i familien , som utvandret i 1912","Shmiel var eldst av syv søsken og midtpunktet i familien , som utvandret til New","Shmiel var eldst av syv søsken og midtpunktet i familien , som utvandret i 1912",til New,i 1912,utvandre,til New York,i 1912,3,2,til,i,New,1912,PROPN,NUM,prepositional,prepositional,Postverbal,NorwegianBokmaal
"Sammen med broren , fotografen Matt , reiste han i fem år rundt på tre kontinenter på jakt etter overlevende , øyenvitner som kunne hjelpe ham til å få klarhet i hva som hadde hendt med hans utraderte familie .","Sammen med broren , fotografen Matt , reiste han i fem år","Sammen med broren , fotografen Matt , reiste han på jakt etter overlevende , øyenvitner som kunne hjelpe ham til å få klarhet i hva som hadde hendt med hans utraderte familie","Sammen med broren , fotografen Matt , reiste han i år","Sammen med broren , fotografen Matt , reiste han på jakt",i år,på jakt,reise,i fem år,"på jakt etter overlevende , øyenvitner som kunne hjelpe ham til å få klarhet i hva som hadde hendt med hans utraderte familie",3,23,i,på,år,jakt,NOUN,NOUN,prepositional,prepositional,Postverbal,NorwegianBokmaal
"Boken består av fem deler , med Mendelsohns odyssé som bunn .",Boken består av fem deler,"Boken består , med Mendelsohns odyssé som bunn",Boken består av deler,Boken består med odyssé,av del,med odyssé,bestå,av fem deler,", med Mendelsohns odyssé som bunn",3,6,av,med,del,odyssé,NOUN,NOUN,prepositional,prepositional,Postverbal,NorwegianBokmaal
"Mendelsohn løfter frem utallige overlevende , gir dem et navn og en skjebne , trekker frem i lyset den enkeltes erfaring mot historiens barbariske vilkårlighet .","Mendelsohn løfter frem utallige overlevende , gir dem et navn og en skjebne , trekker frem i lyset","Mendelsohn løfter frem utallige overlevende , gir dem et navn og en skjebne , trekker mot historiens barbariske vilkårlighet","Mendelsohn løfter frem utallige overlevende , gir dem et navn og en skjebne , trekker frem i lyset","Mendelsohn løfter frem utallige overlevende , gir dem et navn og en skjebne , trekker mot vilkårlighet",frem i lys,mot vilkårlighet,trekke,frem i lyset,mot historiens barbariske vilkårlighet,3,4,frem i,mot,lys,vilkårlighet,NOUN,NOUN,prepositional,prepositional,Postverbal,NorwegianBokmaal
Det gis rom for både kulde og hete i denne like hverdagsnære som sofistikert flerdimensjonale boken .,Det gis rom for både kulde og hete,Det gis rom i denne like hverdagsnære som sofistikert flerdimensjonale boken,Det gis rom for kulde,Det gis rom i boken,for kulde,i bok,gi,for både kulde og hete,i denne like hverdagsnære som sofistikert flerdimensjonale boken,5,8,for,i,kulde,bok,NOUN,NOUN,prepositional,prepositional,Postverbal,NorwegianBokmaal
"Å frata mennesker adgang til sitt livsgrunnlag , slik det skjedde i 1852 og har skjedd blant sjøsamene frem til 2009 , vil resultere i makt og motmakt .","Å frata mennesker adgang til sitt livsgrunnlag , slik det skjedde i 1852 og har skjedd blant sjøsamene","Å frata mennesker adgang til sitt livsgrunnlag , slik det skjedde i 1852 og har skjedd frem til 2009","Å frata mennesker adgang til sitt livsgrunnlag , slik det skjedde i 1852 og har skjedd blant sjøsamene","Å frata mennesker adgang til sitt livsgrunnlag , slik det skjedde i 1852 og har skjedd frem til 2009",blant sjøsame,frem til 2009,skje,blant sjøsamene,frem til 2009,2,3,blant,frem til,sjøsame,2009,NOUN,NUM,prepositional,prepositional,Postverbal,NorwegianBokmaal
"Av Lindners arbeider , Humiliation and International Conflict ( 2006 ) og Emotion and Conflict ( 2008 ) , fremgår det hvorfor krenkelser av menneskerettigheter og urettferdighet vil føre til konflikter på ulike nivå .","Av Lindners arbeider , Humiliation and International Conflict ( 2006 ) og Emotion and Conflict ( 2008 ) , fremgår det hvorfor krenkelser av menneskerettigheter og urettferdighet vil føre til konflikter","Av Lindners arbeider , Humiliation and International Conflict ( 2006 ) og Emotion and Conflict ( 2008 ) , fremgår det hvorfor krenkelser av menneskerettigheter og urettferdighet vil føre på ulike nivå","Av Lindners arbeider , Humiliation and International Conflict ( 2006 ) og Emotion and Conflict ( 2008 ) , fremgår det hvorfor krenkelser av menneskerettigheter og urettferdighet vil føre til konflikter","Av Lindners arbeider , Humiliation and International Conflict ( 2006 ) og Emotion and Conflict ( 2008 ) , fremgår det hvorfor krenkelser av menneskerettigheter og urettferdighet vil føre på nivå",til konflikt,på nivå,føre,til konflikter,på ulike nivå,2,3,til,på,konflikt,nivå,NOUN,NOUN,prepositional,prepositional,Postverbal,NorwegianBokmaal
"Programmet viste hvordan råvarekappløp og markedsmekanismer , støttet av regjeringer , har stengt folk ute fra deres gamle livsgrunnlag , i strid med ILO-konvensjonen og FNs menneskerettigheter .","Programmet viste hvordan råvarekappløp og markedsmekanismer , støttet av regjeringer , har stengt folk ute fra deres gamle livsgrunnlag","Programmet viste hvordan råvarekappløp og markedsmekanismer , støttet av regjeringer , har stengt folk , i strid med ILO-konvensjonen og FNs menneskerettigheter","Programmet viste hvordan råvarekappløp og markedsmekanismer , støttet av regjeringer , har stengt folk ute fra livsgrunnlag","Programmet viste hvordan råvarekappløp og markedsmekanismer , støttet av regjeringer , har stengt folk i strid",ute fra livsgrunnlag,i strid,stenge,ute fra deres gamle livsgrunnlag,", i strid med ILO-konvensjonen og FNs menneskerettigheter",5,8,ute fra,i,livsgrunnlag,strid,NOUN,NOUN,prepositional,prepositional,Postverbal,NorwegianBokmaal
"Vi søker kur og terapi , fokuserer på sykelighet i stedet for friskhet , premierer sykdom med trygd .","Vi søker kur og terapi , fokuserer på sykelighet","Vi søker kur og terapi , fokuserer i stedet for friskhet","Vi søker kur og terapi , fokuserer på sykelighet","Vi søker kur og terapi , fokuserer i stedet",på sykelighet,i sted,fokusere,på sykelighet,i stedet for friskhet,2,4,på,i,sykelighet,sted,NOUN,NOUN,prepositional,prepositional,Postverbal,NorwegianBokmaal
Vi er den generasjonen som fikk oljen til jul i 1969 og som på død og liv skal se hver dråpe brukt opp før vi takker for oss .,Vi er den generasjonen som fikk oljen til jul,Vi er den generasjonen som fikk oljen i 1969,Vi er den generasjonen som fikk oljen til jul,Vi er den generasjonen som fikk oljen i 1969,til jul,i 1969,få,til jul,i 1969,2,2,til,i,jul,1969,NOUN,NUM,prepositional,prepositional,Postverbal,NorwegianBokmaal
"Det er oss som i 40 - 50 år har stappet i oss fra verdens mest generøse buffet , og nå ser frem til en alderdom på spa .",Det er oss som i 40 - 50 år har stappet i oss,Det er oss som i 40 - 50 år har stappet fra verdens mest generøse buffet,Det er oss som i 40 - 50 år har stappet i oss,Det er oss som i 40 - 50 år har stappet fra buffet,i vi,fra buffé,stappe,i oss,fra verdens mest generøse buffet,2,5,i,fra,vi,buffé,PRON,NOUN,prepositional,prepositional,Postverbal,NorwegianBokmaal
Vi har nå et kommersielt system som fokuserer på sykelighet i stedet for friskhet .,Vi har nå et kommersielt system som fokuserer på sykelighet,Vi har nå et kommersielt system som fokuserer i stedet for friskhet,Vi har nå et kommersielt system som fokuserer på sykelighet,Vi har nå et kommersielt system som fokuserer i stedet,på sykelighet,i sted,fokusere,på sykelighet,i stedet for friskhet,2,4,på,i,sykelighet,sted,NOUN,NOUN,prepositional,prepositional,Postverbal,NorwegianBokmaal
Dessverre går de fleste også ut min dør med premien sin i hånden - papiret med stempel på .,Dessverre går de fleste også ut min dør,Dessverre går de fleste også med premien sin i hånden - papiret med stempel på,Dessverre går de fleste også ut dør,Dessverre går de fleste også med premien,ut dør,med premie,gå,ut min dør,med premien sin i hånden - papiret med stempel på,3,10,ut,med,dør,premie,NOUN,NOUN,prepositional,prepositional,Postverbal,NorwegianBokmaal
"Vitenskap taper mot frykt , føleri og synsing i en norsk helsehverdag .","Vitenskap taper mot frykt , føleri og synsing",Vitenskap taper i en norsk helsehverdag,Vitenskap taper mot frykt,Vitenskap taper i helsehverdag,mot frykt,i helsehverdag,tape,"mot frykt , føleri og synsing",i en norsk helsehverdag,6,4,mot,i,frykt,helsehverdag,NOUN,NOUN,prepositional,prepositional,Postverbal,NorwegianBokmaal
"Den balansegangen er utfordrende , fordi det offentlige ikke tør eller evner å markere grenser , sette fungerende normer , lage kontrollmekanismer og flytte siktemålet fra ensidig å vekte mot sykdom og trygd i stedet for mot arbeid , liv og friskhet .","Den balansegangen er utfordrende , fordi det offentlige ikke tør eller evner å markere grenser , sette fungerende normer , lage kontrollmekanismer og flytte siktemålet fra ensidig å vekte mot sykdom og trygd","Den balansegangen er utfordrende , fordi det offentlige ikke tør eller evner å markere grenser , sette fungerende normer , lage kontrollmekanismer og flytte siktemålet fra ensidig å vekte i stedet for mot arbeid , liv og friskhet","Den balansegangen er utfordrende , fordi det offentlige ikke tør eller evner å markere grenser , sette fungerende normer , lage kontrollmekanismer og flytte siktemålet fra ensidig å vekte mot sykdom","Den balansegangen er utfordrende , fordi det offentlige ikke tør eller evner å markere grenser , sette fungerende normer , lage kontrollmekanismer og flytte siktemålet fra ensidig å vekte i stedet",mot sykdom,i sted,vekte,mot sykdom og trygd,"i stedet for mot arbeid , liv og friskhet",4,9,mot,i,sykdom,sted,NOUN,NOUN,prepositional,prepositional,Postverbal,NorwegianBokmaal
"Rektor ringte og fortalte at Bønna hadde stengt den unge vikaren inne på grupperommet , og deretter "" truet "" med å sette fyr på klærne ute i garderoben , men det var jo kun ment som en spøk !","Rektor ringte og fortalte at Bønna hadde stengt den unge vikaren inne på grupperommet , og deretter "" truet "" med å sette fyr på klærne","Rektor ringte og fortalte at Bønna hadde stengt den unge vikaren inne på grupperommet , og deretter "" truet "" med å sette fyr ute i garderoben","Rektor ringte og fortalte at Bønna hadde stengt den unge vikaren inne på grupperommet , og deretter "" truet "" med å sette fyr på klærne","Rektor ringte og fortalte at Bønna hadde stengt den unge vikaren inne på grupperommet , og deretter "" truet "" med å sette fyr ute i garderoben",på klær,ute i garderobe,sette,på klærne,ute i garderoben,2,3,på,ute i,klær,garderobe,NOUN,NOUN,prepositional,prepositional,Postverbal,NorwegianBokmaal
"Rektor påsto at Bønna hadde trykket på brannalarmen med vilje , men Bønna sier at han bare skulle hjelpe en god venn og dermed kom han helt tilfeldig borti alarmen .",Rektor påsto at Bønna hadde trykket på brannalarmen,Rektor påsto at Bønna hadde trykket med vilje,Rektor påsto at Bønna hadde trykket på brannalarmen,Rektor påsto at Bønna hadde trykket med vilje,på brannalarm,med vilje,trykke,på brannalarmen,med vilje,2,2,på,med,brannalarm,vilje,NOUN,NOUN,prepositional,prepositional,Postverbal,NorwegianBokmaal
"Når Bønna blir trist hjemme , får han roe seg foran Xboxen med litt vingummi og cheese doodles .","Når Bønna blir trist hjemme , får han roe seg foran Xboxen","Når Bønna blir trist hjemme , får han roe seg med litt vingummi og cheese doodles","Når Bønna blir trist hjemme , får han roe seg foran Xboxen","Når Bønna blir trist hjemme , får han roe seg med vingummi",foran Xboxen,med vingummi,roe,foran Xboxen,med litt vingummi og cheese doodles,2,6,foran,med,Xboxen,vingummi,PROPN,NOUN,prepositional,prepositional,Postverbal,NorwegianBokmaal
