Sentence,Context_PP1,Context_PP2,Context_PP1_simple,Context_PP2_simple,PP1_simple,PP2_simple,Verb,PP1,PP2,PP1_len,PP2_len,Adp1,Adp2,NP1,NP2,PP1_Pronom,PP2_Pronom,PP1_Type,PP2_Type,Position,Language
Det er difor ikkje sikkert at det å nemna kultur og språk i same andedraget i ei lov- eller grunnlovsføresegn vil vera eit tilstrekkeleg presist uttrykk for det ein tek sikte på å fanga inn .,Det er difor ikkje sikkert at det å nemna kultur og språk i same andedraget,Det er difor ikkje sikkert at det å nemna kultur og språk i ei lov- eller grunnlovsføresegn,Det er difor ikkje sikkert at det å nemna kultur og språk i andedraget,Det er difor ikkje sikkert at det å nemna kultur og språk i lov-,i andedrag,i lov-,nemne,i same andedraget,i ei lov- eller grunnlovsføresegn,3,5,i,i,andedrag,lov-,NOUN,NOUN,prepositional,prepositional,Postverbal,NorwegianNynorsk
"Når lova til dømes fastset at eit statsorgan skal svara på skriv frå private rettssubjekt i den målforma som er nytta i skrivet , må no dette også tolkast slik at vedkomande har krav på å få svar på norsk , jamvel om det ikkje er sagt direkte .",Når lova til dømes fastset at eit statsorgan skal svara på skriv frå private rettssubjekt,Når lova til dømes fastset at eit statsorgan skal svara i den målforma som er nytta i skrivet,Når lova til dømes fastset at eit statsorgan skal svara på skriv,Når lova til dømes fastset at eit statsorgan skal svara i målforma,på skriv,i målform,svare,på skriv frå private rettssubjekt,i den målforma som er nytta i skrivet,5,8,på,i,skriv,målform,NOUN,NOUN,prepositional,prepositional,Postverbal,NorwegianNynorsk
Det er såleis ikkje noko i lova som hindrar eit statsorgan i å bruka engelsk i større eller mindre grad i staden for norsk .,Det er såleis ikkje noko i lova som hindrar eit statsorgan i å bruka engelsk i større eller mindre grad,Det er såleis ikkje noko i lova som hindrar eit statsorgan i å bruka engelsk i staden for norsk,Det er såleis ikkje noko i lova som hindrar eit statsorgan i å bruka engelsk i grad,Det er såleis ikkje noko i lova som hindrar eit statsorgan i å bruka engelsk i staden,i grad,i stad,bruke,i større eller mindre grad,i staden for norsk,5,4,i,i,grad,stad,NOUN,NOUN,prepositional,prepositional,Postverbal,NorwegianNynorsk
"Det heitte vidare at lova skulle ta klart sikte på å motverka at dansk lir domenetap , dvs. at det danske språket ikkje vik for engelsk innanfor vitskap , høgare utdanning , næringsliv og offentleg forvaltning .","Det heitte vidare at lova skulle ta klart sikte på å motverka at dansk lir domenetap , dvs. at det danske språket ikkje vik for engelsk","Det heitte vidare at lova skulle ta klart sikte på å motverka at dansk lir domenetap , dvs. at det danske språket ikkje vik innanfor vitskap , høgare utdanning , næringsliv og offentleg forvaltning","Det heitte vidare at lova skulle ta klart sikte på å motverka at dansk lir domenetap , dvs. at det danske språket ikkje vik for engelsk","Det heitte vidare at lova skulle ta klart sikte på å motverka at dansk lir domenetap , dvs. at det danske språket ikkje vik innanfor vitskap",for engelsk,innanfor vitskap,vike,for engelsk,"innanfor vitskap , høgare utdanning , næringsliv og offentleg forvaltning",2,10,for,innanfor,engelsk,vitskap,NOUN,NOUN,prepositional,prepositional,Postverbal,NorwegianNynorsk
"Denne saka er avhengig av ei nærare avklaring i spørsmålet om den generelle grunnlovsutviklinga i tida framover , mellom anna i kva grad ein skal byggja ut Grunnlova med stadig fleire spesialføresegner , jamført med ei meir restriktiv grunnlovslinje .","Denne saka er avhengig av ei nærare avklaring i spørsmålet om den generelle grunnlovsutviklinga i tida framover , mellom anna","Denne saka er avhengig av ei nærare avklaring i spørsmålet om den generelle grunnlovsutviklinga i tida framover , i kva grad","Denne saka er avhengig av ei nærare avklaring i spørsmålet om den generelle grunnlovsutviklinga i tida framover , mellom anna","Denne saka er avhengig av ei nærare avklaring i spørsmålet om den generelle grunnlovsutviklinga i tida framover , i grad",mellom annan,i grad,byggje,mellom anna,i kva grad,2,3,mellom,i,annan,grad,DET,NOUN,prepositional,prepositional,Preverbal,NorwegianNynorsk
Det vart vist til at departementet ville koma tilbake til saka i annan samanheng .,Det vart vist til at departementet ville koma tilbake til saka,Det vart vist til at departementet ville koma tilbake i annan samanheng,Det vart vist til at departementet ville koma tilbake til saka,Det vart vist til at departementet ville koma tilbake i samanheng,til sak,i samanheng,kome,til saka,i annan samanheng,2,3,til,i,sak,samanheng,NOUN,NOUN,prepositional,prepositional,Postverbal,NorwegianNynorsk
"Dessutan har Samferdselsdepartementet erfart at dei tre nemnde selskapa på deira område ikkje har etterlevd prinsippa i mållova godt nok , trass i den uttrykkjelege føresegna i vedtektene .",Dessutan har Samferdselsdepartementet erfart at dei tre nemnde selskapa på deira område ikkje har etterlevd prinsippa i mållova,"Dessutan har Samferdselsdepartementet erfart at dei tre nemnde selskapa på deira område ikkje har etterlevd prinsippa , trass i den uttrykkjelege føresegna i vedtektene",Dessutan har Samferdselsdepartementet erfart at dei tre nemnde selskapa på deira område ikkje har etterlevd prinsippa i mållova,Dessutan har Samferdselsdepartementet erfart at dei tre nemnde selskapa på deira område ikkje har etterlevd prinsippa trass i føresegna,i mållov,trass i føresegn,etterleve,i mållova,", trass i den uttrykkjelege føresegna i vedtektene",2,8,i,trass i,mållov,føresegn,NOUN,NOUN,prepositional,prepositional,Postverbal,NorwegianNynorsk
Som gjennomgåande system vil det likevel vera vanskeleg å regulera målbruken i offentlege verksemder utanfor forvaltninga gjennom vedtektsfesting i kvart enkelt tilfelle .,Som gjennomgåande system vil det likevel vera vanskeleg å regulera målbruken i offentlege verksemder utanfor forvaltninga,Som gjennomgåande system vil det likevel vera vanskeleg å regulera målbruken gjennom vedtektsfesting i kvart enkelt tilfelle,Som gjennomgåande system vil det likevel vera vanskeleg å regulera målbruken i verksemder,Som gjennomgåande system vil det likevel vera vanskeleg å regulera målbruken gjennom vedtektsfesting,i verksemd,gjennom vedtektsfesting,regulere,i offentlege verksemder utanfor forvaltninga,gjennom vedtektsfesting i kvart enkelt tilfelle,5,6,i,gjennom,verksemd,vedtektsfesting,NOUN,NOUN,prepositional,prepositional,Postverbal,NorwegianNynorsk
"Som døme på rettssubjekt som vil falla utanfor verkeområdet for lova på dette siste grunnlaget , nemner proposisjonen Statoil og Telenor .",Som døme på rettssubjekt som vil falla utanfor verkeområdet for lova,Som døme på rettssubjekt som vil falla på dette siste grunnlaget,Som døme på rettssubjekt som vil falla utanfor verkeområdet,Som døme på rettssubjekt som vil falla på grunnlaget,utanfor verkeområde,på grunnlag,falle,utanfor verkeområdet for lova,på dette siste grunnlaget,4,4,utanfor,på,verkeområde,grunnlag,NOUN,NOUN,prepositional,prepositional,Postverbal,NorwegianNynorsk
Ved ei klarare avgrensing av verkeområdet slik som skissert ovanfor vil mållova fanga opp ein del verksemder som i dag i liten grad praktiserer måljamstilling etter gjeldande reglar .,Ved ei klarare avgrensing av verkeområdet slik som skissert ovanfor vil mållova fanga opp ein del verksemder som i dag,Ved ei klarare avgrensing av verkeområdet slik som skissert ovanfor vil mållova fanga opp ein del verksemder som i liten grad,Ved ei klarare avgrensing av verkeområdet slik som skissert ovanfor vil mållova fanga opp ein del verksemder som i dag,Ved ei klarare avgrensing av verkeområdet slik som skissert ovanfor vil mållova fanga opp ein del verksemder som i grad,i dag,i grad,praktisere,i dag,i liten grad,2,3,i,i,dag,grad,NOUN,NOUN,prepositional,prepositional,Preverbal,NorwegianNynorsk
Ikkje minst må det leggjast til rette for at begge målformene kjem godt til syne i allment informasjonstilfang på Internett .,Ikkje minst må det leggjast til rette for at begge målformene kjem godt til syne,Ikkje minst må det leggjast til rette for at begge målformene kjem i allment informasjonstilfang på Internett,Ikkje minst må det leggjast til rette for at begge målformene kjem til syne,Ikkje minst må det leggjast til rette for at begge målformene kjem i informasjonstilfang,til syne,i informasjonstilfang,kome,godt til syne,i allment informasjonstilfang på Internett,3,5,til,i,syne,informasjonstilfang,NOUN,NOUN,prepositional,prepositional,Postverbal,NorwegianNynorsk
"Sentralt her står kravet om bruk av minst 25 prosent av kvar målform i allment informasjonstilfang frå sentrale statsorgan , dessutan plikta alle statsorgan har , til å svara på skriv frå private rettssubjekt i den målforma som er nytta i vedkomande skriv .","Sentralt her står kravet om bruk av minst 25 prosent av kvar målform i allment informasjonstilfang frå sentrale statsorgan , dessutan plikta alle statsorgan har , til å svara på skriv frå private rettssubjekt","Sentralt her står kravet om bruk av minst 25 prosent av kvar målform i allment informasjonstilfang frå sentrale statsorgan , dessutan plikta alle statsorgan har , til å svara i den målforma som er nytta i vedkomande skriv","Sentralt her står kravet om bruk av minst 25 prosent av kvar målform i allment informasjonstilfang frå sentrale statsorgan , dessutan plikta alle statsorgan har , til å svara på skriv","Sentralt her står kravet om bruk av minst 25 prosent av kvar målform i allment informasjonstilfang frå sentrale statsorgan , dessutan plikta alle statsorgan har , til å svara i målforma",på skriv,i målform,svare,på skriv frå private rettssubjekt,i den målforma som er nytta i vedkomande skriv,5,9,på,i,skriv,målform,NOUN,NOUN,prepositional,prepositional,Postverbal,NorwegianNynorsk
For det tredje skal sentrale statsorgan nytta fleirtalsmålforma innanfor eit geografisk avgrensa område i alt utoverretta informasjonstilfang som har særleg tilknyting til dette området .,For det tredje skal sentrale statsorgan nytta fleirtalsmålforma innanfor eit geografisk avgrensa område,For det tredje skal sentrale statsorgan nytta fleirtalsmålforma i alt utoverretta informasjonstilfang som har særleg tilknyting til dette området,For det tredje skal sentrale statsorgan nytta fleirtalsmålforma innanfor område,For det tredje skal sentrale statsorgan nytta fleirtalsmålforma i informasjonstilfang,innanfor område,i informasjonstilfang,nytte,innanfor eit geografisk avgrensa område,i alt utoverretta informasjonstilfang som har særleg tilknyting til dette området,5,11,innanfor,i,område,informasjonstilfang,NOUN,NOUN,prepositional,prepositional,Postverbal,NorwegianNynorsk
Det kommunaldemokratiske systemet har dermed innebygd i seg ein mekanisme som i praksis gjer at nynorsk når opp til offisiell status som regionalt statleg bruksmål i noko større delar av landet enn det som ville vore tilfellet dersom til dømes reine fleirtalsvurderingar blant innbyggjarane skulle ha avgjort spørsmålet .,Det kommunaldemokratiske systemet har dermed innebygd i seg ein mekanisme som i praksis gjer at nynorsk når opp til offisiell status som regionalt statleg bruksmål,Det kommunaldemokratiske systemet har dermed innebygd i seg ein mekanisme som i praksis gjer at nynorsk når i noko større delar av landet enn det som ville vore tilfellet dersom til dømes reine fleirtalsvurderingar blant innbyggjarane skulle ha avgjort spørsmålet,Det kommunaldemokratiske systemet har dermed innebygd i seg ein mekanisme som i praksis gjer at nynorsk når opp til status,Det kommunaldemokratiske systemet har dermed innebygd i seg ein mekanisme som i praksis gjer at nynorsk når i delar,opp til status,i del,nå,opp til offisiell status som regionalt statleg bruksmål,i noko større delar av landet enn det som ville vore tilfellet dersom til dømes reine fleirtalsvurderingar blant innbyggjarane skulle ha avgjort spørsmålet,8,23,opp til,i,status,del,NOUN,NOUN,prepositional,prepositional,Postverbal,NorwegianNynorsk
"Ikkje minst er måljamstilling eit viktig omsyn når det blir utvikla store , sentrale etatssystem som skal brukast av både statlege , fylkeskommunale og kommunale styresmakter i deira hopehav med publikum .","Ikkje minst er måljamstilling eit viktig omsyn når det blir utvikla store , sentrale etatssystem som skal brukast av både statlege , fylkeskommunale og kommunale styresmakter","Ikkje minst er måljamstilling eit viktig omsyn når det blir utvikla store , sentrale etatssystem som skal brukast i deira hopehav med publikum","Ikkje minst er måljamstilling eit viktig omsyn når det blir utvikla store , sentrale etatssystem som skal brukast av styresmakter","Ikkje minst er måljamstilling eit viktig omsyn når det blir utvikla store , sentrale etatssystem som skal brukast i hopehav",av styresmakt,i hopehav,bruke,"av både statlege , fylkeskommunale og kommunale styresmakter",i deira hopehav med publikum,8,5,av,i,styresmakt,hopehav,NOUN,NOUN,prepositional,prepositional,Postverbal,NorwegianNynorsk
"« Dersom ikkje intensivert innsats og dei andre skisserte tiltaka i denne meldinga gir snarlege og tilfredsstillande resultat , vil regjeringa vurdera om det kan vera tenleg å ta i bruk sanksjonar av meir negativ karakter overfor statsorgan som ikkje viser vilje til å etterleva målbruksreglane . »","« Dersom ikkje intensivert innsats og dei andre skisserte tiltaka i denne meldinga gir snarlege og tilfredsstillande resultat , vil regjeringa vurdera om det kan vera tenleg å ta i bruk","« Dersom ikkje intensivert innsats og dei andre skisserte tiltaka i denne meldinga gir snarlege og tilfredsstillande resultat , vil regjeringa vurdera om det kan vera tenleg å ta overfor statsorgan som ikkje viser vilje til å etterleva målbruksreglane","« Dersom ikkje intensivert innsats og dei andre skisserte tiltaka i denne meldinga gir snarlege og tilfredsstillande resultat , vil regjeringa vurdera om det kan vera tenleg å ta i bruk","« Dersom ikkje intensivert innsats og dei andre skisserte tiltaka i denne meldinga gir snarlege og tilfredsstillande resultat , vil regjeringa vurdera om det kan vera tenleg å ta overfor statsorgan",i bruk,overfor statsorgan,ta,i bruk,overfor statsorgan som ikkje viser vilje til å etterleva målbruksreglane,2,10,i,overfor,bruk,statsorgan,NOUN,NOUN,prepositional,prepositional,Postverbal,NorwegianNynorsk
Slike spørsmål fekk etter kvart større merksemd utover i 1990-åra .,Slike spørsmål fekk etter kvart,Slike spørsmål fekk utover i 1990-åra,Slike spørsmål fekk etter kvart,Slike spørsmål fekk i 1990-åra,etter kvar,i 1990-år,få,etter kvart,utover i 1990-åra,2,3,etter,i,kvar,1990-år,DET,NOUN,prepositional,prepositional,Postverbal,NorwegianNynorsk
"Eg meiner at det var tilfellet i den førre regjeringa , der ein såg at ein veldig stor del av pengane som var til disposisjon , gjekk til skattelette i staden for til å byggja ut offentleg velferd .","Eg meiner at det var tilfellet i den førre regjeringa , der ein såg at ein veldig stor del av pengane som var til disposisjon , gjekk til skattelette","Eg meiner at det var tilfellet i den førre regjeringa , der ein såg at ein veldig stor del av pengane som var til disposisjon , gjekk i staden for til å byggja ut offentleg velferd","Eg meiner at det var tilfellet i den førre regjeringa , der ein såg at ein veldig stor del av pengane som var til disposisjon , gjekk til skattelette","Eg meiner at det var tilfellet i den førre regjeringa , der ein såg at ein veldig stor del av pengane som var til disposisjon , gjekk i staden",til skattelette,i stad,gå,til skattelette,i staden for til å byggja ut offentleg velferd,2,9,til,i,skattelette,stad,NOUN,NOUN,prepositional,prepositional,Postverbal,NorwegianNynorsk
"Representanten Dagfinn Høybråten kringkasta til det norske folket tidlegare i dag at han vil vere endå tydelegare enn leiaren i Venstre , Lars Sponheim , i spørsmålet om ei ny regjering .",Representanten Dagfinn Høybråten kringkasta til det norske folket,Representanten Dagfinn Høybråten kringkasta tidlegare i dag,Representanten Dagfinn Høybråten kringkasta til folket,Representanten Dagfinn Høybråten kringkasta i dag,til folk,i dag,kringkaste,til det norske folket,tidlegare i dag,4,3,til,i,folk,dag,NOUN,NOUN,prepositional,prepositional,Postverbal,NorwegianNynorsk
"Vi har lenge vore vitne til at Høgre , som Kristeleg Folkeparti sat i regjering med frå 2001 til 2005 , held døra open for fleire regjeringsalternativ på borgarleg side .","Vi har lenge vore vitne til at Høgre , som Kristeleg Folkeparti sat i regjering med","Vi har lenge vore vitne til at Høgre , som Kristeleg Folkeparti sat frå 2001 til 2005","Vi har lenge vore vitne til at Høgre , som Kristeleg Folkeparti sat i regjering","Vi har lenge vore vitne til at Høgre , som Kristeleg Folkeparti sat frå 2001",i regjering,frå 2001,sitje,i regjering med,frå 2001 til 2005,3,4,i,frå,regjering,2001,NOUN,NUM,prepositional,prepositional,Postverbal,NorwegianNynorsk
Høgre vil regjere saman med Framstegspartiet i ei brei borgarleg regjering .,Høgre vil regjere saman med Framstegspartiet,Høgre vil regjere i ei brei borgarleg regjering,Høgre vil regjere med Framstegspartiet,Høgre vil regjere i regjering,med Framstegspartiet,i regjering,regjere,saman med Framstegspartiet,i ei brei borgarleg regjering,3,5,med,i,Framstegspartiet,regjering,NOUN,NOUN,prepositional,prepositional,Postverbal,NorwegianNynorsk
"Er representanten Sponheim komfortabel med den uklare situasjonen som rår ved at Høgre framleis , mindre enn eitt år før stortingsvalet , satsar på to hestar i regjeringsspørsmålet ?","Er representanten Sponheim komfortabel med den uklare situasjonen som rår ved at Høgre framleis , mindre enn eitt år før stortingsvalet , satsar på to hestar","Er representanten Sponheim komfortabel med den uklare situasjonen som rår ved at Høgre framleis , mindre enn eitt år før stortingsvalet , satsar i regjeringsspørsmålet","Er representanten Sponheim komfortabel med den uklare situasjonen som rår ved at Høgre framleis , mindre enn eitt år før stortingsvalet , satsar på hestar","Er representanten Sponheim komfortabel med den uklare situasjonen som rår ved at Høgre framleis , mindre enn eitt år før stortingsvalet , satsar i regjeringsspørsmålet",på hest,i regjeringsspørsmål,satse,på to hestar,i regjeringsspørsmålet,3,2,på,i,hest,regjeringsspørsmål,NOUN,NOUN,prepositional,prepositional,Postverbal,NorwegianNynorsk
"Arbeidarpartiet gjekk til val på arbeid til alle , ein betre fellesskule , betre eldreomsorg og ei meir rettferdig fordeling .",Arbeidarpartiet gjekk til val,"Arbeidarpartiet gjekk på arbeid til alle , ein betre fellesskule , betre eldreomsorg og ei meir rettferdig fordeling",Arbeidarpartiet gjekk til val,Arbeidarpartiet gjekk på arbeid,til val,på arbeid,gå,til val,"på arbeid til alle , ein betre fellesskule , betre eldreomsorg og ei meir rettferdig fordeling",2,16,til,på,val,arbeid,NOUN,NOUN,prepositional,prepositional,Postverbal,NorwegianNynorsk
"Folk som ikkje var i nærleiken då bonusane blei betalte ut , må betala rekninga i form av høgare rente og i verste fall gå frå hus og heim på grunn av andre sine spekulasjonar .","Folk som ikkje var i nærleiken då bonusane blei betalte ut , må betala rekninga i form av høgare rente og i verste fall gå frå hus og heim","Folk som ikkje var i nærleiken då bonusane blei betalte ut , må betala rekninga i form av høgare rente og i verste fall gå på grunn av andre sine spekulasjonar","Folk som ikkje var i nærleiken då bonusane blei betalte ut , må betala rekninga i form av høgare rente og i verste fall gå frå hus","Folk som ikkje var i nærleiken då bonusane blei betalte ut , må betala rekninga i form av høgare rente og i verste fall gå på grunn",frå hus,på grunn,gå,frå hus og heim,på grunn av andre sine spekulasjonar,4,6,frå,på,hus,grunn,NOUN,NOUN,prepositional,prepositional,Postverbal,NorwegianNynorsk
"Dette er ei sak som Noreg har operert med overfor ESA og Europa i seks , sju år .",Dette er ei sak som Noreg har operert med overfor ESA og Europa,"Dette er ei sak som Noreg har operert med i seks , sju år",Dette er ei sak som Noreg har operert med overfor ESA,Dette er ei sak som Noreg har operert med i år,overfor ESA,i år,operere,overfor ESA og Europa,"i seks , sju år",4,5,overfor,i,ESA,år,PROPN,NOUN,prepositional,prepositional,Postverbal,NorwegianNynorsk
"Det har vore ei storslått og ukritisk utlåning av pengar nesten til kven som helst , utan tilstrekkeleg pant og tryggleik .",Det har vore ei storslått og ukritisk utlåning av pengar nesten til kven som helst,"Det har vore ei storslått og ukritisk utlåning av pengar , utan tilstrekkeleg pant og tryggleik",Det har vore ei storslått og ukritisk utlåning av pengar til kven,Det har vore ei storslått og ukritisk utlåning av pengar utan pant,til kven,utan pant,vere,nesten til kven som helst,", utan tilstrekkeleg pant og tryggleik",5,6,til,utan,kven,pant,PRON,NOUN,prepositional,prepositional,Postverbal,NorwegianNynorsk
"Fattigdomen og den matvarekrisa vi opplever i år , har vorte kalla den stille tsunamien av Verdens Matvareprogram og kan merkast i ekstrem grad for dei fattige landa i verda no .","Fattigdomen og den matvarekrisa vi opplever i år , har vorte kalla den stille tsunamien av Verdens Matvareprogram og kan merkast i ekstrem grad","Fattigdomen og den matvarekrisa vi opplever i år , har vorte kalla den stille tsunamien av Verdens Matvareprogram og kan merkast for dei fattige landa i verda","Fattigdomen og den matvarekrisa vi opplever i år , har vorte kalla den stille tsunamien av Verdens Matvareprogram og kan merkast i grad","Fattigdomen og den matvarekrisa vi opplever i år , har vorte kalla den stille tsunamien av Verdens Matvareprogram og kan merkast for landa",i grad,for land,merke,i ekstrem grad,for dei fattige landa i verda,3,6,i,for,grad,land,NOUN,NOUN,prepositional,prepositional,Postverbal,NorwegianNynorsk
"85 pst. av Noregs nasjonalformue er såkalla humankapital , altså verdien av vår framtidige og noverande arbeidsinnsats , det vi har i hovud og hender av kunnskap .","85 pst. av Noregs nasjonalformue er såkalla humankapital , altså verdien av vår framtidige og noverande arbeidsinnsats , det vi har i hovud og hender","85 pst. av Noregs nasjonalformue er såkalla humankapital , altså verdien av vår framtidige og noverande arbeidsinnsats , det vi har av kunnskap","85 pst. av Noregs nasjonalformue er såkalla humankapital , altså verdien av vår framtidige og noverande arbeidsinnsats , det vi har i hovud","85 pst. av Noregs nasjonalformue er såkalla humankapital , altså verdien av vår framtidige og noverande arbeidsinnsats , det vi har av kunnskap",i hovud,av kunnskap,ha,i hovud og hender,av kunnskap,4,2,i,av,hovud,kunnskap,NOUN,NOUN,prepositional,prepositional,Postverbal,NorwegianNynorsk
"Det at vi har unngått ei privatisering av den norske skulen , at vi har ein fellesskule der alle møtest på den same arenaen , er eit viktig utgangspunkt for at vi framleis skal satse på kunnskap i Noreg .","Det at vi har unngått ei privatisering av den norske skulen , at vi har ein fellesskule der alle møtest på den same arenaen , er eit viktig utgangspunkt for at vi framleis skal satse på kunnskap","Det at vi har unngått ei privatisering av den norske skulen , at vi har ein fellesskule der alle møtest på den same arenaen , er eit viktig utgangspunkt for at vi framleis skal satse i Noreg","Det at vi har unngått ei privatisering av den norske skulen , at vi har ein fellesskule der alle møtest på den same arenaen , er eit viktig utgangspunkt for at vi framleis skal satse på kunnskap","Det at vi har unngått ei privatisering av den norske skulen , at vi har ein fellesskule der alle møtest på den same arenaen , er eit viktig utgangspunkt for at vi framleis skal satse i Noreg",på kunnskap,i Noreg,satse,på kunnskap,i Noreg,2,2,på,i,kunnskap,Noreg,NOUN,PROPN,prepositional,prepositional,Postverbal,NorwegianNynorsk
"Tidleg innsats vert kjenneteikna ikkje berre ved at det betyr tidleg i livet , men når nokon slit med noko i skulen , må ein ta tak i det med ein gong det vert oppdaga .","Tidleg innsats vert kjenneteikna ikkje berre ved at det betyr tidleg i livet , men når nokon slit med noko","Tidleg innsats vert kjenneteikna ikkje berre ved at det betyr tidleg i livet , men når nokon slit i skulen","Tidleg innsats vert kjenneteikna ikkje berre ved at det betyr tidleg i livet , men når nokon slit med noko","Tidleg innsats vert kjenneteikna ikkje berre ved at det betyr tidleg i livet , men når nokon slit i skulen",med noko,i skule,slite,med noko,i skulen,2,2,med,i,noko,skule,PRON,NOUN,prepositional,prepositional,Postverbal,NorwegianNynorsk
"Næringslivet vil ha gode transporttilbod , slik at folk kjem på jobb til rett tid , og gode vegar , slik at varene kjem fram til marknaden .","Næringslivet vil ha gode transporttilbod , slik at folk kjem på jobb","Næringslivet vil ha gode transporttilbod , slik at folk kjem til rett tid","Næringslivet vil ha gode transporttilbod , slik at folk kjem på jobb","Næringslivet vil ha gode transporttilbod , slik at folk kjem til tid",på jobb,til tid,kome,på jobb,til rett tid,2,3,på,til,jobb,tid,NOUN,NOUN,prepositional,prepositional,Postverbal,NorwegianNynorsk
