Sentence,Context_PP1,Context_PP2,Context_PP1_simple,Context_PP2_simple,PP1_simple,PP2_simple,Verb,PP1,PP2,PP1_len,PP2_len,Adp1,Adp2,NP1,NP2,PP1_Pronom,PP2_Pronom,PP1_Type,PP2_Type,Position,Language
"Det er ikke tvil om at det går bra i NHL for tida , man flytter ikke fire kamper til Europa hvis ikke økonomien er god .",Det er ikke tvil om at det går bra i NHL,Det er ikke tvil om at det går bra for tida,Det er ikke tvil om at det går bra i NHL,Det er ikke tvil om at det går bra for tida,i NHL,for tid,gå,i NHL,for tida,2,2,i,for,NHL,tid,PROPN,NOUN,prepositional,prepositional,Postverbal,NorwegianBokmaal
Vi har sett en enorm vekst på alle områder etter streiken .,Vi har sett en enorm vekst på alle områder,Vi har sett en enorm vekst etter streiken,Vi har sett en enorm vekst på områder,Vi har sett en enorm vekst etter streiken,på område,etter streik,se,på alle områder,etter streiken,3,2,på,etter,område,streik,NOUN,NOUN,prepositional,prepositional,Postverbal,NorwegianBokmaal
Tv-kommentatorene brøler av lykke under slåsskampene .,Tv-kommentatorene brøler av lykke,Tv-kommentatorene brøler under slåsskampene,Tv-kommentatorene brøler av lykke,Tv-kommentatorene brøler under slåsskampene,av lykke,under slåsskamp,brøle,av lykke,under slåsskampene,2,2,av,under,lykke,slåsskamp,NOUN,NOUN,prepositional,prepositional,Postverbal,NorwegianBokmaal
Vi liker ikke hvordan de jobber med spilleroverganger og vi er ikke særlig fornøyde med samtalene vi har hatt med dem om akkurat det .,Vi liker ikke hvordan de jobber med spilleroverganger og vi er ikke særlig fornøyde med samtalene vi har hatt med dem,Vi liker ikke hvordan de jobber med spilleroverganger og vi er ikke særlig fornøyde med samtalene vi har hatt om akkurat det,Vi liker ikke hvordan de jobber med spilleroverganger og vi er ikke særlig fornøyde med samtalene vi har hatt med dem,Vi liker ikke hvordan de jobber med spilleroverganger og vi er ikke særlig fornøyde med samtalene vi har hatt om det,med de,om det,ha,med dem,om akkurat det,2,3,med,om,de,det,PRON,PRON,prepositional,prepositional,Postverbal,NorwegianBokmaal
"Jeg har en mistanke om at hvis det hadde kommet to KHL-lag istedenfor to NHL-lag til Stockholm , så ville ikke interessen vært like stor .",Jeg har en mistanke om at hvis det hadde kommet to KHL-lag istedenfor to NHL-lag,Jeg har en mistanke om at hvis det hadde kommet to KHL-lag til Stockholm,Jeg har en mistanke om at hvis det hadde kommet to KHL-lag istedenfor NHL-lag,Jeg har en mistanke om at hvis det hadde kommet to KHL-lag til Stockholm,istedenfor NHL-lag,til Stockholm,komme,istedenfor to NHL-lag,til Stockholm,3,2,istedenfor,til,NHL-lag,Stockholm,NOUN,PROPN,prepositional,prepositional,Postverbal,NorwegianBokmaal
"Tyler Kennedy får pucken til venstre , foran Senators' mål , beholder farta og banker til i lengste kryss .",Tyler Kennedy får pucken til venstre,"Tyler Kennedy får pucken , foran Senators' mål ,",Tyler Kennedy får pucken til venstre,Tyler Kennedy får pucken foran mål,til venstre,foran mål,få,til venstre,", foran Senators' mål ,",2,5,til,foran,venstre,mål,NOUN,NOUN,prepositional,prepositional,Postverbal,NorwegianBokmaal
"Han forteller at sports-tv-kanalen NASN ( North American Sports Network ) er kjøpt opp av ESPN , og skal bytte navn til ESPN America i februar .","Han forteller at sports-tv-kanalen NASN ( North American Sports Network ) er kjøpt opp av ESPN , og skal bytte navn til ESPN America","Han forteller at sports-tv-kanalen NASN ( North American Sports Network ) er kjøpt opp av ESPN , og skal bytte navn i februar","Han forteller at sports-tv-kanalen NASN ( North American Sports Network ) er kjøpt opp av ESPN , og skal bytte navn til ESPN","Han forteller at sports-tv-kanalen NASN ( North American Sports Network ) er kjøpt opp av ESPN , og skal bytte navn i februar",til ESPN,i februar,bytte,til ESPN America,i februar,3,2,til,i,ESPN,februar,PROPN,NOUN,prepositional,prepositional,Postverbal,NorwegianBokmaal
"Han viser til at selskapet nå har 14 millioner abonnenter i Europa , i motsetning til 35 000 i 2002 .",Han viser til at selskapet nå har 14 millioner abonnenter i Europa,"Han viser til at selskapet nå har 14 millioner abonnenter , i motsetning til 35 000 i 2002",Han viser til at selskapet nå har 14 millioner abonnenter i Europa,Han viser til at selskapet nå har 14 millioner abonnenter i motsetning,i Europa,i motsetning,ha,i Europa,", i motsetning til 35 000 i 2002",2,8,i,i,Europa,motsetning,PROPN,NOUN,prepositional,prepositional,Postverbal,NorwegianBokmaal
"Da rekka hans går av isen , slår han kølla flere ganger i gulvet og kaster den fra seg bak benken .","Da rekka hans går av isen , slår han kølla flere ganger i gulvet og kaster den fra seg","Da rekka hans går av isen , slår han kølla flere ganger i gulvet og kaster den bak benken","Da rekka hans går av isen , slår han kølla flere ganger i gulvet og kaster den fra seg","Da rekka hans går av isen , slår han kølla flere ganger i gulvet og kaster den bak benken",fra seg,bak benk,kaste,fra seg,bak benken,2,2,fra,bak,seg,benk,PRON,NOUN,prepositional,prepositional,Postverbal,NorwegianBokmaal
- Så vi kan regne med å se NHL i Oslo om ett år ?,- Så vi kan regne med å se NHL i Oslo,- Så vi kan regne med å se NHL om ett år,- Så vi kan regne med å se NHL i Oslo,- Så vi kan regne med å se NHL om år,i Oslo,om år,se,i Oslo,om ett år,2,3,i,om,Oslo,år,PROPN,NOUN,prepositional,prepositional,Postverbal,NorwegianBokmaal
Det spares ikke på effektene i kampen om å vekke oppsikt på dansegulvet .,Det spares ikke på effektene,Det spares ikke i kampen om å vekke oppsikt på dansegulvet,Det spares ikke på effektene,Det spares ikke i kampen,på effekt,i kamp,spare,på effektene,i kampen om å vekke oppsikt på dansegulvet,2,8,på,i,effekt,kamp,NOUN,NOUN,prepositional,prepositional,Postverbal,NorwegianBokmaal
"Det skal føles som å ta på deg kjolen på bryllupsdagen , sier Niskanen , som legger til :",Det skal føles som å ta på deg,Det skal føles som å ta på bryllupsdagen,Det skal føles som å ta på deg,Det skal føles som å ta på bryllupsdagen,på du,på bryllupsdag,ta,på deg,på bryllupsdagen,2,2,på,på,du,bryllupsdag,PRON,NOUN,prepositional,prepositional,Postverbal,NorwegianBokmaal
"Og boaene som fantes på hver kjole for noen år siden , er ikke å se i det hele tatt i dag , sier hun .",Og boaene som fantes på hver kjole,Og boaene som fantes for noen år siden,Og boaene som fantes på kjole,Og boaene som fantes for år,på kjole,for år,finnes,på hver kjole,for noen år siden,3,4,på,for,kjole,år,NOUN,NOUN,prepositional,prepositional,Postverbal,NorwegianBokmaal
"- Det finnes noen elementer fra dansesjangeren i motebildet også , som paljetter , chiffon og dramatiske juvelfarger , sier motejournalist i Elle , Anja Stang .",- Det finnes noen elementer fra dansesjangeren i motebildet,"- Det finnes noen elementer fra dansesjangeren , som paljetter , chiffon og dramatiske juvelfarger",- Det finnes noen elementer fra dansesjangeren i motebildet,- Det finnes noen elementer fra dansesjangeren som paljetter,i motebilde,som paljett,finnes,i motebildet,", som paljetter , chiffon og dramatiske juvelfarger",2,8,i,som,motebilde,paljett,NOUN,NOUN,prepositional,prepositional,Postverbal,NorwegianBokmaal
"Hun er ansvarlig for kjøp , leie , sying og eventuell omsying av kostymene som hver fredag virvler rundt under lyskasterne på parketten i TV-studioet .","Hun er ansvarlig for kjøp , leie , sying og eventuell omsying av kostymene som hver fredag virvler rundt under lyskasterne","Hun er ansvarlig for kjøp , leie , sying og eventuell omsying av kostymene som hver fredag virvler rundt på parketten i TV-studioet","Hun er ansvarlig for kjøp , leie , sying og eventuell omsying av kostymene som hver fredag virvler rundt under lyskasterne","Hun er ansvarlig for kjøp , leie , sying og eventuell omsying av kostymene som hver fredag virvler rundt på parketten",under lyskaster,på parkett,virvle,under lyskasterne,på parketten i TV-studioet,2,4,under,på,lyskaster,parkett,NOUN,NOUN,prepositional,prepositional,Postverbal,NorwegianBokmaal
"Ellers minner programmet i stor grad om sportsdanskonkurranser , og trinnene og musikken er de samme .",Ellers minner programmet i stor grad,Ellers minner programmet om sportsdanskonkurranser,Ellers minner programmet i grad,Ellers minner programmet om sportsdanskonkurranser,i grad,om sportsdanskonkurranse,minne,i stor grad,om sportsdanskonkurranser,3,2,i,om,grad,sportsdanskonkurranse,NOUN,NOUN,prepositional,prepositional,Postverbal,NorwegianBokmaal
"Men den hviterussiske danseren som kom til Norge i 2000 for å jobbe med sin norske partner , syr også sine egne kostymer .",Men den hviterussiske danseren som kom til Norge,Men den hviterussiske danseren som kom i 2000,Men den hviterussiske danseren som kom til Norge,Men den hviterussiske danseren som kom i 2000,til Norge,i 2000,komme,til Norge,i 2000,2,2,til,i,Norge,2000,PROPN,NUM,prepositional,prepositional,Postverbal,NorwegianBokmaal
- Men du føler deg litt latterlig når du sitter i alt utstyret på flyplassen .,- Men du føler deg litt latterlig når du sitter i alt utstyret,- Men du føler deg litt latterlig når du sitter på flyplassen,- Men du føler deg litt latterlig når du sitter i utstyret,- Men du føler deg litt latterlig når du sitter på flyplassen,i utstyr,på flyplass,sitte,i alt utstyret,på flyplassen,3,2,i,på,utstyr,flyplass,NOUN,NOUN,prepositional,prepositional,Postverbal,NorwegianBokmaal
Kunstneren har selv spilt på familiepianoet i sju år .,Kunstneren har selv spilt på familiepianoet,Kunstneren har selv spilt i sju år,Kunstneren har selv spilt på familiepianoet,Kunstneren har selv spilt i år,på familiepiano,i år,spille,på familiepianoet,i sju år,2,3,på,i,familiepiano,år,NOUN,NOUN,prepositional,prepositional,Postverbal,NorwegianBokmaal
Familiebilder som inntil nylig har hengt over pianoet hjemme i Brevik .,Familiebilder som inntil nylig har hengt over pianoet,Familiebilder som inntil nylig har hengt hjemme i Brevik,Familiebilder som inntil nylig har hengt over pianoet,Familiebilder som inntil nylig har hengt hjemme i Brevik,over piano,hjemme i Brevik,henge,over pianoet,hjemme i Brevik,2,3,over,hjemme i,piano,Brevik,NOUN,PROPN,prepositional,prepositional,Postverbal,NorwegianBokmaal
Utenfor leiligheten finner vi også filmen om den 70 år gamle tanta som drar til frisøren for første gang og installasjonen « Faren min forsøkte å ringe moren min » .,Utenfor leiligheten finner vi også filmen om den 70 år gamle tanta som drar til frisøren,Utenfor leiligheten finner vi også filmen om den 70 år gamle tanta som drar for første gang,Utenfor leiligheten finner vi også filmen om den 70 år gamle tanta som drar til frisøren,Utenfor leiligheten finner vi også filmen om den 70 år gamle tanta som drar for gang,til frisør,for gang,dra,til frisøren,for første gang,2,3,til,for,frisør,gang,NOUN,NOUN,prepositional,prepositional,Postverbal,NorwegianBokmaal
"- Jeg har jobbet med virkeligheten som utgangspunkt i flere år , og det ble etter hvert så mange kunstverk om min egen familie at jeg fikk ideen om å samle det til en helhetlig utstilling .",- Jeg har jobbet med virkeligheten som utgangspunkt,- Jeg har jobbet i flere år,- Jeg har jobbet med virkeligheten,- Jeg har jobbet i år,med virkelighet,i år,jobbe,med virkeligheten som utgangspunkt,i flere år,4,3,med,i,virkelighet,år,NOUN,NOUN,prepositional,prepositional,Postverbal,NorwegianBokmaal
I det tilfellet måtte jeg legge det fra meg i to år for å tenke meg om .,I det tilfellet måtte jeg legge det fra meg,I det tilfellet måtte jeg legge det i to år,I det tilfellet måtte jeg legge det fra meg,I det tilfellet måtte jeg legge det i år,fra jeg,i år,legge,fra meg,i to år,2,3,fra,i,jeg,år,PRON,NOUN,prepositional,prepositional,Postverbal,NorwegianBokmaal
Sist uke ble familiepianoet kjørt fra Brevik til Oslo .,Sist uke ble familiepianoet kjørt fra Brevik,Sist uke ble familiepianoet kjørt til Oslo,Sist uke ble familiepianoet kjørt fra Brevik,Sist uke ble familiepianoet kjørt til Oslo,fra Brevik,til Oslo,kjøre,fra Brevik,til Oslo,2,2,fra,til,Brevik,Oslo,PROPN,PROPN,prepositional,prepositional,Postverbal,NorwegianBokmaal
Staveland hadde alltid med seg en diktafon i lomma .,Staveland hadde alltid med seg,Staveland hadde alltid i lomma,Staveland hadde alltid med seg,Staveland hadde alltid i lomma,med seg,i lomme,ha,med seg,i lomma,2,2,med,i,seg,lomme,PRON,NOUN,prepositional,prepositional,Postverbal,NorwegianBokmaal
Jeg vet nesten hvor klokka henger på veggen i hvert hus i Haugesund .,Jeg vet nesten hvor klokka henger på veggen,Jeg vet nesten hvor klokka henger i hvert hus i Haugesund,Jeg vet nesten hvor klokka henger på veggen,Jeg vet nesten hvor klokka henger i hus,på vegg,i hus,henge,på veggen,i hvert hus i Haugesund,2,5,på,i,vegg,hus,NOUN,NOUN,prepositional,prepositional,Postverbal,NorwegianBokmaal
- Jeg likte å gå fra hus til hus .,- Jeg likte å gå fra hus,- Jeg likte å gå til hus,- Jeg likte å gå fra hus,- Jeg likte å gå til hus,fra hus,til hus,gå,fra hus,til hus,2,2,fra,til,hus,hus,NOUN,NOUN,prepositional,prepositional,Postverbal,NorwegianBokmaal
"Han bygget uthuset med egne hender i 1993 , med torvtak og det hele , som kontor og studio .",Han bygget uthuset med egne hender,Han bygget uthuset i 1993,Han bygget uthuset med hender,Han bygget uthuset i 1993,med hånd,i 1993,bygge,med egne hender,i 1993,3,2,med,i,hånd,1993,NOUN,NUM,prepositional,prepositional,Postverbal,NorwegianBokmaal
"Over brystpanelet er alle veggene tapetsert med avisutklipp om Vamp , helt opp til taket .",Over brystpanelet er alle veggene tapetsert med avisutklipp om Vamp,"Over brystpanelet er alle veggene tapetsert , helt opp til taket",Over brystpanelet er alle veggene tapetsert med avisutklipp,Over brystpanelet er alle veggene tapetsert opp til taket,med avisutklipp,opp til tak,tapetsere,med avisutklipp om Vamp,", helt opp til taket",4,5,med,opp til,avisutklipp,tak,NOUN,NOUN,prepositional,prepositional,Postverbal,NorwegianBokmaal
- Får de andre selv bestemme hva de skal ha på seg på scenen ?,- Får de andre selv bestemme hva de skal ha på seg,- Får de andre selv bestemme hva de skal ha på scenen,- Får de andre selv bestemme hva de skal ha på seg,- Får de andre selv bestemme hva de skal ha på scenen,på seg,på scene,ha,på seg,på scenen,2,2,på,på,seg,scene,PRON,NOUN,prepositional,prepositional,Postverbal,NorwegianBokmaal
Staveland hadde kjørt til banken i Haugesund om morgenen .,Staveland hadde kjørt til banken i Haugesund,Staveland hadde kjørt om morgenen,Staveland hadde kjørt til banken,Staveland hadde kjørt om morgenen,til bank,om morgen,kjøre,til banken i Haugesund,om morgenen,4,2,til,om,bank,morgen,NOUN,NOUN,prepositional,prepositional,Postverbal,NorwegianBokmaal
Staveland pirker på noe inne i håndflata .,Staveland pirker på noe,Staveland pirker inne i håndflata,Staveland pirker på noe,Staveland pirker inne i håndflata,på noe,inne i håndflate,pirke,på noe,inne i håndflata,2,3,på,inne i,noe,håndflate,PRON,NOUN,prepositional,prepositional,Postverbal,NorwegianBokmaal
Han bar på den i mange år .,Han bar på den,Han bar i mange år,Han bar på den,Han bar i år,på den,i år,bære,på den,i mange år,2,3,på,i,den,år,PRON,NOUN,prepositional,prepositional,Postverbal,NorwegianBokmaal
"Og for ikke å tvære dette ut , kan vi vel kort bare nevne at det ikke er på grunn av været at Staveland snekrer på et nyinnkjøpt hus i Grimstad .","Og for ikke å tvære dette ut , kan vi vel kort bare nevne at det ikke er på grunn av været at Staveland snekrer på et nyinnkjøpt hus","Og for ikke å tvære dette ut , kan vi vel kort bare nevne at det ikke er på grunn av været at Staveland snekrer i Grimstad","Og for ikke å tvære dette ut , kan vi vel kort bare nevne at det ikke er på grunn av været at Staveland snekrer på hus","Og for ikke å tvære dette ut , kan vi vel kort bare nevne at det ikke er på grunn av været at Staveland snekrer i Grimstad",på hus,i Grimstad,snekre,på et nyinnkjøpt hus,i Grimstad,4,2,på,i,hus,Grimstad,NOUN,PROPN,prepositional,prepositional,Postverbal,NorwegianBokmaal
Jeg hadde i utgangspunktet nok med meg sjøl .,Jeg hadde i utgangspunktet,Jeg hadde med meg sjøl,Jeg hadde i utgangspunktet,Jeg hadde med meg,i utgangspunkt,med jeg,ha,i utgangspunktet,med meg sjøl,2,3,i,med,utgangspunkt,jeg,NOUN,PRON,prepositional,prepositional,Postverbal,NorwegianBokmaal
"Hvis du ikke lar toppene og bunnene gå i kroppen på deg , visker du ut alt .",Hvis du ikke lar toppene og bunnene gå i kroppen,Hvis du ikke lar toppene og bunnene gå på deg,Hvis du ikke lar toppene og bunnene gå i kroppen,Hvis du ikke lar toppene og bunnene gå på deg,i kropp,på du,gå,i kroppen,på deg,2,2,i,på,kropp,du,NOUN,PRON,prepositional,prepositional,Postverbal,NorwegianBokmaal
- Jeg reiste rundt i Sør-Amerika for noen år siden .,- Jeg reiste rundt i Sør-Amerika,- Jeg reiste for noen år siden,- Jeg reiste rundt i Sør-Amerika,- Jeg reiste for år,rundt i Sør-Amerika,for år,reise,rundt i Sør-Amerika,for noen år siden,3,4,rundt i,for,Sør-Amerika,år,PROPN,NOUN,prepositional,prepositional,Postverbal,NorwegianBokmaal
Hva tar du med deg på hyttetur ?,Hva tar du med deg,Hva tar du på hyttetur,Hva tar du med deg,Hva tar du på hyttetur,med du,på hyttetur,ta,med deg,på hyttetur,2,2,med,på,du,hyttetur,PRON,NOUN,prepositional,prepositional,Postverbal,NorwegianBokmaal
"Et kamera vil filme en rekke prostituerte ved Halmtorvet , like ved Hovedbanegården og den trafikkerte Istedsgate i København sentrum .",Et kamera vil filme en rekke prostituerte ved Halmtorvet,"Et kamera vil filme en rekke prostituerte , like ved Hovedbanegården og den trafikkerte Istedsgate i København sentrum",Et kamera vil filme en rekke prostituerte ved Halmtorvet,Et kamera vil filme en rekke prostituerte ved Hovedbanegården,ved Halmtorvet,ved Hovedbanegården,filme,ved Halmtorvet,", like ved Hovedbanegården og den trafikkerte Istedsgate i København sentrum",2,11,ved,ved,Halmtorvet,Hovedbanegården,PROPN,PROPN,prepositional,prepositional,Postverbal,NorwegianBokmaal
Hun er en av de prostituerte som kan tenke seg å stille opp til casting på premierekvelden den 1. november .,Hun er en av de prostituerte som kan tenke seg å stille opp til casting,Hun er en av de prostituerte som kan tenke seg å stille opp på premierekvelden den 1. november,Hun er en av de prostituerte som kan tenke seg å stille opp til casting,Hun er en av de prostituerte som kan tenke seg å stille opp på premierekvelden,til casting,på premierekveld,stille,til casting,på premierekvelden den 1. november,2,5,til,på,casting,premierekveld,NOUN,NOUN,prepositional,prepositional,Postverbal,NorwegianBokmaal
Og den kommer som regel som julaften på kjerringa .,Og den kommer som regel,Og den kommer som julaften på kjerringa,Og den kommer som regel,Og den kommer som julaften,som regel,som julaften,komme,som regel,som julaften på kjerringa,2,4,som,som,regel,julaften,NOUN,NOUN,prepositional,prepositional,Postverbal,NorwegianBokmaal
"De lokale jordmødrene snakker også med mennene om familieplanlegging , og de øker menns forståelse for verdien av konas og barnas liv .",De lokale jordmødrene snakker også med mennene,De lokale jordmødrene snakker også om familieplanlegging,De lokale jordmødrene snakker også med mennene,De lokale jordmødrene snakker også om familieplanlegging,med mann,om familieplanlegging,snakke,med mennene,om familieplanlegging,2,2,med,om,mann,familieplanlegging,NOUN,NOUN,prepositional,prepositional,Postverbal,NorwegianBokmaal
"- En gang reiste jeg alene uten teamet mitt til Pakthia i sør , hvor jeg skulle intervjue tjue jordmødre .",- En gang reiste jeg alene uten teamet mitt,"- En gang reiste jeg alene til Pakthia i sør , hvor jeg skulle intervjue tjue jordmødre",- En gang reiste jeg alene uten teamet,- En gang reiste jeg alene til Pakthia,uten team,til Pakthia,reise,uten teamet mitt,"til Pakthia i sør , hvor jeg skulle intervjue tjue jordmødre",3,11,uten,til,team,Pakthia,NOUN,PROPN,prepositional,prepositional,Postverbal,NorwegianBokmaal
Av sikkerhetsmessige grunner går Firooza alltid i burka på reisene sine sør for Kabul .,Av sikkerhetsmessige grunner går Firooza alltid i burka,Av sikkerhetsmessige grunner går Firooza alltid på reisene sine sør for Kabul,Av sikkerhetsmessige grunner går Firooza alltid i burka,Av sikkerhetsmessige grunner går Firooza alltid på reisene,i burka,på reise,gå,i burka,på reisene sine sør for Kabul,2,6,i,på,burka,reise,NOUN,NOUN,prepositional,prepositional,Postverbal,NorwegianBokmaal
"Har du spørsmål eller kommentarer , send dem til oss på epost .","Har du spørsmål eller kommentarer , send dem til oss","Har du spørsmål eller kommentarer , send dem på epost","Har du spørsmål eller kommentarer , send dem til oss","Har du spørsmål eller kommentarer , send dem på epost",til vi,på epost,sende,til oss,på epost,2,2,til,på,vi,epost,PRON,NOUN,prepositional,prepositional,Postverbal,NorwegianBokmaal
"Hannahs største ønske var å få leve sine siste måneder sammen med foreldrene og sine tre søsken i fred og ro , etter å ha gått inn og ut av sykehus hele livet .",Hannahs største ønske var å få leve sine siste måneder sammen med foreldrene og sine tre søsken,Hannahs største ønske var å få leve sine siste måneder i fred og ro,Hannahs største ønske var å få leve sine siste måneder med foreldrene,Hannahs største ønske var å få leve sine siste måneder i fred,med forelder,i fred,leve,sammen med foreldrene og sine tre søsken,i fred og ro,7,4,med,i,forelder,fred,NOUN,NOUN,prepositional,prepositional,Postverbal,NorwegianBokmaal
Uten forsikring tør ikke familien reise til USA - i tilfelle noe skulle skje med Hannah .,Uten forsikring tør ikke familien reise til USA,Uten forsikring tør ikke familien reise - i tilfelle noe skulle skje med Hannah,Uten forsikring tør ikke familien reise til USA,Uten forsikring tør ikke familien reise i tilfelle,til USA,i tilfelle,reise,til USA,- i tilfelle noe skulle skje med Hannah,2,8,til,i,USA,tilfelle,PROPN,NOUN,prepositional,prepositional,Postverbal,NorwegianBokmaal
Hun kom inn på American Comedy Institute i grevens tid .,Hun kom inn på American Comedy Institute,Hun kom inn i grevens tid,Hun kom inn på American,Hun kom inn i tid,på American,i tid,komme,på American Comedy Institute,i grevens tid,4,3,på,i,American,tid,PROPN,NOUN,prepositional,prepositional,Postverbal,NorwegianBokmaal
"For da Shabana forlot den norske offentligheten og flyttet til USA i 2005 , var det ikke fordi noen hadde skutt med grovkalibret våpen mot restauranten til søstera hennes .",For da Shabana forlot den norske offentligheten og flyttet til USA,For da Shabana forlot den norske offentligheten og flyttet i 2005,For da Shabana forlot den norske offentligheten og flyttet til USA,For da Shabana forlot den norske offentligheten og flyttet i 2005,til USA,i 2005,flytte,til USA,i 2005,2,2,til,i,USA,2005,PROPN,NUM,prepositional,prepositional,Postverbal,NorwegianBokmaal
"For da Shabana forlot den norske offentligheten og flyttet til USA i 2005 , var det ikke fordi noen hadde skutt med grovkalibret våpen mot restauranten til søstera hennes .","For da Shabana forlot den norske offentligheten og flyttet til USA i 2005 , var det ikke fordi noen hadde skutt med grovkalibret våpen","For da Shabana forlot den norske offentligheten og flyttet til USA i 2005 , var det ikke fordi noen hadde skutt mot restauranten til søstera hennes","For da Shabana forlot den norske offentligheten og flyttet til USA i 2005 , var det ikke fordi noen hadde skutt med våpen","For da Shabana forlot den norske offentligheten og flyttet til USA i 2005 , var det ikke fordi noen hadde skutt mot restauranten",med våpen,mot restaurant,skyte,med grovkalibret våpen,mot restauranten til søstera hennes,3,5,med,mot,våpen,restaurant,NOUN,NOUN,prepositional,prepositional,Postverbal,NorwegianBokmaal
Hun kom bare inn på American Comedy Institute i grevens tid .,Hun kom bare inn på American Comedy Institute,Hun kom bare inn i grevens tid,Hun kom bare inn på American,Hun kom bare inn i tid,på American,i tid,komme,på American Comedy Institute,i grevens tid,4,3,på,i,American,tid,PROPN,NOUN,prepositional,prepositional,Postverbal,NorwegianBokmaal
"Ut ifra hva jeg legger i begrepet akkurat nå , står det i veien for en rendyrket og bevisst debatt om humanisme i mitt liv » , erklærte Shabana på forumet til kvinnenettverket Femail Bonding i 2004 , før hun avsluttet med :","Ut ifra hva jeg legger i begrepet akkurat nå , står det i veien for en rendyrket og bevisst debatt om humanisme i mitt liv » , erklærte Shabana på forumet til kvinnenettverket Femail Bonding","Ut ifra hva jeg legger i begrepet akkurat nå , står det i veien for en rendyrket og bevisst debatt om humanisme i mitt liv » , erklærte Shabana i 2004","Ut ifra hva jeg legger i begrepet akkurat nå , står det i veien for en rendyrket og bevisst debatt om humanisme i mitt liv » , erklærte Shabana på forumet","Ut ifra hva jeg legger i begrepet akkurat nå , står det i veien for en rendyrket og bevisst debatt om humanisme i mitt liv » , erklærte Shabana i 2004",på forum,i 2004,erklære,på forumet til kvinnenettverket Femail Bonding,i 2004,6,2,på,i,forum,2004,NOUN,NUM,prepositional,prepositional,Postverbal,NorwegianBokmaal
"Vi blir forbanna på mennesker og holdninger i dag , ikke kjønn .",Vi blir forbanna på mennesker og holdninger,Vi blir forbanna i dag,Vi blir forbanna på mennesker,Vi blir forbanna i dag,på menneske,i dag,forbanne,på mennesker og holdninger,i dag,4,2,på,i,menneske,dag,NOUN,NOUN,prepositional,prepositional,Postverbal,NorwegianBokmaal
