Sentence,Context_PP1,Context_PP2,Context_PP1_simple,Context_PP2_simple,PP1_simple,PP2_simple,Verb,PP1,PP2,PP1_len,PP2_len,Adp1,Adp2,NP1,NP2,PP1_Pronom,PP2_Pronom,PP1_Type,PP2_Type,Position,Language
"Etter dette mindretallets mening er det dagens statskirkeordning som best sikrer at Den norske kirke er der for alle som ønsker det , og som best sikrer en tilstrekkelig lav terskel for at alle skal kunne føle seg hjemme i kirken uansett trosengasjement .","Etter dette mindretallets mening er det dagens statskirkeordning som best sikrer at Den norske kirke er der for alle som ønsker det , og som best sikrer en tilstrekkelig lav terskel for at alle skal kunne føle seg hjemme i kirken","Etter dette mindretallets mening er det dagens statskirkeordning som best sikrer at Den norske kirke er der for alle som ønsker det , og som best sikrer en tilstrekkelig lav terskel for at alle skal kunne føle seg hjemme uansett trosengasjement","Etter dette mindretallets mening er det dagens statskirkeordning som best sikrer at Den norske kirke er der for alle som ønsker det , og som best sikrer en tilstrekkelig lav terskel for at alle skal kunne føle seg hjemme i kirken","Etter dette mindretallets mening er det dagens statskirkeordning som best sikrer at Den norske kirke er der for alle som ønsker det , og som best sikrer en tilstrekkelig lav terskel for at alle skal kunne føle seg hjemme uansett trosengasjement",i kirke,uansett trosengasjement,føle,i kirken,uansett trosengasjement,2,2,i,uansett,kirke,trosengasjement,NOUN,NOUN,prepositional,prepositional,Postverbal,NorwegianBokmaal
"For flertallets foreslåtte kirkeordning , en lovforankret folkekirke , anbefaler et flertall på 15 utvalgsmedlemmer at offentlige bevilgninger står for hovedfinansieringen , med statlige tilskudd som dekker lønninger og tilknyttede personalkostnader for alle kirkelige ansatte og kommunale tilskudd som dekker bygging , vedlikehold , forvaltning og drift av kirkebygg .","For flertallets foreslåtte kirkeordning , en lovforankret folkekirke , anbefaler et flertall på 15 utvalgsmedlemmer at offentlige bevilgninger står for hovedfinansieringen","For flertallets foreslåtte kirkeordning , en lovforankret folkekirke , anbefaler et flertall på 15 utvalgsmedlemmer at offentlige bevilgninger står , med statlige tilskudd som dekker lønninger og tilknyttede personalkostnader for alle kirkelige ansatte og kommunale tilskudd som dekker bygging , vedlikehold , forvaltning og drift av kirkebygg","For flertallets foreslåtte kirkeordning , en lovforankret folkekirke , anbefaler et flertall på 15 utvalgsmedlemmer at offentlige bevilgninger står for hovedfinansieringen","For flertallets foreslåtte kirkeordning , en lovforankret folkekirke , anbefaler et flertall på 15 utvalgsmedlemmer at offentlige bevilgninger står med tilskudd",for hovedfinansiering,med tilskudd,stå,for hovedfinansieringen,", med statlige tilskudd som dekker lønninger og tilknyttede personalkostnader for alle kirkelige ansatte og kommunale tilskudd som dekker bygging , vedlikehold , forvaltning og drift av kirkebygg",2,28,for,med,hovedfinansiering,tilskudd,NOUN,NOUN,prepositional,prepositional,Postverbal,NorwegianBokmaal
I kapittel 3 kastes det lys over kirkens historie med hovedfokus på selve statskirkeordningen .,I kapittel 3 kastes det lys over kirkens historie,I kapittel 3 kastes det lys med hovedfokus på selve statskirkeordningen,I kapittel 3 kastes det lys over historie,I kapittel 3 kastes det lys med hovedfokus,over historie,med hovedfokus,kaste,over kirkens historie,med hovedfokus på selve statskirkeordningen,3,5,over,med,historie,hovedfokus,NOUN,NOUN,prepositional,prepositional,Postverbal,NorwegianBokmaal
"Stortingets alminnelige myndighet gjelder til dels også på det kirkelige området , herunder å gi lover , fastsette bevilgninger og kontrollere hvordan regjeringen forvalter kirkesakene .",Stortingets alminnelige myndighet gjelder til dels,Stortingets alminnelige myndighet gjelder også på det kirkelige området,Stortingets alminnelige myndighet gjelder til dels,Stortingets alminnelige myndighet gjelder på området,til del,på område,gjelde,til dels,også på det kirkelige området,2,5,til,på,del,område,NOUN,NOUN,prepositional,prepositional,Postverbal,NorwegianBokmaal
De andre ansatte i kirken er lokalt ansatt av kirkens egne organer med en viss koordinering gjennom en felles arbeidsgiverforening .,De andre ansatte i kirken er lokalt ansatt av kirkens egne organer,De andre ansatte i kirken er lokalt ansatt med en viss koordinering gjennom en felles arbeidsgiverforening,De andre ansatte i kirken er lokalt ansatt av organer,De andre ansatte i kirken er lokalt ansatt med koordinering,av organ,med koordinering,ansette,av kirkens egne organer,med en viss koordinering gjennom en felles arbeidsgiverforening,4,8,av,med,organ,koordinering,NOUN,NOUN,prepositional,prepositional,Postverbal,NorwegianBokmaal
"Biskoper utnevnes av Den norske kirke , på grunnlag av en bred nominasjons- og valgordning .",Biskoper utnevnes av Den norske kirke,"Biskoper utnevnes , på grunnlag av en bred nominasjons- og valgordning",Biskoper utnevnes av Den,Biskoper utnevnes på grunnlag,av Den,på grunnlag,utnevne,av Den norske kirke,", på grunnlag av en bred nominasjons- og valgordning",4,9,av,på,Den,grunnlag,PROPN,NOUN,prepositional,prepositional,Postverbal,NorwegianBokmaal
"Ut fra Riksantikvarens beregninger bevilges det i dag 3 mrd. kroner for lite til istandsetting , og vel 100 mill. kroner mangler til årlig vedlikehold .",Ut fra Riksantikvarens beregninger bevilges det i dag,Ut fra Riksantikvarens beregninger bevilges det til istandsetting,Ut fra Riksantikvarens beregninger bevilges det i dag,Ut fra Riksantikvarens beregninger bevilges det til istandsetting,i dag,til istandsetting,bevilge,i dag,til istandsetting,2,2,i,til,dag,istandsetting,NOUN,NOUN,prepositional,prepositional,Postverbal,NorwegianBokmaal
Både de store sjøfuglbestandene og pattedyr som isbjørn og polarrev henter i hovedsak sin næring fra de marine næringskjedene .,Både de store sjøfuglbestandene og pattedyr som isbjørn og polarrev henter i hovedsak,Både de store sjøfuglbestandene og pattedyr som isbjørn og polarrev henter fra de marine næringskjedene,Både de store sjøfuglbestandene og pattedyr som isbjørn og polarrev henter i hovedsak,Både de store sjøfuglbestandene og pattedyr som isbjørn og polarrev henter fra næringskjedene,i hovedsak,fra næringskjede,hente,i hovedsak,fra de marine næringskjedene,2,4,i,fra,hovedsak,næringskjede,NOUN,NOUN,prepositional,prepositional,Postverbal,NorwegianBokmaal
Organiske miljøgifter løses i dette fettet og overføres gjennom næringskjeden sammen med fettet .,Organiske miljøgifter løses i dette fettet og overføres gjennom næringskjeden,Organiske miljøgifter løses i dette fettet og overføres sammen med fettet,Organiske miljøgifter løses i dette fettet og overføres gjennom næringskjeden,Organiske miljøgifter løses i dette fettet og overføres med fettet,gjennom næringskjede,med fett,overføre,gjennom næringskjeden,sammen med fettet,2,3,gjennom,med,næringskjede,fett,NOUN,NOUN,prepositional,prepositional,Postverbal,NorwegianBokmaal
"Fra nederlenderne kom til Svalbard i 1596 og fram til ca 1900 , var det utnytting av de biologiske ressursene som var grunnlaget for virksomheten .",Fra nederlenderne kom til Svalbard,Fra nederlenderne kom i 1596,Fra nederlenderne kom til Svalbard,Fra nederlenderne kom i 1596,til Svalbard,i 1596,komme,til Svalbard,i 1596,2,2,til,i,Svalbard,1596,PROPN,NUM,prepositional,prepositional,Postverbal,NorwegianBokmaal
"I tillegg er det overvintringer på spredte steder rundt om på øygruppen , blant annet i Hornsund , på Hopen og på Bjørnøya .",I tillegg er det overvintringer på spredte steder rundt om på øygruppen,"I tillegg er det overvintringer , blant annet i Hornsund , på Hopen og på Bjørnøya",I tillegg er det overvintringer på steder,I tillegg er det overvintringer i Hornsund,på sted,i Hornsund,være,på spredte steder rundt om på øygruppen,", blant annet i Hornsund , på Hopen og på Bjørnøya",7,11,på,i,sted,Hornsund,NOUN,PROPN,prepositional,prepositional,Postverbal,NorwegianBokmaal
"Det utføres i dag ca 950 årsverk i Longyearbyen , hvorav ca 200 er tilknyttet kulldriften .",Det utføres i dag,Det utføres i Longyearbyen,Det utføres i dag,Det utføres i Longyearbyen,i dag,i Longyearbyen,utføre,i dag,i Longyearbyen,2,2,i,i,dag,Longyearbyen,NOUN,PROPN,prepositional,prepositional,Postverbal,NorwegianBokmaal
Om lag 35 personer bor i Ny-Ålesund året rundt .,Om lag 35 personer bor i Ny-Ålesund,Om lag 35 personer bor året rundt,Om lag 35 personer bor i Ny-Ålesund,Om lag 35 personer bor året rundt,i Ny-Ålesund,år rundt,bo,i Ny-Ålesund,året rundt,2,2,i,rundt,Ny-Ålesund,år,PROPN,NOUN,prepositional,postpositional,Postverbal,NorwegianBokmaal
"I august 1996 omkom 141 mennesker på vei til Barentsburg under flyulykken på Operafjellet utenfor Longyearbyen , og i september 1997 ble 23 gruvearbeidere drept ved en eksplosjon i gruva .",I august 1996 omkom 141 mennesker på vei til Barentsburg,I august 1996 omkom 141 mennesker under flyulykken på Operafjellet utenfor Longyearbyen,I august 1996 omkom 141 mennesker på vei,I august 1996 omkom 141 mennesker under flyulykken,på vei,under flyulykke,omkomme,på vei til Barentsburg,under flyulykken på Operafjellet utenfor Longyearbyen,4,6,på,under,vei,flyulykke,NOUN,NOUN,prepositional,prepositional,Postverbal,NorwegianBokmaal
Trust Arktikugol stengte i april 1998 kullgruvedriften i Pyramiden etter 53 års kontinuerlig drift .,Trust Arktikugol stengte i april 1998,Trust Arktikugol stengte etter 53 års kontinuerlig drift,Trust Arktikugol stengte i april,Trust Arktikugol stengte etter drift,i april,etter drift,stenge,i april 1998,etter 53 års kontinuerlig drift,3,5,i,etter,april,drift,NOUN,NOUN,prepositional,prepositional,Postverbal,NorwegianBokmaal
"Store Norske Spitsbergen Kulkompani AS ( SNSK ) har drevet kullgruvedrift i Svea i Van Mijenfjorden fra 1933 , da anlegget ble kjøpt av selskapet Nya Svenska Stenkolsaktiebolaget Spetsbergen .",Store Norske Spitsbergen Kulkompani AS ( SNSK ) har drevet kullgruvedrift i Svea i Van Mijenfjorden,"Store Norske Spitsbergen Kulkompani AS ( SNSK ) har drevet kullgruvedrift fra 1933 , da anlegget ble kjøpt av selskapet Nya Svenska Stenkolsaktiebolaget Spetsbergen",Store Norske Spitsbergen Kulkompani AS ( SNSK ) har drevet kullgruvedrift i Svea,Store Norske Spitsbergen Kulkompani AS ( SNSK ) har drevet kullgruvedrift fra 1933,i Svea,fra 1933,drive,i Svea i Van Mijenfjorden,"fra 1933 , da anlegget ble kjøpt av selskapet Nya Svenska Stenkolsaktiebolaget Spetsbergen",5,13,i,fra,Svea,1933,PROPN,NUM,prepositional,prepositional,Postverbal,NorwegianBokmaal
Virksomheten i Svea drives med personell fast bosatt i Longyearbyen som arbeider i Svea etter en turnusordning .,Virksomheten i Svea drives med personell fast bosatt i Longyearbyen som arbeider i Svea,Virksomheten i Svea drives med personell fast bosatt i Longyearbyen som arbeider etter en turnusordning,Virksomheten i Svea drives med personell fast bosatt i Longyearbyen som arbeider i Svea,Virksomheten i Svea drives med personell fast bosatt i Longyearbyen som arbeider etter turnusordning,i Svea,etter turnusordning,arbeide,i Svea,etter en turnusordning,2,3,i,etter,Svea,turnusordning,PROPN,NOUN,prepositional,prepositional,Postverbal,NorwegianBokmaal
Det befinner seg til enhver tid mellom 50 og 100 personer i Svea .,Det befinner seg til enhver tid,Det befinner seg i Svea,Det befinner seg til tid,Det befinner seg i Svea,til tid,i Svea,befinne,til enhver tid,i Svea,3,2,til,i,tid,Svea,NOUN,PROPN,prepositional,prepositional,Postverbal,NorwegianBokmaal
Forøvrig koordineres forvaltningen av Svalbard på vanlig måte mellom departementene .,Forøvrig koordineres forvaltningen av Svalbard på vanlig måte,Forøvrig koordineres forvaltningen av Svalbard mellom departementene,Forøvrig koordineres forvaltningen av Svalbard på måte,Forøvrig koordineres forvaltningen av Svalbard mellom departementene,på måte,mellom departement,koordinere,på vanlig måte,mellom departementene,3,2,på,mellom,måte,departement,NOUN,NOUN,prepositional,prepositional,Postverbal,NorwegianBokmaal
"Inntil 1995 var myndigheten etter de gjeldende miljøvernforskriftene for Svalbard lagt til Miljøverndepartementet , Riksantikvaren og sysselmannen .",Inntil 1995,etter de gjeldende miljøvernforskriftene for Svalbard,Inntil 1995,etter miljøvernforskriftene,inntil 1995,etter miljøvernforskrift,legge,Inntil 1995,etter de gjeldende miljøvernforskriftene for Svalbard,2,6,inntil,etter,1995,miljøvernforskrift,NUM,NOUN,prepositional,prepositional,Preverbal,NorwegianBokmaal
"Fiskeridirektoratet utarbeider forskrifter om tillatelse til fiske i Svalbards territorialfarvann og i fiskerivernsonen , med hjemmel i forskrift opprettet ved kgl res 28 april 1978 i medhold av svalbardloven .","Fiskeridirektoratet utarbeider forskrifter om tillatelse til fiske i Svalbards territorialfarvann og i fiskerivernsonen , med hjemmel i forskrift opprettet ved kgl res 28 april 1978","Fiskeridirektoratet utarbeider forskrifter om tillatelse til fiske i Svalbards territorialfarvann og i fiskerivernsonen , med hjemmel i forskrift opprettet i medhold av svalbardloven","Fiskeridirektoratet utarbeider forskrifter om tillatelse til fiske i Svalbards territorialfarvann og i fiskerivernsonen , med hjemmel i forskrift opprettet ved res","Fiskeridirektoratet utarbeider forskrifter om tillatelse til fiske i Svalbards territorialfarvann og i fiskerivernsonen , med hjemmel i forskrift opprettet i medhold",ved res.,i medhold,opprette,ved kgl res 28 april 1978,i medhold av svalbardloven,6,4,ved,i,res.,medhold,NOUN,NOUN,prepositional,prepositional,Postverbal,NorwegianBokmaal
"Regelverket om ferdsel med luftfartøy som bygger på lov 11 juni 1993 nr 101 om luftfart ( luftfartsloven ) og svalbardloven , forvaltes av Luftfartsverket , med unntak av bestemmelsene i naturvernforskriften og verneforskriftene .","Regelverket om ferdsel med luftfartøy som bygger på lov 11 juni 1993 nr 101 om luftfart ( luftfartsloven ) og svalbardloven , forvaltes av Luftfartsverket","Regelverket om ferdsel med luftfartøy som bygger på lov 11 juni 1993 nr 101 om luftfart ( luftfartsloven ) og svalbardloven , forvaltes , med unntak av bestemmelsene i naturvernforskriften og verneforskriftene","Regelverket om ferdsel med luftfartøy som bygger på lov 11 juni 1993 nr 101 om luftfart ( luftfartsloven ) og svalbardloven , forvaltes av Luftfartsverket","Regelverket om ferdsel med luftfartøy som bygger på lov 11 juni 1993 nr 101 om luftfart ( luftfartsloven ) og svalbardloven , forvaltes med unntak",av Luftfartsverket,med unntak,forvalte,av Luftfartsverket,", med unntak av bestemmelsene i naturvernforskriften og verneforskriftene",2,9,av,med,Luftfartsverket,unntak,PROPN,NOUN,prepositional,prepositional,Postverbal,NorwegianBokmaal
I den forbindelse rapporterer bergmesteren til sysselmannen om forhold som kan ha betydning for miljøet .,I den forbindelse rapporterer bergmesteren til sysselmannen,I den forbindelse rapporterer bergmesteren om forhold som kan ha betydning for miljøet,I den forbindelse rapporterer bergmesteren til sysselmannen,I den forbindelse rapporterer bergmesteren om forhold,til sysselmann,om forhold,rapportere,til sysselmannen,om forhold som kan ha betydning for miljøet,2,8,til,om,sysselmann,forhold,NOUN,NOUN,prepositional,prepositional,Postverbal,NorwegianBokmaal
"En rekke oppgaver som ivaretas av kommunen på fastlandet er i Longyearbyen tillagt Svalbard Samfunnsdrift AS ( SSD ) , som er et heleiet statlig aksjeselskap underlagt Nærings- og handelsdepartementet .",En rekke oppgaver som ivaretas av kommunen,En rekke oppgaver som ivaretas på fastlandet,En rekke oppgaver som ivaretas av kommunen,En rekke oppgaver som ivaretas på fastlandet,av kommune,på fastland,ivareta,av kommunen,på fastlandet,2,2,av,på,kommune,fastland,NOUN,NOUN,prepositional,prepositional,Postverbal,NorwegianBokmaal
"Svalbardtraktaten gjelder ikke for Jan Mayen , slik at norsk myndighet kan utøves over Jan Mayen uten hensyn til begrensninger som traktaten setter .","Svalbardtraktaten gjelder ikke for Jan Mayen , slik at norsk myndighet kan utøves over Jan Mayen","Svalbardtraktaten gjelder ikke for Jan Mayen , slik at norsk myndighet kan utøves uten hensyn til begrensninger som traktaten setter","Svalbardtraktaten gjelder ikke for Jan Mayen , slik at norsk myndighet kan utøves over Jan","Svalbardtraktaten gjelder ikke for Jan Mayen , slik at norsk myndighet kan utøves uten hensyn",over Jan,uten hensyn,utøve,over Jan Mayen,uten hensyn til begrensninger som traktaten setter,3,7,over,uten,Jan,hensyn,PROPN,NOUN,prepositional,prepositional,Postverbal,NorwegianBokmaal
Øya ligger i overgangen mellom arktisk og borealt klima med en månedlig middeltemperatur på Midt-Jan som varierer mellom +5°C og -6°C .,Øya ligger i overgangen mellom arktisk og borealt klima,Øya ligger med en månedlig middeltemperatur på Midt-Jan som varierer mellom +5°C og -6°C,Øya ligger i overgangen,Øya ligger med middeltemperatur,i overgang,med middeltemperatur,ligge,i overgangen mellom arktisk og borealt klima,med en månedlig middeltemperatur på Midt-Jan som varierer mellom +5°C og -6°C,7,12,i,med,overgang,middeltemperatur,NOUN,NOUN,prepositional,prepositional,Postverbal,NorwegianBokmaal
"Øya har sitt navn etter den nederlandske oppdageren , og nederlenderne hadde flere hvalfangststasjoner på Jan Mayen på 1600-tallet .","Øya har sitt navn etter den nederlandske oppdageren , og nederlenderne hadde flere hvalfangststasjoner på Jan Mayen","Øya har sitt navn etter den nederlandske oppdageren , og nederlenderne hadde flere hvalfangststasjoner på 1600-tallet","Øya har sitt navn etter den nederlandske oppdageren , og nederlenderne hadde flere hvalfangststasjoner på Jan","Øya har sitt navn etter den nederlandske oppdageren , og nederlenderne hadde flere hvalfangststasjoner på 1600-tallet",på Jan,på 1600-tall,ha,på Jan Mayen,på 1600-tallet,3,2,på,på,Jan,1600-tall,PROPN,NOUN,prepositional,prepositional,Postverbal,NorwegianBokmaal
"Oljen tas inn på nordsiden og lagres dels der , dels på sørsiden , og transporteres over land i en overjordisk rørledning .","Oljen tas inn på nordsiden og lagres dels der , dels på sørsiden , og transporteres over land","Oljen tas inn på nordsiden og lagres dels der , dels på sørsiden , og transporteres i en overjordisk rørledning","Oljen tas inn på nordsiden og lagres dels der , dels på sørsiden , og transporteres over land","Oljen tas inn på nordsiden og lagres dels der , dels på sørsiden , og transporteres i rørledning",over land,i rørledning,transportere,over land,i en overjordisk rørledning,2,4,over,i,land,rørledning,NOUN,NOUN,prepositional,prepositional,Postverbal,NorwegianBokmaal
Sommerstid kan imidlertid enkelte turister ta seg i land fra båter når værforholdene tillater det .,Sommerstid kan imidlertid enkelte turister ta seg i land,Sommerstid kan imidlertid enkelte turister ta seg fra båter,Sommerstid kan imidlertid enkelte turister ta seg i land,Sommerstid kan imidlertid enkelte turister ta seg fra båter,i land,fra båt,ta,i land,fra båter,2,2,i,fra,land,båt,NOUN,NOUN,prepositional,prepositional,Postverbal,NorwegianBokmaal
Annen lovgivning gjelder for Jan Mayen bare i den utstrekning det er bestemt .,Annen lovgivning gjelder for Jan Mayen,Annen lovgivning gjelder bare i den utstrekning det er bestemt,Annen lovgivning gjelder for Jan,Annen lovgivning gjelder i utstrekning,for Jan,i utstrekning,gjelde,for Jan Mayen,bare i den utstrekning det er bestemt,3,7,for,i,Jan,utstrekning,PROPN,NOUN,prepositional,prepositional,Postverbal,NorwegianBokmaal
"Etterat arvingene overdro sine rettigheter til staten i 1952 , er all grunn , bygninger , anlegg og levninger statseiendom , jf også Jan Mayen-loven § 3 .",Etterat arvingene overdro sine rettigheter til staten,Etterat arvingene overdro sine rettigheter i 1952,Etterat arvingene overdro sine rettigheter til staten,Etterat arvingene overdro sine rettigheter i 1952,til stat,i 1952,overdra,til staten,i 1952,2,2,til,i,stat,1952,NOUN,NUM,prepositional,prepositional,Postverbal,NorwegianBokmaal
Mot Grønland er sonegrensen trukket opp ved Den internasjonale domstols dom i Jan Mayen-saken mellom Danmark og Norge i 1993 ( ICJ Reports 1993 s 38 flg ) .,Mot Grønland er sonegrensen trukket opp ved Den internasjonale domstols dom i Jan Mayen-saken mellom Danmark og Norge,Mot Grønland er sonegrensen trukket opp i 1993,Mot Grønland er sonegrensen trukket opp ved dom,Mot Grønland er sonegrensen trukket opp i 1993,ved dom,i 1993,trekke,ved Den internasjonale domstols dom i Jan Mayen-saken mellom Danmark og Norge,i 1993,12,2,ved,i,dom,1993,NOUN,NUM,prepositional,prepositional,Postverbal,NorwegianBokmaal
"Domfelte trodde dermed at forholdet til henne var like fast og varmt , i hver fall frem til Elin flyttet inn i Skaregata i midten av oktober .","Domfelte trodde dermed at forholdet til henne var like fast og varmt , i hver fall frem til Elin flyttet inn i Skaregata","Domfelte trodde dermed at forholdet til henne var like fast og varmt , i hver fall frem til Elin flyttet i midten av oktober","Domfelte trodde dermed at forholdet til henne var like fast og varmt , i hver fall frem til Elin flyttet inn i Skaregata","Domfelte trodde dermed at forholdet til henne var like fast og varmt , i hver fall frem til Elin flyttet i midten",inn i Skaregata,i midt,flytte,inn i Skaregata,i midten av oktober,3,4,inn i,i,Skaregata,midt,PROPN,NOUN,prepositional,prepositional,Postverbal,NorwegianBokmaal
Deretter dro han til Skaregata 2 uten pistol .,Deretter dro han til Skaregata 2,Deretter dro han uten pistol,Deretter dro han til Skaregata,Deretter dro han uten pistol,til Skaregata,uten pistol,dra,til Skaregata 2,uten pistol,3,2,til,uten,Skaregata,pistol,PROPN,NOUN,prepositional,prepositional,Postverbal,NorwegianBokmaal
"Faren er klart til stede for en gjentakelse av det som skjedde for to år siden , da Hødd rykte ned fra eliteserien etter siste kamp på Lerkendal .","Faren er klart til stede for en gjentakelse av det som skjedde for to år siden , da Hødd rykte ned fra eliteserien","Faren er klart til stede for en gjentakelse av det som skjedde for to år siden , da Hødd rykte etter siste kamp på Lerkendal","Faren er klart til stede for en gjentakelse av det som skjedde for to år siden , da Hødd rykte ned fra eliteserien","Faren er klart til stede for en gjentakelse av det som skjedde for to år siden , da Hødd rykte etter kamp",ned fra eliteserie,etter kamp,rykke,ned fra eliteserien,etter siste kamp på Lerkendal,3,5,ned fra,etter,eliteserie,kamp,NOUN,NOUN,prepositional,prepositional,Postverbal,NorwegianBokmaal
Stein Holsvik satte seg sjøl utenfor da han fikk en kvist i øyet under hagearbeid .,Stein Holsvik satte seg sjøl utenfor da han fikk en kvist i øyet,Stein Holsvik satte seg sjøl utenfor da han fikk en kvist under hagearbeid,Stein Holsvik satte seg sjøl utenfor da han fikk en kvist i øyet,Stein Holsvik satte seg sjøl utenfor da han fikk en kvist under hagearbeid,i øye,under hagearbeid,få,i øyet,under hagearbeid,2,2,i,under,øye,hagearbeid,NOUN,NOUN,prepositional,prepositional,Postverbal,NorwegianBokmaal
"Harald Aasland Riise måtte tas ut etter halvtimen p.g.a. problemer etter sjukdom , og baneforhold som slett ikke passet tungvekteren .",Harald Aasland Riise måtte tas ut etter halvtimen,"Harald Aasland Riise måtte tas ut p.g.a. problemer etter sjukdom , og baneforhold som slett ikke passet tungvekteren",Harald Aasland Riise måtte tas ut etter halvtimen,Harald Aasland Riise måtte tas ut p.g.a. problemer,etter halvtime,pga. problem,ta,etter halvtimen,"p.g.a. problemer etter sjukdom , og baneforhold som slett ikke passet tungvekteren",2,12,etter,pga.,halvtime,problem,NOUN,NOUN,prepositional,prepositional,Postverbal,NorwegianBokmaal
Bengt Sæternes fikk pirke ballen over linja fra en meters hold .,Bengt Sæternes fikk pirke ballen over linja,Bengt Sæternes fikk pirke ballen fra en meters hold,Bengt Sæternes fikk pirke ballen over linja,Bengt Sæternes fikk pirke ballen fra hold,over linje,fra hold,pirke,over linja,fra en meters hold,2,4,over,fra,linje,hold,NOUN,NOUN,prepositional,prepositional,Postverbal,NorwegianBokmaal
Hødd har sviktet på heimebane i høst .,Hødd har sviktet på heimebane,Hødd har sviktet i høst,Hødd har sviktet på heimebane,Hødd har sviktet i høst,på heimebane,i høst,svikte,på heimebane,i høst,2,2,på,i,heimebane,høst,NOUN,NOUN,prepositional,prepositional,Postverbal,NorwegianBokmaal
Fire av de fem siste heimekampene endte uten poeng for laget som vanligvis tar godt med poeng på høsttung Høddvoll-matte .,Fire av de fem siste heimekampene endte uten poeng,Fire av de fem siste heimekampene endte for laget som vanligvis tar godt med poeng på høsttung Høddvoll-matte,Fire av de fem siste heimekampene endte uten poeng,Fire av de fem siste heimekampene endte for laget,uten poeng,for lag,ende,uten poeng,for laget som vanligvis tar godt med poeng på høsttung Høddvoll-matte,2,11,uten,for,poeng,lag,NOUN,NOUN,prepositional,prepositional,Postverbal,NorwegianBokmaal
"- Å ta barnet fra foreldrene på det grunnlaget som her er gjort , ville aldri skjedd for eksempel i Oslo .",- Å ta barnet fra foreldrene,- Å ta barnet på det grunnlaget som her er gjort,- Å ta barnet fra foreldrene,- Å ta barnet på grunnlaget,fra forelder,på grunnlag,ta,fra foreldrene,på det grunnlaget som her er gjort,2,7,fra,på,forelder,grunnlag,NOUN,NOUN,prepositional,prepositional,Postverbal,NorwegianBokmaal
