Sentence,Context_PP1,Context_PP2,Context_PP1_simple,Context_PP2_simple,PP1_simple,PP2_simple,Verb,PP1,PP2,PP1_len,PP2_len,Adp1,Adp2,NP1,NP2,PP1_Pronom,PP2_Pronom,PP1_Type,PP2_Type,Position,Language
"Nie wiadomo z góry , czy zima będzie ciepła czy mroźna i dlatego przedsiębiorstwa ogrzewcze muszą na wszelki wypadek zamawiać w elektrociepłowni ciepło "" z zapasem "" .","Nie wiadomo z góry , czy zima będzie ciepła czy mroźna i dlatego przedsiębiorstwa ogrzewcze muszą na wszelki wypadek zamawiać w elektrociepłowni","Nie wiadomo z góry , czy zima będzie ciepła czy mroźna i dlatego przedsiębiorstwa ogrzewcze muszą na wszelki wypadek zamawiać "" z zapasem ""","Nie wiadomo z góry , czy zima będzie ciepła czy mroźna i dlatego przedsiębiorstwa ogrzewcze muszą na wszelki wypadek zamawiać w elektrociepłowni","Nie wiadomo z góry , czy zima będzie ciepła czy mroźna i dlatego przedsiębiorstwa ogrzewcze muszą na wszelki wypadek zamawiać z zapasem",w elektrociepłownia,z zapas,zamawiać,w elektrociepłowni,""" z zapasem """,2,4,w,z,elektrociepłownia,zapas,NOUN,NOUN,prepositional,prepositional,Postverbal,Polish
"W razie niepowodzenia i utraty kontroli trafisz prosto do "" czubków "" z rozpoznaniem - schizofrenia i nikt Ci nie będzie w stanie pomóć .","W razie niepowodzenia i utraty kontroli trafisz prosto do "" czubków """,W razie niepowodzenia i utraty kontroli trafisz z rozpoznaniem - schizofrenia,W razie niepowodzenia i utraty kontroli trafisz do czubków,W razie niepowodzenia i utraty kontroli trafisz z rozpoznaniem,do czubek,z rozpoznanie,trafić,"prosto do "" czubków """,z rozpoznaniem - schizofrenia,5,4,do,z,czubek,rozpoznanie,NOUN,NOUN,prepositional,prepositional,Postverbal,Polish
"Po naszym telefonie na miejscu pojawiła się policja , by ocenić , czy jest to krzew znajdujący się na liście zakazanych używek halucynogennych .",Po naszym telefonie,na miejscu,Po telefonie,na miejscu,po telefon,na miejsce,pojawić,Po naszym telefonie,na miejscu,3,2,po,na,telefon,miejsce,NOUN,NOUN,prepositional,prepositional,Preverbal,Polish
"2 . Na kontach ksiąg pomocniczych można w ciągu okresu sprawozdawczego stosować , obok lub zamiast jednostek pieniężnych , jednostki naturalne .",2 . Na kontach ksiąg pomocniczych,2 . w ciągu okresu sprawozdawczego,2 . Na kontach,2 . w okresu,na konto,w okres,stosować,Na kontach ksiąg pomocniczych,w ciągu okresu sprawozdawczego,4,4,na,w,konto,okres,NOUN,NOUN,prepositional,prepositional,Preverbal,Polish
"- Dotarli śmy do świadków , którzy twierdzą , że wbrew temu , co można było dotąd usłyszeć , wobec uczestników manifestacji użyto siły , czyli mówiąc wprost - brutalnie ich bito pałkami - tłumaczy prokurator .","- Dotarli śmy do świadków , którzy twierdzą , że wbrew temu , co można było dotąd usłyszeć ,","- Dotarli śmy do świadków , którzy twierdzą , że wobec uczestników manifestacji","- Dotarli śmy do świadków , którzy twierdzą , że wbrew temu","- Dotarli śmy do świadków , którzy twierdzą , że wobec uczestników",wbrew to,wobec uczestnik,użyć,"wbrew temu , co można było dotąd usłyszeć ,",wobec uczestników manifestacji,9,3,wbrew,wobec,to,uczestnik,PRON,NOUN,prepositional,prepositional,Preverbal,Polish
"Ta chwila pomiędzy już i nigdy jest czasem , gdy energia objawia się tutaj , w tobie , przez ciebie .","Ta chwila pomiędzy już i nigdy jest czasem , gdy energia objawia się tutaj , w tobie","Ta chwila pomiędzy już i nigdy jest czasem , gdy energia objawia się tutaj , przez ciebie","Ta chwila pomiędzy już i nigdy jest czasem , gdy energia objawia się tutaj , w tobie","Ta chwila pomiędzy już i nigdy jest czasem , gdy energia objawia się tutaj , przez ciebie",w ty,przez ty,objawiać,w tobie,przez ciebie,2,2,w,przez,ty,ty,PRON,PRON,prepositional,prepositional,Postverbal,Polish
"W przedostatnim w 1999 roku numerze "" Polityki "" , pod nową winietą Dwa Jerze . . . , ukazała się podwójna recenzja , Jerzego Waldorffa i Jerzego Kisielewskiego , poznańskiego koncertu Krystiana Zimermana .","W przedostatnim w 1999 roku numerze "" Polityki """,", pod nową winietą Dwa Jerze . . . ,",W numerze,pod winietą,w numer,pod winieta,ukazać,"W przedostatnim w 1999 roku numerze "" Polityki """,", pod nową winietą Dwa Jerze . . . ,",9,10,w,pod,numer,winieta,NOUN,NOUN,prepositional,prepositional,Preverbal,Polish
"Przed kilkoma dniami z Sądu Wojewódzkiego w Nowym Sączu nadeszły dokumenty , potwierdzające osobowość prawną Centrum Przewodnictwa Tatrzańskiego , które zostało zarejestrowane jako związek stowarzyszeń w dniu 16 lipca br .",Przed kilkoma dniami,z Sądu Wojewódzkiego w Nowym Sączu,Przed dniami,z Sądu,przed dzień,z sąd,nadejść,Przed kilkoma dniami,z Sądu Wojewódzkiego w Nowym Sączu,3,6,przed,z,dzień,sąd,NOUN,NOUN,prepositional,prepositional,Preverbal,Polish
W roku 1912 Olga w związku z kolejną przygotowującą się pod jej nieobecność wystawą zasięgnęła rady Sainsèrea przy wyborze obrazów .,W roku 1912,w związku z kolejną przygotowującą się pod jej nieobecność wystawą,W roku,w wystawą,w rok,w wystawa,zasięgnąć,W roku 1912,w związku z kolejną przygotowującą się pod jej nieobecność wystawą,3,10,w,w,rok,wystawa,NOUN,NOUN,prepositional,prepositional,Preverbal,Polish
"4 . W czasie pełnienia służby dyżurnej na bluzie polowej ( ćwiczebnej ) , koszuli polowej z krótkimi rękawami lub kurtce polowej i kurtce zimowej nieprzemakalnej koloru czarnego ( z wyjątkiem służby dyżurnej operacyjnej ) nosi się plakietkę z napisem : "" SŁUŻBA DYŻURNA "" przymocowaną do klapki prawej górnej kieszeni .","4 . W czasie pełnienia służby dyżurnej na bluzie polowej ( ćwiczebnej ) , koszuli polowej z krótkimi rękawami lub kurtce polowej i kurtce zimowej nieprzemakalnej koloru czarnego ( z wyjątkiem służby dyżurnej operacyjnej )","4 . na bluzie polowej ( ćwiczebnej ) , koszuli polowej z krótkimi rękawami lub kurtce polowej i kurtce zimowej nieprzemakalnej koloru czarnego",4 . W pełnienia,4 . na bluzie,w pełnić,na bluza,nosić,"W czasie pełnienia służby dyżurnej na bluzie polowej ( ćwiczebnej ) , koszuli polowej z krótkimi rękawami lub kurtce polowej i kurtce zimowej nieprzemakalnej koloru czarnego ( z wyjątkiem służby dyżurnej operacyjnej )","na bluzie polowej ( ćwiczebnej ) , koszuli polowej z krótkimi rękawami lub kurtce polowej i kurtce zimowej nieprzemakalnej koloru czarnego",33,21,w,na,pełnić,bluza,NOUN,NOUN,prepositional,prepositional,Preverbal,Polish
Siedzi na ławeczce w kąciku krużganka .,Siedzi na ławeczce,Siedzi w kąciku krużganka,Siedzi na ławeczce,Siedzi w kąciku,na ławeczka,w kącik,siedzieć,na ławeczce,w kąciku krużganka,2,3,na,w,ławeczka,kącik,NOUN,NOUN,prepositional,prepositional,Postverbal,Polish
"Groch , fasola czy koniczyna , żyjąc w symbiozie z tymi bakteriami , są prawie niezależne od zawartości azotu w podłożu .","Groch , fasola czy koniczyna , żyjąc w symbiozie","Groch , fasola czy koniczyna , żyjąc z tymi bakteriami","Groch , fasola czy koniczyna , żyjąc w symbiozie","Groch , fasola czy koniczyna , żyjąc z bakteriami",w symbioza,z bakteria,żyć,w symbiozie,z tymi bakteriami,2,3,w,z,symbioza,bakteria,NOUN,NOUN,prepositional,prepositional,Postverbal,Polish
"Lubił em wracać do wioski o zmierzchu , gdy ze zmęczenia nie chciało się już nawet mówić , a milczenie było usprawiedliwioną i zasłużoną chwilą wytchnienia , nie krępowało , nie wymuszało obowiązku podtrzymywania rozmowy .",Lubił em wracać do wioski,"Lubił em wracać o zmierzchu , gdy ze zmęczenia nie chciało się już nawet mówić , a milczenie było usprawiedliwioną i zasłużoną chwilą wytchnienia , nie krępowało , nie wymuszało obowiązku podtrzymywania rozmowy",Lubił em wracać do wioski,Lubił em wracać o zmierzchu,do wioska,o zmierzch,wracać,do wioski,"o zmierzchu , gdy ze zmęczenia nie chciało się już nawet mówić , a milczenie było usprawiedliwioną i zasłużoną chwilą wytchnienia , nie krępowało , nie wymuszało obowiązku podtrzymywania rozmowy",2,30,do,o,wioska,zmierzch,NOUN,NOUN,prepositional,prepositional,Postverbal,Polish
"Zgodnie z nimi rosyjski produkt krajowy brutto zmalał w ubiegłym roku o 17 proc . , a od końca 1991 roku , kiedy rozpoczęto reformowanie gospodarki , skurczył się aż o 50 proc .",Zgodnie z nimi rosyjski produkt krajowy brutto zmalał w ubiegłym roku,Zgodnie z nimi rosyjski produkt krajowy brutto zmalał o 17 proc .,Zgodnie z nimi rosyjski produkt krajowy brutto zmalał w roku,Zgodnie z nimi rosyjski produkt krajowy brutto zmalał o proc,w rok,o procent,zmaleć,w ubiegłym roku,o 17 proc .,3,4,w,o,rok,procent,NOUN,X,prepositional,prepositional,Postverbal,Polish
"Shirley : Zapewniam cię , że chłopaki lubią sobie poszaleć w hotelu po koncercie .","Shirley : Zapewniam cię , że chłopaki lubią sobie poszaleć w hotelu","Shirley : Zapewniam cię , że chłopaki lubią sobie poszaleć po koncercie","Shirley : Zapewniam cię , że chłopaki lubią sobie poszaleć w hotelu","Shirley : Zapewniam cię , że chłopaki lubią sobie poszaleć po koncercie",w hotel,po koncert,poszaleć,w hotelu,po koncercie,2,2,w,po,hotel,koncert,NOUN,NOUN,prepositional,prepositional,Postverbal,Polish
Na przejście drogowe w Budzisku około 6.00 rano podjechał specjalistyczny autobus z przyczepą - warsztatem na motocykle .,Na przejście drogowe w Budzisku,około 6.00,Na przejście,około 6.00,na przejście,około 6.00,podjechać,Na przejście drogowe w Budzisku,około 6.00,5,2,na,około,przejście,6.00,NOUN,ADJ,prepositional,prepositional,Preverbal,Polish
"Również prezydent nie przybył do kombatantów na Torwar , a przecież na niego czekali .",Również prezydent nie przybył do kombatantów,Również prezydent nie przybył na Torwar,Również prezydent nie przybył do kombatantów,Również prezydent nie przybył na Torwar,do kombatant,na Torwar,przybyć,do kombatantów,na Torwar,2,2,do,na,kombatant,Torwar,NOUN,PROPN,prepositional,prepositional,Postverbal,Polish
""" Dąbrowska odnotowuje , że zarys którejś z nowel Kowalska w pośpiechu rzuciła na papier po francusku "" .",""" Dąbrowska odnotowuje , że zarys którejś z nowel Kowalska w pośpiechu rzuciła na papier",""" Dąbrowska odnotowuje , że zarys którejś z nowel Kowalska w pośpiechu rzuciła po francusku",""" Dąbrowska odnotowuje , że zarys którejś z nowel Kowalska w pośpiechu rzuciła na papier",""" Dąbrowska odnotowuje , że zarys którejś z nowel Kowalska w pośpiechu rzuciła po francusku",na papier,po francuski,rzucić,na papier,po francusku,2,2,na,po,papier,francuski,NOUN,ADJ,prepositional,prepositional,Postverbal,Polish
"- Chociaż nowe prawo dewizowe zrównało pod względem formalnoprawnym walutę polską z walutami wymienialnymi w rozliczeniach wynikających z obrotu dewizowego z zagranicą , uznanie złotego za walutę w pełni wymienialną będzie zależało od siły polskiej gospodarki .",- Chociaż nowe prawo dewizowe zrównało pod względem formalnoprawnym,- Chociaż nowe prawo dewizowe zrównało w rozliczeniach wynikających z obrotu dewizowego z zagranicą,- Chociaż nowe prawo dewizowe zrównało pod względem,- Chociaż nowe prawo dewizowe zrównało w rozliczeniach,pod wzgląd,w rozliczenie,zrównać,pod względem formalnoprawnym,w rozliczeniach wynikających z obrotu dewizowego z zagranicą,3,8,pod,w,wzgląd,rozliczenie,NOUN,NOUN,prepositional,prepositional,Postverbal,Polish
"Prawdopodobnie dlatego , że gra z nami w MŚ w Katowicach już w pierwszym meczu .","Prawdopodobnie dlatego , że gra z nami w MŚ w Katowicach","Prawdopodobnie dlatego , że gra z nami w MŚ już w pierwszym meczu","Prawdopodobnie dlatego , że gra z nami w MŚ w Katowicach","Prawdopodobnie dlatego , że gra z nami w MŚ w meczu",w Katowice,w mecz,grać,w Katowicach,już w pierwszym meczu,2,4,w,w,Katowice,mecz,PROPN,NOUN,prepositional,prepositional,Postverbal,Polish
Ostatni zawodnicy maratonu przybiegli na metę nawet kilka godzin po Afrykańczyku .,Ostatni zawodnicy maratonu przybiegli na metę,Ostatni zawodnicy maratonu przybiegli nawet kilka godzin po Afrykańczyku,Ostatni zawodnicy maratonu przybiegli na metę,Ostatni zawodnicy maratonu przybiegli po Afrykańczyku,na meta,po Afrykańczyk,przybiec,na metę,nawet kilka godzin po Afrykańczyku,2,5,na,po,meta,Afrykańczyk,NOUN,PROPN,prepositional,prepositional,Postverbal,Polish
"Wiele szczęścia miała grupa uczniów z Warszawy , która wybrała się w niedzielę na pieszą wycieczkę po Karkonoszach .","Wiele szczęścia miała grupa uczniów z Warszawy , która wybrała się w niedzielę","Wiele szczęścia miała grupa uczniów z Warszawy , która wybrała się na pieszą wycieczkę po Karkonoszach","Wiele szczęścia miała grupa uczniów z Warszawy , która wybrała się w niedzielę","Wiele szczęścia miała grupa uczniów z Warszawy , która wybrała się na wycieczkę",w niedziela,na wycieczka,wybrać,w niedzielę,na pieszą wycieczkę po Karkonoszach,2,5,w,na,niedziela,wycieczka,NOUN,NOUN,prepositional,prepositional,Postverbal,Polish
"Ta nieśmiała dziewczynka , z której do dziś pozostał wielki głos i spojrzenie uwiecznione na starych zdjęciach , była zapewne ostatnim romantycznym mitem życia nierozerwalnie splecionego z pracą artysty i zapewne ostatnim wielkim mitem Francji , bo po nim zapanowały już tylko mitologie codzienności .","Ta nieśmiała dziewczynka , z której","Ta nieśmiała dziewczynka , do dziś","Ta nieśmiała dziewczynka , z której","Ta nieśmiała dziewczynka , do dziś",z który,do dziś,pozostać,z której,do dziś,2,2,z,do,który,dziś,DET,NOUN,prepositional,prepositional,Preverbal,Polish
"Natomiast właśnie w tym czasie , kiedy Agnus jeszcze znajdował się w Michniowie , oczekując na decyzję o swoim ewentualnym przyjęciu do oddziału , w Ostrowcu doszło do innej tragedii , w akcji na Fabrykę Słodyczy Amor .","Natomiast właśnie w tym czasie , kiedy Agnus jeszcze znajdował się w Michniowie , oczekując na decyzję o swoim ewentualnym przyjęciu do oddziału ,",Natomiast w Ostrowcu,Natomiast w czasie,Natomiast w Ostrowcu,w czas,w Ostrowiec,dojść,"właśnie w tym czasie , kiedy Agnus jeszcze znajdował się w Michniowie , oczekując na decyzję o swoim ewentualnym przyjęciu do oddziału ,",w Ostrowcu,23,2,w,w,czas,Ostrowiec,NOUN,PROPN,prepositional,prepositional,Preverbal,Polish
"I trzecie wydarzenie : kiedy samolot papieski , tym razem afrykańskiej linii UTA , wiózł nas do Rzymu z Wybrzeża Kości Słoniowej , ostatniego etapu kolejnej afrykańskiej wizyty Jana Pawła II , papież wszedł niespodziewanie do dziennikarskiej kabiny i rozmawiał kolejno z każdym z nas .","I trzecie wydarzenie : kiedy samolot papieski , tym razem afrykańskiej linii UTA , wiózł nas do Rzymu","I trzecie wydarzenie : kiedy samolot papieski , tym razem afrykańskiej linii UTA , wiózł nas z Wybrzeża Kości Słoniowej , ostatniego etapu kolejnej afrykańskiej wizyty Jana Pawła II ,","I trzecie wydarzenie : kiedy samolot papieski , tym razem afrykańskiej linii UTA , wiózł nas do Rzymu","I trzecie wydarzenie : kiedy samolot papieski , tym razem afrykańskiej linii UTA , wiózł nas z Wybrzeża",do Rzym,z Wybrzeże,wieźć,do Rzymu,"z Wybrzeża Kości Słoniowej , ostatniego etapu kolejnej afrykańskiej wizyty Jana Pawła II ,",2,14,do,z,Rzym,Wybrzeże,PROPN,PROPN,prepositional,prepositional,Postverbal,Polish
"Szczegółowe informacje o tym , gdzie i kiedy możemy zgłosić się po aktualny spis , pojawią się na naszych wyciągach w chwili , gdy zbiór numerów będzie już wydrukowany .","Szczegółowe informacje o tym , gdzie i kiedy możemy zgłosić się po aktualny spis , pojawią się na naszych wyciągach","Szczegółowe informacje o tym , gdzie i kiedy możemy zgłosić się po aktualny spis , pojawią się w chwili , gdy zbiór numerów będzie już wydrukowany","Szczegółowe informacje o tym , gdzie i kiedy możemy zgłosić się po aktualny spis , pojawią się na wyciągach","Szczegółowe informacje o tym , gdzie i kiedy możemy zgłosić się po aktualny spis , pojawią się w chwili",na wyciąg,w chwila,pojawić,na naszych wyciągach,"w chwili , gdy zbiór numerów będzie już wydrukowany",3,9,na,w,wyciąg,chwila,NOUN,NOUN,prepositional,prepositional,Postverbal,Polish
"We wtorek odprawa samochodów osobowych w Chyżnem odbywała się na bieżąco , zaś kierowcy ciężarówek musieli oczekiwać w kolejce po około 15 godzin .","We wtorek odprawa samochodów osobowych w Chyżnem odbywała się na bieżąco , zaś kierowcy ciężarówek musieli oczekiwać w kolejce","We wtorek odprawa samochodów osobowych w Chyżnem odbywała się na bieżąco , zaś kierowcy ciężarówek musieli oczekiwać po około 15 godzin","We wtorek odprawa samochodów osobowych w Chyżnem odbywała się na bieżąco , zaś kierowcy ciężarówek musieli oczekiwać w kolejce","We wtorek odprawa samochodów osobowych w Chyżnem odbywała się na bieżąco , zaś kierowcy ciężarówek musieli oczekiwać po godzin",w kolejka,po godzina,oczekiwać,w kolejce,po około 15 godzin,2,4,w,po,kolejka,godzina,NOUN,NOUN,prepositional,prepositional,Postverbal,Polish
- Teraz będę bez problemu puszczać sygnały do kolegi w czasie lekcji - cieszy się chłopak .,- Teraz będę bez problemu puszczać sygnały do kolegi,- Teraz będę bez problemu puszczać sygnały w czasie lekcji,- Teraz będę bez problemu puszczać sygnały do kolegi,- Teraz będę bez problemu puszczać sygnały w lekcji,do kolega,w lekcja,puszczać,do kolegi,w czasie lekcji,2,3,do,w,kolega,lekcja,NOUN,NOUN,prepositional,prepositional,Postverbal,Polish
"Do tego czasu postanowiono poskładać wszystko do kilku skrzyń , które zgodzili się przechować u siebie w szopie Jonesowie i ich najbliźsi sąsiedzi , Carrowie .","Do tego czasu postanowiono poskładać wszystko do kilku skrzyń , które zgodzili się przechować u siebie","Do tego czasu postanowiono poskładać wszystko do kilku skrzyń , które zgodzili się przechować w szopie","Do tego czasu postanowiono poskładać wszystko do kilku skrzyń , które zgodzili się przechować u siebie","Do tego czasu postanowiono poskładać wszystko do kilku skrzyń , które zgodzili się przechować w szopie",u siebie,w szopa,przechować,u siebie,w szopie,2,2,u,w,siebie,szopa,PRON,NOUN,prepositional,prepositional,Postverbal,Polish
"W 1877 roku na wniosek Walerego Eljasza - Radzikowskiego zwężeniu temu nadano miano Bramy Kraszewskiego , dla uczczenia jubileuszu 50-lecia pracy pisarza , o czym informuje tablica wmurowana po przeciwnej stronie potoku .",W 1877 roku,na wniosek Walerego Eljasza - Radzikowskiego,W roku,na wniosek,w rok,na wniosek,nadać,W 1877 roku,na wniosek Walerego Eljasza - Radzikowskiego,3,6,w,na,rok,wniosek,NOUN,NOUN,prepositional,prepositional,Preverbal,Polish
"W miniony czwartek w referendum ratyfikacyjnym Irlandia odrzuciła ten Traktat , otwierający drogę do rozszerzenia Unii .",W miniony czwartek,w referendum ratyfikacyjnym,W czwartek,w referendum,w czwartek,w referendum,odrzucić,W miniony czwartek,w referendum ratyfikacyjnym,3,3,w,w,czwartek,referendum,NOUN,NOUN,prepositional,prepositional,Preverbal,Polish
"Politycy uważający się za rewolucjonistów po zdobyciu władzy w trosce o swój wizerunek , a przede wszystkim umocnienie pozycji , dopisują sobie chwalebne karty w biografii .",Politycy uważający się za rewolucjonistów po zdobyciu władzy,"Politycy uważający się za rewolucjonistów w trosce o swój wizerunek , a przede wszystkim umocnienie pozycji ,",Politycy uważający się za rewolucjonistów po zdobyciu,Politycy uważający się za rewolucjonistów w wizerunek,po zdobyć,w wizerunek,dopisywać,po zdobyciu władzy,"w trosce o swój wizerunek , a przede wszystkim umocnienie pozycji ,",3,12,po,w,zdobyć,wizerunek,NOUN,NOUN,prepositional,prepositional,Preverbal,Polish
Rz : Fiat pokazuje na wystawie we Frankfurcie przede wszystkim małe i średnie auta z oszczędnymi silnikami .,Rz : Fiat pokazuje na wystawie,Rz : Fiat pokazuje we Frankfurcie,Rz : Fiat pokazuje na wystawie,Rz : Fiat pokazuje we Frankfurcie,na wystawa,w Frankfurt,pokazywać,na wystawie,we Frankfurcie,2,2,na,w,wystawa,Frankfurt,NOUN,PROPN,prepositional,prepositional,Postverbal,Polish
"Niejedną deskę w życiu w ten sposób połamał , nieraz pokaleczył sobie pośladki .",Niejedną deskę w życiu,Niejedną deskę w ten sposób,Niejedną deskę w życiu,Niejedną deskę w sposób,w życie,w sposób,połamać,w życiu,w ten sposób,2,3,w,w,życie,sposób,NOUN,NOUN,prepositional,prepositional,Preverbal,Polish
"Powinna pilnować dzieci - wściekał się Marcin ( 36 l . ) , który stał w tłumie gapiów przed blokiem .","Powinna pilnować dzieci - wściekał się Marcin ( 36 l . ) , który stał w tłumie gapiów","Powinna pilnować dzieci - wściekał się Marcin ( 36 l . ) , który stał przed blokiem","Powinna pilnować dzieci - wściekał się Marcin ( 36 l . ) , który stał w tłumie","Powinna pilnować dzieci - wściekał się Marcin ( 36 l . ) , który stał przed blokiem",w tłum,przed blok,stać,w tłumie gapiów,przed blokiem,3,2,w,przed,tłum,blok,NOUN,NOUN,prepositional,prepositional,Postverbal,Polish
""" Życie Warszawy "" 11 października 2000 roku jako pierwsze ujawniło , że na Pradze Południe od września 1996 r . grasuje seryjny gwałciciel , nazwany przez policjantów "" Szklarzem "" .",""" Życie Warszawy "" 11 października 2000 roku jako pierwsze ujawniło , że na Pradze Południe",""" Życie Warszawy "" 11 października 2000 roku jako pierwsze ujawniło , że od września 1996 r .",""" Życie Warszawy "" 11 października 2000 roku jako pierwsze ujawniło , że na Pradze",""" Życie Warszawy "" 11 października 2000 roku jako pierwsze ujawniło , że od września",na Praga,od wrzesień,grasować,na Pradze Południe,od września 1996 r .,3,5,na,od,Praga,wrzesień,PROPN,NOUN,prepositional,prepositional,Preverbal,Polish
"Wyszedł po chwili z tej balowej sali , ustawił nas w rzędzie , według instrumentów , skrzypce , altówka , klarnet , trąbka , puzon , perkusja i ja , saksofon .",Wyszedł po chwili,Wyszedł z tej balowej sali,Wyszedł po chwili,Wyszedł z sali,po chwila,z sala,wyjść,po chwili,z tej balowej sali,2,4,po,z,chwila,sala,NOUN,NOUN,prepositional,prepositional,Postverbal,Polish
"Dzięki jego zaangażowaniu w naszym mieście nadal funkcjonuje sekcja piłki nożnej na odpowiednim poziomie sportowym , promująca Jarosław na terenie Polski południowo - wschodniej .",Dzięki jego zaangażowaniu,w naszym mieście,Dzięki zaangażowaniu,w mieście,dzięki zaangażowanie,w miasto,funkcjonować,Dzięki jego zaangażowaniu,w naszym mieście,3,3,dzięki,w,zaangażowanie,miasto,NOUN,NOUN,prepositional,prepositional,Preverbal,Polish
"- Szczegóły są nieważne - oświadczył , gdy weszła na taras w granatowo - białym pasiastym szlafroczku .","- Szczegóły są nieważne - oświadczył , gdy weszła na taras","- Szczegóły są nieważne - oświadczył , gdy weszła w granatowo - białym pasiastym szlafroczku","- Szczegóły są nieważne - oświadczył , gdy weszła na taras","- Szczegóły są nieważne - oświadczył , gdy weszła w szlafroczku",na taras,w szlafroczek,wejść,na taras,w granatowo - białym pasiastym szlafroczku,2,6,na,w,taras,szlafroczek,NOUN,NOUN,prepositional,prepositional,Postverbal,Polish
"31 marca wskazówki zegarów przesuniemy z godziny 2 . 00 na 3 . 00 , która będzie godziną początkową czasu letniego .",31 marca wskazówki zegarów przesuniemy z godziny 2 . 00,"31 marca wskazówki zegarów przesuniemy na 3 . 00 , która będzie godziną początkową czasu letniego",31 marca wskazówki zegarów przesuniemy z godziny,31 marca wskazówki zegarów przesuniemy na 3,z godzina,na 3,przesunąć,z godziny 2 . 00,"na 3 . 00 , która będzie godziną początkową czasu letniego",5,11,z,na,godzina,3,NOUN,ADJ,prepositional,prepositional,Postverbal,Polish
"Do 1945 Bielsko znane było jako ośrodek niemczyzny na ziemi cieszyńskiej , w którym Polacy w 1910 stanowili zaledwie 15 % ogółu mieszkańców .","Do 1945 Bielsko znane było jako ośrodek niemczyzny na ziemi cieszyńskiej , w którym","Do 1945 Bielsko znane było jako ośrodek niemczyzny na ziemi cieszyńskiej , w 1910","Do 1945 Bielsko znane było jako ośrodek niemczyzny na ziemi cieszyńskiej , w którym","Do 1945 Bielsko znane było jako ośrodek niemczyzny na ziemi cieszyńskiej , w 1910",w który,w 1910,stanowić,w którym,w 1910,2,2,w,w,który,1910,DET,ADJ,prepositional,prepositional,Preverbal,Polish
"Od momentu , gdy Hitler i Keitel włączyli rozrusznik niemieckiej machiny wojennej , dla Polski czynnik czasu zaczął odgrywać istotną rolę .","Od momentu , gdy Hitler i Keitel włączyli rozrusznik niemieckiej machiny wojennej ,",dla Polski,Od momentu,dla Polski,od moment,dla Polska,zacząć,"Od momentu , gdy Hitler i Keitel włączyli rozrusznik niemieckiej machiny wojennej ,",dla Polski,13,2,od,dla,moment,Polska,NOUN,PROPN,prepositional,prepositional,Preverbal,Polish
"Siedział odchylony za swoim biurkiem z taką miną , jakby dowodził całą policją , Interpolem i FBI na dodatek i delektował się kawą .",Siedział odchylony za swoim biurkiem,"Siedział odchylony z taką miną , jakby dowodził całą policją , Interpolem i FBI na dodatek",Siedział odchylony za biurkiem,Siedział odchylony z miną,za biurko,z mina,siedzieć,za swoim biurkiem,"z taką miną , jakby dowodził całą policją , Interpolem i FBI na dodatek",3,14,za,z,biurko,mina,NOUN,NOUN,prepositional,prepositional,Postverbal,Polish
