Sentence,Context_PP1,Context_PP2,Context_PP1_simple,Context_PP2_simple,PP1_simple,PP2_simple,Verb,PP1,PP2,PP1_len,PP2_len,Adp1,Adp2,NP1,NP2,PP1_Pronom,PP2_Pronom,PP1_Type,PP2_Type,Position,Language
Przyszedł do nas po kolędzie .,Przyszedł do nas,Przyszedł po kolędzie,Przyszedł do nas,Przyszedł po kolędzie,do my,po kolęda,przyjść,do nas,po kolędzie,2,2,do,po,my,kolęda,PRON,NOUN,prepositional,prepositional,Postverbal,Polish
Ograniczenie szybkości obowiązuje tutaj od soboty z powodu rutynowych prac konserwatorskich .,Ograniczenie szybkości obowiązuje tutaj od soboty,Ograniczenie szybkości obowiązuje tutaj z powodu rutynowych prac konserwatorskich,Ograniczenie szybkości obowiązuje tutaj od soboty,Ograniczenie szybkości obowiązuje tutaj z prac,od sobota,z praca,obowiązywać,od soboty,z powodu rutynowych prac konserwatorskich,2,5,od,z,sobota,praca,NOUN,NOUN,prepositional,prepositional,Postverbal,Polish
W Olsztynie pod drzwiami szpitalnymi zmarły ostatnio dwie osoby .,W Olsztynie,pod drzwiami szpitalnymi,W Olsztynie,pod drzwiami,w Olsztyn,pod drzwi,zemrzeć,W Olsztynie,pod drzwiami szpitalnymi,2,3,w,pod,Olsztyn,drzwi,PROPN,NOUN,prepositional,prepositional,Preverbal,Polish
Na koniec wyniki podliczono by w blasku jupiterów na wielkiej konwencji ogólnopolskiej .,Na koniec wyniki podliczono by w blasku jupiterów,Na koniec wyniki podliczono by na wielkiej konwencji ogólnopolskiej,Na koniec wyniki podliczono by w blasku,Na koniec wyniki podliczono by na konwencji,w blask,na konwencja,podliczyć,w blasku jupiterów,na wielkiej konwencji ogólnopolskiej,3,4,w,na,blask,konwencja,NOUN,NOUN,prepositional,prepositional,Postverbal,Polish
"Sukienka podłużona tiulową falbaną , bo w ciągu miesiąca od kupna wyrosła z niej tyczka grochowa , już krzywo ma wianek z perełkami , w deszczu na marne pójdzie matki staranie .","Sukienka podłużona tiulową falbaną , bo w ciągu miesiąca od kupna wyrosła z niej tyczka grochowa , już krzywo ma wianek z perełkami , w deszczu","Sukienka podłużona tiulową falbaną , bo w ciągu miesiąca od kupna wyrosła z niej tyczka grochowa , już krzywo ma wianek z perełkami , na marne","Sukienka podłużona tiulową falbaną , bo w ciągu miesiąca od kupna wyrosła z niej tyczka grochowa , już krzywo ma wianek z perełkami , w deszczu","Sukienka podłużona tiulową falbaną , bo w ciągu miesiąca od kupna wyrosła z niej tyczka grochowa , już krzywo ma wianek z perełkami , na marne",w deszcz,na marny,pójść,w deszczu,na marne,2,2,w,na,deszcz,marny,NOUN,ADJ,prepositional,prepositional,Preverbal,Polish
Kinga Baranowska : - Wbrew pozorom wypadków w górach jest bardzo mało .,Kinga Baranowska : - Wbrew pozorom,Kinga Baranowska : - w górach,Kinga Baranowska : - Wbrew pozorom,Kinga Baranowska : - w górach,wbrew pozór,w góra,być,Wbrew pozorom,w górach,2,2,wbrew,w,pozór,góra,NOUN,NOUN,prepositional,prepositional,Preverbal,Polish
"Wskaźnik oddanych na niego głosów w ciągu paru godzin urósł na oczach całego kraju do 52,9 procent .",Wskaźnik oddanych na niego głosów w ciągu paru godzin urósł na oczach całego kraju,"Wskaźnik oddanych na niego głosów w ciągu paru godzin urósł do 52,9 procent",Wskaźnik oddanych na niego głosów w ciągu paru godzin urósł na oczach,Wskaźnik oddanych na niego głosów w ciągu paru godzin urósł do procent,na oko,do procent,urosnąć,na oczach całego kraju,"do 52,9 procent",4,3,na,do,oko,procent,NOUN,NOUN,prepositional,prepositional,Postverbal,Polish
"Wczoraj Tula przywiozła mi tulipan , "" za własne zarobione pieniądze "" i sok z marchwi , który na poczekaniu z wielkim łaknieniem wyduldała m .","Wczoraj Tula przywiozła mi tulipan , "" za własne zarobione pieniądze "" i sok z marchwi , który na poczekaniu","Wczoraj Tula przywiozła mi tulipan , "" za własne zarobione pieniądze "" i sok z marchwi , który z wielkim łaknieniem","Wczoraj Tula przywiozła mi tulipan , "" za własne zarobione pieniądze "" i sok z marchwi , który na poczekaniu","Wczoraj Tula przywiozła mi tulipan , "" za własne zarobione pieniądze "" i sok z marchwi , który z łaknieniem",na poczekanie,z łaknienie,wyduldać,na poczekaniu,z wielkim łaknieniem,2,3,na,z,poczekanie,łaknienie,NOUN,NOUN,prepositional,prepositional,Preverbal,Polish
"Wróciła i przez pół roku przy łóżku ojca siedziała , a potem , gdy zmarł , do szkoły tej paskudnej nie odjechała i , nie czekając końca żałoby , za młodego organistę , Bogusza , wyszła , choć matka dla syna inną partię , Annę od młynarza , bogacza na Kaleń i okolicę , zamówioną miała .",Wróciła i przez pół roku,Wróciła i przy łóżku ojca,Wróciła i przez roku,Wróciła i przy łóżku,przez rok,przy łóżko,siedzieć,przez pół roku,przy łóżku ojca,3,3,przez,przy,rok,łóżko,NOUN,NOUN,prepositional,prepositional,Preverbal,Polish
Zmyli piasek z nóg pod kranem przy basenie i pobiegli do hotelu .,Zmyli piasek z nóg pod kranem,Zmyli piasek z nóg przy basenie,Zmyli piasek z nóg pod kranem,Zmyli piasek z nóg przy basenie,pod kran,przy basen,zmyć,pod kranem,przy basenie,2,2,pod,przy,kran,basen,NOUN,NOUN,prepositional,prepositional,Postverbal,Polish
"Po wyjściu udręczonego chłopca uśmiech odleciał z oczów Adasia jak motyl , co przysiadł na nich tylko na chwilę .","Po wyjściu udręczonego chłopca uśmiech odleciał z oczów Adasia jak motyl , co przysiadł na nich","Po wyjściu udręczonego chłopca uśmiech odleciał z oczów Adasia jak motyl , co przysiadł tylko na chwilę","Po wyjściu udręczonego chłopca uśmiech odleciał z oczów Adasia jak motyl , co przysiadł na nich","Po wyjściu udręczonego chłopca uśmiech odleciał z oczów Adasia jak motyl , co przysiadł na chwilę",na on,na chwila,przysiąść,na nich,tylko na chwilę,2,3,na,na,on,chwila,PRON,NOUN,prepositional,prepositional,Postverbal,Polish
"Atak nastąpił z bliska , w wąskiej uliczce .",Atak nastąpił z bliska,"Atak nastąpił , w wąskiej uliczce",Atak nastąpił z bliska,Atak nastąpił w uliczce,z bliski,w uliczka,nastąpić,z bliska,", w wąskiej uliczce",2,4,z,w,bliski,uliczka,ADJ,NOUN,prepositional,prepositional,Postverbal,Polish
W Świebodzinie na śmietniku znaleziono torbę z fałszywymi banknotami wartości miliarda złotych .,W Świebodzinie,na śmietniku,W Świebodzinie,na śmietniku,w Świebodzin,na śmietnik,znaleźć,W Świebodzinie,na śmietniku,2,2,w,na,Świebodzin,śmietnik,PROPN,NOUN,prepositional,prepositional,Preverbal,Polish
"Czy jednak w okresach , takich jak obecny , kiedy wymagana jest największa szybkość decyzji , zdolność przecinania gordyjskich węzłów jednym cięciem , upór , wyrzeczenie się wątpliwości ( te nieraz mają posmak defetyzmu ) - czy w tych warunkach jest miejsce dla ludzi podobnego typu - czy można stwierdzić ( i to nie tylko teoretycznie , ale doświadczalnie ) , że pojawia się przychylna dla nich zbiorowa atmosfera ?","Czy jednak w okresach , takich jak obecny , kiedy wymagana jest największa szybkość decyzji , zdolność przecinania gordyjskich węzłów jednym cięciem , upór , wyrzeczenie się wątpliwości ( te nieraz mają posmak defetyzmu )",Czy jednak w tych warunkach,Czy jednak w okresach,Czy jednak w warunkach,w okres,w warunki,być,"w okresach , takich jak obecny , kiedy wymagana jest największa szybkość decyzji , zdolność przecinania gordyjskich węzłów jednym cięciem , upór , wyrzeczenie się wątpliwości ( te nieraz mają posmak defetyzmu )",w tych warunkach,33,3,w,w,okres,warunki,NOUN,NOUN,prepositional,prepositional,Preverbal,Polish
"Solimy , dodajemy olej i janginizujemy na małym ogniu do miękkości , od czasu do czasu mieszając .","Solimy , dodajemy olej i janginizujemy na małym ogniu","Solimy , dodajemy olej i janginizujemy do miękkości","Solimy , dodajemy olej i janginizujemy na ogniu","Solimy , dodajemy olej i janginizujemy do miękkości",na ogień,do miękkość,janginizować,na małym ogniu,do miękkości,3,2,na,do,ogień,miękkość,NOUN,NOUN,prepositional,prepositional,Postverbal,Polish
Myśli kapitana poszybowały na moment do odległych Alp Julijskich i zawisły nad stylowym pensjonatem ze świerkowych bali .,Myśli kapitana poszybowały na moment,Myśli kapitana poszybowały do odległych Alp Julijskich,Myśli kapitana poszybowały na moment,Myśli kapitana poszybowały do Alp,na moment,do Alpy,poszybować,na moment,do odległych Alp Julijskich,2,4,na,do,moment,Alpy,NOUN,PROPN,prepositional,prepositional,Postverbal,Polish
"Wybuch w domu mieszkalnym w Petersburgu jest wynikiem ataku kryminalnego , ale nie ma żadnego związku z falą zamachów , która przetacza się przez Rosję od końca sierpnia - poinformowała w piątek petersburska milicja .","Wybuch w domu mieszkalnym w Petersburgu jest wynikiem ataku kryminalnego , ale nie ma żadnego związku z falą zamachów , która przetacza się przez Rosję","Wybuch w domu mieszkalnym w Petersburgu jest wynikiem ataku kryminalnego , ale nie ma żadnego związku z falą zamachów , która przetacza się od końca sierpnia","Wybuch w domu mieszkalnym w Petersburgu jest wynikiem ataku kryminalnego , ale nie ma żadnego związku z falą zamachów , która przetacza się przez Rosję","Wybuch w domu mieszkalnym w Petersburgu jest wynikiem ataku kryminalnego , ale nie ma żadnego związku z falą zamachów , która przetacza się od końca",przez Rosja,od koniec,przetaczać,przez Rosję,od końca sierpnia,2,3,przez,od,Rosja,koniec,PROPN,NOUN,prepositional,prepositional,Postverbal,Polish
"Wówczas warto pospieszyć się z odpowiedzią , bo od złożenia takiej deklaracji operator w ciągu miesiąca musi wprowadzić nowe , korzystniejsze opłaty .","Wówczas warto pospieszyć się z odpowiedzią , bo od złożenia takiej deklaracji","Wówczas warto pospieszyć się z odpowiedzią , bo w ciągu miesiąca","Wówczas warto pospieszyć się z odpowiedzią , bo od złożenia","Wówczas warto pospieszyć się z odpowiedzią , bo w miesiąca",od złożyć,w miesiąc,wprowadzić,od złożenia takiej deklaracji,w ciągu miesiąca,4,3,od,w,złożyć,miesiąc,NOUN,NOUN,prepositional,prepositional,Preverbal,Polish
"Za to w zwykły dzień tygodnia nie przeszło się przez wieś , żeby się nie natknąć na Hankego , jak z tym aparatem na piersiach , nieraz od samego rana , łowił ludzi niczym diabeł dusze i pstrykał .",Za to,w zwykły dzień tygodnia,Za to,w dzień,za to,w dzień,przejść,Za to,w zwykły dzień tygodnia,2,4,za,w,to,dzień,PRON,NOUN,prepositional,prepositional,Preverbal,Polish
"Za to w zwykły dzień tygodnia nie przeszło się przez wieś , żeby się nie natknąć na Hankego , jak z tym aparatem na piersiach , nieraz od samego rana , łowił ludzi niczym diabeł dusze i pstrykał .","Za to w zwykły dzień tygodnia nie przeszło się przez wieś , żeby się nie natknąć na Hankego , jak z tym aparatem na piersiach","Za to w zwykły dzień tygodnia nie przeszło się przez wieś , żeby się nie natknąć na Hankego , jak , nieraz od samego rana ,","Za to w zwykły dzień tygodnia nie przeszło się przez wieś , żeby się nie natknąć na Hankego , jak z aparatem","Za to w zwykły dzień tygodnia nie przeszło się przez wieś , żeby się nie natknąć na Hankego , jak od rana",z aparat,od rano,łowić,z tym aparatem na piersiach,", nieraz od samego rana ,",5,6,z,od,aparat,rano,NOUN,NOUN,prepositional,prepositional,Preverbal,Polish
Poza tym w 1997 r . Polska będzie musiała dostosować się do standardów europejskich obniżając zawartość substancji smolistych w papierosie do 15 mg .,Poza tym w 1997 r . Polska będzie musiała dostosować się do standardów europejskich obniżając zawartość substancji smolistych w papierosie,Poza tym w 1997 r . Polska będzie musiała dostosować się do standardów europejskich obniżając zawartość substancji smolistych do 15 mg,Poza tym w 1997 r . Polska będzie musiała dostosować się do standardów europejskich obniżając zawartość substancji smolistych w papierosie,Poza tym w 1997 r . Polska będzie musiała dostosować się do standardów europejskich obniżając zawartość substancji smolistych do mg,w papieros,do miligram,obniżać,w papierosie,do 15 mg,2,3,w,do,papieros,miligram,NOUN,X,prepositional,prepositional,Postverbal,Polish
"Mock uznał za absurdalną myśl , że tłusty Huhmann , mszcząc się na nim za dawne poniżenia , mógł by gdzieś przenosić ciała zabitych i łamać im kości .","Mock uznał za absurdalną myśl , że tłusty Huhmann , mszcząc się na nim","Mock uznał za absurdalną myśl , że tłusty Huhmann , mszcząc się za dawne poniżenia","Mock uznał za absurdalną myśl , że tłusty Huhmann , mszcząc się na nim","Mock uznał za absurdalną myśl , że tłusty Huhmann , mszcząc się za poniżenia",na on,za poniżenie,mścić,na nim,za dawne poniżenia,2,3,na,za,on,poniżenie,PRON,NOUN,prepositional,prepositional,Postverbal,Polish
"Do sklepów i do domów , dzięki telewizji , wjeżdża więc Santa Claus , będący bardziej poczciwym , jowialnym , rozbawionym Dziadkiem Mrozem niż statecznym biskupem z Myry , dyskretnym Świętym Mikołajem .",Do sklepów i do domów,", dzięki telewizji ,",Do sklepów,dzięki telewizji,do sklep,dzięki telewizja,wjeżdżać,Do sklepów i do domów,", dzięki telewizji ,",5,4,do,dzięki,sklep,telewizja,NOUN,NOUN,prepositional,prepositional,Preverbal,Polish
"Już w roku 1921 usłyszał em o nim po raz pierwszy , jako o komuniście .",Już w roku 1921 usłyszał em o nim po raz pierwszy,"Już w roku 1921 usłyszał em o nim , jako o komuniście",Już w roku 1921 usłyszał em o nim po raz,Już w roku 1921 usłyszał em o nim o komuniście,po raz,o komunista,usłyszeć,po raz pierwszy,", jako o komuniście",3,4,po,o,raz,komunista,NOUN,NOUN,prepositional,prepositional,Postverbal,Polish
"R’N’B okazało się po prostu wspólnym językiem dla nas , jako muzyków .",R’N’B okazało się po prostu,"R’N’B okazało się dla nas , jako muzyków",R’N’B okazało się po prostu,R’N’B okazało się dla nas,po prosty,dla my,okazać,po prostu,"dla nas , jako muzyków",2,5,po,dla,prosty,my,ADJ,PRON,prepositional,prepositional,Postverbal,Polish
"Inwestorzy zagraniczni muszą wpłacić pieniądze z góry w nadziei , że biuro maklerskie wywiąże się ze zobowiązania .",Inwestorzy zagraniczni muszą wpłacić pieniądze z góry,"Inwestorzy zagraniczni muszą wpłacić pieniądze w nadziei , że biuro maklerskie wywiąże się ze zobowiązania",Inwestorzy zagraniczni muszą wpłacić pieniądze z góry,Inwestorzy zagraniczni muszą wpłacić pieniądze w nadziei,z góra,w nadzieja,wpłacić,z góry,"w nadziei , że biuro maklerskie wywiąże się ze zobowiązania",2,10,z,w,góra,nadzieja,NOUN,NOUN,prepositional,prepositional,Postverbal,Polish
"Poza tymi trzema projektami , o prawie milion złotych zwiększono środki na zamknięcie i rekultywację II kwatery miejskiego składowiska .","Poza tymi trzema projektami ,",o prawie milion złotych,Poza projektami,o milion,poza projekt,o milion,zwiększyć,"Poza tymi trzema projektami ,",o prawie milion złotych,5,4,poza,o,projekt,milion,NOUN,NOUN,prepositional,prepositional,Preverbal,Polish
"W okresie okupacji pracuje w Krakowie przy rozbudowie Zakładów Sodowych oraz Gmachu banku Rolnego , jako kierownik robót i statyk .",W okresie okupacji pracuje w Krakowie,W okresie okupacji pracuje przy rozbudowie Zakładów Sodowych oraz Gmachu banku Rolnego,W okresie okupacji pracuje w Krakowie,W okresie okupacji pracuje przy rozbudowie,w Kraków,przy rozbudowa,pracować,w Krakowie,przy rozbudowie Zakładów Sodowych oraz Gmachu banku Rolnego,2,8,w,przy,Kraków,rozbudowa,PROPN,NOUN,prepositional,prepositional,Postverbal,Polish
"Rodzice pojechali pod Warszawę na pogrzeb kolegi ojca z wojska i zabalowali na stypie , Krzysztof z Agnieszką siedzieli w górach .",Rodzice pojechali pod Warszawę,Rodzice pojechali na pogrzeb kolegi ojca z wojska,Rodzice pojechali pod Warszawę,Rodzice pojechali na pogrzeb,pod Warszawa,na pogrzeb,pojechać,pod Warszawę,na pogrzeb kolegi ojca z wojska,2,6,pod,na,Warszawa,pogrzeb,PROPN,NOUN,prepositional,prepositional,Postverbal,Polish
"Pracuję z nim od pięciu lat , wcześniej jako instrumentariuszka i dlatego wiem , jak stresujący dla chirurga może być ciężki zabieg .",Pracuję z nim,Pracuję od pięciu lat,Pracuję z nim,Pracuję od lat,z on,od rok,pracować,z nim,od pięciu lat,2,3,z,od,on,rok,PRON,NOUN,prepositional,prepositional,Postverbal,Polish
"– Spojrzała na mnie , a w jej oczach znów ujrzał em to , co tak wiele zamieszania robiło we mnie od momentu , gdy ją zobaczył em .","– Spojrzała na mnie , a w jej oczach znów ujrzał em to , co tak wiele zamieszania robiło we mnie","– Spojrzała na mnie , a w jej oczach znów ujrzał em to , co tak wiele zamieszania robiło od momentu , gdy ją zobaczył em","– Spojrzała na mnie , a w jej oczach znów ujrzał em to , co tak wiele zamieszania robiło we mnie","– Spojrzała na mnie , a w jej oczach znów ujrzał em to , co tak wiele zamieszania robiło od momentu",w ja,od moment,robić,we mnie,"od momentu , gdy ją zobaczył em",2,7,w,od,ja,moment,PRON,NOUN,prepositional,prepositional,Postverbal,Polish
"Około 2900 listków bibuły nasączonej LSD - silnym syntetycznym narkotykiem o wartości około 115 tys . zł znaleźli stołeczni policjanci u trzech mężczyzn na warszawskim Mokotowie - poinformował wczoraj podinspektor Witold Gierałt , rzecznik prasowy komendanta stołecznej policji .",Około 2900 listków bibuły nasączonej LSD - silnym syntetycznym narkotykiem o wartości około 115 tys . zł znaleźli stołeczni policjanci u trzech mężczyzn,Około 2900 listków bibuły nasączonej LSD - silnym syntetycznym narkotykiem o wartości około 115 tys . zł znaleźli stołeczni policjanci na warszawskim Mokotowie,Około 2900 listków bibuły nasączonej LSD - silnym syntetycznym narkotykiem o wartości około 115 tys . zł znaleźli stołeczni policjanci u mężczyzn,Około 2900 listków bibuły nasączonej LSD - silnym syntetycznym narkotykiem o wartości około 115 tys . zł znaleźli stołeczni policjanci na Mokotowie,u mężczyzna,na Mokotów,znaleźć,u trzech mężczyzn,na warszawskim Mokotowie,3,3,u,na,mężczyzna,Mokotów,NOUN,PROPN,prepositional,prepositional,Postverbal,Polish
"Spojrzała m na niego , jakby w ogrodzie Sobczyńskich wysiadł przed chwilą z talerza kosmitów .","Spojrzała m na niego , jakby w ogrodzie Sobczyńskich wysiadł przed chwilą","Spojrzała m na niego , jakby w ogrodzie Sobczyńskich wysiadł z talerza kosmitów","Spojrzała m na niego , jakby w ogrodzie Sobczyńskich wysiadł przed chwilą","Spojrzała m na niego , jakby w ogrodzie Sobczyńskich wysiadł z talerza",przed chwila,z talerz,wysiąść,przed chwilą,z talerza kosmitów,2,3,przed,z,chwila,talerz,NOUN,NOUN,prepositional,prepositional,Postverbal,Polish
"- Przecież społeczeństwo stawiało temu systemowi opór od pierwszej niemal chwili : przez mówienie jasno , jaka jest prawda , przez przedstawianie swojego etosu , tak jak to zawsze robił i robi w tej chwili choćby Tygodnik Powszechny , a co może robić każdy profesor humanista , każdy asystent , każdy student w dyskusjach , na seminariach .",- Przecież społeczeństwo stawiało temu systemowi opór od pierwszej niemal chwili,"- Przecież społeczeństwo stawiało temu systemowi opór : przez mówienie jasno , jaka jest prawda , przez przedstawianie swojego etosu",- Przecież społeczeństwo stawiało temu systemowi opór od chwili,- Przecież społeczeństwo stawiało temu systemowi opór przez mówienie,od chwila,przez mówić,stawiać,od pierwszej niemal chwili,": przez mówienie jasno , jaka jest prawda , przez przedstawianie swojego etosu",4,13,od,przez,chwila,mówić,NOUN,NOUN,prepositional,prepositional,Postverbal,Polish
Lista leków za złotówkę dla osób po 65 . roku życia będzie znana dopiero po nowelizacji ustawy o ubezpieczeniu zdrowotnym - powiedział na konferencji prasowej we wtorek minister zdrowia Marek Łapiński .,Lista leków za złotówkę dla osób po 65 . roku życia będzie znana dopiero po nowelizacji ustawy o ubezpieczeniu zdrowotnym - powiedział na konferencji prasowej,Lista leków za złotówkę dla osób po 65 . roku życia będzie znana dopiero po nowelizacji ustawy o ubezpieczeniu zdrowotnym - powiedział we wtorek,Lista leków za złotówkę dla osób po 65 . roku życia będzie znana dopiero po nowelizacji ustawy o ubezpieczeniu zdrowotnym - powiedział na konferencji,Lista leków za złotówkę dla osób po 65 . roku życia będzie znana dopiero po nowelizacji ustawy o ubezpieczeniu zdrowotnym - powiedział we wtorek,na konferencja,w wtorek,powiedzieć,na konferencji prasowej,we wtorek,3,2,na,w,konferencja,wtorek,NOUN,NOUN,prepositional,prepositional,Postverbal,Polish
"Oto za chwilę na rynek wejdzie jego następca - MMS , za pomocą którego oprócz informacji tekstowych można przesyłać zdjęcia lub obraz wideo .",Oto za chwilę,Oto na rynek,Oto za chwilę,Oto na rynek,za chwila,na rynek,wejść,za chwilę,na rynek,2,2,za,na,chwila,rynek,NOUN,NOUN,prepositional,prepositional,Preverbal,Polish
"W pewnej chwili na małym ekranie ukazuje się plansza : "" Przepraszamy za zakłócenia "" .",W pewnej chwili,na małym ekranie,W chwili,na ekranie,w chwila,na ekran,ukazywać,W pewnej chwili,na małym ekranie,3,3,w,na,chwila,ekran,NOUN,NOUN,prepositional,prepositional,Preverbal,Polish
Po raz drugi w tak krótkim czasie nie potrafiła m siebie rozpoznać .,Po raz drugi,w tak krótkim czasie,Po raz,w czasie,po raz,w czas,potrafić,Po raz drugi,w tak krótkim czasie,3,4,po,w,raz,czas,NOUN,NOUN,prepositional,prepositional,Preverbal,Polish
"Po chwili jednak ocknął się , złapał za głowę i pochwycił niezmiernie ważną myśl : „ Sen jest domeną lichych detektywów ” ; Holmes przywdział płaszcz , wcisnął na głowę melonik i wyszedł z dziećmi z sąsiedztwa na sanki .","Po chwili jednak ocknął się , złapał za głowę i pochwycił niezmiernie ważną myśl : „ Sen jest domeną lichych detektywów ” ; Holmes przywdział płaszcz , wcisnął na głowę melonik i wyszedł z dziećmi z sąsiedztwa","Po chwili jednak ocknął się , złapał za głowę i pochwycił niezmiernie ważną myśl : „ Sen jest domeną lichych detektywów ” ; Holmes przywdział płaszcz , wcisnął na głowę melonik i wyszedł na sanki","Po chwili jednak ocknął się , złapał za głowę i pochwycił niezmiernie ważną myśl : „ Sen jest domeną lichych detektywów ” ; Holmes przywdział płaszcz , wcisnął na głowę melonik i wyszedł z dziećmi","Po chwili jednak ocknął się , złapał za głowę i pochwycił niezmiernie ważną myśl : „ Sen jest domeną lichych detektywów ” ; Holmes przywdział płaszcz , wcisnął na głowę melonik i wyszedł na sanki",z dziecko,na sanki,wyjść,z dziećmi z sąsiedztwa,na sanki,4,2,z,na,dziecko,sanki,NOUN,NOUN,prepositional,prepositional,Postverbal,Polish
"We wtorek koło Kukułowa silne wiatry spowodowały podniesienie stanu wody na Dziwnie , która zerwała drogę .",We wtorek,koło Kukułowa,We wtorek,koło Kukułowa,w wtorek,koło Kukułowo,spowodować,We wtorek,koło Kukułowa,2,2,w,koło,wtorek,Kukułowo,NOUN,PROPN,prepositional,prepositional,Preverbal,Polish
Stoisko Poczty Polskiej - sponsora imprezy - będzie w parku w Tarnowie Podgórnym .,Stoisko Poczty Polskiej - sponsora imprezy - będzie w parku,Stoisko Poczty Polskiej - sponsora imprezy - będzie w Tarnowie Podgórnym,Stoisko Poczty Polskiej - sponsora imprezy - będzie w parku,Stoisko Poczty Polskiej - sponsora imprezy - będzie w Tarnowie,w park,w Tarnowo,być,w parku,w Tarnowie Podgórnym,2,3,w,w,park,Tarnowo,NOUN,PROPN,prepositional,prepositional,Postverbal,Polish
"Siedział już w oknie , z nogami wystawionymi na zewnątrz , ale w porę obezwładnili go i ściągnęli z okna strażnicy miejscy .",Siedział już w oknie,"Siedział już , z nogami wystawionymi na zewnątrz",Siedział już w oknie,Siedział już z nogami,w okno,z noga,siedzieć,w oknie,", z nogami wystawionymi na zewnątrz",2,6,w,z,okno,noga,NOUN,NOUN,prepositional,prepositional,Postverbal,Polish
W 1989 roku Humphrey zaczął pracować w rezydencji premierów Wielkiej Brytanii w charakterze niezłomnego pogromcy myszy i szczurów .,W 1989 roku Humphrey zaczął pracować w rezydencji premierów Wielkiej Brytanii,W 1989 roku Humphrey zaczął pracować w charakterze niezłomnego pogromcy myszy i szczurów,W 1989 roku Humphrey zaczął pracować w rezydencji,W 1989 roku Humphrey zaczął pracować w pogromcy,w rezydencja,w pogromca,pracować,w rezydencji premierów Wielkiej Brytanii,w charakterze niezłomnego pogromcy myszy i szczurów,5,7,w,w,rezydencja,pogromca,NOUN,NOUN,prepositional,prepositional,Postverbal,Polish
