Sentence,Context_PP1,Context_PP2,Context_PP1_simple,Context_PP2_simple,PP1_simple,PP2_simple,Verb,PP1,PP2,PP1_len,PP2_len,Adp1,Adp2,NP1,NP2,PP1_Pronom,PP2_Pronom,PP1_Type,PP2_Type,Position,Language
"Кода "" : з перших же слів зал ціпеніє , і ти читаєш у гробовій тиші - з відчуттям , ніби ріжеш по живому .","Кода "" : з перших же слів зал ціпеніє , і ти читаєш у гробовій тиші","Кода "" : з перших же слів зал ціпеніє , і ти читаєш - з відчуттям , ніби ріжеш по живому","Кода "" : з перших же слів зал ціпеніє , і ти читаєш у тиші","Кода "" : з перших же слів зал ціпеніє , і ти читаєш з відчуттям",у тиша,з відчуття,читати,у гробовій тиші,"- з відчуттям , ніби ріжеш по живому",3,8,у,з,тиша,відчуття,NOUN,NOUN,prepositional,prepositional,Postverbal,Ukrainian
"А після слів « Скільки часу вам треба , щоб спакуватись , коли на порозі вашого дому стануть люди з автоматами й скажуть вам : виносьтеся , транспорт жде ? » - по залу пробігає легенький дрижачок електричного струму , і десь у задніх рядах чоловічий голос стиха буркає , собі під носа :","А після слів « Скільки часу вам треба , щоб спакуватись , коли на порозі вашого дому стануть люди з автоматами й скажуть вам : виносьтеся , транспорт жде ? »",А по залу,А після слів,А по залу,після слово,по зал,пробігати,"після слів « Скільки часу вам треба , щоб спакуватись , коли на порозі вашого дому стануть люди з автоматами й скажуть вам : виносьтеся , транспорт жде ? »",по залу,30,2,після,по,слово,зал,NOUN,NOUN,prepositional,prepositional,Preverbal,Ukrainian
"Це й є те , чого вам не розкажуть про Харків у жодному ЗМІ .","Це й є те , чого вам не розкажуть про Харків","Це й є те , чого вам не розкажуть у жодному ЗМІ","Це й є те , чого вам не розкажуть про Харків","Це й є те , чого вам не розкажуть у ЗМІ",про Харків,у ЗМІ,розказати,про Харків,у жодному ЗМІ,2,3,про,у,Харків,ЗМІ,PROPN,NOUN,prepositional,prepositional,Postverbal,Ukrainian
"Нагадуємо , Аушвіц - один із найбільших концентраційних таборів нацистської Німеччини , який розташували на території Польщі ( біля м . Освенцим ) впродовж 1940 - 1945 рр .","Нагадуємо , Аушвіц - один із найбільших концентраційних таборів нацистської Німеччини , який розташували на території Польщі ( біля м . Освенцим )","Нагадуємо , Аушвіц - один із найбільших концентраційних таборів нацистської Німеччини , який розташували впродовж 1940 - 1945 рр","Нагадуємо , Аушвіц - один із найбільших концентраційних таборів нацистської Німеччини , який розташували на території","Нагадуємо , Аушвіц - один із найбільших концентраційних таборів нацистської Німеччини , який розташували впродовж рр",на територія,впродовж рр.,розташувати,на території Польщі ( біля м . Освенцим ),впродовж 1940 - 1945 рр,9,5,на,впродовж,територія,рр.,NOUN,NOUN,prepositional,prepositional,Postverbal,Ukrainian
Ми обов'язково вийдемо з Вами на зв'язок .,Ми обов'язково вийдемо з Вами,Ми обов'язково вийдемо на зв'язок,Ми обов'язково вийдемо з Вами,Ми обов'язково вийдемо на зв'язок,з ви,на зв’язок,вийти,з Вами,на зв'язок,2,2,з,на,ви,зв’язок,PRON,NOUN,prepositional,prepositional,Postverbal,Ukrainian
Міжнародна авіакосмічна виставка AeroIndia проводиться в Індії вже в одинадцяте і за цей час стала центром з розвитку співпраці оборонних підприємств авіаційної галузі в усій Азії .,Міжнародна авіакосмічна виставка AeroIndia проводиться в Індії,Міжнародна авіакосмічна виставка AeroIndia проводиться вже в одинадцяте,Міжнародна авіакосмічна виставка AeroIndia проводиться в Індії,Міжнародна авіакосмічна виставка AeroIndia проводиться в одинадцяте,в Індія,в одинадцяте,проводитися,в Індії,вже в одинадцяте,2,3,в,в,Індія,одинадцяте,PROPN,NOUN,prepositional,prepositional,Postverbal,Ukrainian
"І завела звичку складати графік дня , спілкуватися з людьми в рамках графіку , а потім вимикати телефон і не хвилюватися , що хтось образиться .","І завела звичку складати графік дня , спілкуватися з людьми","І завела звичку складати графік дня , спілкуватися в рамках графіку","І завела звичку складати графік дня , спілкуватися з людьми","І завела звичку складати графік дня , спілкуватися в рамках",з людина,в рамка,спілкуватися,з людьми,в рамках графіку,2,3,з,в,людина,рамка,NOUN,NOUN,prepositional,prepositional,Postverbal,Ukrainian
"8 - 10 лютого у Запоріжжі , в рамках соціальної програми дружини Президента України Марини Порошенко , проходив третій етап спеціалізованих тренінгів « Інклюзивна освіта – рівень свідомості нації .",8 - 10 лютого у Запоріжжі,"8 - 10 лютого , в рамках соціальної програми дружини Президента України Марини Порошенко ,",8 - 10 лютого у Запоріжжі,8 - 10 лютого в рамках,у Запоріжжя,в рамка,проходити,у Запоріжжі,", в рамках соціальної програми дружини Президента України Марини Порошенко ,",2,11,у,в,Запоріжжя,рамка,PROPN,NOUN,prepositional,prepositional,Preverbal,Ukrainian
Замовлення тепер доставлятимуть просто на поріг покупця за допомогою безпілотних літальних апаратів та парашутів .,Замовлення тепер доставлятимуть просто на поріг покупця,Замовлення тепер доставлятимуть за допомогою безпілотних літальних апаратів та парашутів,Замовлення тепер доставлятимуть на поріг,Замовлення тепер доставлятимуть за допомогою,на поріг,за допомога,доставляти,просто на поріг покупця,за допомогою безпілотних літальних апаратів та парашутів,4,7,на,за,поріг,допомога,NOUN,NOUN,prepositional,prepositional,Postverbal,Ukrainian
"Випробування технології проводилось протягом грудня у Кембриджі ( Великобританія ) , і , як показали результати , доставка може тривати близько 30 хвилин , що значно швидше та ефективніше , ніж доставка багатьма іншими методами .",Випробування технології проводилось протягом грудня,Випробування технології проводилось у Кембриджі ( Великобританія ),Випробування технології проводилось протягом грудня,Випробування технології проводилось у Кембриджі,протягом грудень,у Кембридж,проводитися,протягом грудня,у Кембриджі ( Великобританія ),2,5,протягом,у,грудень,Кембридж,NOUN,PROPN,prepositional,prepositional,Postverbal,Ukrainian
Зареєструйтеся і сплачуйте регулярні рахунки без комісії протягом перших 2-х місяців * разом з нами !,Зареєструйтеся і сплачуйте регулярні рахунки без комісії,Зареєструйтеся і сплачуйте регулярні рахунки протягом перших 2-х місяців *,Зареєструйтеся і сплачуйте регулярні рахунки без комісії,Зареєструйтеся і сплачуйте регулярні рахунки протягом місяців,без комісія,протягом місяць,сплачувати,без комісії,протягом перших 2-х місяців *,2,5,без,протягом,комісія,місяць,NOUN,NOUN,prepositional,prepositional,Postverbal,Ukrainian
"На відміну від них я дивлюся на ті події з дистанції , не так , як безпосередні учасники , маю зовсім інший досвід їх переживання .",На відміну від них я дивлюся на ті події,На відміну від них я дивлюся з дистанції,На відміну від них я дивлюся на події,На відміну від них я дивлюся з дистанції,на подія,з дистанція,дивитися,на ті події,з дистанції,3,2,на,з,подія,дистанція,NOUN,NOUN,prepositional,prepositional,Postverbal,Ukrainian
"Я дуже чутлива до того , як події , що відбулися в Іспанії в 1936 – 1939-му , позначаються на сьогоденні .","Я дуже чутлива до того , як події , що відбулися в Іспанії","Я дуже чутлива до того , як події , що відбулися в 1936 – 1939-му","Я дуже чутлива до того , як події , що відбулися в Іспанії","Я дуже чутлива до того , як події , що відбулися в 1936",в Іспанія,в 1936,відбутися,в Іспанії,в 1936 – 1939-му,2,4,в,в,Іспанія,1936,PROPN,NOUN,prepositional,prepositional,Postverbal,Ukrainian
"Шановне видавництво , людина явно просто переймалася чи не є це зміщення чимось на зразок темного логотипу на ваших класичних виданнях "" Гаррі Поттера "" , яке означало свого часу підробку книги ( пам'ятаю в якомусь виданні "" Поттера "" про це згадувалося в кінці книги ) .","Шановне видавництво , людина явно просто переймалася чи не є це зміщення чимось на зразок темного логотипу на ваших класичних виданнях "" Гаррі Поттера "" , яке означало свого часу підробку книги ( пам'ятаю в якомусь виданні "" Поттера ""","Шановне видавництво , людина явно просто переймалася чи не є це зміщення чимось на зразок темного логотипу на ваших класичних виданнях "" Гаррі Поттера "" , яке означало свого часу підробку книги ( пам'ятаю про це","Шановне видавництво , людина явно просто переймалася чи не є це зміщення чимось на зразок темного логотипу на ваших класичних виданнях "" Гаррі Поттера "" , яке означало свого часу підробку книги ( пам'ятаю в виданні","Шановне видавництво , людина явно просто переймалася чи не є це зміщення чимось на зразок темного логотипу на ваших класичних виданнях "" Гаррі Поттера "" , яке означало свого часу підробку книги ( пам'ятаю про це",в видання,про це,згадуватися,"в якомусь виданні "" Поттера """,про це,6,2,в,про,видання,це,NOUN,PRON,prepositional,prepositional,Preverbal,Ukrainian
"Прочитала на Вашому сайті про книгу "" Сіроманець "" Миколи Вінграновського .",Прочитала на Вашому сайті,"Прочитала про книгу "" Сіроманець "" Миколи Вінграновського",Прочитала на сайті,Прочитала про книгу,на сайт,про книга,прочитати,на Вашому сайті,"про книгу "" Сіроманець "" Миколи Вінграновського",3,7,на,про,сайт,книга,NOUN,NOUN,prepositional,prepositional,Postverbal,Ukrainian
"Нарешті я отримала свою довгоочікувану книгу , з таким нетерпінням летіла на пошту в дощ , як не знаю що ...","Нарешті я отримала свою довгоочікувану книгу , з таким нетерпінням летіла на пошту","Нарешті я отримала свою довгоочікувану книгу , з таким нетерпінням летіла в дощ","Нарешті я отримала свою довгоочікувану книгу , з таким нетерпінням летіла на пошту","Нарешті я отримала свою довгоочікувану книгу , з таким нетерпінням летіла в дощ",на пошта,в дощ,летіти,на пошту,в дощ,2,2,на,в,пошта,дощ,NOUN,NOUN,prepositional,prepositional,Postverbal,Ukrainian
Змініть у разі необхідності налаштування браузера за зразком : - у пункті меню « Властивості » / « Зміст » / « Автозаповнення » відключити режим автозаповнення імен користувачів і паролів у формах ; - у пункті меню « Властивості » / « Додатково » / « Безпека » вибрати « Не зберігати зашифровані сторінки на диск » .,Змініть у разі необхідності,Змініть за зразком : - у пункті меню « Властивості » / « Зміст » / « Автозаповнення » відключити режим автозаповнення імен користувачів і паролів у формах ; - у пункті меню « Властивості » / « Додатково » / « Безпека » вибрати « Не зберігати зашифровані сторінки на диск »,Змініть у разі,Змініть за зразком,у раз,за зразок,змінити,у разі необхідності,за зразком : - у пункті меню « Властивості » / « Зміст » / « Автозаповнення » відключити режим автозаповнення імен користувачів і паролів у формах ; - у пункті меню « Властивості » / « Додатково » / « Безпека » вибрати « Не зберігати зашифровані сторінки на диск »,3,52,у,за,раз,зразок,NOUN,NOUN,prepositional,prepositional,Postverbal,Ukrainian
"Ввечері 2 березня , якраз напередодні дня народження Насірова , у Феофанії відбулось чергове дійство , головними дійовими особами якого були слідчі і "" напівпритомний , ледь живий "" український чиновник .","Ввечері 2 березня , якраз напередодні дня народження Насірова ,",у Феофанії,Ввечері 2,у Феофанії,ввечері 2,у Феофанія,відбутися,"Ввечері 2 березня , якраз напередодні дня народження Насірова ,",у Феофанії,10,2,ввечері,у,2,Феофанія,ADJ,PROPN,prepositional,prepositional,Preverbal,Ukrainian
"Замість акул тіньової економіки до категорії « дармоїдів » потрапили найменш забезпечені прошарки населення : матері , що перебувають у декретній відпустці , люди , які доглядають за літніми батьками або родичами - інвалідами , ті , хто працює вахтовим методом ( та й не вахтовим теж ) за кордоном , безробітні , які довгий час не можуть знайти роботу з гідною оплатою , фрилансери , представники творчих професій і навіть спортсмени , які « працюють » тільки на чемпіонатах різних рівнів .",Замість акул тіньової економіки,до категорії « дармоїдів »,Замість акул,до категорії,замість акула,до категорія,потрапити,Замість акул тіньової економіки,до категорії « дармоїдів »,4,5,замість,до,акула,категорія,NOUN,NOUN,prepositional,prepositional,Preverbal,Ukrainian
Прем’єр - міністр Великої Британії Тереза Мей першою серед іноземних лідерів зголосилася зустрітися з президентом Трампом після його інавгурації .,Прем’єр - міністр Великої Британії Тереза Мей першою серед іноземних лідерів зголосилася зустрітися з президентом Трампом,Прем’єр - міністр Великої Британії Тереза Мей першою серед іноземних лідерів зголосилася зустрітися після його інавгурації,Прем’єр - міністр Великої Британії Тереза Мей першою серед іноземних лідерів зголосилася зустрітися з президентом,Прем’єр - міністр Великої Британії Тереза Мей першою серед іноземних лідерів зголосилася зустрітися після інавгурації,з президент,після інавгурація,зустрітися,з президентом Трампом,після його інавгурації,3,3,з,після,президент,інавгурація,NOUN,NOUN,prepositional,prepositional,Postverbal,Ukrainian
"Попри те що більшість британців не приймають поглядів і політики нового президента США , Мей звернулася до колеги з теплими словами .","Попри те що більшість британців не приймають поглядів і політики нового президента США , Мей звернулася до колеги","Попри те що більшість британців не приймають поглядів і політики нового президента США , Мей звернулася з теплими словами","Попри те що більшість британців не приймають поглядів і політики нового президента США , Мей звернулася до колеги","Попри те що більшість британців не приймають поглядів і політики нового президента США , Мей звернулася з словами",до колега,з слово,звернутися,до колеги,з теплими словами,2,3,до,з,колега,слово,NOUN,NOUN,prepositional,prepositional,Postverbal,Ukrainian
До того ж передала запрошення від королеви : новообраний президент може зупинитися в Букінгемському палаці під час офіційного візиту .,До того ж передала запрошення від королеви : новообраний президент може зупинитися в Букінгемському палаці,До того ж передала запрошення від королеви : новообраний президент може зупинитися під час офіційного візиту,До того ж передала запрошення від королеви : новообраний президент може зупинитися в палаці,До того ж передала запрошення від королеви : новообраний президент може зупинитися під час,в палац,під час,зупинитися,в Букінгемському палаці,під час офіційного візиту,3,4,в,під,палац,час,NOUN,NOUN,prepositional,prepositional,Postverbal,Ukrainian
"Тим часом матір нового президента США була шотландкою ; він не раз висловлював захоплення королевою і , як відомо , з нетерпінням чекає на гостини в Єлизавети II .","Тим часом матір нового президента США була шотландкою ; він не раз висловлював захоплення королевою і , як відомо , з нетерпінням чекає на гостини","Тим часом матір нового президента США була шотландкою ; він не раз висловлював захоплення королевою і , як відомо , з нетерпінням чекає в Єлизавети II","Тим часом матір нового президента США була шотландкою ; він не раз висловлював захоплення королевою і , як відомо , з нетерпінням чекає на гостини","Тим часом матір нового президента США була шотландкою ; він не раз висловлював захоплення королевою і , як відомо , з нетерпінням чекає в Єлизавети",на гостини,в Єлизавета,чекати,на гостини,в Єлизавети II,2,3,на,в,гостини,Єлизавета,NOUN,PROPN,prepositional,prepositional,Postverbal,Ukrainian
