Sentence,Context_PP1,Context_PP2,Context_PP1_simple,Context_PP2_simple,PP1_simple,PP2_simple,Verb,PP1,PP2,PP1_len,PP2_len,Adp1,Adp2,NP1,NP2,PP1_Pronom,PP2_Pronom,PP1_Type,PP2_Type,Position,Language
"Зокрема , у листі до сестри Ольги , датованому вереснем 1897 : « Тим часом не роблю , як і перше , сливе нічого , от тільки половину « Kapital’у » « проштудировала » ( « читати » його не можна ) , і , знаєш , чим далі читаю , тим більше розчаровуюсь : я не бачу тієї « строгой системы » , про яку говорять фанатики сеї книжки , бачу багато фактів , чимало дотепних гіпотез і ще більше просто дотепів , але багато зостається для мене темного , невиясненого , недоговореного і в науковій теорії , і в практичних виводах з неї .","Зокрема , у листі до сестри Ольги , датованому вереснем 1897 : « Тим часом не роблю , як і перше , сливе нічого , от тільки половину « Kapital’у » « проштудировала » ( « читати » його не можна ) , і , знаєш , чим далі читаю , тим більше розчаровуюсь : я не бачу тієї « строгой системы » , про яку говорять фанатики сеї книжки , бачу багато фактів , чимало дотепних гіпотез і ще більше просто дотепів , але багато зостається для мене","Зокрема , у листі до сестри Ольги , датованому вереснем 1897 : « Тим часом не роблю , як і перше , сливе нічого , от тільки половину « Kapital’у » « проштудировала » ( « читати » його не можна ) , і , знаєш , чим далі читаю , тим більше розчаровуюсь : я не бачу тієї « строгой системы » , про яку говорять фанатики сеї книжки , бачу багато фактів , чимало дотепних гіпотез і ще більше просто дотепів , але багато зостається і в науковій теорії , і в практичних виводах з неї","Зокрема , у листі до сестри Ольги , датованому вереснем 1897 : « Тим часом не роблю , як і перше , сливе нічого , от тільки половину « Kapital’у » « проштудировала » ( « читати » його не можна ) , і , знаєш , чим далі читаю , тим більше розчаровуюсь : я не бачу тієї « строгой системы » , про яку говорять фанатики сеї книжки , бачу багато фактів , чимало дотепних гіпотез і ще більше просто дотепів , але багато зостається для мене","Зокрема , у листі до сестри Ольги , датованому вереснем 1897 : « Тим часом не роблю , як і перше , сливе нічого , от тільки половину « Kapital’у » « проштудировала » ( « читати » його не можна ) , і , знаєш , чим далі читаю , тим більше розчаровуюсь : я не бачу тієї « строгой системы » , про яку говорять фанатики сеї книжки , бачу багато фактів , чимало дотепних гіпотез і ще більше просто дотепів , але багато зостається в теорії",для я,в теорія,зоставатися,для мене,"і в науковій теорії , і в практичних виводах з неї",2,11,для,в,я,теорія,PRON,NOUN,prepositional,prepositional,Postverbal,Ukrainian
"Вона знає , що , як нагадує один з героїв « Оргії » , « Рим ходив у Грецію до школи » , що претензії на роль старшого брата у слов’янській сім’ї цілковито безпідставні .","Вона знає , що , як нагадує один з героїв « Оргії » , « Рим ходив у Грецію","Вона знає , що , як нагадує один з героїв « Оргії » , « Рим ходив до школи","Вона знає , що , як нагадує один з героїв « Оргії » , « Рим ходив у Грецію","Вона знає , що , як нагадує один з героїв « Оргії » , « Рим ходив до школи",у Греція,до школа,ходити,у Грецію,до школи,2,2,у,до,Греція,школа,PROPN,NOUN,prepositional,prepositional,Postverbal,Ukrainian
"Миритися з таким станом справ нізащо не згоджується : « [ … ] я ніколи не згоджуся вступитися з дороги перед усякими перевертнями і покутними борзописцями з чужої літератури , – dafűr ich bin mir doch zu gut !",Миритися з таким станом справ нізащо не згоджується : « [ … ] я ніколи не згоджуся вступитися з дороги,Миритися з таким станом справ нізащо не згоджується : « [ … ] я ніколи не згоджуся вступитися перед усякими перевертнями і покутними борзописцями з чужої літератури,Миритися з таким станом справ нізащо не згоджується : « [ … ] я ніколи не згоджуся вступитися з дороги,Миритися з таким станом справ нізащо не згоджується : « [ … ] я ніколи не згоджуся вступитися перед перевертнями,з дорога,перед перевертень,вступитися,з дороги,перед усякими перевертнями і покутними борзописцями з чужої літератури,2,9,з,перед,дорога,перевертень,NOUN,NOUN,prepositional,prepositional,Postverbal,Ukrainian
"Та пора вже й публіку нашу привчити ( не говорячи про самих редакторів ) , щоб не била поклонів перед усякими nullite’s через те тілько , що вони в ряди - годи удостоюють нам « в хату плюнути » ( раніше « наплювавши » на неї ) , забрівши знічев’я з роскішних сусідських палат до нашого вбогого куріня .","Та пора вже й публіку нашу привчити ( не говорячи про самих редакторів ) , щоб не била поклонів перед усякими nullite’s","Та пора вже й публіку нашу привчити ( не говорячи про самих редакторів ) , щоб не била поклонів через те тілько , що вони в ряди - годи удостоюють нам « в хату плюнути » ( раніше « наплювавши » на неї ) , забрівши знічев’я з роскішних сусідських палат до нашого вбогого куріня","Та пора вже й публіку нашу привчити ( не говорячи про самих редакторів ) , щоб не била поклонів перед nullite’s","Та пора вже й публіку нашу привчити ( не говорячи про самих редакторів ) , щоб не била поклонів через те",перед nullite’s,через те,бити,перед усякими nullite’s,"через те тілько , що вони в ряди - годи удостоюють нам « в хату плюнути » ( раніше « наплювавши » на неї ) , забрівши знічев’я з роскішних сусідських палат до нашого вбогого куріня",3,36,перед,через,nullite’s,те,X,PRON,prepositional,prepositional,Postverbal,Ukrainian
"Та пора вже й публіку нашу привчити ( не говорячи про самих редакторів ) , щоб не била поклонів перед усякими nullite’s через те тілько , що вони в ряди - годи удостоюють нам « в хату плюнути » ( раніше « наплювавши » на неї ) , забрівши знічев’я з роскішних сусідських палат до нашого вбогого куріня .","Та пора вже й публіку нашу привчити ( не говорячи про самих редакторів ) , щоб не била поклонів перед усякими nullite’s через те тілько , що вони в ряди - годи удостоюють нам « в хату плюнути » ( раніше « наплювавши » на неї ) , забрівши знічев’я з роскішних сусідських палат","Та пора вже й публіку нашу привчити ( не говорячи про самих редакторів ) , щоб не била поклонів перед усякими nullite’s через те тілько , що вони в ряди - годи удостоюють нам « в хату плюнути » ( раніше « наплювавши » на неї ) , забрівши знічев’я до нашого вбогого куріня","Та пора вже й публіку нашу привчити ( не говорячи про самих редакторів ) , щоб не била поклонів перед усякими nullite’s через те тілько , що вони в ряди - годи удостоюють нам « в хату плюнути » ( раніше « наплювавши » на неї ) , забрівши знічев’я з палат","Та пора вже й публіку нашу привчити ( не говорячи про самих редакторів ) , щоб не била поклонів перед усякими nullite’s через те тілько , що вони в ряди - годи удостоюють нам « в хату плюнути » ( раніше « наплювавши » на неї ) , забрівши знічев’я до куріня",з палата,до курінь,забрести,з роскішних сусідських палат,до нашого вбогого куріня,4,4,з,до,палата,курінь,NOUN,NOUN,prepositional,prepositional,Postverbal,Ukrainian
"Адже і в курінях на покуті сиділо виборне отамання та чесне товариство , а не якісь заволоки - потурнаки » .",Адже і в курінях,Адже на покуті,Адже в курінях,Адже на покуті,в курінь,на покуть,сидіти,і в курінях,на покуті,3,2,в,на,курінь,покуть,NOUN,NOUN,prepositional,prepositional,Preverbal,Ukrainian
— От так ! — прошепотів хтось до когось за спинами товаришів .,— От так ! — прошепотів хтось до когось,— От так ! — прошепотів хтось за спинами товаришів,— От так ! — прошепотів хтось до когось,— От так ! — прошепотів хтось за спинами,до хтось,за спина,прошепотіти,до когось,за спинами товаришів,2,3,до,за,хтось,спина,PRON,NOUN,prepositional,prepositional,Postverbal,Ukrainian
"Маленький смугастий звірок , що сидів собі навпочіпки на поваленій кедрині проти сонечка і пильно , з виглядом ученого дослідника , розглядав торішній грибок , тримаючи його передніми лапками , раптом нашорошився .","Маленький смугастий звірок , що сидів собі навпочіпки на поваленій кедрині","Маленький смугастий звірок , що сидів собі навпочіпки проти сонечка","Маленький смугастий звірок , що сидів собі навпочіпки на кедрині","Маленький смугастий звірок , що сидів собі навпочіпки проти сонечка",на кедрина,проти сонечко,сидіти,на поваленій кедрині,проти сонечка,3,2,на,проти,кедрина,сонечко,NOUN,NOUN,prepositional,prepositional,Postverbal,Ukrainian
"Лише рябок , засвистівши , пролетів з однієї височенної кедри на іншу і завмер на гілці , мов сучок , нерухомо , опустивши чубату голівку вниз і витягши шию .","Лише рябок , засвистівши , пролетів з однієї височенної кедри","Лише рябок , засвистівши , пролетів на іншу","Лише рябок , засвистівши , пролетів з кедри","Лише рябок , засвистівши , пролетів на іншу",з кедра,на інший,пролетіти,з однієї височенної кедри,на іншу,4,2,з,на,кедра,інший,NOUN,DET,prepositional,prepositional,Postverbal,Ukrainian
"Квартира знаходилася на сьомому поверсі , і Вінстон , який мав тридцять дев’ять років та варикозну виразку на правій щиколотці , йшов дуже повільно , відпочиваючи по декілька разів під час сходження .","Квартира знаходилася на сьомому поверсі , і Вінстон , який мав тридцять дев’ять років та варикозну виразку на правій щиколотці , йшов дуже повільно , відпочиваючи по декілька разів","Квартира знаходилася на сьомому поверсі , і Вінстон , який мав тридцять дев’ять років та варикозну виразку на правій щиколотці , йшов дуже повільно , відпочиваючи під час сходження","Квартира знаходилася на сьомому поверсі , і Вінстон , який мав тридцять дев’ять років та варикозну виразку на правій щиколотці , йшов дуже повільно , відпочиваючи по разів","Квартира знаходилася на сьомому поверсі , і Вінстон , який мав тридцять дев’ять років та варикозну виразку на правій щиколотці , йшов дуже повільно , відпочиваючи під час",по раз,під час,відпочивати,по декілька разів,під час сходження,3,3,по,під,раз,час,NOUN,NOUN,prepositional,prepositional,Postverbal,Ukrainian
Звісно не було жодного способу дізнатись чи спостерігають за вами саме у цей проміжок часу .,Звісно не було жодного способу дізнатись чи спостерігають за вами,Звісно не було жодного способу дізнатись чи спостерігають саме у цей проміжок часу,Звісно не було жодного способу дізнатись чи спостерігають за вами,Звісно не було жодного способу дізнатись чи спостерігають у проміжок,за ви,у проміжок,спостерігати,за вами,саме у цей проміжок часу,2,5,за,у,ви,проміжок,PRON,NOUN,prepositional,prepositional,Postverbal,Ukrainian
Але вони могли обрати навмання і смикнути саме за твій ляльковий дріт у будь-який час коли вони цього забажають .,Але вони могли обрати навмання і смикнути саме за твій ляльковий дріт,Але вони могли обрати навмання і смикнути у будь-який час коли вони цього забажають,Але вони могли обрати навмання і смикнути за дріт,Але вони могли обрати навмання і смикнути у час,за дріт,у час,смикнути,саме за твій ляльковий дріт,у будь-який час коли вони цього забажають,5,7,за,у,дріт,час,NOUN,NOUN,prepositional,prepositional,Postverbal,Ukrainian
Він пішов крізь кімнату до вузенької кухні .,Він пішов крізь кімнату,Він пішов до вузенької кухні,Він пішов крізь кімнату,Він пішов до кухні,крізь кімната,до кухня,піти,крізь кімнату,до вузенької кухні,2,3,крізь,до,кімната,кухня,NOUN,NOUN,prepositional,prepositional,Postverbal,Ukrainian
Залишаючи Міністерство о цій порі дня він пожертвував своїм ланчем у буфеті та усвідомлював що на кухні з їжі є лише скибка чорного хліба яка не дотягне до завтрашнього сніданку .,Залишаючи Міністерство о цій порі дня він пожертвував своїм ланчем у буфеті та усвідомлював що на кухні,Залишаючи Міністерство о цій порі дня він пожертвував своїм ланчем у буфеті та усвідомлював що з їжі,Залишаючи Міністерство о цій порі дня він пожертвував своїм ланчем у буфеті та усвідомлював що на кухні,Залишаючи Міністерство о цій порі дня він пожертвував своїм ланчем у буфеті та усвідомлював що з їжі,на кухня,з їжа,бути,на кухні,з їжі,2,2,на,з,кухня,їжа,NOUN,NOUN,prepositional,prepositional,Preverbal,Ukrainian
"Ручка з пером це був архаїчний інструмент , зрідка вживаний навіть для підписів , просто він відчував що цей чудовий кремовий папір заслуговує на те щоб бути розписаним справжнім пером замість того щоб бути подряпаним звичайним хімічним олівцем .","Ручка з пером це був архаїчний інструмент , зрідка вживаний навіть для підписів , просто він відчував що цей чудовий кремовий папір заслуговує на те щоб бути розписаним справжнім пером","Ручка з пером це був архаїчний інструмент , зрідка вживаний навіть для підписів , просто він відчував що цей чудовий кремовий папір заслуговує замість того щоб бути подряпаним звичайним хімічним олівцем","Ручка з пером це був архаїчний інструмент , зрідка вживаний навіть для підписів , просто він відчував що цей чудовий кремовий папір заслуговує на те","Ручка з пером це був архаїчний інструмент , зрідка вживаний навіть для підписів , просто він відчував що цей чудовий кремовий папір заслуговує замість того",на те,замість те,заслуговувати,на те щоб бути розписаним справжнім пером,замість того щоб бути подряпаним звичайним хімічним олівцем,7,8,на,замість,те,те,PRON,PRON,prepositional,prepositional,Postverbal,Ukrainian
Він ніколи не міг дивитися на обличчя Гольдштейна без болючої емоційної суміші .,Він ніколи не міг дивитися на обличчя Гольдштейна,Він ніколи не міг дивитися без болючої емоційної суміші,Він ніколи не міг дивитися на обличчя,Він ніколи не міг дивитися без суміші,на обличчя,без суміш,дивитися,на обличчя Гольдштейна,без болючої емоційної суміші,3,4,на,без,обличчя,суміш,NOUN,NOUN,prepositional,prepositional,Postverbal,Ukrainian
"Він вдарився , з глухим звуком , об ніс Гольдштейна та відскочив ; його голос лунав невблаганно .","Він вдарився , з глухим звуком ,",Він вдарився об ніс Гольдштейна,Він вдарився з звуком,Він вдарився об ніс,з звук,об ніс,вдаритися,", з глухим звуком ,",об ніс Гольдштейна,5,3,з,об,звук,ніс,NOUN,NOUN,prepositional,prepositional,Postverbal,Ukrainian
"І зараз лють яку відчував кожен стала абстрактною , не адресованою емоцією яку можна було передавати та спрямовувати з одного об’єкта на інший неначе вогонь у паяльній лампі .","І зараз лють яку відчував кожен стала абстрактною , не адресованою емоцією яку можна було передавати та спрямовувати з одного об’єкта","І зараз лють яку відчував кожен стала абстрактною , не адресованою емоцією яку можна було передавати та спрямовувати на інший","І зараз лють яку відчував кожен стала абстрактною , не адресованою емоцією яку можна було передавати та спрямовувати з об’єкта","І зараз лють яку відчував кожен стала абстрактною , не адресованою емоцією яку можна було передавати та спрямовувати на інший",з об’єкт,на інший,спрямовувати,з одного об’єкта,на інший,3,2,з,на,об’єкт,інший,NOUN,DET,prepositional,prepositional,Postverbal,Ukrainian
"Хоча , от , в суботу , ми з карапузом вигулювались на біговєлі до парку Перемоги .","Хоча , от , в суботу , ми з карапузом вигулювались на біговєлі","Хоча , от , в суботу , ми з карапузом вигулювались до парку Перемоги","Хоча , от , в суботу , ми з карапузом вигулювались на біговєлі","Хоча , от , в суботу , ми з карапузом вигулювались до парку",на біговело,до парк,вигулюватися,на біговєлі,до парку Перемоги,2,3,на,до,біговело,парк,NOUN,NOUN,prepositional,prepositional,Postverbal,Ukrainian
