Sentence,Context_PP1,Context_PP2,Context_PP1_simple,Context_PP2_simple,PP1_simple,PP2_simple,Verb,PP1,PP2,PP1_len,PP2_len,Adp1,Adp2,NP1,NP2,PP1_Pronom,PP2_Pronom,PP1_Type,PP2_Type,Position,Language
Ще перед відкриттям біля каварень утворювалася черга .,Ще перед відкриттям,біля каварень,перед відкриттям,біля каварень,перед відкриття,біля каварня,утворюватися,Ще перед відкриттям,біля каварень,3,2,перед,біля,відкриття,каварня,NOUN,NOUN,prepositional,prepositional,Preverbal,Ukrainian
Люди приходили під склепи ще перед шостою .,Люди приходили під склепи,Люди приходили ще перед шостою,Люди приходили під склепи,Люди приходили перед шостою,під склеп,перед шостий,приходити,під склепи,ще перед шостою,2,3,під,перед,склеп,шостий,NOUN,ADJ,prepositional,prepositional,Postverbal,Ukrainian
"Художник потім казав , що це була його найкраща кава у житті — ми ввійшли у міську стоматологічну поліклініку , пройшли повз десятки спотворених болем і терпінням облич , за дверима кабінетів гули повільні бури , йшли попри плювальниці з кривавою ватою , через майстерні з гіпсовими зліпками і шліфувальними верстатами , через авдиторії , переходили сходами зі страшними стінгазетами .","Художник потім казав , що це була його найкраща кава у житті — ми ввійшли у міську стоматологічну поліклініку , пройшли повз десятки спотворених болем і терпінням облич , за дверима кабінетів гули повільні бури , йшли попри плювальниці з кривавою ватою","Художник потім казав , що це була його найкраща кава у житті — ми ввійшли у міську стоматологічну поліклініку , пройшли повз десятки спотворених болем і терпінням облич , за дверима кабінетів гули повільні бури , йшли , через майстерні з гіпсовими зліпками і шліфувальними верстатами , через авдиторії","Художник потім казав , що це була його найкраща кава у житті — ми ввійшли у міську стоматологічну поліклініку , пройшли повз десятки спотворених болем і терпінням облич , за дверима кабінетів гули повільні бури , йшли попри плювальниці","Художник потім казав , що це була його найкраща кава у житті — ми ввійшли у міську стоматологічну поліклініку , пройшли повз десятки спотворених болем і терпінням облич , за дверима кабінетів гули повільні бури , йшли через майстерні",попри плювальниця,через майстерня,йти,попри плювальниці з кривавою ватою,", через майстерні з гіпсовими зліпками і шліфувальними верстатами , через авдиторії",5,12,попри,через,плювальниця,майстерня,NOUN,NOUN,prepositional,prepositional,Postverbal,Ukrainian
Час від часу Джон їздив автостопом до Ноттінгему по пенсію .,Час від часу Джон їздив автостопом до Ноттінгему,Час від часу Джон їздив автостопом по пенсію,Час від часу Джон їздив автостопом до Ноттінгему,Час від часу Джон їздив автостопом по пенсію,до Ноттінгем,по пенсія,їздити,до Ноттінгему,по пенсію,2,2,до,по,Ноттінгем,пенсія,PROPN,NOUN,prepositional,prepositional,Postverbal,Ukrainian
Він мешкав по черзі у нас і в наших друзів .,Він мешкав по черзі,Він мешкав у нас і в наших друзів,Він мешкав по черзі,Він мешкав у нас,по черга,у ми,мешкати,по черзі,у нас і в наших друзів,2,6,по,у,черга,ми,NOUN,PRON,prepositional,prepositional,Postverbal,Ukrainian
"Коли я їхав до Делятина сам з двома малесенькими дітьми , кондуктори навіть не питалися , чи я маю білет .",Коли я їхав до Делятина,Коли я їхав з двома малесенькими дітьми,Коли я їхав до Делятина,Коли я їхав з дітьми,до Делятин,з дитина,їхати,до Делятина,з двома малесенькими дітьми,2,4,до,з,Делятин,дитина,PROPN,NOUN,prepositional,prepositional,Postverbal,Ukrainian
"Коли я давав їм по скибочці чорного хліба у вагоні , то на нас усі дивилися як на святу родину .",Коли я давав їм по скибочці чорного хліба,Коли я давав їм у вагоні,Коли я давав їм по скибочці,Коли я давав їм у вагоні,по скибочка,у вагон,давати,по скибочці чорного хліба,у вагоні,4,2,по,у,скибочка,вагон,NOUN,NOUN,prepositional,prepositional,Postverbal,Ukrainian
"Ми їхали на літо до Делятина , бо там був дешевий сир , були ягоди , гриби і яблука , була добра кринична вода .",Ми їхали на літо,Ми їхали до Делятина,Ми їхали на літо,Ми їхали до Делятина,на літо,до Делятин,їхати,на літо,до Делятина,2,2,на,до,літо,Делятин,NOUN,PROPN,prepositional,prepositional,Postverbal,Ukrainian
"Вечорами , коли діти засинали , я брав із запасів на стриху якусь пилку , або емальовану ринку , або кілька керамічних попільничок і йшов це продавати у якийсь із нічних барів , яких у ті часи в Делятині було більше , ніж у Франківську чи Львові .","Вечорами , коли діти засинали , я брав із запасів на стриху якусь пилку , або емальовану ринку , або кілька керамічних попільничок і йшов це продавати у якийсь із нічних барів , яких у ті часи","Вечорами , коли діти засинали , я брав із запасів на стриху якусь пилку , або емальовану ринку , або кілька керамічних попільничок і йшов це продавати у якийсь із нічних барів , яких в Делятині","Вечорами , коли діти засинали , я брав із запасів на стриху якусь пилку , або емальовану ринку , або кілька керамічних попільничок і йшов це продавати у якийсь із нічних барів , яких у часи","Вечорами , коли діти засинали , я брав із запасів на стриху якусь пилку , або емальовану ринку , або кілька керамічних попільничок і йшов це продавати у якийсь із нічних барів , яких в Делятині",у час,в Делятин,бути,у ті часи,в Делятині,3,2,у,в,час,Делятин,NOUN,PROPN,prepositional,prepositional,Preverbal,Ukrainian
Дзядзьо Михась привіз бабцю Зоню і тата до Делятина у п’ятдесят шостому .,Дзядзьо Михась привіз бабцю Зоню і тата до Делятина,Дзядзьо Михась привіз бабцю Зоню і тата у п’ятдесят шостому,Дзядзьо Михась привіз бабцю Зоню і тата до Делятина,Дзядзьо Михась привіз бабцю Зоню і тата у шостому,до Делятин,у шостий,привезти,до Делятина,у п’ятдесят шостому,2,3,до,у,Делятин,шостий,PROPN,NOUN,prepositional,prepositional,Postverbal,Ukrainian
"Він мовчки собі сидів , а водії невдовзі почали говорити між собою , перейшовши за звичкою на угорську .","Він мовчки собі сидів , а водії невдовзі почали говорити між собою , перейшовши за звичкою","Він мовчки собі сидів , а водії невдовзі почали говорити між собою , перейшовши на угорську","Він мовчки собі сидів , а водії невдовзі почали говорити між собою , перейшовши за звичкою","Він мовчки собі сидів , а водії невдовзі почали говорити між собою , перейшовши на угорську",за звичка,на угорська,перейти,за звичкою,на угорську,2,2,за,на,звичка,угорська,NOUN,NOUN,prepositional,prepositional,Postverbal,Ukrainian
"Пояс порвався на Кавказі , в горах Абхазії , на кордоні Пслух .",Пояс порвався на Кавказі,"Пояс порвався , в горах Абхазії , на кордоні Пслух",Пояс порвався на Кавказі,Пояс порвався в горах,на Кавказ,в гора,порватися,на Кавказі,", в горах Абхазії , на кордоні Пслух",2,8,на,в,Кавказ,гора,PROPN,NOUN,prepositional,prepositional,Postverbal,Ukrainian
Від Красної Поляни до лісничівки на кордоні треба було ще двадцять кілометрів іти пішки .,Від Красної Поляни,до лісничівки на кордоні,Від Красної,до лісничівки,від Красна,до лісничівка,іти,Від Красної Поляни,до лісничівки на кордоні,3,4,від,до,Красна,лісничівка,PROPN,NOUN,prepositional,prepositional,Preverbal,Ukrainian
"Вночі після снігопаду , коли птахи не спали , бо розпачали над гніздами з яйцями , засипаними снігом , « Свобода » без жодних перешкод повідомила про жахливу ядерну катастрофу на Західній Україні .",Вночі після снігопаду,Вночі без жодних перешкод,Вночі після снігопаду,Вночі без перешкод,після снігопад,без перешкода,повідомити,після снігопаду,без жодних перешкод,2,3,після,без,снігопад,перешкода,NOUN,NOUN,prepositional,prepositional,Preverbal,Ukrainian
"Вночі після снігопаду , коли птахи не спали , бо розпачали над гніздами з яйцями , засипаними снігом , « Свобода » без жодних перешкод повідомила про жахливу ядерну катастрофу на Західній Україні .","Вночі після снігопаду , коли птахи не спали , бо розпачали над гніздами з яйцями , засипаними снігом , « Свобода » без жодних перешкод повідомила про жахливу ядерну катастрофу","Вночі після снігопаду , коли птахи не спали , бо розпачали над гніздами з яйцями , засипаними снігом , « Свобода » без жодних перешкод повідомила на Західній Україні","Вночі після снігопаду , коли птахи не спали , бо розпачали над гніздами з яйцями , засипаними снігом , « Свобода » без жодних перешкод повідомила про катастрофу","Вночі після снігопаду , коли птахи не спали , бо розпачали над гніздами з яйцями , засипаними снігом , « Свобода » без жодних перешкод повідомила на Україні",про катастрофа,на Україна,повідомити,про жахливу ядерну катастрофу,на Західній Україні,4,3,про,на,катастрофа,Україна,NOUN,PROPN,prepositional,prepositional,Postverbal,Ukrainian
"Дівчинка навчилась вирізати ножицями гнійні рани , заки три дні чекала на Каракєджбу , якого посадили на губу за те , що зачинив кількох нестаранних солдатів у пивниці з відкритими бочками лізолу .","Дівчинка навчилась вирізати ножицями гнійні рани , заки три дні чекала на Каракєджбу , якого посадили на губу","Дівчинка навчилась вирізати ножицями гнійні рани , заки три дні чекала на Каракєджбу , якого посадили за те , що зачинив кількох нестаранних солдатів у пивниці з відкритими бочками лізолу","Дівчинка навчилась вирізати ножицями гнійні рани , заки три дні чекала на Каракєджбу , якого посадили на губу","Дівчинка навчилась вирізати ножицями гнійні рани , заки три дні чекала на Каракєджбу , якого посадили за те",на губа,за те,посадити,на губу,"за те , що зачинив кількох нестаранних солдатів у пивниці з відкритими бочками лізолу",2,14,на,за,губа,те,NOUN,PRON,prepositional,prepositional,Postverbal,Ukrainian
"Щодня палату мили розчином хлорки , і вже через пів години на підлозі лежали тільця комарів , котрі здихали і падали зі стелі .","Щодня палату мили розчином хлорки , і вже через пів години","Щодня палату мили розчином хлорки , і вже на підлозі","Щодня палату мили розчином хлорки , і вже через години","Щодня палату мили розчином хлорки , і вже на підлозі",через година,на підлога,лежати,через пів години,на підлозі,3,2,через,на,година,підлога,NOUN,NOUN,prepositional,prepositional,Preverbal,Ukrainian
Тоді хліб треба було самому вибирати на полицях і підходити з ним до каси .,Тоді хліб треба було самому вибирати на полицях і підходити з ним,Тоді хліб треба було самому вибирати на полицях і підходити до каси,Тоді хліб треба було самому вибирати на полицях і підходити з ним,Тоді хліб треба було самому вибирати на полицях і підходити до каси,з він,до каса,підходити,з ним,до каси,2,2,з,до,він,каса,PRON,NOUN,prepositional,prepositional,Postverbal,Ukrainian
Інший знайомий з Франківська зустрічався у Львові з донькою шведської красуні і арабського багача .,Інший знайомий з Франківська зустрічався у Львові,Інший знайомий з Франківська зустрічався з донькою шведської красуні і арабського багача,Інший знайомий з Франківська зустрічався у Львові,Інший знайомий з Франківська зустрічався з донькою,у Львів,з донька,зустрічатися,у Львові,з донькою шведської красуні і арабського багача,2,7,у,з,Львів,донька,PROPN,NOUN,prepositional,prepositional,Postverbal,Ukrainian
Через кілька хвилин до лазнички ввійшла покоївка з чайником .,Через кілька хвилин,до лазнички,Через хвилин,до лазнички,через хвилина,до лазничка,ввійти,Через кілька хвилин,до лазнички,3,2,через,до,хвилина,лазничка,NOUN,NOUN,prepositional,prepositional,Preverbal,Ukrainian
"Посеред денного сеансу в дитячому кінотеатрі , де ми прогулювали уроки , вмикалося світло , і функціонери міськкому комсомолу відпроваджували прогульників до дитячої кімнати міліції .",Посеред денного сеансу,"в дитячому кінотеатрі , де ми прогулювали уроки ,",Посеред сеансу,в кінотеатрі,посеред сеанс,в кінотеатр,вмикатися,Посеред денного сеансу,"в дитячому кінотеатрі , де ми прогулювали уроки ,",3,9,посеред,в,сеанс,кінотеатр,NOUN,NOUN,prepositional,prepositional,Preverbal,Ukrainian
Мій брат побував у дитячій кімнаті з іншої причини .,Мій брат побував у дитячій кімнаті,Мій брат побував з іншої причини,Мій брат побував у кімнаті,Мій брат побував з причини,у кімната,з причина,побувати,у дитячій кімнаті,з іншої причини,3,3,у,з,кімната,причина,NOUN,NOUN,prepositional,prepositional,Postverbal,Ukrainian
"Після довгої співбесіди версія розсипалася , але брата про всяке передали на облік до дитячої кімнати міліції .","Після довгої співбесіди версія розсипалася , але брата про всяке передали на облік","Після довгої співбесіди версія розсипалася , але брата про всяке передали до дитячої кімнати міліції","Після довгої співбесіди версія розсипалася , але брата про всяке передали на облік","Після довгої співбесіди версія розсипалася , але брата про всяке передали до кімнати",на облік,до кімната,передати,на облік,до дитячої кімнати міліції,2,4,на,до,облік,кімната,NOUN,NOUN,prepositional,prepositional,Postverbal,Ukrainian
"Наступного дня Пуня накрив парту білим обрусом і цілий урок їв пишного товченика , докладав з риночки на тарілку різні салати , маніпулював усілякими виделками , ножами , ложечками , попивав гарячу каву , а біля тарілки стояв флакон з гіацинтом .","Наступного дня Пуня накрив парту білим обрусом і цілий урок їв пишного товченика , докладав з риночки","Наступного дня Пуня накрив парту білим обрусом і цілий урок їв пишного товченика , докладав на тарілку","Наступного дня Пуня накрив парту білим обрусом і цілий урок їв пишного товченика , докладав з риночки","Наступного дня Пуня накрив парту білим обрусом і цілий урок їв пишного товченика , докладав на тарілку",з риночка,на тарілка,докладати,з риночки,на тарілку,2,2,з,на,риночка,тарілка,NOUN,NOUN,prepositional,prepositional,Postverbal,Ukrainian
Тижнями жили у залізі самі серед лісу .,Тижнями жили у залізі,Тижнями жили серед лісу,Тижнями жили у залізі,Тижнями жили серед лісу,у залізо,серед ліс,жити,у залізі,серед лісу,2,2,у,серед,залізо,ліс,NOUN,NOUN,prepositional,prepositional,Postverbal,Ukrainian
"Посеред ночі від холодного відчаю ми вискакували на сніг , і мороз під зоряним небом видавався полегшенням .",Посеред ночі,від холодного відчаю,Посеред ночі,від відчаю,посеред ніч,від відчай,вискакувати,Посеред ночі,від холодного відчаю,2,3,посеред,від,ніч,відчай,NOUN,NOUN,prepositional,prepositional,Preverbal,Ukrainian
"Через кілька місяців після дембеля Раїль розбився на мотоциклі , їдучи до дівчини , з якою про все домовився .","Через кілька місяців після дембеля Раїль розбився на мотоциклі , їдучи до дівчини , з якою","Через кілька місяців після дембеля Раїль розбився на мотоциклі , їдучи до дівчини , про все","Через кілька місяців після дембеля Раїль розбився на мотоциклі , їдучи до дівчини , з якою","Через кілька місяців після дембеля Раїль розбився на мотоциклі , їдучи до дівчини , про все",з який,про все,домовитися,з якою,про все,2,2,з,про,який,все,DET,PRON,prepositional,prepositional,Preverbal,Ukrainian
У тому барі при довгій стійці постійно сиділо кілька відвідувачів .,У тому барі,при довгій стійці,У барі,при стійці,у бар,при стійка,сидіти,У тому барі,при довгій стійці,3,3,у,при,бар,стійка,NOUN,NOUN,prepositional,prepositional,Preverbal,Ukrainian
"Я мусив переходити від одного до іншого , щоби вислуховувати історії їхнього життя і давати мудрі поради .",Я мусив переходити від одного,Я мусив переходити до іншого,Я мусив переходити від одного,Я мусив переходити до іншого,від один,до інший,переходити,від одного,до іншого,2,2,від,до,один,інший,DET,DET,prepositional,prepositional,Postverbal,Ukrainian
