Sentence,Context_PP1,Context_PP2,Context_PP1_simple,Context_PP2_simple,PP1_simple,PP2_simple,Verb,PP1,PP2,PP1_len,PP2_len,Adp1,Adp2,NP1,NP2,PP1_Pronom,PP2_Pronom,PP1_Type,PP2_Type,Position,Language
"Раніше контакти української мови з тюркськими були міцніші й різноманітніші : печеніги ( X - XI ст . ) , половці ( XI - XIII ст . ) і татари ( від XIII ст . ) межували з нею на сході та південному сході , а іноді проникали й углиб українських теренів , призводячи до мовної котериторіальності ; турки межували з українськими землями на півдні ( особливо в XVII - XVIII ст . ) .","Раніше контакти української мови з тюркськими були міцніші й різноманітніші : печеніги ( X - XI ст . ) , половці ( XI - XIII ст . ) і татари ( від XIII ст . ) межували з нею на сході та південному сході , а іноді проникали й углиб українських теренів , призводячи до мовної котериторіальності ; турки межували з українськими землями","Раніше контакти української мови з тюркськими були міцніші й різноманітніші : печеніги ( X - XI ст . ) , половці ( XI - XIII ст . ) і татари ( від XIII ст . ) межували з нею на сході та південному сході , а іноді проникали й углиб українських теренів , призводячи до мовної котериторіальності ; турки межували на півдні","Раніше контакти української мови з тюркськими були міцніші й різноманітніші : печеніги ( X - XI ст . ) , половці ( XI - XIII ст . ) і татари ( від XIII ст . ) межували з нею на сході та південному сході , а іноді проникали й углиб українських теренів , призводячи до мовної котериторіальності ; турки межували з землями","Раніше контакти української мови з тюркськими були міцніші й різноманітніші : печеніги ( X - XI ст . ) , половці ( XI - XIII ст . ) і татари ( від XIII ст . ) межували з нею на сході та південному сході , а іноді проникали й углиб українських теренів , призводячи до мовної котериторіальності ; турки межували на півдні",з земля,на південь,межувати,з українськими землями,на півдні,3,2,з,на,земля,південь,NOUN,NOUN,prepositional,prepositional,Postverbal,Ukrainian
"Насправді проблему її визначення слід заступити іншою , конкретнішою : відмовляючися від спроб установлення — принаймні наразі та з лінгвістичного погляду — невловного суб’єктивного "" моменту запалення "" , історик української мови має відносити термін "" український "" , заради зручності , щонайдалі назад у часі , наскільки це дозволяють матеріальні свідчення , і замість пошуку відповіді на питання про початки української мови спробувати відповісти на питання , коли почався її особливий , окремішній розвиток .","Насправді проблему її визначення слід заступити іншою , конкретнішою : відмовляючися від спроб установлення — принаймні наразі та з лінгвістичного погляду — невловного суб’єктивного "" моменту запалення "" , історик української мови має відносити термін "" український "" , заради зручності ,","Насправді проблему її визначення слід заступити іншою , конкретнішою : відмовляючися від спроб установлення — принаймні наразі та з лінгвістичного погляду — невловного суб’єктивного "" моменту запалення "" , історик української мови має відносити термін "" український "" щонайдалі назад у часі , наскільки це дозволяють матеріальні свідчення","Насправді проблему її визначення слід заступити іншою , конкретнішою : відмовляючися від спроб установлення — принаймні наразі та з лінгвістичного погляду — невловного суб’єктивного "" моменту запалення "" , історик української мови має відносити термін "" український "" заради зручності","Насправді проблему її визначення слід заступити іншою , конкретнішою : відмовляючися від спроб установлення — принаймні наразі та з лінгвістичного погляду — невловного суб’єктивного "" моменту запалення "" , історик української мови має відносити термін "" український "" у часі",заради зручність,у час,відносити,", заради зручності ,","щонайдалі назад у часі , наскільки це дозволяють матеріальні свідчення",4,10,заради,у,зручність,час,NOUN,NOUN,prepositional,prepositional,Postverbal,Ukrainian
"У рамцях фонології це можна зробити , встановивши першу фонетичну зміну , що поширилася серед слов’янських мовців на пізнішій українській території , але оминула сусідні слов’янські племінні групи .","У рамцях фонології це можна зробити , встановивши першу фонетичну зміну , що поширилася серед слов’янських мовців","У рамцях фонології це можна зробити , встановивши першу фонетичну зміну , що поширилася на пізнішій українській території","У рамцях фонології це можна зробити , встановивши першу фонетичну зміну , що поширилася серед мовців","У рамцях фонології це можна зробити , встановивши першу фонетичну зміну , що поширилася на території",серед мовець,на територія,поширитися,серед слов’янських мовців,на пізнішій українській території,3,4,серед,на,мовець,територія,NOUN,NOUN,prepositional,prepositional,Postverbal,Ukrainian
"Ясно , принаймні , що на той час , з якого до нас дійшли перші писемні пам’ятки , нагромадження специфічно українських рис є значним , і цей факт уже в XIX ст . був добре відомий .","Ясно , принаймні , що на той час , з якого","Ясно , принаймні , що на той час , до нас","Ясно , принаймні , що на той час , з якого","Ясно , принаймні , що на той час , до нас",з який,до ми,дійти,з якого,до нас,2,2,з,до,який,ми,DET,PRON,prepositional,prepositional,Preverbal,Ukrainian
"На початку за взірець правила церковнослов’янська мова , і пам’яток , писаних саме цією мовою ( в різних її редакціях ) , є сила - силенна впродовж усієї історії української мови від XI до XVIII ст .",На початку,за взірець,На початку,за взірець,на початок,за взірець,правити,На початку,за взірець,2,2,на,за,початок,взірець,NOUN,NOUN,prepositional,prepositional,Preverbal,Ukrainian
"З-посеред них західноволинські , надсянські , наддністрянські , бойківські , західноподільські та покутські говірки ймовірно ведуть свою традицію в тих самих ареалах із доісторичних часів .","З-посеред них західноволинські , надсянські , наддністрянські , бойківські , західноподільські та покутські говірки ймовірно ведуть свою традицію в тих самих ареалах","З-посеред них західноволинські , надсянські , наддністрянські , бойківські , західноподільські та покутські говірки ймовірно ведуть свою традицію із доісторичних часів","З-посеред них західноволинські , надсянські , наддністрянські , бойківські , західноподільські та покутські говірки ймовірно ведуть свою традицію в ареалах","З-посеред них західноволинські , надсянські , наддністрянські , бойківські , західноподільські та покутські говірки ймовірно ведуть свою традицію із часів",в ареал,із час,вести,в тих самих ареалах,із доісторичних часів,4,3,в,із,ареал,час,NOUN,NOUN,prepositional,prepositional,Postverbal,Ukrainian
"Проте ці назви не можна вважати дуже давніми , і до племінних назв доісторичного періоду вони з цілковитою певністю не нав’язують .","Проте ці назви не можна вважати дуже давніми , і до племінних назв доісторичного періоду","Проте ці назви не можна вважати дуже давніми , і з цілковитою певністю","Проте ці назви не можна вважати дуже давніми , і до назв","Проте ці назви не можна вважати дуже давніми , і з певністю",до назва,з певність,нав’язувати,до племінних назв доісторичного періоду,з цілковитою певністю,5,3,до,з,назва,певність,NOUN,NOUN,prepositional,prepositional,Preverbal,Ukrainian
Перша фіксація фонологічного нововведення в пам’ятці звичайно відстоїть у часі від його постання в мові ; такий розрив може подеколи бути тривалим .,Перша фіксація фонологічного нововведення в пам’ятці звичайно відстоїть у часі,Перша фіксація фонологічного нововведення в пам’ятці звичайно відстоїть від його постання в мові,Перша фіксація фонологічного нововведення в пам’ятці звичайно відстоїть у часі,Перша фіксація фонологічного нововведення в пам’ятці звичайно відстоїть від постання,у час,від постання,відстояти,у часі,від його постання в мові,2,5,у,від,час,постання,NOUN,NOUN,prepositional,prepositional,Postverbal,Ukrainian
"Проте , якщо ми не маємо інших засобів визначення хронології зміни ( запозичення з інших мов у давньоукраїнські діалекти або літературну мову чи навпаки , відносна хронологія ) , дослідник не годен виміряти цю часову відстань і мусить уважати , що перша дата появи інновації в пам’ятці приблизно збігається в часі з самою фонологічною зміною .","Проте , якщо ми не маємо інших засобів визначення хронології зміни ( запозичення з інших мов у давньоукраїнські діалекти або літературну мову чи навпаки , відносна хронологія ) , дослідник не годен виміряти цю часову відстань і мусить уважати , що перша дата появи інновації в пам’ятці приблизно збігається в часі","Проте , якщо ми не маємо інших засобів визначення хронології зміни ( запозичення з інших мов у давньоукраїнські діалекти або літературну мову чи навпаки , відносна хронологія ) , дослідник не годен виміряти цю часову відстань і мусить уважати , що перша дата появи інновації в пам’ятці приблизно збігається з самою фонологічною зміною","Проте , якщо ми не маємо інших засобів визначення хронології зміни ( запозичення з інших мов у давньоукраїнські діалекти або літературну мову чи навпаки , відносна хронологія ) , дослідник не годен виміряти цю часову відстань і мусить уважати , що перша дата появи інновації в пам’ятці приблизно збігається в часі","Проте , якщо ми не маємо інших засобів визначення хронології зміни ( запозичення з інших мов у давньоукраїнські діалекти або літературну мову чи навпаки , відносна хронологія ) , дослідник не годен виміряти цю часову відстань і мусить уважати , що перша дата появи інновації в пам’ятці приблизно збігається з зміною",в час,з зміна,збігатися,в часі,з самою фонологічною зміною,2,4,в,з,час,зміна,NOUN,NOUN,prepositional,prepositional,Postverbal,Ukrainian
"Далі слід заохотити чоловіка розповідати про себе , сторожко видивляючись , що він вважає за найцінніше у своєму житті .","Далі слід заохотити чоловіка розповідати про себе , сторожко видивляючись , що він вважає за найцінніше","Далі слід заохотити чоловіка розповідати про себе , сторожко видивляючись , що він вважає у своєму житті","Далі слід заохотити чоловіка розповідати про себе , сторожко видивляючись , що він вважає за найцінніше","Далі слід заохотити чоловіка розповідати про себе , сторожко видивляючись , що він вважає у житті",за найцінніше,у життя,вважати,за найцінніше,у своєму житті,2,3,за,у,найцінніше,життя,NOUN,NOUN,prepositional,prepositional,Postverbal,Ukrainian
"Шукати у коханої людини зрозуміння та розради — природна річ , але ніко́ли не годиться заводити про це мову у ліжку чи за столом , бо то препогана завичка — змішувати харч і секс з денними мороками .","Шукати у коханої людини зрозуміння та розради — природна річ , але ніко́ли не годиться заводити про це","Шукати у коханої людини зрозуміння та розради — природна річ , але ніко́ли не годиться заводити у ліжку чи за столом","Шукати у коханої людини зрозуміння та розради — природна річ , але ніко́ли не годиться заводити про це","Шукати у коханої людини зрозуміння та розради — природна річ , але ніко́ли не годиться заводити у ліжку",про це,у ліжко,заводити,про це,у ліжку чи за столом,2,5,про,у,це,ліжко,PRON,NOUN,prepositional,prepositional,Postverbal,Ukrainian
"Ведучи мову про дотикові пестощі геніталій , не оминути чоловіка , у якого саме у цій частині тіла зосереджуються статево чутливі рецептори .","Ведучи мову про дотикові пестощі геніталій , не оминути чоловіка , у якого","Ведучи мову про дотикові пестощі геніталій , не оминути чоловіка , саме у цій частині тіла","Ведучи мову про дотикові пестощі геніталій , не оминути чоловіка , у якого","Ведучи мову про дотикові пестощі геніталій , не оминути чоловіка , у частині",у який,у частина,зосереджуватися,у якого,саме у цій частині тіла,2,5,у,у,який,частина,DET,NOUN,prepositional,prepositional,Preverbal,Ukrainian
"Вони виконують подвійну роль , пробуджуючи еротичну чутливість жінки та призвичаюючи її до вигляду і дотику прутня у час солодких зазнава́нь .","Вони виконують подвійну роль , пробуджуючи еротичну чутливість жінки та призвичаюючи її до вигляду і дотику прутня","Вони виконують подвійну роль , пробуджуючи еротичну чутливість жінки та призвичаюючи її у час солодких зазнава́нь","Вони виконують подвійну роль , пробуджуючи еротичну чутливість жінки та призвичаюючи її до вигляду","Вони виконують подвійну роль , пробуджуючи еротичну чутливість жінки та призвичаюючи її у час",до вигляд,у час,призвичаювати,до вигляду і дотику прутня,у час солодких зазнава́нь,5,4,до,у,вигляд,час,NOUN,NOUN,prepositional,prepositional,Postverbal,Ukrainian
"Коли погано з ним , — може підставити ніжку приятелеві і знаходити для себе сатисфакцію в біді його .","Коли погано з ним , — може підставити ніжку приятелеві і знаходити для себе","Коли погано з ним , — може підставити ніжку приятелеві і знаходити в біді його","Коли погано з ним , — може підставити ніжку приятелеві і знаходити для себе","Коли погано з ним , — може підставити ніжку приятелеві і знаходити в біді",для себе,в біда,знаходити,для себе,в біді його,2,3,для,в,себе,біда,PRON,NOUN,prepositional,prepositional,Postverbal,Ukrainian
"Але Сосницький по камінчику , як Клапан , довбає і з усіх сил тримає себе , щоб не кинутись на неї з криком "" ура "" !","Але Сосницький по камінчику , як Клапан , довбає і з усіх сил тримає себе , щоб не кинутись на неї","Але Сосницький по камінчику , як Клапан , довбає і з усіх сил тримає себе , щоб не кинутись з криком "" ура ""","Але Сосницький по камінчику , як Клапан , довбає і з усіх сил тримає себе , щоб не кинутись на неї","Але Сосницький по камінчику , як Клапан , довбає і з усіх сил тримає себе , щоб не кинутись з криком",на вона,з крик,кинутися,на неї,"з криком "" ура """,2,5,на,з,вона,крик,PRON,NOUN,prepositional,prepositional,Postverbal,Ukrainian
"Серед нас , серед наших ретельно поголених облич , бездоганних комірців , строго вигладжених бриж на штанях , лякованих черевиків , він робить вражіння не то псаломщика , не то прикащика з економії .",Серед нас,", серед наших ретельно поголених облич , бездоганних комірців , строго вигладжених бриж на штанях , лякованих черевиків ,",Серед нас,серед облич,серед ми,серед обличчя,робити,Серед нас,", серед наших ретельно поголених облич , бездоганних комірців , строго вигладжених бриж на штанях , лякованих черевиків ,",2,19,серед,серед,ми,обличчя,PRON,NOUN,prepositional,prepositional,Preverbal,Ukrainian
"Колись робітники напам’ять учили прокламації , написані цією рукою , що тепер так несміло і злодійкувато посилає в рот на виделці смачні гриби .","Колись робітники напам’ять учили прокламації , написані цією рукою , що тепер так несміло і злодійкувато посилає в рот","Колись робітники напам’ять учили прокламації , написані цією рукою , що тепер так несміло і злодійкувато посилає на виделці","Колись робітники напам’ять учили прокламації , написані цією рукою , що тепер так несміло і злодійкувато посилає в рот","Колись робітники напам’ять учили прокламації , написані цією рукою , що тепер так несміло і злодійкувато посилає на виделці",в рот,на виделка,посилати,в рот,на виделці,2,2,в,на,рот,виделка,NOUN,NOUN,prepositional,prepositional,Postverbal,Ukrainian
